reddit_id,shorten_post
azwnr0,"looking for some advice. my father has memory issues from a tbi back in 2014, and his neurologist has been treating my father with a protocol similar to someone with dementia. in early january my mother passed away suddenly in her sleep, and she was the main care taker of my father so when she passed we had him temporarily move in with my wife and i until we could figure out a sustainable long term solution. every day while with us he would ask when my mother was coming home from the hospital... at first we would have the long, hard conversation that mom had passed away. he'd cry, be upset, etc. the next day he would again ask when my mother was coming home and if we could go visit her. after a week of the questions we started to play into his question and lie to him saying we spoke to her earlier, she'd be coming home soon, etc. this was on the advice of several people including my mother-in-law who works in a memory care unit. she said that if telling him the truth every time he asked was too hard for both him and myself then maybe it would be best to lie to him. fast forward to now - about 2+ weeks ago we moved him into a senior care center with a memory care unit. he's not a patient at the memory care unit, but they deal with dementia and alzheimer's patients and we feel like it's a good fit for now. almost immediately from when i left after moving him in he began calling my phone constantly asking if we could go see mom, when is she coming home, etc. then he started calling all the local hospitals, and in a panic called me asking what was going on and why couldn't he find mom. i drove over to the senior center and we had the long, hard talk again. he cried, got upset... the usual when we would have the conversations. but then the next day he remembered our conversation... and again he remembered the day after. we went out for dinner and he remembered 4 days after i told him. he would ask me what happened, how did she die... questions like that. i was so relieved that maybe things were getting better. then day 5 - he calls me and asks when mom is coming home again.   i'm basically at a loss. if i tell him the truth, he doesn't remember. if i lie, he calls me every 15 minutes asking when we can go visit, are there any updates on mom, etc. i haven't had more than 12 hours away from him to even begin grieving the loss of my mother, and i seriously don't know what to do anymore. last night i couldn't even go out to dinner with my wife for our anniversary without him calling me every 5 minutes. i had to turn my phone off - i felt so awful doing so but i'm at the point where if i don't shut it off i'm going to lose my phone. &amp;#x200b;has anyone dealt with some sort of similar situation and if so - do you have any advice? like i said - i'm at a complete loss at this point as to what i should do. i appreciate any and all help / advice. thanks."
b6fl2v,"as my title says, i am really really struggling to cope with what i feel like is the loss of my my grandma due to her severe dementia because really it's like she hasn't been alive for the last 5 years even though physically she is still alive. i'll try to give some background information but i really don't know a whole lot since my mom and aunt have been handling everything but my grandma is early 70s and i am currently 22 but was around 17 when i feel like i really lost her to her dementia. no one else in our family has experienced dementia or alzheimer's or anything similar let alone in their mid 60's so it was something that was totally out of left field and i never expected and i don't think i have really processed it until this year to be honest. i'm graduating university in june with two degrees (esl and spanish), getting married in august and moving out of state in september. i always looked up to her so much and she was such an amazing, strong, independent and progressive woman and it crushes me that she can't see who i am now because i think she would be so incredibly proud of me. all of this may seem sort of childish but it's really been weighing heavily for the last nine-ish months that even though she is still alive, she won't be at any of these events and even worse to me is that i can't even let her know about all these exciting things in my life because she has such severe dementia. i'm just incredibly sad because she has always no matter what been extremely proud of me and loved me so much that i just wish with all my heart she knew about what i'm doing. i feel like it would all be easier to cope with if she had passed five years ago because that's so final and you can carry out the grieving process and such but instead this feels like such a purgatory since i can visit her and talk to her and tell her everything that's happening but i know that she cannot understand and it breaks my heart because i love my grandma so so so much and it's so heartbreaking to see her like this and to not be able to tell her about everything happening in our lives because yes her body is still here and functioning to the best of it's ability but she herself as i'd always known her has been gone for five years. thank you so much if you read all this i just feel like i've really been bottling this up and am now coming to the realization of how much it has effected me and wanted to reach out to a community who has most likely struggled with the same feelings and am wondering how any of you got through it or if you're going it through it now even."
4s7paw,"i assume you all are far more educated on this than i am, i'm just trying to figure out how i should go about doing something.so my grandfather just died of cancer last night, but his wife (they still lived together) has pretty bad alzheimer's. he died right next to her and it's been about 20 hours now, but she still doesn't know. each time my mom or my dad has tried to tell her, she laughs and doesn't get it. she either thinks it's a joke or she says ""he just needs sleep.""do we just let her live in an ignorance is bliss scenario, or do we keep trying to tell her that her husband is dead? and if we do tell her, how should we go about doing that? a direct approach didn't seem very effective."
vq6hc3,"hello. my mother at 62 was diagnosed with vascular dementia last august. she is what is described as a long hauler. she had to quit her ebay business that she ran from home. fortunately she now receives social security. her primary caretakers are myself (her 30 year old lives at home son who works a 9-5 type office job) and my dad (who works at home for a call center job with some shifts starting at 3:45 am till 12:15 pm dealing with u.k. clients). we have gotten her on medication and vitamins. for the most part it hasn’t been horrible. she and my father are amazing and have done their best. recently though she has what she herself named “figments.” where when she looks at my dad. she doesn’t see my dad. it’s someone who looks like him. a brother sometimes. another person with the same name. not the father of her two kids. my dad would try holding her hand, looking at old photos, telling stories, showing her matching rings, but now she’s not believing him. she doesn’t mind these other people, but she’s afraid she’s hurting her husband by being with them, or upset when i call them dad. and so far much to my surprise the only one she’s been confused on is dadi hate to start my 1st post in this group with a question, but any tips or strategies to help any of us would be appreciated. thanks"
ke158s,"i don't know if this is the best place to post here, but i have never dealt with dementia before and i have no idea what to do. i seem to be one of the only ones aware of what's going on with her, but i don't know how to help her, or even if i can at this point in time. my grandma has been acting very rude and strange lately, and her facebook posts have been getting more and more incoherent. she has always been politically minded, but she used to be coherent and mindful of people's different perspectives.  i have been avoiding her for the most part because we don't really click well to begin with, but i checked my emails and noticed she has been sending me strange political conspiracy nonsense in all caps lock (which is very unlike her). it's not even the usual q-anon conspiracies we are all likely familiar with, although i think she has been influenced by that, it's a mix of her own strange delusional thoughts. if she were around my age, i'd honestly think she was a disorganized schizophrenic. her typing is starting to remind me of my own mental illness. of course, this led to an argument because i thought it was very distasteful of her to bombard my emails (and my facebook too) with such presumptuous, inflammatory nonsense. it led to a number of other things, basically her saying vague statements throughout that had no relevance whatsoever to the conversation and didn't prove any points she so adamantly insisted on having. she also wasn't respectful of me saying that i don't appreciate having political or religious talk shoved down my throat like that, i would rather talk about other things because i don't agree with any of her points. she dismissed all that and made it out like it was my fault for being not being receptive, but she's always been a narcissist, making everything about her.  she used to be more socially aware though. she had the nerve to tell me i'm not mentally ill (i'm on the schizophrenic spectrum!) and it hurt my feelings so bad i lashed out at her pretty sharply. but then i reflected on our argument and realized that she is tangential (worse than me), incoherent and is rapidly losing her sharpness. sadly, she doesn't believe that mental health is a real thing so i unfortunately think she's in total denial for now. it's still early in the symptomatic stage and i don't want to assume that it's dementia when it could be other things, but she is reluctant about getting help. i can't even use my schizophrenia as a coaxing mechanism (""see grandma, i got help"") because she does not believe that i am mentally ill.what is strange is that my father is a low functioning schizophrenic, and when she was younger she was willing to call the mental institution and get him help multiple times, so she recognized he was crazy, though she always dismissed psychology as a subject and said it ""wasn't a science"" (rolls eyes). i know dementia is a brain disease and not exactly a mental disorder, but her lack of insight into any mental health issues is allowing her to be cognitively dissonant and in complete denial that she needs help herself. i know after reading through the symptoms of dementia that no matter what happens, i need to understand her point of view and understand that it is her brain malfunctioning, it's not her will to behave like this. that being said, it is very hurtful because it puts my mental health at a serious compromise.  i'm not exactly known for being emotionally fluent and supportive myself, especially when i feel like i'm blatantly being disrespected. we have always had different opinions on politics and religion and her randomly, sporadically lashing out disturbing nonsense at me is terrifying, and triggering me to have positive symptoms. it reminds me of how my dad verbally abused me during his schizophrenic episodes; i now need therapy again and have been disassociating something awful. it reminds me of my own mental illness, but at least i have the self awareness to know something is wrong with me, and to try to be nice and respectful in spite of it. i'm worried the rest of our family won't catch on until it's too late because many of them are in denial of mental illness and even 'like' some of her word salad posts. to be fair, she has always been abrasive and opinionated, so it's not like a completely new personality, just her behaving and saying strange things. she also used to respect science and health experts but of course covid19 changed all of that. she keeps calling it the ""flu"". i explained multiple times this isn't the same viral strain as the flu - it's as if she's not capable of taking in new information. she also started talking about sex extremely graphically around an 8 year old girl doing homework the other day, which is completely unlike her. she would have never done that around me or my friends when we were 13, let alone 8. the girls stepdad snapped at her and told her to stop.anyways, i know i'm not the best person to be her caregiver considering with her (potential) dementia and my schizophrenia, we are both so blatantly honest towards each other in rude ways. it just doesn't work. i'm trying to get other family members to keep an eye on her and i will do a welfare check on her if i have to, but i honestly don't know what else to do. i can't live with her, last time i did i was running naked in the woods because i thought the planes in the sky were government drones she was using to spy on me; that's how much she makes me nuts. i love her because she's my grandmother, but, damn me, i just don't have much respect for her as a person. but i still want her to get the help she needs despite everything. and yes, i have told her i think she has dementia though i wasn't polite about it, i was still hurt at her dismissing my schizophrenia and i don't know if i can forgive her for that. of course everything i say is one ear out the other. she's still driving and shopping and stuff, and she has a husband but he's slowly dying of diabetes, and he's just as ignorant as she is in a lot of ways so he is no help. neither is my schizophrenic dad, hence my need to potentially call a welfare check on her.   sigh.if anybody has any suggestions, i would greatly appreciate it - and i'm sorry for rambling."
esgk15,"i am the only support for my 77 yo widowed mother who has moderate dementia.  she is in assisted living (not memory care yet) but lives 10 hours away from me.  she has a handful of local friends and relatives but all are even older than her and have their own medical issues.  none can help in any way other than occasional social interaction.  this means i am attempting to manage all things including finances, legal, medical, etc...., for her from afar.  while i love her, we have never been close.  there is no bad blood, we are just very different people and she has ""disapproved of my lifestyle"" ever since i became an adult and left home 27 years ago.  until i was alerted by her panicking financial advisor that she was nearly broke 1.5 years ago, i had very little involvement with her life....which suited both of us just fine.  we perhaps talked on the phone once every 6 weeks or so and i would visit for 2-3 days once a year.  she has never had any interest in her grandchildren and could not have said what my husband or i do for a living at any point in my adult life.  after the alert from the financial advisor, i uncovered all kinds of ways mom was no longer able to manage herself, including runaway type ii diabetes, months of backed rent, driving without car insurance, pets that were in dire need of medical attention, hoarding, improperly managed meds, bounced checks and late fees all over the place, etc.... that she was unable to manage due to poor cognitive functioning.  so, a lot has happened in the last year.  i finally have a handle on most things financial/legal/medical.  now i am grappling with some secondary issues.  the most pressing being her anger towards me.  i could use some tips on how to ""enter her world"" when she is agitated on the phone.at least once a week and sometimes multiple times a day, she will call me (or my husband) about one very specific topic.  she only calls either of us when she is upset about this.  but even when i call her, the conversation often goes to this topic immediately:  ""everyone thinks i am too stupid to manage my own (fill in the blank here...finances, medical appointments, meds, meals, etc.....).""  she will go on to insist that she was managing just fine until i stepped in and that my involvement is unnecessary (not true). that she never agreed to my involvement (not true, she had the dpoa drafted without my knowledge).  that i am not managing her affairs properly (she believes this to be true because she accidentally reprograms her tv and then thinks i failed to pay the cable bill).  sometimes she will rant elaborate stories about how she selected and moved to her facility all on her own (not even a little bit true) so there is no reason for me to be involved.  she worries i am going to come take her car next (that is true but we have never discussed it).  she feels she is being treated very poorly and tells me she certainly hopes my child does not treat me this way in the future or hopes i am not treating mil this way.  once we are there, i cannot get in a single word.  i never react with anger....but even if i was inclined to, i simply cannot get a single word in anyway.  she gets more and more upset until she either hangs up on me or tells me she hates me and then hangs up on me.  these rants typically go on for 10-20 minutes non-stop.  once it was so bad and vicious that the director of the facility overheard and called me after she hung up to try and console me.  this has been going on for about 9 months.  i try not to take it personally but it does upset me....taking care of her affairs has created so much anxiety that it has (temporarily, i hope) wrecked my life....so getting this abuse on top of that is a hard pill to swallow even if i know it is the illness talking.  and obviously, she is upset too.  and from a  practical standpoint, i cannot get or give any information during calls when this happens.  i am her dpoa but not her guardian so she can and does still make many of her own decisions....which often requires communication between us.my sister, who lives even further away reports that mom rants these same things (about me) to her too.  mom does not get upset with/at my sister.  they have always had a much closer relationship and my sister is not the one doing any of these things.  so at least mom has one ""safe"" loved one to talk to.  i have started letting all of mom's calls go to vm and i don't call back aside from the very rare times there is a legit reason for the call.  but i still need to be able to call her to get business done and to check in.  any ideas on how to redirect or ""enter her world"" to set a new call in the right direction?  there are countless other things that upset her but they are far easier for me to empathize and redirect.  but since these are really about me, or more specifically my involvement in her life, i am at a loss."
rl6ef1,"my mom called today and said there was a man in the house she did not recognize.  i asked if it was my dad and she responded by saying her dad has been dead for years. i asked if the man in the house was ****, my dads name, and she had no idea how i knew him.  my heart sank and i’m finally having to face how bad her memory has become.  this is brand new to me and i have no idea how to deal with this.  please provide any and all advice you can; i would really appreciate it"
ki444x,"my grandma was the one who bought me up, and she's always loved me unconditionally and beyond anything i deserve. after a couple of major falls this year, and spending half of it bed ridden, she is slowly sinking into dementia. while she recognizes my mother (her daughter), she seems to have gone ""back"" 20 years and thinks we have just moved into this house (which we did 20 years ago). she is holding on to a picture of mine from then (i was 5) asking all of us where oversteercentral is. she refuses to accept that i am the grown up version of that photo. this is ripping her heart and mind apart - i am, rather was, the apple of her eye, as good as her son, if not more, and now she feels that i have abandoned her/died/been thrown out of the house. when she sees the actual me, she thinks i'm an older brother of that boy in the picture, even though i am the only child. she's getting sadder by the day, and any time we try to explain things to her, she just thinks its a conspiracy. she is dying of emotional pain as i write thing, and i don't know what the hell to do. on a less significant note and optional note, this is beginning to really break my heart to. i am beginning to really feel that i'm not being there for her, but i really don't know what to do. seeing her fade is not the problem, i have been ready for that. but seeing her in acute emotional pain and confusion makes me want to throw up my insides (sorry). i dont even know what self care i can do here. i just love her so much, i want to make this better for her. please help!"
g989t2,"re-minding mom mom has always been tightly wound. an open, walking wound. so we step softly, not to slip in her spilt blood. but her time is running out. we remind her time and again and again of the time.that she has to mind again.we remind her. rewind her. but the sands are slipping through her. every morning we wind her up. but time is running out of her. still, she minds. still, she winds herself up.so we take her down, off her pedestal and place her gentlyon a shelf where she will never be forgotten but will forgetand finally wind down,and be still."
ltrj9h,"does the awareness of having dementia stop?i'd say our loved one with dementia is mid stage, maybe getting into stage 6. her husband is the care giver. i can't say for sure which stage, i am sure behind doors she is unfornately worse. she has lewy body, seems to change rapidly. lots of delusions. mood swings, high anxiety, no short term memory, lost the ability to do tasks, sundowners. she's aware enough to know she has dementia, avoids family members because she is embarrassed of how she behaves or can't do tasks. does that awareness fade?i have tried to talk to her about, say she can tell me anything, we support her, she says she is fine and changes the topic. i was hoping making her feel comfortable and supported, she doesn't have to hide. she wants to pretend she doesn't have dementia, i have to respect that. she isolates herself, makes up excuses to why she can't visit or have visits. her husband has told us about her diagnosis, we all play along as if its not noticable to keep her happy. my husband misses her, she is his mother. how long could this avoiding us go on for?"
icrzam,"she’s moving in because we believe she is no longer safe living alone 17 hours away from us. we are not sure how bad her memory has gotten, my partner fears that she’s “faking it” often when they talk on the phone and that she’s much worse off than she appears. we live in a one bedroom apartment, my partner and i are moving into the living room and giving her the bedroom until march when our lease is up when we can move to a house. so it’s gonna be tight quarters for a while! what slightly complicated things is that i have never met her before. my friends call her my “new mystery roommate”. i’m not worried about having someone i’ve never met move in, i’m worried about someone with dementia moving in. if anyone has any tips on how to help my mil have a successful and less stressful transition that would be much appreciated."
4mi4g7,"on monday morning my mom's doctor visited with her to ensure she was comfortable. everyone knew she was dying. she had terrible aphasia but the core of my mother was still in there. she managed to tell him three things. ""i think the end is near. i think i am dying. i am not afraid.""  she had some orange juice and ginger ale and a little milkshake. she closed her eyes. she died 24 hours later. she was 11 days shy of her 93 birthday."
hwntds,"my wife’s mom, her older brother, and i suspect fairly soon her older sister have died from alzheimer’s and the complications it brings on. my wife has shown signs of it for well over a year, and pretty much is in denial. our family doctor mostly dismissed my concerns last year saying that i was overly sensitive to her behavior because of her family. it’s now undeniable, although she still resists being tested. she’s coming around, and will in time i suspect, but it’s hard. with all the rest of the crap that’s happening in the world, and then this. what do i do next?thanks for letting me vent."
