reddit_id,shorten_post
ht22nh,"hey guys, joined this sub for a little advice. my great grandma is 95 and has had alzheimers/dementia for a few years but it’s only gotten kind of bad the past year or so. me and a few other family members take turns coming to her house to watch her, and also have cameras at the house for when no one is there. 23 years ago, she moved out of the house she had been in for most of her life, and moved into her current house when she married her husband (he’s now passed away). her old house was sold to my aunt but it looks nothing like it used to, anyway. sometimes, like today, she’ll constantly say she wants to go home. when i say this is home, she’ll say something along the lines of “this is my home yes but i don’t live here, i want to go where i was this morning” even though she slept here the night before. i don’t have a car so i can’t bring her to my aunt‘s house anyway to go along with it, but even when someone else was here my aunt got tired of having to deal with her coming up there almost daily. what should i do in this situation?"
8a9l8p,"first i should mention she is in the nursing home, so she is at least safe and taken care of.it's interesting because she has what i guess they would consider fairly severe and advanced dementia, however, she still remembers people. she almost always remembers us, friends, other family, neighbors from 40 years ago. every once in awhile she'll need reminding but over all that part of her memory is somewhat intact.she doesn't remember places, homes, towns, anything like virtually at all and thinks north is south and vice versa. she's been in the nursing home for over a year now, but never remembers her room and constantly thinks she's in a different room.  for some reason the last month or two she's latched on to the idea that every time my dad and i come to visit we're there to take her home, even though she doesn't even remember where ""home"" supposedly is.  her issues are further complicated by the fact that she was in a freak accident at the nursing home last year and had a lot of trauma from it. just to give a short idea - her back was broken, her pelvis was broken in two places, she had 7-9 fractured ribs, her left leg was broken in 4 places with two major compound fractures one which required a skin graft and her heel was crushed, and the other leg was broken in 2 places i believe. i don't know how much metal she has in her legs now but it's a lot, in addition to already having two false knees from before. after hours and hours of multiple surgeries, she recovered remarkably well, especially for being 86 at the time of such a traumatic accident. however, she did lose the ability to walk so she can't use the restroom on her own, etc. she is wheelchair bound now though she actually is in fairly good shape physically. she just never regained enough strength and mobility after the accident to walk again.this creates a problem in itself because she can't remember that she can't walk anymore and tries to stand up to ""prove us wrong"" all the time or show people that she can walk. we didn't really worry about it too much because we didn't think she had enough upper body strength to pull herself out of the wheelchair but apparently that is not the case because the other day she managed to get out without hurting herself and was sitting on the floor putting her shoes on getting ready to ""go home"" when the staff found her.we haven't been able to get her out of that delusion. so now any time we visit she becomes inconsolable and varies between violent anger and crying the entire time while yelling at us, staff, other residents, and anyone who's around. she's still verbal but limited in that a lot of what she says is delusional or non-sensical. it's impossible to reason with her or calm her down because she can't hold conversation anymore. we used to be able to just steer the conversation a different direction or remind her that she used to be happy at the nursing home, but it's not working anymore.at this point it's getting more and more aggressive (kicking things, kicking her wheel chair, throwing things) and we're afraid she's going to start lashing out at us, the staff, or the other residents.she is on ativan as needed but it's not enough anymore. at this point dad and i don't know what to do anymore. do we just stay away completely in case we are triggering the upset? then she's just sad and asks about us and is mad thinking we don't care. we can't just go visit her and be yelled at and abused the entire time, that's not good for anyone involved. the staff is frustrated, we're frustrated, and i'm sure she isn't happy as well and that's the most heartbreaking thing. our goal has been to preserve whatever quality of life she can have for as long as possible, especially after the accident, but i know she's miserable all the time right now.did any of your loved ones go through this stage? any recommendations or advice would be super helpful!   edit: i should mention - surprisingly she's in fairly little ongoing pain from the accident. her worst leg and her back does get sore sometimes, in addition to arthritis in her hands but she is still very good about speaking up when she has pain and we and the staff make sure to ask frequently if she's in any pain. so they're fairly certain she's not lashing out in response to physical pain."
lb0jpk,"my grandparent has vascular dementia and lives at home with one of her older children. i go over to help give company when i can, and i think the hardest part is making her feel at home. she constantly asks when we are leaving to go home, as she thinks she isn't in her house and wants to go back to what we assume is the house she grew up in with her parents in a different state. how can i answer her questions to make her feel at home? she mostly asks when we are leaving, if she needs money or how to pack for the trip. every day when it's not freezing outside and in some that it is she packs her car with random things like she is going somewhere or brings things up and down the stairs trying to get ready. we of course have the keys hidden but leave the car doors unlocked because she can get angry when her car isn't available to her. i've made a sign for her bedroom door that says her name and plan on making a memory book with a picture of her in her house with some family so she can maybe make the association on her own. but nothing really seems to make her feel better and she gets more and more restless and hard to deal with by the day.i usually try to answer that she is home and that her family lives with her, and try to point out things in the house that she knows are hers -paintings she has done, or take her to her room to give her a tour. sometimes she realizes that it is her house but usually not and she often answers with ""i didn't know that."" this is how every conversation goes and i just wonder if anyone has any tips for how to answer or make her feel more comfortable without trying to force the information on her?"
io70fz,"hi, i'm new to this sub. i just wanted to ask those of you who have parents or loved ones with dementia or alzheimer's what you say to your loved one who is asking to go home. my grandmother-in-law is getting to late stages, and every day she asks to go home, or says she's going home soon. she's been living with all of us (mil, wife, and me) for nearly 4 years, and we moved to tennessee almost exactly a year ago. she insists that she has friends somewhere else and she's going to go visit them... or something. i don't believe she has a troubling amount of anxiety during the day, not enough to say she wants to be safe, and they why she's asking. we think it's most likely that she's just remembering house she lived in before the stroke in florida, since it's the last place she had friends and such.  what do we tell her when she keeps begging and begging to go to a place she hasn't owned in half a decade?"
jfcw38,"my grandma is staying with us and sometimes she might think she's at her old home. she even sometimes think that long past relatives are still alive. this infuriates my mom. she yells at grandma and calls her names. she keeps trying to explain things to grandma as if they'll stick, but obviously they won't. she's treating grandma like she knows what she's saying. seriously, my grandma could say she met abraham lincoln and my mom will actually sit there and explain to her, in detail, how that isn't possible. people say it's my mom grieving, but i don't really get it. please help :("
vrxgk6,"my grandmother is mid stage, and in the past month or two, something new that has come up, is a couple times a week she will get upset and insist she's not in her house, despite living there for 51 years.  this will go on for hours, sometimes the whole day.  she gets very depressed and upset over it.  she remembers her address, she remembers the city, but she insists she is living in an apartment in ""a town i don't know the name of"" and goes on and on about how much she hates it there and wants to go home.  telling her it is her home, and trying to get her to recognize some of her belongings doesn't help, it just makes her very mad and she starts yelling that she's not crazy.  telling her she will be going home next week, and everything will be back to normal then doesn't help either.  she remains depressed and upset and lamenting about wanting to go home right away.  trying to redirect the conversation to another topic doesn't help either, she goes right back to talking about wanting to go home.  we're not sure *what* to say to her on the days she gets like this.  is this one of those things where there is nothing to do?  we just have to deal with her being upset/depressed on these days?"
lskmfe,"i’m venting, this is long but i need advice and someone to tell. i’m 20 and my grandma has had dementia for the last couple years, she’s slowly deteriorating but this year has been the hardest for me. mainly because of how aware i became of the issues and her situation. she lives in the midwest and i live and grew up on the east coast so i didn’t get to see her a lot when i was growing up. i didn’t love going to her house as a kid because i just always felt a homesick and there wasn’t a lot going on over there and i could never sleep. as i became a teenager it definitely became more manageable but i still didn’t see her a lot because i was in sports and school and whatever the excuses. she lives with my grandpa still who is just a old fart and used to order her around the house all the time and her son (my uncle) has lived there his whole life and he’s just a lost soul who drinks, he means well. the dynamic of that house is the last bit ideal for someone with dementia too. it’s just low vibes and my uncle doesn’t really get along with my grandpa and it’s just a mess. there’s not enough interaction or high energy to keep her wheels turning. i’m also 1/2 grandchildren and the only girl in my family since my grandma had all boys, and the other grandkid is a boy. anyways i feel an immense guilt and responsibility to go and help her and take care of her. from never seeing her a kid and knowing she always wanted a daughter and i was the closets thing to a daughter and i never even got to see her. and i didn’t like calling her when i was kid and i wish i would’ve just called her. i feel like i missed out on years of love and stories from her and she missed them from me. i didn’t even give her a chance. or so it feels. my only problem is that i would have to pick up my whole life and move to missouri, i’m in arizona. and it just feels like i could be doing so much to help her and make these last years really amazing for her. and if i don’t go i’m going to live with the guilt of not being the best granddaughter i could’ve been, i don’t even feel like i was a good one at all. it took me 20 years to realize how much i truly love and care about her, i just wish i would’ve called her more growing up and seen her more. it was just because i didn’t want to or feel like it or just because it was awkward sometimes. i call her as much as i can now but it’s hard and draining. i always cry and spiral and she always mentions to me that i should come visit her. she deserves the world and i just wish i could give it to her. i hope this all made sense, i just got off the phone with her so i’m emotional and all over the place and conflicted. i just need some advice or a sweet message lol"
8a726n,in addition to the title we have a young couple that are providing day to day services for my mother so she can stay in her house. the problem is that she is now constantly convinced that my dad should be home any minute and calls me looking for him. it takes a few solid minutes of explaining that he passed away about 30 years ago and that i'm here for her. my question is...what is the best way to answer her questions? do i just keep explaining the current situation to her? is there a better option? i'm not a big reader but i'm open to suggestions on reading material regarding this situation. thanks reddit.
kc18vq,"a few years ago my grandmother was in hospital (aged 88) and because of the medication she was under, she kept showing common tropes of that of a person with dementia (delusion, forgetting peoples names, etc.) and was placed in a ward with patients of the same illness.she checked out of hospital after about a month and went back to normal every day life. she broke her hip last year and had to be in hospital again for about three months. she behaved the same kind of way she did last time and it took her a few days to fully recognise her house when she finally returned home (for the most part she would only recognise a couple bits of furniture).she's 91 now and she's aware her memory isn't what it used to be. she'll spend a great deal of time when i visit talking about the exact same things (religion, what she's watching on tv, etc.). i noticed last time i was there she confused me for my brother and kept referring to us by the wrong name. she also told us that she's lived in her house for the last sixty-odd years and raised six children there, as if my brother and i never knew that.a few months ago she asked to take a picture of my granda and brighten it up in photoshop since she never liked how it came out, and i brought it back a few months ago. last time i was down at her house with my brother she was convinced it was my brother that had altered the picture and even gave him money for it.i want to try and visit her as often as i can and i want to know what i can do to when i visit her (how to stay patient when she gets confused, how to keep her on track with the conversation, etc.). i know this may sound insensitive to some people on this sub and i apologise for that, but i don't know where else to go"
e8yls8,"she is in the late stages of alzheimers, and every night she asks me ""have you ever been here before?"" and i say of course and explain to her that we are still in the town we have lived in for over half a decade, which just confuses her and then she will ask again in a minute or two.my question is what can i do to make her realize that she is home?"
cb4h2j,"my great grandmother has been battling with dementia for the past couple years and just recently got officially diagnosed. i’ve been going over to her house a few times a week to help take care of her and i didn’t know it would be this hard. i love her to death and seeing her like this breaks my heart and i guess i’m just looking for other people who are experiencing the same thing. sometimes she has an idea of who i am but most of the time i’m pretty sure she has no idea. when i first started it wasn’t terrible because i didn’t mind talking about the same three things for eight hours straight but over time it has made me feel very sad and just.. brain dead i guess is the only way to describe it. she always thinks she still lives in arkansas where she grew up which i understand is very common in people with dementia and alzheimer’s. i’m not really sure what the point of this post is, i guess just to get these things off my chest and if anyone has any advise it would be greatly appreciated."
l56in5,"my grandmother's mother (my great grandmother) died over 20 years ago. my grandmother becomes confused and asks me where her mother is. i'm unsure how to respond without causing her more distress. do i explain as gently as possible that her mother died over 2 decades ago? or say something along the lines of her mother being out shopping/living elsewhere/etc? when i've told her that her mother passed away a long time ago, she seems upset. when my gm asks whose house she's in, i have no trouble explaining that it's her house. likewise when i explain other things like what day it is or where different living relatives live. i'm just not sure how i should answer when she asks about her deceased mother. any advice?"
o1j3lh,"hi all, looking for advice.my grandma has short term memory loss that has progressed within the past 6 months.we had an at-home doctors/memory facility visit yesterday. she’s currently livid with my father for taking her car so she’s resentful of anything he does.long story short, today i asked her what she remembered about yesterday and she said “nothing.”so, with that being said, she’s on schedule to move within the next few weeks but due to her forgetting when she gets angry whenever her independence is questioned, we’re afraid of how to approach breaking the news to her.any advice would be great. thanks in advance!"
3l6fa7,"hello , i have just turned 18 , my mother has alzheimer's and the situation is looking dire . she is only 52 , but im guessing its a pretty late stage . she has been repeating the same things for a long time now , she started packing/unpacking/moving things around for no reason the last month . she has a caregiver in the morning when i go to school and my dad is working , my grandma and i look after her in the afternoon (especially my grandma) and when my dad comes back home in the evening he stays with her. this whole responsability juggle works in theory , but its really breaking me , talking to her is really hard , she basically only says hello , and then asks when is my dad coming back home , is he gonna come back home , can she call him to know when he's coming back etc... she seems really troubled all the time my dad is not here and i dont know how to ease her up anymore , i researched and tried a lot of things (asking her about old photos , happy memories , trying to distract her ) but none of them seem to work anymore . she was literally shaking today because she wasnt sure if my dad was going to come back home... at this point i dont know what to do , i feel useless , and the thought that she is only going to get worse scares me a lot (i really fear the day she is not going to be able to recognize me). my grandma already had an heart attack last may because of this whole situation (she was the primary caregiver back then , now i help her out and it is only in the afternoon) so there is also that . sorry for the wall of text , but i am honestly getting desperate at this whole situation , and i see nothing but sadness in the next months/years of my life , if someone has any suggestions i would really appreciate it ."
3ttjvb,"im not sure if there's another subreddit maybe i should post on, but here goes.in the past year, both my parents (dad 78, mom 75) have been diagnosed with dementia. dad's is more mild (mostly cognitive impairment), mom is alzheimer's. we had to move them into assisted living this summer—separately, because mom's dementia and delusions and agitation was pulling dad down a downward spiral.its been a few months now, and things have settled down a bit—though i now realize things never really ""settle down."" but i can't bear to see or call my mom much. now that i know shes being taken care of i find that i'm trying to close the door on her to save my sanity.i see my dad at his residence every other week—we laugh, and have lunch and talk, sometimes do puzzles and stuff.  he's changed a lot, but is still a person and i feel like its worth the hour-and-a-half trip to build on the relationship we have. mom is declining fast. when i visit, she's just fixated on leaving and being reunited with my dad, her husband of 55 years. (they get together once or twice a week—either i or my brother bring him over).she knows who i am, but nothing really sticks, and its the same 2-3 questions over and over. shes not really clear on where she is, or whats happening to her. i feel like 10 minutes after i leave its like i never came.my mother was an over-intellectual, opinionated, demanding spitfire of a woman. seeing her like this is eating me alive. i want to do everything and anything i can to bring her any relief or comfort, but i also pray for her to die.i feel like i'm slipping in quicksand. i get anxiety attacks just calling her—and the calls are just 5-6 minutes long with nothing really said.i have a brother who lives closer, and is very involved in both my parents lives. he hasn't given me a hard time, but part of my issue is trying to make sure i'm doing my share.how do you find the balance between obligation and survival? i feel like i'm at war with myself—part of me says ""you're selfish, you're lazy."" and part of me says ""save yourself."" i know thats normal in this situation, but how can i least start to heal, and find that balance?"
8egcx4,"my mom is 64 and has been experiencing dementia since feb 2016. from then until aug 2017, she was in a nursing home. she had a head injury and combined with her medications, she was super out of it in the beginning. over time, she improved to the point where my dad believed he could care for her at home. it quickly became apparent that her being home wasn’t going to work - she has no impulse control... she’s going to get what she wants, come hell or high water, regardless of what anyone says. one day, she snuck out of the house and took a ride from a stranger because my dad wouldn’t take her shopping.  after several weeks of stress, arguments, drama, and police intervention, we finally got her into a new nursing home with a locked dementia unit. she’s been in the new location since late october, and absolutely hates it. she is still in the “earlier” stages of dementia... she’s pretty with it most of the time. every time we visit, she’s constantly telling us she doesn’t belong there (most of the residents are significantly older and have much more advanced cases of dementia), and asks when she can go home. she’s in total denial that she has dementia, even though the doctors have told her she does. since october, she has caused quite a stir at her nursing home. in january, she tried to pack up all her stuff - she thought she was going home, even though nobody told her she was. she tried to reach something on a high shelf in her wardrobe, so she stepped up inside the cabinet. it wasn’t anchored to the wall, and fell over. mom ended up with a broken toe.  a few weeks later, she was repeatedly throwing herself out of bed. the nurses were concerned that she would injure herself beyond her toe, so she ended up staying in a mental hospital for a week. she has been known to scream for help when she needs something, rather than turning on her call light. in a recent care conference, i asked the social  worker if mom was going to be kicked out, and while she didn’t come right out and say yes, she did imply that if the behavior continued, it would be a possibility. last year, she had some baseline cognitive assessments done, and recently underwent the testing again to see if any progress was made.  in response to her latest queries about when she could go home, my dad told her we would see what the doctor had to say at her next appointment, and we’d go from there.  she translates this to mean that she can go home after her appointment. the doctor has already called my dad with the test results and has informed him that he recommends she stay in a locked dementia unit. mom is not going to take this news well.  i’m concerned that she is going to resume her negative behaviors and potentially get kicked out of her nursing facility. it was so hard to get her into this one, i don’t know what we’ll do if she gets kicked out... there are only so many facilities with locked units, and not all of them accept medicaid. just wondering if anyone else has been in a similar situation, and how you handled it... thanks for reading this long rant!"
