reddit_id,shorten_post
40becj,"my grandma is in a nursing home after breaking her hip (a blessing in disguise as it finally got my parents and aunt to understand she couldn't live at home even with a 24h nurse anymore). anyway now that she's there, she's much happier, and doesn't cry and beg you to take her home, so it's much easier to go visit. i love to see her, we talk about what nail polish we like and all sorts of girly fun things. but she doesn't know that i'm her granddaughter all the time so she'll talk to me about more serious things too sometimes. i always feel she's much happier when i just talk to her and go along with whatever she is saying. i never correct her unless she asks me a question and i feel like it makes her happier. however my mom and aunt still try to remind her of things, like that my grandpa died or that she's not at home/work/wherever. i just feel like why tell her, why remind her of these things? i wouldn't want to find out every day that my husband died. but i don't know. am i wrong in playing into her delusions so much? i just want to make her as happy as possible but i don't want to do something that would adversely affect her either. this is all so confusing and i guess i just need an outsiders opinion because i don't really have anybody to ask."
pa9ebv,"my grandmother has been living with alzheimer’s for about 6 ish years now. it has become clear that she is entering her final stages of life, as she is no longer mobile.the one question i ask is what to explain to her when she asks about my deceased grandfather? it breaks my heart, and she asks about him every few minutes during visits. often she thinks that he has left her. i’ve tried different approaches to answering her, but if anyone has experience i’d like to know what may be most comforting for her to hear."
snhq8e,"my grandmothers memory has been deteriorating for a while now but recently she has started forgetting a lot of conversations we've had and i'm starting to think she's forgot my visits too. she angry with me all the time, thinks i'm doing nothing to help her but i've been supporting her a lot. she's scared, i understand that but its heartbreaking knowing she is so angry when i'm trying my best. it's just me and her and i'm so out of my depth. we're no where near her needing to go in a home but she says she never wants to and i can just move in with her. but i know there will come a day i can no longer handle it by myself. i'm terrified of the future and i'm worried it's more than just bad memory due to her age."
ksgi94,"my grandma has dementia/alzheimer well something of the two, really wired form of it. she remembers who we are and everything but she is getting more angry/aggressive lately. me and my mom are the primal car-takers of her. it’s starting to become to much to care for here at home and we think to get her into a home lately but are still not to impressed about it, it just fells wrong. bit all of our family has a full time job, and are not home all the time. what are some techniques to calm her down when shes angry? should we just leave here to cool off or talk to here? she just gets extremely frustrated and still has some good days. she even dresses herself and everything apart cooking.any advice appreciated."
rgk9zg,"hi everyone, i'm a bit torn about this so i thought maybe someone here had some helpful advice.my grandma (92) lives in a nursing home, and has dementia. she hid it for a good while, but it became apparent just how bad it is when my grandpa died last year. she thinks she is temporarily in the hospital and wants to go home, but by home she means the family farm, where she hasn't lived since she was a teen. she sometimes recognizes my dad and aunt, but often she doesn't, since she thinks they are kids. other than them i don't think she recognizes a lot of people very often.and here is my dilemma: my dad recently mentioned to me that she might be getting close to death and if i would want to visit her a last time i should do so soon. my grandma was a lovely part of my childhood and it pained me so much that i didn't get to see my grandpa before he died. but on the other hand, she will most likely have no idea who i am, but she will fake it since she has gotten used to that after hiding it for so many years. so maybe a visit will just stress her out without doing anything good for her? right now my last moment with her was at my granddads funeral where she in a clear moment marched over to me, took my hand, looked deeply into my eyes and said ""he loved you very much you know?"" which is quite lovely.so yeah, i'm torn about if i should go see her or not, thoughts and advice is appreciated"
k050x8,"my 86y old grandma has been battling dementia for nearly 5 years now. it started with her repeating stories but it went downhill after my grandpa died.her short term memory is horrible. she will ask the same question many times, forgets my name sometimes (but knows who we all are) and generally acts like a child most of the time.she seems to always be very happy, doesn't understand tv shows but finds it amusing to watch and the most interesting thing - she's completely capable of living by herself.she lights fire in the fireplace, eats food we leave her and takes meds (i have to call her to remind her of everything tho). we visit her 2 times a week.the only thing that's gotten progressively worse is her short term memory and even her long term but she still knows who we all are and understands everything we tell her. it's been a slow decline during these past 5 years.what to expect in the future?"
jvvmep,"hi everyone.just like the title says, i'm looking for some tools and advice to helping, redirecting, and calming my grandma. she was officially diagnosed with alzheimer's several years ago. at first, i think most of us were in denial, but as the disease progressed, we came to terms with the fact that it had taken hold of her. earlier on, it was easily dismissable things, like misplacing items, or forgetting if she had said something to someone. later, it became telling the same thing multiple times in a conversation.now, it has progressed so much, she's more often ""lost"" than she is lucid. it seems like, within the past few months, her disease has revved up and progressed much faster than it had previously. she doesn't remember where she keeps her dishes. she'll put the cups in the drawer with the casserole dishes. you'll be engaged in a conversation with her when she'll suddenly walk off and wander around. she's confused so much of the time. it's gotten to the point where she can't remember many of my family members' names. she refers to my grandpa (her husband) as ""this guy"", and often doesn't realize who he is, or where she is.every morning, my grandpa has to walk around and show her pictures on the wall to bring her back and help her feel comfortable and recognize that she's in her home, however, it's not working like it used to. last week, my grandma was distraught and called my dad, angry and asking him when he was coming home. she thinks he's still a teenager, not a grown man. then, the other night, my grandma woke up, walked out into the garage, came back inside, and asked, scared, and angry who the man was in her bed. she wouldn't accept that it was her husband, so my grandpa moved out onto the couch. later that night, she came back out and asked him if he was coming to bed, as she forgot what had just happened. things are being put in motion to get her into a home. grandpa has been an absolute saint with her, but it's too much. i want to know what are some things that i can do when i am around to keep her occupied and happy. puzzles, coloring, etc. how can i calm her down when she gets confused or if it escalates, how do i redirect her attention to something that will keep her calm? she has been such a wonderful grandma to me. it breaks my heart to watch this disease slowly chip away at her. i want to be for her, everything she has been for me. any advice is truly appreciated.&amp;#x200b;tl;dr: this disease has progressed to the point where she is often confused, doesn't recognize her husband, and is upset. what tools or advice can i use to keep her happy and occupied?"
4v3tpj,"my grandmother has alzheimer's. sometimes when we do certain things she gets very irritated, like touching and moving her stuff around. we (my parents and i) know that we do not have the time to be primary care givers, and now that my grandfather has passed, we have to move her into a memory care unit of a nursing home.do we involve her in the moving? do we tell her or just move her one day? we are in fact allowed to bring some of her furniture, so i'm not sure we should involve her, but i'm asking for my parents' sake.thanks ahead of time, folks. "
a19y2o,"i recently found this subreddit and i’m hoping to pull support and well as support others going through similar situations. i just needed a place to vent and clear my thoughts. please let me know if this isn’t right place. my grandma was diagnosed with both dementia and alzheimer’s back in the late 1990s. i understand how lucky my grandma and my family are that she didn’t show tell-tale signs until 2008-ish. my whole life, my grandparents helped raise me and my three siblings. my father’s house was conveniently next door to them. my brothers and i loved it! eventually, my grandma wanted to move 6 hours north of where we lived. their home would be in the middle of no where. we simply thought they wanted to spend their golden years in a area similar to both of their home states. when we would go up for visits, we realized she was having more and more difficulty in the day to day. she would feed her mini-horses 5 or more times because she would simply forget. it  would get worse. she wouldn’t follow a conversation and get frustrated. as a young child, i didn’t know much and i got frustrated with her. a cardiac event in 2016-ish caused her and my grandpa to move back to the city. she was flown from her property to the hospital near her. it could have been much worse. we are forever grateful this was done before the golden hour was up. unfortunately, things got worse. in december 2016, i remember getting a call from my aunt, explaining a terrible incident that had happened. i had to rush over to practically baby-sit my grandma. my grandpa desperately needed a break. skip to the next week, we had no choice but to place her in a group home. she had completely forgotten who her husband was. it was now a unsafe place for him. she believed he was a terrible man, doing terrible things to her. my grandpa was a sweet, caring man. i saw her occasionally but it wasn’t enough. i kept kicking myself to see her but it was so rough. i couldn’t do it. i just couldn’t. my grandpa’s health was worsening too. he was in and out of the hospital all throughout 2017. unfortunately he passed in january 2018, just shortly after his 79th birthday. it was rough and my own resentment to myself was only getting worse. i did not see her from early 2017 to literally today. i forced myself to drive to her. her group home is in my own neighborhood. i’m so glad i saw her. she remembered my face and we talked about whatever she wanted. of course, the conversation didn’t flow but i didn’t care. i was with my grandma. i couldn’t believe i had forgotten what her face looked like with her wrinkles, how her blue eyes shined bright when she was happy. i realize i am lucky to have her remember me and i promised to her i will see her more often."
inx0j2,"okay so i'm going to try and get to the point. she's been ""difficult"" as a younger woman and girl from what i've learned. not sure if there's a condition that worsens and develops into dementia at some point? but it's gotten worse over time. especially since she's alone now (grandfather passed in 2016 at 86). i did everything i could considering i live a couple of hours away now. i'd come to town and just fight through the negativity to help. every little thing she notices out of place makes her think someone is coming in the house just to mess with her. honestly there's a rat issue that still hasn't completely resolved, and they might be the culprit. she had been saying for almost a year or longer someone is coming in, even accused me and another family member. i insisted she got cameras inside the house to monitor anything unusual. i have access to her security system, and found her to do some strange things when she alerted me of someone coming in. like, she made coffee, poured it into a bowl, and just .. idk what she did with it? she insisted someone came in to cook food, another time someone left dishes she didn't recognize, left dirty rags, moved some things, put clothes on the floor, etc. the list goes on. security company finds nothing unusual, but she just gets angry and accuses people of trying to ""make her like she's crazy"". i always tell her she can call the company if she wants to review footage of a particular time, see if they see anything. she never wants to anymore because they will tell her nothing happened. she started covering the cameras so no one could look at her when she didn't want them to. of course i never checked footage unless she insisted something happened.sometimes i feel uncomfortable taking any action because when police came after getting an emergency call, they suggested calling adult services and i quickly learned how terrible it can be dealing with them. they came in a vehicle with a flashing yellow light on top and made her feel totally uncomfortable. she fears someone wants to ""take control"" of her. this isn't a lie actually, because 3/4 of her kids excluding my mom and one grandkid took advantage of her financially. long lasting family business basically went to shit over time and died bc of mismanaging funds and taking out loans under grandparents noses. i never did nor do i now want to take advantage, and i don't want her in a nursing home. i also understand she needs help, but a special kind of help abs support that won't stress her. my mom and aunt will not bother to call her or return calls (aunt lives next door in house grandparents financed and rented to her about 30 years ago). they are her only surviving kids (one uncle died in 2015 and the other earlier this year), and the other 4 grandchildren don't bother checking on her at all. it's just me trying and it's stressful (23) feeling as if i can't do shit. i haven't been able to emotionally take all of the things she's been saying (she can get quite verbal and personal unfortunately) without having to end the convo and i feel bad because i know she can't help it. but as i've seen, continuing the conversations have lead to health issues with other family members who have now passed (uncles, grandpa). there was a time i actually felt myself getting deeply stressed and unhealthy trying to save a failing business/deal with the fact that part of it failing had to do with her being irrational majority of the time (being rude/personal with customers and employees etc.) and had to step away and find my inner peace again. the business was dead by the time i tried to fix it all, and was financially drained. it started to work fine for a couple of months but ultimately the plug was pulled.she hasn't even been diagnosed with it and i know she won't get tested willingly. she's given me durable poa over properties, business, etc. (excluding health) about a year ago or less, but revoked it after a mischievous family member got involved (they disappeared when they found out grandma had nothing to give). she's mentioned that her doctor suggested having someone look after her, but of course she was enraged at the thought. so yeah.. probably hasn't gotten tested. my ideal circumstance is to have someone look after her at home where she's comfy, and not doped up on meds. also, she's in bankruptcy and having a difficult time understanding things but wants no poa activated out of fear she'll be put away (even though i never had health poa). she will end up losing everything and my fear of her dying from stress will still be a threat if i don't get involved.im sorry if it seems like i'm all over the place, i can barely think straight! i just want her at home, and to know the property etc. she wants to keep are safe so that she's happy. how do i get this ideal scenario for her? i know she'd still be furious about someone aiding her at home but it can't be as stressful as a nursing home. how do i ensure my poa is active again? this is hard."
dhvdgq,"i live with my 85 y.o. mother. she’s been having issues with memory for the last 6-8 months that is getting worse. i think it’s been a problem more than i knew; now i feel she’s been hiding it. for a while it seems she has the impression that i am two different people taking care of her. she can’t explain it, but i inform her it’s just me living here with her.two weeks ago, she became too confused to manage her rx, so i took over with a pill organizer. she now needs to be told where and when her pills are. then a week ago, she asked what my first name was.last night, it came to a head. she doesn’t really know who i am. it was very hard to get her to go to bed (i was hoping a night’s sleep would get her back to speed, but it didn’t.) it’s coming out this morning that she doesn’t really know i’m her son. as i’m explaining our relationship, she thinks it’s like a movie that she has found out she has a son. i do have an estranged brother that she is aware of, but somehow the person she sees every day is a mystery.i go with her to her doctors appointments every month. i told him of her failing memory for the last 6 months, but he feels it is normal aging memory loss (he did do a verbal test i thought she failed, but guess not.). i pushed for medication to help, and he went with it. it didn’t help, obviously. i’m waiting for a call back on what i should do about this. she doesn’t know me – that’s not normal aging.i could use some guidance on where to go from here. can anyone point me in a direction? websites or recommend what specialists i should push for…"
mubl3c,"my grandmother is 88, she was formally diagnosed by her pcp with dementia about 1.5 years ago, we started noticing some minor issues maybe 2.5 years ago.  the thing is, she doesn't really fit into any of the ""stages"" of dementia.  if you go by the 7 stages, or just a more broad early, mid, late, she's all over the place with symptoms.  in the last few months there's been a handful of times she hasn't been able to recognize me, my mom, or my grandfather.  she doesn't think we're strangers, but confuses us with someone else.  two month ago i picked her up for a doctor's appointment around noon (usually she is very good at this time of day) and she thought i was her brother for the entire ride there.  on the way home though, she knew i was her grandson.  two weeks ago she thought my mom was her sister.  just last night, she woke up in the middle of the night and refused to believe my grandfather was her husband, she thought he was her father.  but in between those incidents, no problem.  she recognizes everyone just fine.  even this morning when i stopped by she knew exactly who i was, and was back to knowing who my grandfather was.  honestly, these more severe issues are an outlier.  i'd say 75% of the time she's relatively fine, and things come across are simply more age related forgetfulness that you would expect from someone who will be 89 in six months.  for example, if i go over when the news in on, we can talk about current events.  she knows what's going on, and she understands it.   the majority of the time it might just be mixing up what day it is, repeating some family gossip she already told me a few days before (so she still has the ability to make new memories), or screwing up while cooking dinner because she forgot something in a recipe.  on a day to day basis she gets dressed on her own, she cleans the house, she goes up and down from the basement to do laundry (though sometimes she forgets the right settings on the machine), she goes grocery shopping, and she even still writes out the checks to pay the bills when they come in the mail. but she's got these off and on periods of severe confusion, and her pcp has diagnosed her with dementia.  it just doesn't make any sense to me, and i've begged my grandfather to take her to a specialist or just *anyone* for a second opinion to make sure there isn't something else going on (maybe a medication issue) but he refuses.  not because he's an asshole, but he's just very old school.  their pcp of 30 years gave a diagnoses, she gets mad if he talks to her about her symptoms, so he just deals with the issues and placates her.  so i'm just wondering, maybe i'm in the wrong here, and something like this is common....the ""stages"" are more mixed and not rigid, and this is just a normal case of dementia.  it's just....""fishy"" to me.  i want the best for my grandmother in her final years, and i feel like i'm the only family member who is researching this and not just accepting the opinion of a 75 year old pcp diagnosing an 88 year old with dementia and not looking into it further."
5au0vr,"hey guys, i'm looking for a little advice. my grandmother is one of the most intelligent people i know, she's an accomplished lawyer, a self sufficient woman, and an all around great person. i love her dearly, but i'm becoming concerned about her cognitive abilities. she's beginning to repeat the same stories over and over, sometimes only a day apart.  she often forgets her wallet, her phone, or the location of her car keys. she's even starting to forget the names of the streets she drives on every day. my accounts have all been confirmed by other people in her life. so i guess the root of my question is, am i right to be concerned. and if so, how do i bring it up to her? do i go over her head to her sons who live many states away? i'm just feeling a little lost right now, and any advice you guys could give me would be greatly appreciated. "
5ici7w,"crosspost from r/alzheimershello everyone,i am in a bit of a jam.my grandmother stopped driving about 4 years ago. her driver's license has expired in that time. does anyone know how or what i can do to get a new form of id for her?i have a durable power of attorney for her in order to manage her finances and bills. is there anything i can do myself without trying to drag her into a state id facility? i doubt she would be able to answer any questions... she has deteriorated quite a lot in the past few months. i assume to even get a state id you have to answer questions...documents of hers i do currently have:social security cardexpired licencepoa signed by her as well as mei might be able to get a copy of her birth certificate... though i am unsure.i am just kind of stressing out, because i only realized today she has no ""real"" form of picture id and this may be come a big problem later.thank you all for any help, and i hope you are doing as well as possible. the holidays can be a hard time for people affected by this terrible illness."
ss4ies,"for background, my 82 yr old mil has dimentia (i don't know the specific level or formal name). she isn't able to drive, cook, she forgets names, she can't be left alone,etc. she lives 1000 miles away and we haven't been able to spend much time with her over the past few years. the past few years have been tough, but the past few months have been extremely challenging for her. she lost her husband two weeks ago and because of her condition we decided to sell her house and move her into a memory care facility. because we live out of state, living with her is not an option. as i write this it sounds horrible that we haven't included her in the detailed conversation, but she wasn't able to understand and contribute to conversations with her husband and family months ago.my wife and family quietly packed up part of her house without discussing it with her until the end. they explained that she was moving to a place where she can be cared for and safe. my wife and her flew to our house and told her that she was staying with us for a while. the reality is that we're getting her place at the memory care facility ready for her to move in shortly after her things arrive. she only remembers a few pieces of the conversation (s) about moving, and incorrectly remembers the details frequently. she will tell us that someone (she knows it was family but doesn't remember who) came in last week and started packing up the house. then she said that someone told her that she was moving but she didn't have other details. my wife will explain that they packed up their house and they're trying to figure out the best place for her to live. luckily, she understands that she can't stay in her house alone which is very helpful. this conversation happens again and again and again. my mil brings this up somewhere between once an hour and as frequently used every five minutes. my wife had that conversation 10 times in less than an hour and a half tonight. she also wakes my wife up multiple times per night to have the same conversation. how can we either help her understand and remember the plan, or reduce the frequency of having the same conversation? we have been truthful with her about the plan (except that we have decided on moving her to a facility) but she forgets within minutes....not sure what to do from here."
