reddit_id,shorten_post
jkg9uu,"my mom was officially diagnosed with alcohol induced dementia today. i talked to her on the phone for over an hour, and she was in her own little world. as much as it hurts to hear her talk about things that aren't real, she seemed the happiest she's been since i can remember. unfortunately, i live in a different state and covid has put a hault on any visitations for the nursing home she's currently in. i guess my question is how should i talk to her? should i just let her play out what's going on in her head and go with it, or calmly and patiently try and bring her back to a more ""normal""  state than what she's in now?sorry if it's a dumb question. i'm just trying to wrap my head around all of it and try and be there the best that i can for my mom."
mhdpl4,"i'm a psych nurse but have worked with younger patients mostly, presenting with schizophrenia and personality disorders. my mom is rapidity progressing through dementia and i find myself at a loss on how to respond to her, how to keep her safe and comfortable. she lives at home with my dad, who is bed bound 2d to strokes. there is a caretaker there 24 hours and my sister and i visit daily. mom has started to try to ""go home"". she asks over and over for us to take her home and does not recognize that she is in the house she's lived in for 40 years. any advice or sources of information are welcome."
eo539k,"my 71 year old mother has been dealing with alzheimer's for many years. i've been bathing her about a year now. dad turns off gas and locks doors ( supplying details to give a frame of reference ).she often talks about going home to check on her parents (gone for 20 years) or kids (i'm her youngest at 34 years old) or whatever. she yells at my dad to take her home all the while saying their current home  is actually her house her dad got for her (it isn't).we are managing, but what's best to say to her? when she pleads to me to pick her up and take her home? most if the time, i can change the topic and she forgets eventually, but sometimes she gets fixated. do i go pick her up and drive around? do i gently remind her she is home? do i just listen? what's best in your experiences?"
jdlndz,"throwaway because i don't want such a personal text on my main account.i'm  35m. my mother (59f) has finally been diagnosed with early-onset  alzheimers a few weeks ago. she had been having symptoms for a few  years, which we always attributed to the strong medications she takes  for a rare vascular disease she has. her dementia progressed very, very  quickly. just two years ago she was a little forgetful but you could  have a normal conversation with her, she still drove herself to errands,  etc. one year later she's completely taken by the dementia, having very  aggressive episodes (she tries to hit my father constantly - she's  never been aggressive before), paranoia, can't hold a memory for more  than 5 minutes, forgets she's already home and gives tantrums wanting to  ""go home"". you know, all the symptoms of alzheimer in a moderate to  late stage.i live about 200 miles  away from her. she lives in a small countryside town with my father and  my elderly grandmother (her mother). i had been sort of a distant son  for the past decade because of relationship issues i had with them  growing up. nothing really traumatic, but my upbringing drove me away  from them. i moved to a big city and visited them about 3 or 4 times a  year, talking weekly-ish on the phone. now this is happening and i'm  getting closer to them again, especially my father, to give him support.  he is taking this pretty badly and is getting desperate, not knowing  how to deal with her condition. nobody is prepared for this. i'm trying  to visit them at least once a month, but covid makes me very afraid to  go. they're in a small town with very few cases, while i live in my  country's largest city with tens of thousands of cases. my fear is  unknowingly bringing the virus to them, since they all have high-risk  conditions if they're infected.my  father (63m) had to quit his job to become her 24/7 caregiver.  thankfully i have a good job in the city and i'm able to help them  financially, but i'm not rich by any means. he's still a few years away  from being eligible for retirement. i feel like she's getting quite  close to having to be put in a long-term care facility, which is crazy  expensive in my country. at the same time, she still has some good days  and we'd feel awful to send her away.to  add insult to injury, she has a lot of sisters but apart from one,  they're all ganging up against my father and making the situation worse.  we don't want their help, we just need them to not be part of the  problem. this is the hardest situation we have ever dealt with in our  lives and they keep making it worse out of pettiness, ignorance and  family drama.anyway, i guess i  just wanted to vent. i know plenty of people here are or have been in  similar situations. i'm open to advice or any kind of feedback.thank you for reading."
5cgsho,"my grandma is 83 and has had early dementia for the past two years and she keeps telling us she wants to go home to her ""house in the woods."" she tells us this multiple times a day, when she's at the house she's lived in for 50+ years. nothing's changed at the house it still looks the same etc. she starts to get agitated and insists we take her home. this is really the only thing that she does besides asking the same thing over and over and it only happens early in the morning or late at night. i don't get frustrated at her, because i know she can't help it, but it does make me sad because she's like a second mom to me and has been all of my life.does anyone know why she does this and how to help? it makes me sad because i wonder why she doesn't recognize the home she's lived in for so long. thanks for any help."
p0p72z,"to start off, i have some experience with this dementia nightmare.  my dad had alzheimer's.  when he asked for a ""ride across the bridge"" to take him ""home"", i would tell him i couldn't drive at night (white lie).  i'd happily drive him tomorrow (another white lie).  he accepted excuses and diversions easily. my mom has lived in her senior building with hired help for 10 years.  she suffers from dementia.  she normally can be distracted from requests to go home.  today, no matter what i did, she kept asking to go home.  ""let's eat lunch!""  ""let's go to the park!"", i suggested.  she literally would not say anything else but ""will you take me home?  how will i get home?  is there a bus to take me home?"" (i don't think my mom has rode a bus in 50 years). over and over, nothing but home.  i finally just called my brother.  told her i would take her home but first, we were stopping at her son's.  it diverted her enough.  but it was a difficult day with the constant pleading of home.  she's normally interested in home but no so fixated.  she wouldn't even hold a conversation today so i couldn't even distract her with different topics.   this is hard, folks!"
hahcz7,"hi all,i want to start this by saying, i think you're all incredible. this community has been so lovely to me when i've reached out and it making all of this feel more manageable.my grandma has mid-late stage alzheimers. we finally got her assessed last week by a geriatric care team as recommended by her gp. they ruled out a uti or any other infection and have placed her on an antipsychotic to help with her delusions (was seeing intruders in the house). my mom has kind of taken the lead with all of this, with her siblings kind of falling in line even though there have been a few missteps. she's been incredibly strong and the biggest complaint i've heard from her was ""i wish i could fix it"".tonight my mom hit a wall and the floodgate was released. my heart broke when i heard her say she missed her mom. i miss who my grandma was too, she was a spitfire, witty, naughty and so cheeky, an amazing story teller and loved to giggle with me on the phone. but i also know the way i'd feel if this was my mom would be different.my mom is also devastated for my grandad. my grandma has some awful sundowners and is horrible to him and i can only imagine how hard it is for him. she was also pretty bad to my mom last week, convinced that she was my grandad's illegitimate daughter and told my mom that she would never love her. so reddit, i turn to you. what do i do? what do i say to my mom? especially when a lot of the good in my grandma is gone and there are only small moments and flickers of it. i'm just wondering what you wish someone had said to you if you went gone through this grief process.my mom knows there's no fixing it and that all we can do is make sure my grandma is healthy and safe, and if some happy comes, that's great too.thank you for reading my ramblings. much love and good vibes to you and yours &lt;3"
u3aiaa,"i'm not even sure how to ask about this. short-ish version:i want to know if it's ok to have my mom over to *her own house* for holidays. my only experience with this sort of thing is with my spouse's family situation. with their family, they do not let the grandma go to her old house any more. she gets upset and doesn't want to leave. i was told by my wife not to bring my mom back to her old home, as it would cause trouble or upset her like how her grandma got upset. both my wife's grandma and my mom have to go back to their nursing homes each day, so they can't stay at their old homes. they both have alzheimer's, but it hasn't progressed so far for them not to remember their old houses. long version: my mother is in skilled nursing / memory care. i sometimes take her out to places for lunch, ice cream, or go shopping. i have to make sure to get her back to the nursing home every time, because it's important for her to always take her scheduled medicine (and have nurses available around the clock). she still owns her house, and i've been taking care of it for years.since she hasn't been there in a long time, most of her possessions are gone, things have been fixed up, some rooms have been repainted, there are new appliances, and the yard looks different. i basically tried fixing it up, just in case we had to sell it to pay for my mom's care. well, medicaid took care of things, and they said that we can keep the house. so then we had this nice house, all fixed up. we have been wanting to do more things there. we did halloween there, and we want to do easter over there. my wife and i have been looking into selling our house for a while (since before my mom went into memory care), so it actually works out well for us to stay at my mom's house. i talked to my mom about this already,and she thought it would be a good idea for me to stay there to make sure it was taken care of. i was thinking about getting my mom for easter and having her join us, but i don't know if that is a good idea. i don't want to make her upset. i would also feel real guilty about doing stuff with family but not have my mom there at her own house. but i'm afraid that she might see her old house and not want to leave. or maybe she will see her old house, realize how much of it has changed and get really upset. it's also possible that she won't remember the house at all. has anyone else been in a situation like this?"
l10qa9,"i live with my grandma, 82, and my mom. my grandma has pretty bad dementia but its just recently been getting worse and worse and we sometimes don't know what to do about it. we are struggling hard at not snapping at her when she sees stuff or tries to do things. its hard but we are trying. one concern is when she tries to do things she physically can't. how do i get her to stop without getting her upset? she thinks she's young and can do it all. the biggest problem we are having right now is she thinks she isn't home some nights when its the worst. she will scream at us and cry and persist that she isn't home and she needs to be taken home right now. she will refuse to take off her shoes and won't listen to us trying to calmly tell her she is home. i've gotten her to calm down a couple times by walking with her to her bedroom, showing her all my deceased grandpas things and making her understand she is home but there has to be a better way. she sat and cried for 15 minutes straight tonight bc she didn't understand why we wouldn't just take her home. im younger, 25, and i think she's beginning to not recognize me, so she thinks i'm a stranger and it fuels her thinking she isn't home. its breaking my heart. i think her head is about 20 years back rn, which would make sense as to why she can't recognize me and why she thinks she isn't home, because she didn't live here then. any advice? i'm becoming lost as to how to help her."
rhr2e8,"forgive me for this is going to be a long story.hi! so for context, i have a grandmother who’s probably 100+ years old (father’s side) with insanely terrible dementia. my parents are the only caretakers despite my dad having older siblings (he’s the youngest). she’s been staying with us for several years now as she was in a different country before and it’s just getting worse. i feel incredible sad and sorry for my parents who have sacrificed their time and insanity to take care of someone who’s extremely loud and abusive (verbally and physically) to everyone. she screams calling for her older son who lives literally next door. they refuse to take her in because of her behavior. they’ve completely ignored their responsibilities of taking care of their mother and thus my parents have no other choice but to keep her with us. i wake up early in the morning because of her screams. oftentimes, she does not sleep and will talk and scream for about 3 nights in a row. i know my parents are fully exhausted to the core which is why i keep telling them to ask my dad’s brother to take her even just for a few months but they don’t even try asking. it frustrates me that i want to be able to help them and lighten their responsibilities but it;s like they refuse to be helped. my mother does everything for her; cook, wash her, do her laundry, etc. she always verbally (even physically) abuses my mother, sometimes my father, and i just can;t take it anymore. it also affects me and my sisters because our house isn’t big so we can hear her all the time. my sisters are studying and i work at home. my family is also traditional so they will never have her live in facilities.i’m frustrated and want to cry looking at my tired parents because i know they want this to be over. i’m about to cry as i type this because i just have a lot of emotions. today was too much for and i’m at my limits. i want to run away from this house and live far away where i can’t hear her screaming for her other son. i feel angry, tired, and guilty of all this and i don’t even know what to do or think anymore. i love my parents but i don’t want them suffering from a this. if you’ve reached the end thank you very much.tldr; i’m going crazy trying to help my parents because of my grandmother with the worst case of dementia possible"
9o0rq5,"my mom has been on the decline with alzheimer's for the past 10 years or so.  within the past year her symptoms have gotten much worse (she's 71 now).   until the past couple of weeks her moods ranged from confused, but chipper to confused and depressed.  but increasingly she just wants to go ""home.""  she packs and unpacks constantly.  and the past few days her mood has become staunchly defiant and angry --- she believes her delusions are real (she talks to inanimate objects all day) and that all of the real people around her are trying to fool her.  she's told me that i and my dad deserve to die.  i have had to physically restrain her from breaking windows with whatever heavy object she gets her hands on.  even lately though she's calmed down around dinner time to eat and take her meds, but not tonight.  she went to bet at 6:30 without food and refused to eat or take her pills.she is clearly at the point where everyone (including her) would be happier if she could be in a quality care facility.  (we seriously try to accommodate her in every way we can).  but we simply don't have the funds to do so. in fact, we rely on her ss income just to help pay the bills.does anyone know good ways to deal with a loved one with dementia who becomes increasingly hostile while still being able to provide care at home?  we really just try to be nice to her, take her for drives or give her hugs (when she'll accept them)."
e170gy,"title really says it all... my dad (69) is now in a state where he's unable to function on his own, forgets who people are, does weird stuff, and all the usual alzheimer-y stuff. my mum (66) is the one taking care of him, essentially babysitting him 24/7, and she's mentally and emotionally exhausted.every time i call her, i can tell that she's been crying recently. it breaks my heart and i have no idea what to say or do to somehow make it better for her.so if anyone has any experience with this, i'd really appreciate some advice... :("
nl9dvj,"hello. this post is not like me but i feel like i need it. i was raised by my grandparents from the time i was 8 till 18. my mom left me and my brother and they took us in. my dad was a jobless alcoholic during that time. growing up, my grandma was always distant. she suffered from mental illness and depression. there were times where she would stay in bed for months, she never loved us unconditionally, it was always conditional. since i moved out and started college, she hasn’t called me once. i love her like a mother, yet experience so much confusion. her dementia is getting really bad, she has forgotten so much. for her, however, at this point she is more paranoid. despite how distant she is, i don’t think much of it. we never celebrated holidays, she never told us she loved us, she’s like that to everybody. still i go over there maybe once every few months. this time was different. she said my dad doesn’t live with them anymore (he was because like i said he’s a drunk). i simply expressed how i think that is for the best. she felt as if i was attacking her son and lost it on me. she called me every name in the book, called me worthless, and said i’ll never amount to anything. my face went white, i was so hurt. she said my dad is an amazing man and with every bit of courage i had in me i told her i’m 4 times the man my dad is (he beat my mom, never worked, done nothing for us, and does drugs). she pointed her finger in my face and told me to leave her house (the house i grew up in) and never return. before this, i never knew where my dad got it from, but seeing the wantonness on her face, i now know where he gets his anger. i went straight to my car and cried, my grandfather said her meanness has been a constant lately. that she simply forgets losing her cool and acts like nothing happened.how do i get past that? how do i not take it personally? i want to go back but i can’t put myself through that again. i am not worthless. everything i do i do to make her proud, she was an educator so i am in school to be one. her calling me nothing might not be my last memory of her but it will forever be the most prominent and i’m angry."
2kthc2,"my recently widowed 83 year old mom has vascular dementia, though she is still pretty functional. i've moved back in with her at our family home and we have an in-home care provider twice per week. we want to keep her engaged as much as possible, so we take her to attend various activities about 5 days per week. except for church, she grumbles about why she has to do this and why we want her to, saying that she just wants to stay at home by herself, excepting for my presence. most of the time she'll participate once she's there but has been becoming a bit more resistant to going lately. what's a good strategy to overcome her objections and/or convince her that getting out of the house isn't a bad thing?"
2rgki6,"my mom married my wonderful step-father 6-7 years ago. he is 56 years old, and it is believed he is in stage 4 of his alzheimers.i'm thirty years old, and i'm not too sure how to help out. my step-dad is still highly independent and can still act like himself around other people. i can often have a conversation with him and if i didn't already know it, i wouldn't be able to guess he has alzheimers. he struggles with things such as remembering how to log onto the computer, he can't tell time on an analog clock, but he can still go out on his own to shop and visit people. i'm seeking out for my mother. she is struggling, because for 3/4 of their marriage it has been a challenge for her and things have slowly been going downhill after the first couple of years of their relationship. she says he isn't the man she fell in love with, though she can see glimpses of him every now and then (which is understandable).he is verbally abusive to her often (never in front of any one else), and is angry all of the time. i know she is suffering, and that it is hard for her because everything is all about the person with alzheimers, and not the spouse. her self esteem is suffering and she feels trapped. she says everything sets him off (yelling and berates her), and he becomes focused on things and often freaks out at her if she says or does the wrong thing.i don't know what to do to help her. i love my step-father so so dearly, but it is so hard to watch my mother in this. a big part of me wants to tell her to leave before it's too late and he loses his independence, because she is so young and has so much ahead of her still and the other part feels so guilty to even think of wanting her to do that. every outcome for both of them breaks my heart.is she doomed with a life where she has to walk over egg shells and ""be agreeable"" to prevent his freak outs? this is the advice she's been given multiple times. she says he has never been physically violent, but that his anger is very unpredictable/severe and the littlest things set him off. she has also been told to ""always carry a cell phone, even at home"" just in case things get bad. she isn't interested in going to a support group because she doesn't want to sit around and talk about all of the crappy things happening.can anyone relate to this? i feel helpless."
l35efw,"my mother (not quite 60) has always been super sweet and loving, very athletic, gorgeous, with a really broad mind, and full of intellectual conversation, a real social butterfly. now, she's angry at the world and at her loved ones, constantly. she finds no pleasure in anything she used to. she is becoming more and more reclusive, and her decision making seems to becoming childish. she is even becoming violent with the animals, who she has always adored. i see a doddering, angry, bitter, old woman where my mother used to be, and it breaks my heart.i have just come to the realization that dementia is likely behind the change. i feel it's pointless to argue with her anymore. i just need to help her as best i can. what do you do with a parent who is still with it enough to function, but is losing ground by the day? what can i expect? what can i do?i have already devoted a significant portion of my life to her because of other illnesses she had when she was younger (cancer, ptsd, endometriosis that was left undetected too long and nearly killed her, the subsequent hysterectomy, and early surgical menopause). i feel like my life has always been on pause, and that i've never had a chance to be young. now, this is just one more punch in the gut. i'm sorry for me, for my dad, for my family, for our pets, and mostly for my mom, who seems trapped in her own hell. what can a child do? i don't even know how to approach this realization."
v65ziz,"in the past year, my 94-year-old grandmother has slowly started to forget things. we recently brought her to live with us and she still thinks she's at her home in mexico. she truly believes that she's in her home even though she's actually in the u.s living with my family. luckily she still remembers my family but has forgotten a lot of other people. my question is what do i do to help her? are these the early stages or are we way past that? should i let her think she's in her home so she won't want to leave?"
