reddit_id,post,memory_loss
4kkp3r,"i've been dating a girl who lives with and cares for her mother, who has the early signs of alzheimer's. we've been dating for about year, and i'm absolutely in love with this girl.some background on the mom: she is definitely forgetful, but not as much as i would have thought when i first heard that she has alzheimer's. she may ask the same question more than once in a short period of time, but she can definitely cary a conversation. in fact, she is extremely personable and we get along very well. i guess the biggest struggle with the mom is that she doesn't ever want to do _anything_. we try encouraging her to get out of the house and enjoy life and keep exercising her mind, but it is always like twisting her arm to get her to do anything. she is unaware of her condition.what can i do to help make my girlfriend's life easier? how can i help? what should i try to keep in mind when she vents about her mom? things to say/not to say?have any of you tried to maintain a relationship while simultaneously being a caregiver for a parent? what do you wish your so would have done different? or, conversely, what did you so do that made you really happy?",0
qca4rx,"hello,so my grandma is 83 - 4'11 and like 80lbs. a very mighty woman, extremely active.in the past few years her memory is slipping more and more. covid made it worse and i think part of it is she is lonely since her husband died 10 years ago and all her friends are dying. the entire family has jobs - we're all hard workers so we can't talk much.she is calling us non-stop about ""hey do you know if it's going to rain today?"" ""just wanted to let you know i'm going to go cook some food"" ""where is whole foods again? (even though she goes there everyweek)"" or just calls to chat about random stuff.so it's partly she's asking something and partly that she's bored i guess.the worst is if she calls my mom and my mom doesn't answer, she automatically thinks my mom is dead and calls all of us crying and flipping out.what do we do? she swears she'll never go into an assisted living place and my mom ""just can't do that to her"" so i really don't know what to do",2
dqbmt6,"i genuinely don't know what on earth to do anymore. before i get into everything, let me give you a little background on myself. i'm 18 years old living in a household with my mother, my father, four cats, and recently my grandmother. i'm in my last year of highschool so i've been super busy with school and basically getting ready for college. but besides that, i'm having a problem that i literally have no clue how to fix. my grandmother has been diagnosed alzheimer's for a little over 5 years now, and she's only been living with us for about 9 months. she hasn't been too bad or anything, she actually has been doing amazing lately, but my dad sees her as this burden. he always makes it seem like my mother and i never help him out with her (even though he leaves me for a day or two while he's hanging out with a friend at a brewery or something) and he constantly says how he is frustrated with life. the worst part is that it is now influencing my grandmother, having her say ""i want to die"" and ""no one wants me around"". what am i supposed to do in this situation? i know i'll be leaving for college soon, but i don't want to leave my mother in a toxic environment like that. how do i make him see that he is effecting the whole house with his attitude?",0
dqbmt6,"i genuinely don't know what on earth to do anymore. before i get into everything, let me give you a little background on myself. i'm 18 years old living in a household with my mother, my father, four cats, and recently my grandmother. i'm in my last year of highschool so i've been super busy with school and basically getting ready for college. but besides that, i'm having a problem that i literally have no clue how to fix. my grandmother has been diagnosed alzheimer's for a little over 5 years now, and she's only been living with us for about 9 months. she hasn't been too bad or anything, she actually has been doing amazing lately, but my dad sees her as this burden. he always makes it seem like my mother and i never help him out with her (even though he leaves me for a day or two while he's hanging out with a friend at a brewery or something) and he constantly says how he is frustrated with life. the worst part is that it is now influencing my grandmother, having her say ""i want to die"" and ""no one wants me around"". what am i supposed to do in this situation? i know i'll be leaving for college soon, but i don't want to leave my mother in a toxic environment like that. how do i make him see that he is effecting the whole house with his attitude?",0
dqbmt6,"i genuinely don't know what on earth to do anymore. before i get into everything, let me give you a little background on myself. i'm 18 years old living in a household with my mother, my father, four cats, and recently my grandmother. i'm in my last year of highschool so i've been super busy with school and basically getting ready for college. but besides that, i'm having a problem that i literally have no clue how to fix. my grandmother has been diagnosed alzheimer's for a little over 5 years now, and she's only been living with us for about 9 months. she hasn't been too bad or anything, she actually has been doing amazing lately, but my dad sees her as this burden. he always makes it seem like my mother and i never help him out with her (even though he leaves me for a day or two while he's hanging out with a friend at a brewery or something) and he constantly says how he is frustrated with life. the worst part is that it is now influencing my grandmother, having her say ""i want to die"" and ""no one wants me around"". what am i supposed to do in this situation? i know i'll be leaving for college soon, but i don't want to leave my mother in a toxic environment like that. how do i make him see that he is effecting the whole house with his attitude?",0
7tq4ye,"i'm having trouble finding words that aren't blunt or harsh to say to my mother when she says she can just go live back in her house. she's almost 89 and is in the early stages of dementia. she told me today that she wants to save the money memory care is costing her by moving back to her house. i want to be kind and not distress her, but seriously this is not an option. who's got some nice sound bites they use for their parent that they will share? any favorite distraction tactics to get her off the topic? thanks in advance :)",0
2zn3aw,"hi, i have a mom with dementia. she is a great mother and i love her very much but her dementia is getting out of hand and not manageable anymore. i've been taking care of her for 3 years. her dementia has progressed and getting worse and i can't do things like work or leave the house even when people are with her. she begins screaming and wailing like she is in extreme pain, this happens now when i'm not around her. we are making plans on relocating her to care facility. she gets extremely upset when i mention it and i have to retract my statements to calm her down. i'm terrified of the day i take her to a facility. does anyone have any experience with relocating dementia family members who get upset or refuse to move out to a care facility?edit: thanks everyone, i feel much more confident and better about getting her to a home. i will have to lie as well.",0
rw0fxh,"i've posted a few times asking for help and wanted to share some good news for once. we had moved my mother to a nursing facility and she went downhill pretty quick. assumed it was the dementia/alzheimer's progressing, she was ornery and never got out of bed or spoke with anyone really. tho she was talking with dead people.after 4 months we moved her to another facility and within 3 days, she's almost back to being my mother again. the previous facility apparently had her on 3 different anti-depressants, so not a good thing. today (4th day), she's actually going to eat lunch in the dining room, sounds simple, but i'm in tears. so happy she's getting out of bed and trying to live again. amazing how a high rated facility can be so bad. just glad we moved her and didn't keep believing the bs we were being told.",0
b8zdbm,"new to this sub, as we got the official alzheimer's diagnosis for my 75 y/o mother this morning. even though my sister and myself already knew my mom's mind was deteriorating, it was still a shock to hear the doctor confirm our suspicions. only 4,5 years ago we lost our dad to a very rare brain disease (corticobasal degeneration), two years after that my mom got breast cancer (from which she is completely recovered) and now alzheimer's. when it rains, it pours.thankfully we have a very good healthcare system here in the netherlands. we're getting a home care nurse to apply medication patches once a day (and to check up on her), and a special dementia care coordinator will contact us soon to help us find the care we need for our mom. right now, my sister and me can still handle most things (making sure her bills are paid, taking her grocery shopping once a week, etc) but in the future she'll need help with self-care, keeping her house clean. my mom is very resistant to the idea of getting care like that. and it's not just the disease talking, she just doesn't want to accept help especially from strangers and never has. any tips on how to break the need for future care to her gently and peacefully? if push comes to shove my sister and myself have power of attorney over her (we had a legal document made with her permission and filed at a notary for this when we realized she probably had dementia) but we would rather not force the issue. she told me flat out over the phone just now she didn't even want the home care nurse to stop by. tough, tomorrow i'll be at my mom's for that appointment to make sure things go smoothly (fingers crossed).",0
o9wnoo,"my grandmother‚Äôs dementia has progressed significantly in the past few months since my grandfather passed away. they were living in their home independently, but without him, things took a sharp turn and right away, my grandmother couldn‚Äôt be left alone anymore even for a few hours. my mom and her two siblings all live in different states from each other and my grandmother, but took turns looking after her in her home and their own homes for a period of several weeks, trying to figure out the best place to move her long term that would make her happiest. she became very aggressive and threatening toward my mom and my aunt during this time over the discussion of assisted living facilities, and eventually got so violent that she had to stay in a psychiatric hospital for a month before being moved to a memory care facility near my uncle, since she remembered fighting with my mom and aunt and didn‚Äôt want to see them anymore.i wanted to know if anyone has advice for how to best support my mom. my grandmother cursed my mom out and said some very horrible things to her then ended by saying she never wanted to see her again. my mom and grandmother have always had a good relationship overall, but my grandmother had been known to say some hurtful things here and there before she got sick. however, i know her very well and i have no doubt that she would not have wanted to say that to my mom if she had been in her right mind, no matter how upset she may have been over anything. my mom is really hurt though and said because my grandmother remembered it all the next day, she thinks she really meant it and it wasn‚Äôt the disease talking. i said that i don‚Äôt think someone with advanced dementia is ever not affected by it in some ways, trying to make her feel better, but my saying that seemed to make things worse. she basically said she thinks blaming the disease invalidates how hurtful it was to her.i love my mom and want to give her the best support possible during this hard time. what is a better way for me to relate to her over what happened?",0
k050x8,"my 86y old grandma has been battling dementia for nearly 5 years now. it started with her repeating stories but it went downhill after my grandpa died.her short term memory is horrible. she will ask the same question many times, forgets my name sometimes (but knows who we all are) and generally acts like a child most of the time.she seems to always be very happy, doesn't understand tv shows but finds it amusing to watch and the most interesting thing - she's completely capable of living by herself.she lights fire in the fireplace, eats food we leave her and takes meds (i have to call her to remind her of everything tho). we visit her 2 times a week.the only thing that's gotten progressively worse is her short term memory and even her long term but she still knows who we all are and understands everything we tell her. it's been a slow decline during these past 5 years.what to expect in the future?",1
utbh3f,"her dementia has been worsening for years but the stroke really took a toll. she's also severely depressed and refuses food and water and my grandpa keeps going to the hospital to solve this but it's definitely related to her dementia and ongoing depression. she's very stubborn and every task is difficult. now she's not walking although she can physically, but gets nauseous when she tries. she hates pills and doesn't eat enough to hide them in anything. she sobs all day between her rambles. i just want her to be content, i don't know how to get her there. the family thinks it's so admirable that i'm here but i don't have any choice since my grandpa refuses a caregiver but i think that would make a huge difference given she hates my grandpa and it's especially bad without visitors. any advice in opening these conversations/what i could do? i feel so trapped here.",0
oi9nh6,"i was referred over this direction from r/childofhoarder. i know there is probably a lot of overlap, and also with depression, too. my almost 69-year-old mother is living in a squalor hoarder situation. she's never made the best decisions about her life, especially regarding her house and stuff. i am concerned that she may be progressing into dementia but i'm not sure what to attribute to her hoarding and what to attribute to possible dementia, if that makes sense? i'm in the process of trying to help her with her finances and get her to doctor's appointments she's been avoiding, and eventually get her out of the house and into somewhere safe. she signed over voluntary power of attorney to me after she basically handed over her inheritance to my aunt for nothing and we realized it after the fact, so i have some legal ability to help her, but not the power to unilaterally force her into anything as she can withdraw the power of attorney. what should i look out for as a sign of dementia? what can i expect from dealing with her if there is dementia on top of the hoarding? where can i take her to get tested that she would agree to go? i'm sorry i have a lot of questions but i'm just realizing things are worse than i thought, and it's possible its more than the hoarding that i'm going to have to deal with. thanks in advance.",0
huujh5,"hey guys. i'm staying with my mom while my dad is in the hospital. i don't know how long he's gonna be in there but the doctors said anywhere from 3-7 days. when my dad is with my mom, she's totally fine, lucid, can do normal things, but you can tell there's something going on with her memory and if you ask her to recall things, you can tell she doesn't know how or remembers unless it's something from when we were kids or a long time ago.no one can have any visitors so her behaviors are that she'll fixate on my dad and when he can get out, why he's in there, why no one told her, but then we'll remind her and she remembers. though, there are times when she gets upset and she'll start crying just focusing on my dad being in the hospital and she thinks no one is telling her anything. sometimes things will upset her and we have to spent like 30-40 minutes just repeating the same shit to calm her down. for example, my dad called to complain last night before bed and mentioned something the doctor didn't do that upset him therefore it upset her, and so she was doing fine all day and then right before bed he upset her so it took forever to calm her down.i was wondering if you all had any links or resources on how to deal with the behavior and/or things to help calm her down, ways of talking to her, etc? my gf and i are taking care of her and i feel like what we're doing is good for the moment and calms her down, but i quickly realized that this is way harder than i thought it was going to be. we've been doing things that have helped like draw out calendars counting off days until he gets home or have learned when to tell her info and not tell her anything upsetting at all.",1
drks89,"about two months ago my grandmother had a fall in her house and since that point it was decided by doctors/family that it is no longer safe for her to live on her own because she is a fall risk and has dementia. previous to this she had been refusing to leave the house and did nothing but read and watch tv. however, she did have a dog. she has now moved into assisted living and everytime anyone visits half of what she talks about is not wanting to be in ""this prison"". we have tried gently reminding her that it is safer for her and that she is doing the same things she would be at home but she believes that she was much more independent than she actually was. she refuses to participate in any of the activities the facility has and does not socialize with the other residents. she has just in the last week finally started reading again. my mother is feeling immense amounts of guilt about this and i want to figure out the best way to help my grandmother adjust to the situation. we all believe it is the best choice but she doesn't want to hear it.",0
8ey8sw,"my mum was diagnosed with early onset alzheimer's about 6 years ago. she is currently 59. we as a family have made the hard desision to move her into fulltime care in a beautiful dementia place near us.it's hard on my dad. his wife of 40 years and soulmate is no longer there. she's gone from a headstrong beautiful lady to a shell with this angry combative small child that's come out.she doesn't remember who we are much at all these days and seems so angry at the world. her speech is a combination of letters and numbers and sometimes spiteful swear words. she is disinterested in anything around her and lately isn't eating despite everyone's best efforts.working in aged care myself i have managed to kind of seperate the ""old"" mum from the ""new"" mum and i find myself crying less and less.i am worried about my dad. i don't want him to end up bitter and sad and alone when mums journey ends.does anyone know if there are any support groups tailored for men who are struggling?thanks for listening to my story. for anyone else who may need someone to chat to please feel free to message me here.",0
h89peb,"i'm 19 and last year my mum was diagnosed with young onset dementia at 52.since she began to change years ago, the strain on my family has been unbearable. her marriage to my dad has gone down the pan - he does try to help her, but he has next to no patience, usually eventually snapping at her after she repeats the same thing for the fifth time. i feel that same frustration, but i can't take it out on her as it's not her fault. she told me today how unhappy and lonely she is when i'm not there (normally i'm living away at uni, but i've come back to live with my family since covid 19), as my dad leaves the house for hours at a time, never spending any time with her. i've had a word with him to try to fix things, but feeling as though i have to help maintain my parents marriage, and constantly trying to diffuse tension and their hostility towards each other is draining me. does anyone have experience with a situation like this? i'd appreciate any advice or support more than words can say.",0
qwhyx8,"my grandmother (76) has had a rapid loss of memory and was recently diagnosed with dementia. we suspected it was dementia as despite being able to remember recent events, she relates most conversations back to her childhood. right now she struggles to remember things like how to get around her hometown, future events, and things we have said recently. it is coming on very fast and drs said she might start forgetting us within a year bc of how fast it is. the idea of her forgetting my family and i really scares me. what should i expect from rapid onset dementia? how can i make her feel more comfortable about it and what can i do to help? how do i handle her forgetting who i am?",0
ab7dxg,"so my mom is in her late 50s with a general dementia diagnosis and my dad is currently the sole caregiver and also is the sole source of income at their house. i live about 1500 miles away from them and i'm feeling helpless as what i can do to help. i'm married and deeply rooted into my current career that doesn't have any offerings in the same field where my parents live, so moving in with them right now isn't an option. due to my mother's condition (among a myriad of other issues) her mood goes from content to a full rage to sobbing uncontrollably seemingly in a blink of an eye. i know they've been fighting more and more lately since the diagnosis in may and they both feel really isolated due to me staying in the state they both grew up in and them having to move due to medical necessity. all of her friends from here, including some they met locally pretty much fell off when my mom couldn't drive anymore. i try to facetime several times a week but where nobody really does much outside of working there isn't usually much to talk about other than my mom and her condition. lately though it's been increasingly awkward/upsetting as her condition keeps worsening. tl;dr: what's the best way to give long distant support for both of my parents?",0
hnjnzt,"mom has not been diagnosed with dementia but she has many of the symptoms. she lives with my father who has alzheimers dementia. lately she has become really angry with me and my sister and she seems sad and depressed, partly due to being home with my father all the time because of corona. we try to help her and our dad but she doesn't want any help, sees any suggestion from us as an affront. she wrote an email the other day where she threatens us and our families (yes her children and grandchildren) and also mentions stuff like suicide. any tips on how to handle this? how can someone reach her?",0
35mg34,"my grandmother's dementia has gotten very bad very quickly. her husband passed away a month ago and since then she has begun calling our house every 2 minutes in the evening because she's worried that he ""hasn't come home from work yet"" (he retired over 10 years ago and was debilitated from alzheimer's and parkinson's for the last 5ish years).she has our number, and only our number, memorized. it's not on speed dial. there were over 60 messages on our machine the other night when we came home from dinner and a movie, and that's typical. when we do pick up the phone and explain to her (again) that he's gone, it still doesn't sink in and she calls back minutes later.she has 24/7 aides with her in her home and we have printed up in big type a note explaining when/where/how he passed away. nothing seems to help. we can't go through the rest of her life like this. it's not healthy for her to be so worried all the time about him not being home, and the constantly ringing phone is driving us all insane (aside from us not being able to grieve because we have to keep breaking her heart with the re-tellings).what can we do? what can the aides do?",1
j7286q,as the title says. she has alzheimers. what should we do?,0
8g5g9s,"my nanna, who i have lived with most of my life, was officially diagnosed with alzheimers today. my grandpa and i both knew this was coming so we were both emotionally prepared for the news, but god it‚Äôs shitty. thankfully it‚Äôs still very early days for her, she is lucid 100% of the time but struggles with remembering where things are or performing simple tasks such as turning on the tv or making a phone call.i‚Äôm not even sure why i‚Äôm writing this, but i‚Äôve been reading along with all of you since i first suspected a few months ago.any tips on how i can make this transition any easier for her? any tips on how i can make this any easier for myself?",0
anxd2b,"my grandmother knows our faces, and can always identify us, even during a spell. she's rarely lucid, but i enjoy our time together when she is. it makes me sad/depressed she still knows our names, but she'll tell us to take a painting off the wall behind her, when there isn't one. also, she tells us she's preparing our favorite food for dinner and she has to go to the store to get it, but she's bedridden.so...is it better to explain to them they have dementia or go along with it? what is more comfortable for them?",0
