reddit_id,post,memory_loss
i8t88v,"so i could use some advice for my gran. a few months ago she went into kidney failure and got a lot of side effects from it. the kidneys are very slowly getting better. however she's been diagnosed with rapid progressive dementia. she went from being absolutely fine to not knowing who anyone was and other symptoms in a matter of weeks.shes now eventually gone into a care home, it's not an amazing place and they aren't specialised in dementia patients. unfortunately we can't afford or find anywhere better at the moment.we're allowed to visit her, but with walkie talkies through a window and we were calling her. some days she's absolutely fine, like normal and cheerful.other times she seems absolutely insane. she believes she's being tortured and there are people being murdered around her, any advice on how we can sooth her over the phone or whatever?we've tried absolutely everything and she just gets completely paranoid and hysterical, it's really hurting my parents and me i suppose to see her like this.",0
v65ziz,"in the past year, my 94-year-old grandmother has slowly started to forget things. we recently brought her to live with us and she still thinks she's at her home in mexico. she truly believes that she's in her home even though she's actually in the u.s living with my family. luckily she still remembers my family but has forgotten a lot of other people. my question is what do i do to help her? are these the early stages or are we way past that? should i let her think she's in her home so she won't want to leave?",1
o7zhfw,"my mother(65) was recently diagnosed with dementia. at first it wasn't too bad, i(25f) would help with giving her her meds and the cooking and cleaning and all that, but just within the last two weeks she has rapidly declined. she has forgotten where the bathroom is, she's gone in the laundry room and her closet that i know of. almost everyday i am doing soild laundry. she can't speak in coherent sentences. she takes her clothes off in the middle of the living room. she wanders when she's awake but sleeps most of the day. she has a referral put in for a memory care facility, but that is going to take a while. my daughter has also gotten very possessive over her stuff, but only to grandma. i've tried to explain to her whats going on but she's only 3 and doesn't understand why grandma is suddenly acting this way.i don't know what the point of this post was. i guess i just wanted to rant. am i a horrible daughter if i say i hope the wait for a place in memory care comes soon?",0
f3cq23,"i'm 16; both my parents are older (dad's in his 60s, mom's in her 50s). my mom, not officially diagnosed yet, has been showing signs of early-onset dementia and her doctor's said it's pretty likely that she has it. &amp;#x200b;it seems to come and go- she has good days and bad days i guess, and the bad days are pretty rare but i still get freaked out. like the other day we had the same conversation about a shirt four times in a row (exact wording and everything). sometimes she's aware that she forgot something and sometimes she's not, but it's always really hard seeing her so confused and even crying sometimes. she always makes jokes about 'if i ever forget who i am or who you are, just take me out in the backyard and shoot me', so at least she's trying to be positive...&amp;#x200b;i'm just finishing up high school now, my brother's super busy in college, and my dad's still working even though he was supposed to retire years ago because he has to support his kids through college. i do schooling online so i'm the one who's home with her most often and sees what's going on. when i leave for college, she's not going to have someone at home to lean on.&amp;#x200b;how do you deal with it? i'm fricken terrified.",0
ht22nh,"hey guys, joined this sub for a little advice. my great grandma is 95 and has had alzheimers/dementia for a few years but it‚Äôs only gotten kind of bad the past year or so. me and a few other family members take turns coming to her house to watch her, and also have cameras at the house for when no one is there. 23 years ago, she moved out of the house she had been in for most of her life, and moved into her current house when she married her husband (he‚Äôs now passed away). her old house was sold to my aunt but it looks nothing like it used to, anyway. sometimes, like today, she‚Äôll constantly say she wants to go home. when i say this is home, she‚Äôll say something along the lines of ‚Äúthis is my home yes but i don‚Äôt live here, i want to go where i was this morning‚Äù even though she slept here the night before. i don‚Äôt have a car so i can‚Äôt bring her to my aunt‚Äòs house anyway to go along with it, but even when someone else was here my aunt got tired of having to deal with her coming up there almost daily. what should i do in this situation?",1
s18lom,"i and my family think my mum (72) has some serious mental health issues, we think dementia is likely. she is a lovely caring person; the sort of person you'd bring a friend home to and she would fuss over them and make sure everything is perfect.in the last 2 years or so, she has changed, becoming fixated on odd topics (she watches hours of news everyday), become more moody and also very bitter. in the last week, she has been adamant it is the 28th of december, even tho my dad showed her a calender and tried to explain what day it was. she has had two arguements with people who were walking there dogs on the street past her house etc. it is so out of character. the problem is that she refuses to get help. my dad has asked her multiple times. i've mentioned it (in the guise of treating covid induced anxiety) and she told me my dad didn't want her seeing anyone. i‚Äôve noticed these changes in the past couple of years, but it has swiftly accelerated in the past few months.i guess my question is, what is the best way forward? how do we get her help? i have not yet sat her down for a ""serious"" conversation as my concern itwill antaganoise her. any suggestions are much appreciated.",0
rtt3di,"hi,my grandmother passed away on friday after a period of illness. my grandfather is very progressed in his dementia and has regressed to childhood memories only and his native language. he understands to some extent that we are family and sometimes that he has a daughter (my mom).. he has glimpses where he is more lucid but for the past months of my grandmother's illness, he seems to have thought that she was his mom. when he was informed of her passing on friday he broke down, by the time they arrived t the hospital to see her body he had to be reminded about why he was there.he seems to have lost the ability to form any new memories.. how should we approach this? is it more merciful to not inform him as he gets so upset? or should we keep at it?",1
gxn6z9,"hey everyone.i'm curious about what others' experiences have been regarding senior parents in isolation during the pandemic?i knew this would be hard on my mother (73) and 3 months later, it's clear she has deteriorated quite a bit. she's been having growing memory issues over the past few years and now they are far worse and she's having delusions. seeing things that aren't there, and despite the fact i live 4 hours away, she is convinced i visit her every night and when i talk to her, asks when i'm coming over. i can't even be there to do anything because of closed borders but over the past 4 months i have called her every single day, many times twice, ordered her groceries and take out in an attempt to take care of her from afar and not let her feel so lonely. i know it wasn't all for naught because had i ignored her, it might have been much worse a whole lot faster. what have others' experiences been like? how have you coped? i imagine that my mother is verging on dementia territory if she's not there already but has there been instances where some of these issues have been reversible? thanks for anything you can share.",0
9e036t,"using a throwaway as i don't usually use reddit for personal stuff.as the title suggests, my mum sadly passed earlier this week. my dad's (80's) dementia is quite advanced and he's been in residential care for a few months now. he remembers that he's married but he doesn't realise that the wife in his head is the woman he was living with for 50+ years prior to going into care.i'll be going to see him in the next couple of days and i have no idea how to break this to him or even whether he'll understand.can anyone give me any pointers on how to approach this with him? happy to answer any questions and thank you in advance.",0
o746rk,"tia for sharing ideas or experience with your own situations. my 76 yr old mom has had a rapid decline and was diagnosed last month with mod-severe alz and vascular dementia. i'm her only child, have not been involved in her personal business until april but now need to manage everything. i'm her only child and just got durable poa.this is a delicate situation- she's far enough along that she can't handle these things herself (doesn't know how to use her phone any more for example), but it seems very important to her to stay involved, probably due to her being a bookkeeper by trade.when i try to involve her to be respectful, she is frustrated, needs extra time to understand, and forgets decisions we already made together. slows the whole process way down. throw on top of that a lifelong tendency to think everyone is out to swindle her, now exacerbated by dementia, and it's a mess.how do i convince her to let go of things that are too complicated for her brain to understand without her feeling alienated? i have my own small children, marriage, and career to tend to and our current method is taking way too long and creating too much frustration for both of us.advice on how to (gracefully) handle this transition? what worked or didn't work for you?thanks much.",0
8oouw4,"my grandmother has been living undiagnosed with dementia for about 3 years now. she refuses to believe shes losing her touch and i am her 34 year old grandson who lives with her and is basically a caretaker because she forgets to eat and take her medication other than that shes fairly independent with basic needs except her stubborn pride. today i had a blow up, she is forgetting one minute to the next, she thinks im belittling her by constantly having to correct her even though im simply stating ""you forget we just talked about this few mins ago"" and in her mind im making it up, she doesn't believe she was just told something or that something has just been explained and its gotten to the point where she now sees me as a bully, a bad person who isnt to be trusted. now the awful part is im going at this alone, her daughters arent interested in trying to help me, or her!! they are in denial as well because they say ""she acts just fine around me"" but they do not see the day to day, hour by hour changes that she goes through and now suddenly im the bad guy!! im afraid to say im gonna have to move out and give her up to herself or simply let her live alone for awhile. she has fallen 3x in one year, she will take her meds over and over forgetting she already took them, but ive gone and done all i can!!! i feel like once im gone, she will hate me for leaving, but if i stay she will hate me anyway so im at a loss....please tell me im not alone in this, can someone relate?",0
oof0do,"my grandmother (78) has always been known for being a bit scatterbrained and making silly remarks, and we‚Äôve always joked about it. last year, my aunt said she was more concerned about my grandmothers memory and that she was becoming more forgetful. we brushed it off as her just having a moment and the fact she is a little bit older, and that was fine. she‚Äôs perfectly lucid and has a quick, sharp wit. i saw her today and now i‚Äôm concerned- she was trying to tell a story about a family member and it took 4 or 5 attempts for her to get the story right, and that was with me asking her to clarify who she was talking about as she was getting names confused and my grandfather also intervened to correct her at one point. on the flip side, she remembered nearly every detail of something insignificant that happened 25 years ago (passing my parents car on a road in a tourist destination). she also has moments of forgetfulness in regard to her short term memory- you may speak to her and tell her you‚Äôre doing something and she‚Äôll completely forget until you remind her and will be like ‚Äúoh yeah‚Äù, and she often confuses details about stories. this is the first time where i am wondering if there is something more than just age-related confusion. can anyone give me advice on next steps or how i should approach this? i‚Äôm going to speak to my mother about it of course, but not sure what else i could do. there‚Äôs no other dementia in the family, apart from an aunt who is 105, so i don‚Äôt have much experience with this‚Ä¶.",0
khq2fo,"hey all.my grandma has just received the diagnosis of alzheimer's disease and my whole family is confused about the best approach. we will obviously be speaking with all the medical professionals we can, but because it's the christmas period we haven't gotten much yet and wondered if you could help get my mind a bit clearer?my grandma doesn't know she has alzheimer's, my aunt was told while she wasn't in the room. she knows that she had scans, knows that her medications are going to change, and knows we're all worried about her but she has no idea about her official diagnosis. my grandad (she is his carer) and aunt don't want my grandma to know, because they're scared at her response. her mental health in general isn't great and her main alzheimer's symptom is paranoia and loss of emotional control.i don't feel like this is fair and will just end up creating more dangerous situations in the future. as she deteriorates she's likely to get more confused and surely having time to come to terms with the future before this happens is better? all i'm imagining is periods of lucidity being filled with ""what is wrong with me""what is your experience of this stage? was the person aware of their diagnosis? any general tips for dealing with this to make her life/our lives easier?thanks!",1
ib5ljq,"hi all! new member here, hoping for some advice!my grandfather lives states away and has dementia, and it‚Äôs progressed pretty severely at this point. essentially, he no longer recognizes who my grandmother is :( he calls us every night, paranoid, asking for help finding her when she‚Äôs right next to him. i‚Äôm an slp by training so i know how important it is to stay calm, not challenge him, and affirm for him how much he we love him and that it will be okay. unfortunately, he is pretty adamant that we take action and call her to find her. when it gets to this point, we‚Äôre not sure how to respond. have any of you had similar experiences and have creative ideas on how to respond when he gets stuck in this mindset? nothing we‚Äôve done seems to work, so any ideas are so appreciated!! thank you for taking the time to read, and wishing you well!",1
61l41y,"my last grandparent (my nan) has dementia and asks us the same questions about every minute. usually requests for tea, wondering how old we are, asking when she's going home, etc. recently we've been told she has about two weeks to live as she is unable to eat and they've removed all meds except palliative ones. i've been visiting her about every two to three days although it never feels like enough and leaving feels like i'm the worst person in the world.one of the questions she's been asking is if she's dying. sometimes it's a statement. but what do/would you say to this? usually we say no and she forgets. sometimes my mum asks why she thinks that. yesterday she said because she's old and today she said because she could hear god.but what would you say? even knowing she's going to forget anyway i want to do right by her.",0
7pl1gf,"today i received a message that my great-grandma was taken to hospital. my great-grandma is in her early 90s. i'm not sure when or if it was diagnosed but i think she has alzheimer‚Äôs, in which she started showing symptoms for when she was around 86, maybe earlier. in hindsight it's clear to see why but i believe she started showing symptoms of dementia when she started to accuse my uncle and my cousin (his son) of stealing from her, which she adamantly believed happened. this may have coinsided with some home renovation carried out by the council, i'm not sure if anything was actually stolen but she seriously believed my uncle and cousin did it which led to friction and upset. fast forward a year or so later to the next time i saw her and it was clear that her memory was detiorating, she remembered me but she seemed struggled to remember the last time she saw my nan (her ex-daughter-in-law which visited her the day or week before). as i left in the car (with my mother and aunty) i was upset as it was starting to set in that the grandma i loved dearly was starting to fade away, doubled with the news that my mum told me in the car that she also accused her of stealing several items.these accusations have upset my mum deeply and she has not seen my grandma since (i have since learn that accusing people of stealing happens regularly in those diagnosed with alzheimer‚Äôs and told my mum that it wasn't my grandma talking).fast forward another 2 or 3 year later to last september and i went to see her with my nan, which was the first time i saw my grandma since the prior visit (i was conflicted to whether i should go to see my grandma anymore or not her and at the time i didn't know accusing family of stealing was connected to her illness). although i was expecting her memory to have worsened i thought she may she have still remembered me. but it wasn't until she asked who i was, who my mother is and how i was related to her did my heart drop. i had to contain my emotion as i was on the verge of crying infront of her and my nan.i haven't seen her since and i am constantly filled with regrets and emotions...would she still have remembered me if i saw her more often? i can't but help thinking that in her time of need i abandoned her and left her without a reason to why i stopped visiting her. what makes it even harder is that i can't even apologise for what happened and tell her that i'm sorry.",1
rkpkwf,"my mom has dementia and i care for her in her home. she likes to help with the dishes, but she doesn‚Äôt remember where she keeps anything and finds different places all the time. i used to get frustrated when cooking because i couldn‚Äôt find anything, but now i look to it as a cognitive game for myself. i note where she put a utensil, bowl, etc. and instead of moving it, i try to remember where i saw it. if nothing else, i‚Äôm more mindful and observant, which helps me to not get as sad as i watch her struggle. i don‚Äôt want her to ever feel like she‚Äôs a burden or see me upset, it‚Äôs unsettling for her. what helps you with your loved ones with dementia? she‚Äôs refusing labels, too proud for them and she says her dementia is her secret, so i keep it. i don‚Äôt think i‚Äôm breaking it here because i feel somewhat anonymous.",2
gw7n6k,"hi, i just found this place. might someone with experience be able to tell me something useful?my mother was diagnosed with early onset dementia. she's in her late 60's. she's getting worse but it seems as though she can't see it.she'll ask me things that are totally out in left field, or things that don't make sense. sometimes she'll combine 2 unrelated things into a question/statement. and she gets this blank expression of confusion on her face where her eyes gloss over with a ""dead"" look like she's not there. the lights are on but nobody's home.she accuses me of intentionally making her feel stupid but i'm not. i try to explain that she's not making sense or that i don't understand what she's asking. this always ends in a big fight when she's around. i can tell that she's struggling or frustrated but i don't know how to help her.when a situation like that occurs, is there a right way to explain i don't understand while diffusing the situation? how is this handled without coming across as aggressive or humiliating?thanks so much. any suggestions are helpful.",1
m6j2g2,"my dad is 84yo with alzheimers. i don't know what stage he's in, but suffice it to say that he generally doesn't recognize any of us as family. and generally thinks that he's already in a facility.my mom is the 24/7 caregiver - generally in good health, but physically/emotionally/mentally exhausted. he knows her name and thinks it's an interesting coincidence that her name is the same as his wife's name.up to this point, my mom has made it a point to rarely correct or argue with him about his perceived reality. but we're now at a point he's become fixated on the idea of asking his ""nurse"" to contact his ""wife"" ... and wonders why she won't call. as if he thinks that his wife has abandoned him. so seems like our options are:* start correcting him and trying to explain to him that his caregiver is his wife* or take this ""never correct or argue with him"" to the point of making the charade even more elaborate by faking a phone call or a voicemail from her to himanyone ever deal with this? i'm not sure how he'll react when he tries to mentally reconcile that his nurse is actually his wife.",1
60jikk,"my aunt fell last week, and her mind seems to be deteriorating quickly now. i understand it's normal to backslide after a fall, but she's starting to talk about people who have passed away as though she saw them recently. i know i'm supposed to just listen and not correct her, but i'm concerned if i should remind her that her husband passed away five years ago. she says she doesn't know where he is, and she knows that he would've come to see her if he still loved her. so she's got it in her mind now that he has sided with her sister (also dead) that is trying to steal her money. i know that paranoia is part of the disease, but i don't know if it would be worse to tell her that her husband has passed on and is looking out for her from heaven, or to just let her keep thinking he doesn't want to see her. any thoughts?tl;dr: what's worse? husband of 69 years dead, or doesn't love her and won't see her?",1
p6x7ae,"my grandmother (86) has diagnosed dementia and is in the process of being moved into a care facility. my mother, who is my grandmother's daughter, has a bit of strained relationship with her. this is especially true now as my grandmother's paranoia progresses (i.e., accusing my mom of ruining her life, stealing her things, just being generally nasty, etc.). the decision to move her into a full-time care facility has been extremely hard on my mom and she's not only burned out but also guilt-ridden over doing what she knows my grandmother does not want. myself and the rest of my family agree that she needs to be in full-time care (she sometimes wanders at night if left alone) but also that she cannot live with my parents for the sake of my mother's mental health and general inability to provide the level of care she requires. yet whenever i try to reassure my mom that she is making the right decision, no matter how difficult, she ends up in tears over how guilty she feels and how scared she is that the care facility will ""drug up"" my grandmother to ""keep her under control."" does anyone have some advice on what i can say to put my mom at ease? i've already taken time off of work to be there for the move, but my heart still hurts for my mother who's just trying her best and i'm struggling to come up with some comforting words. thank you in advance!",0
kljlwu,"hello fellow redditors. i'm new here and just read through so many of your posts. you all seem so kind and supportive so i thought i would ask for your advice. my mom has early onset alzheimer's (she's 64) and it's progressing more each time i see her. i see her about twice a year. she still knows who everyone is but gets confused often, can't find her way through my house and needs help with things certain tasks like dressing and showering. not sure what stage that is but i can see things getting worse. my dad seems in denial (or maybe just doesn't want to talk about it) about the severity of the situation and what the future holds. being that he's not really prepared for the road ahead i was wondering what advice you could give me in planning for the future. is there something we/he should be doing now to make the road easier? she's been diagnosed and takes a couple different memory related medicines and is on an antidepressant.",2
