reddit_id,post,memory_loss
p6xm7b,"my mom has dementia, and now physical health problems severe enough doctors in the rehab she is in now are suggesting hospice. i'm her health care proxy, so they communicate with me.do i explain what is happening in detail to her, or just keep it general. nothing i tell her will be retained a day, or even a couple hours, later. it would be a recurring explanation if i tell her.alternatively, do i just tell her she's moving to a different location than where she is now?i hate to lie to her, but making someone confront their death over and over just seems unnecessarily cruel.",0
vxja55,"my mother has dementia and mental health issues. i see her condition deteriorating over the years. but now i realise its for real. she is not diagnosed because she denies everything although it is the exact same pattern as my grand mother.for the past 10 years, she has cut ties with everyone in her circle, except me (am i next?). i live 3 hours far from her. i don't see her often, because she is very mean to me and it affects me.she refuses to leave her house to live somewhere with healthcare, she calls me a liar when i broach the subject of her memory.i really dont know what is next and it scares me‚Ä¶ i feel very alone in this.anyone is far from the person and still manage to be the caregiver? how?",0
25x2y2,"hey guys,my nanna has alzheimer's and i was just wondering. she forgets things so fast, is the usual thing to do to tell her things that might upset her over and over if she asks questions? like people who have died? is there any point to that? or is it just best to say ""oh he's fine"".also i'm not talking about whether lying to her is moral.i mean is it bad for her for some reason? are you specifically supposed to remind people of the truth about that kind of thing?",1
swlo2h,"dementia doesn‚Äôt run in my family, but in the past year i‚Äôve noticed things in my mom that aren‚Äôt really justified by her age (59). she‚Äôs constantly having trouble remembering names of actors/actresses or tv shows and movies, and just last week we began rewatching better call saul. things that happened 1-2 episodes ago are completely gone in her head, and she‚Äôs asking me about them like it‚Äôs the first time she‚Äôs heard about it.i told her the show‚Äôs set in 2002 3 days ago, and she asked me today again. some detail in an episode yesterday mentioned in today‚Äôs episode, she asked about it today like she heard it for the first time. it‚Äôs honestly frightening, i hope she‚Äôs just not paying attention‚Ä¶what other signs can i look out for?",0
vzb4iw,"i have a strong family history of dementia and my mother's elder sister passed recently in her late sixties with almost no memory left. my mother is currently older than her sister was when she passed. first thing this morning, my mother asked me how i wanted my liverwurst sandwich, something she has made me since i was a child and have never eaten any differently than how she has always eaten them herself (and still does). i had to explain to her what items go on this sandwich and i am now concerned. she has had some little moments here and there (missing a turn when driving, tasks taking much longer than usual as she gets distracted, little 'senior' moments) but most of them are explainable one way or another but this is sticking out to me and i am concerned. with our family history and semi-recent passing, bringing up any memory loss questions is a minefield, so i am very unsure as to what to do here. any suggestions or should this just be something i keep in the back of my head to keep track of?",0
3083x5,"we've known for about a year that something was wrong. she has horrible short term memory, random migraines, black outs, and randomly loses her vision during bad migraines. she's seen multiple doctors but when we moved to our current location a doctor told her what he thinks. earlier today she called me and told me that a loan got approved and what needs to happen before we pick it up, and 20 minutes later she calls and it's the same exact conversation. it's frustrating and i'm not trying to show my frustrations. i'm scared shitless for my wife and what's inevitably going to happen. how does someone cope with this at such a relatively young age?",0
bv8sd7,"my mom was recently diagnosed with dementia after a fall that caused a head injury and resulted in hospitalization. before the fall we had noticed memory issues and she was no longer able to text and forgot how to knit. the head injury seems to have intensified her memory issues, and her short term memory is shot. while in the hospital she was diagnosed as having moderate to early advanced dementia. should we tell her about this diagnosis? she currently thinks that all her memory issues are a result of the fall. it seems cruel to upset her by telling her she has dementia, and she most likely won't remember it anyway! how have you dealt with telling an elderly person they have dementia?",0
pldqs4,"she's 92, in assisted living and uses a wheelchair because she broke her hip in a fall. (she had other falls resulting in other broken bones, too.) she has a diagnosis of dementia and takes a dementia drug whose name i can't remember and three different antidepressants in addition to some of the usual 'old age' drugs.how do you handle this particular delusion? she can't remember what was stolen (obviously, because nothing was stolen), so offering to help look for 'it' or 'them' just frustrates her more. telling her that nothing was stolen isn't the right thing, i'm pretty sure (anyway, i don't do it).do i just go along with it and commiserate about the awful people who sneak into her room?",0
pi02ju,my grandparents passed in 2008 and 2019. after the 2019 death of my grandmother was when my dad‚Äôs was really when i noticed his dementia. he was the one who found her on the floor after she passed. everything has been progressing with his dementia and he‚Äôs now late stage and lately he thinks they are coming home from vacation in california. a few times a week we go over to the house which is a bit of a time capsule and he looks for them. to the point of checking the bed to see if anyone has been sleeping it in and he thinks they have. the bed is covered in clothes and coats. last week he found the death certificate for my grandmother and was agitated for a whole day. but today we are back at it waiting for them to get home. how do i tell him they are not coming back or do i even bother? so far i‚Äôve ignored it and just go along with the visits. am i doing him a disservice?,0
mf4t6o,"for a long time i've been putting down my mum's (71f) quirks down to her personality disorder (undiagnosed but likely borderline, maybe others), but something that happened today has made me look up dementia and i realised she has several symptoms.&amp;#x200b;according to her, everyone else is wrong, nothing is wrong with her, she would never need to see a doctor, if i question her about forgotten memories i'm the one who is crazy.today she asked my partner if she had met my mum's partner. she has met him mutiple times over the last 2 years, most recently 2 weeks ago when we had a coffee with them.&amp;#x200b;i literally don't know what to do now. i just asked my mum's sister if she noticed anything similar and she told me of a similar event. i won't get my mum to the doctor and if i confront her with what has happened she will just explode at me and still not see a doctor.please, what do i do? it's been a gradual decline over years but i think it's accelerated recently.",3
cx7b2c,"my grandma has been in hospital since last saturday, so over a week. she was admitted because she wouldn't get out of bed, hadn't eaten anything for days and was talking nonsense. they gave her a ct scan and finally after months of us noticing symptoms she was diagnosed with vascular dementia. they didn't release her until they had a care plan in place - care 3 times a day to get her up, feed her and put her to bed.today she was released from hospital, at about 14.30. at 21.30 the phone rang and it was my uncle telling us that he had just gone to her house to find it empty, in complete darkness, with the door unlocked and the key in the outside of the lock. he lives a lot closer than my mum and me do.he drove around bradford for 45mins looking for her, finally finding her in a stranger's garden wearing only a hospital nightie. she saw him and started spouting nonsense about how she had just been to a funeral and she was angry at him because he was supposed to take her to this funeral but hadn't shown up.my mum got a call from my uncle telling her all this, so we rang the out of hours care line because we didn't know what else to do. the lady on the other end of the phone said 'well, i don't know what you expect us to do about it' and now my mum is in floods of tears because she doesn't know what to do. she was just released from hospital a few hours ago but she's obviously not okay to be at home by herself, even with the care put into place by the hospital.where do we go from here?",0
ne87f1,"my grandmother has been on a huge mental decline for the past several months where i am extremely concerned. she keeps creating these wild stories that are not true, and its getting to a point that if i don't go along with them she gets mad at me, tells me she wants to die, and hangs up. during these moments she can't form sentences. but hours later she will call me back and apologize. things were better this week, but now she called me to tell me she has a mental condition that can only be fixed with eyedrops, but can only go to an ""old folk's home"" to get it done. she spent three hours looking at her old phone books looking for a place to get it done. which means i'm going to spend another three months telling her this isn't real. she hates doctors, other than the things she knows she needs to go to. how did you convince your loved one to get tested? or just go to the dr?",3
6die6p,"i've looked around a lot and can't seem to find symptoms to support that my mum might have early signs of dementia but something definitely isn't right. she keeps asking very obvious questions, sometimes even rhetorical questions and gets annoyed when i don't answer her. some of the questions she asks where she's clearly mid way through a thought and they have no context to what we are doing at the time. she gets very frustrated by my confusion, but it's hard to answer a question totally out of context. such as ""should i do that tomorrow then?"" so i ask, ""do what?"" she'll throw her arms up in frustration and accuse me of not listening. she's also become extremely hypocritical getting very upset if someone doesn't ask her how she is despite her never asking anyone else how they are. the final straw for me was when we were talking on the phone and she suddenly hung up, when i rang back she claimed she thought we had finished talking. is there anything i can do, or anyway i can approach this? living in the uk as well. thanks in advanced.",3
bzly5a,"my father (58) was diagnosed with frontal temporal dementia about a year ago. (it got bad quick) we have never been close with his much younger brazilian wife. upon us telling her about his diagnosis, she promptly drained his 401k, and we couldn‚Äôt get a hold of either of them for a few months. when we finally got ahold of them we discovered that they up and left everything and moved to brazil. she also denies his diagnosis,and acted like she didn‚Äôt know what we were talking about. fast forward now , their homes here are getting foreclosed on, we have no way to contact him, .. i am getting married in february, and my dad doesn‚Äôt even know. anyone have a similar situation, or advice? thanks.",0
ovh81r,"my mother passed three weeks ago from alcoholism. it wasn‚Äôt a good situation so i was only in contact with my father over the phone and the calls were brief. since she passed he has been spending a significant amount of time at my house and is doing some things that concern me- forgetting words, mistaking who he‚Äôs talking to, forgetting how to play a board game while playing it.yesterday, he was leaving to go back to his house and walked passed his car which was parked on my side of the street. he then crossed the street and started walking down the sidewalk. he paused and then went to his car. when i asked him about it today, he said he had forgotten where he parked. his car was the only one on the street. because i have only had brief contact these last few months, i don‚Äôt really know if this is new behavior or perhaps a response to the trauma of my mother dying? he also has parkinson‚Äôs and i know that can lead to dementia.what are some first steps i should be taking? do i contact his doctor? thanks in advance for any advice.",1
co1tic,"my grandmother (mmse score of 17, down from 21 early this year) was doing fine until my grandfather had a fall, and now he‚Äôll be in the hospital for several weeks. she keeps asking where her husband is, and she‚Äôs mortified when i tell her he‚Äôs in the hospital. this happens every 5-10 minutes, and i don‚Äôt want her to panic. i also don‚Äôt want to lie to her (and she can tell, anyway). i‚Äôve been telling her he‚Äôs in the hospital, and immediately adding he‚Äôs okay and he‚Äôll be back, and it seems to help. she‚Äôs no doubt still confused. but i‚Äôm wondering if there‚Äôs a better way to handle it?",0
p8ykoj,"i almost put ‚Äúfriends‚Äù in quotes, because i have strong opinions about true friendship and what that means. my wife is in total angry denial that anything‚Äôs wrong. she acidly tells me to stop telling her ‚Äúi already told you‚Äù and the like (5 times this morning about this evening‚Äôs plan). as long as she stays in denial and refuses to even see a dr, i will not pretend that the empress‚Äôs new clothes are fine. but other than our two adult children and one very long term friend, no other friend, acquaintance or relative says anything. so my wife keeps saying that no one else tells her this. saw a cousin of hers yesterday who‚Äôs ‚Äúlooking for the right time‚Äù. of course, it never is. after yesterday i texted her that ‚Äúthe reality is, to help would take other people telling her what i've been saying‚Ä¶no one is telling the empress about her new clothes. that's what's needed.‚Äùany suggestions on approaching other‚Äùfriends‚Äù? our community all notices and knows, but no one says anything to her, and mostly not to me.",0
lh1xu7,"hello, all. i‚Äôm a 19 year old girl in college, and i help take care of my grandpa pretty much full time. we know the time is coming soon (talked to hospice and all that). i‚Äôm pretty much terrified to ask this question, but too embarrassed to ask my mom. if i try to wake him up one day and he‚Äôs not breathing, what do i do? do i call the ambulance to verify his death?do i call my mom? any advice or tips would be helpful, as i am clueless and need some guidance from those that are dealing/have dealt with this. thank you!",0
q83pjg,"we haven't had anybody with dementia in our family so we are not sure how it starts and what it's like.my grandma is 80 years old. well, even when she was in her 50s, she loved to exaggerate everything about herself and her family - how good looking or educated they were, that she was more important and loved than she actually was etc., but now it's getting worse and worse.most of the times she comes up with stories related to celebrities, famous people, whatever she sees on tv etc.a couple of examples:1. there was some economics expert speaking on radio. when his name was announced, she claimed she knows him very well, and that he was his lecturer at the university. the guy is 40 yeard old max. he wasn't even born when grandma went to college. we tried to explain this calmly, but she just got upset and didn't change her story.2. our distant relative (joe) is a politician and has worked with the prime minister of our country. grandma claims that when she was at the funeral of joe's dad, she hang out with the prime minister and his wife, she sat in their car, they drove to the graveyard together and had a nice chat on the way. the pm and his wife did not attend the funeral and grandma did not meet them at all. it this a sign of dementia, what should we expect next and how fast does it progress?",0
um7yxm,"hi there!i'm a 30-year-old, and i'm wondering if/terrified that i'm starting to develop dementia:- completely forgot someone's name for ten or so seconds. known them for years- feel like i'm in a haze all the time- spaced out more time than not- trouble reading; feel like my brain shuts down half-way through any sentencei've talked to my doc about this, and she's inclined to believe it's my anxiety and depression, but after several years of unexplained and unaddressed symptoms, i'm starting to reach out to others a bit. i have no history of dementia, though my grandma had trouble recalling the correct names for many years for no given reason. i've had a ct, blood work, and a urine test, none of them through neuro, and all seemed to come back clear. what'cha think? something serious or mental illness running amok?",0
q7v9k8,"so, my wife's grandfather died last week of prostate cancer at the age of 92. it was about a 2 year battle (unfortunately, through most of covid) and he passed peacefully in his sleep last tuesday. he left behind his wife of 67 years, who has dementia. we are a small family - my wife is the only child of an only child - which means the care giving is falling primarily on my wife and i (fil has another member he is already caring for).it seems that the family never really confronted grandma's dementia when it was diagnosed about 10 years ago, and now that her husband is gone, it's become increasingly difficult to sit with her. conversations inevitably circle back to where her husband is, what happened to him, and how she is a terrible wife and person for not knowing he was sick. we try to reassure her, but then 30 seconds later it all repeats.i'm learning more about the disease, but the last week has been... just utterly exhausting. we've begun to keep a ""memory journal"" where she can record her thoughts and feelings, as well as a schedule broken down by hour of what has and is going to happen that day. this seems to help somewhat, but i wonder how much progress can be realistically expected.at this point i'm not even sure what my question is. i guess i'm just looking for advice, or at the least some positive things to keep in view, since the future seems very bleak at the moment.",0
acd9fy,"she has lost something in her house but doesn‚Äôt know what it is. she keeps telling my mom and i ‚Äúwe will know when we find it‚Äù then a few moments later, she says she‚Äôs looking for an envelope with $100 in it. so far, we‚Äôve just been looking around with her for about 45 minutes even though she can‚Äôt consistently remember what we are looking for and it keeps changing. is there a way that we can help break her concentration from this while not making her feel bad or belittle her?",0
4wtccs,"hello all,first and foremost i would like to send my condolences to all who have to use this subreddit to look for help.i am a 22 y/o male who is dating a 22 y/o female. my girlfriends mother has ftd in her mid 50s and is in assisted living at this point. throughout my girlfriends life she has been forgetful (leaving phone at restaurant, pocket book at park, etc.) just recently she is starting to think that this is a symptom of ftd and has become very emotional about it and i try to convince her that since she has been forgetful since she was a little girl that it is unrelated. does anyone have some wise words to help me try cheering up my girlfriend? from everything i read only 1/3 of cases are familial and even when they are familial, there is a 50% chance of inheriting it.any advice would be majorly appreciated. thank you all.",0
5z4k56,"hi everyone.first of all, excuse my english, i'm from belgium so english is not my native language.my grandmother is in the early stages of dementia and i don't really know what to do anymore. for a while now everyone in my family has noticed my grandmother forgetting small things. the address my girlfriend works at (she still knows the company though), the name of our cat,... small things like that.when things became worse we decided it was time to have her tested. at the hospital where she did some tests it became clear she couldn't interpret time anymore. when asked what year it was she said 2013 while it was 2016 at the time.the doctor suspected alzheimer's although further testing needed to be done so we booked her an appointment for the tests a few weeks later.when the appointment approached the hospital for some stupid reason decided to call my grandmother, asking if she still wanted to go through with her appointment. so of course she says no, because she forgot what it was about and she believes the doctors are trying to pull a scam on her by having her do as many appointments as possible so they get paid alot.this of course put us quite a few steps back, as she absolutely does not want to visit the hospital to get diagnosed now.in the meantime my grandfather, who also happened to be diagnosed with kahler's disease at the meantime (cancer of the bloodcells), has to cope with my grandmother who is becoming increasingly aggressive and forgetful.every week they do groceries together and every week they bring home the same things they already have 9 of because she believes they ran out.when my grandfather points this out she becomes angry and doesn't believe him and even throws a fit right in the middle of the store.anyway, i'm drifting. i would like to know if there are any possibilities of getting my grandmother to the hospital to get a diagnose, i already know what dementia eventually does to people but i would like for my grandfather to have it easier. perhaps if she can take some meds that calm her down it would be a huge help.also if she has to be admitted to a nursing home it would be easier if she has a diagnose.it's just so hard because everytime the word doctor is pronounced she just immediately refuses any cooperation and we can't really tie her down and drag her to the hospital for tests.does anyone have some tricks?thanks for letting me vent and providing advice everyone. stay strong.",2
447vul,"hi all,so my mom's boyfriend of the past almost year fell this week, and he's not doing very well. at the very least, he'll be gone for a while for medical treatment. i'm not sure how to approach the issue with her. she often retains strong negative emotions, and last time she had a depression bender of sorts, she was miserable and suffering a lot. we've framed photos of them together in her room, and my mom would pretty much spend most of her free time with the guy. a bunch of her clothes and whatnot are in his room. but she can't ever remember his name, and a few days she'd call asking who the very nice man was that seemed to know so much about her. any tips on how to handle talking about it with her? or would just not mentioning it have benefits? would taking her to visit him and continue facilitating their relationship be worth it? any advice from others who might have been in a similar situation would be appreciated.",0
99a24z,"half vent &amp; half question here. mr dad went into the hospital for some heart procedures. my mom, who has dementia stage 6, has been in his room during the daytimes. dads basically just laying around getting tests. anyway mom won‚Äôt eat or drink anything beyond the smallest bit. tonight she is accusing me of all sorts of crazy saying i didn‚Äôt tell her dad is in hospital. she‚Äôs gotten like this before from dehydration. i can‚Äôt force her to drink. she is very stubborn and combative. do i force her to go to er? do i just wait it out until morning and get her checked out when we go to hospital to see dad tomorrow?",0
