submission,comment,url,title
"hey all i’m new to this subreddit, my grandmothers dementia has been prevalent for about 5 years she’s 84 years old now. but this past year in particular has been very overwhelming for me and my family. during the day i would go over to her house during the day to bring her food and watch her because she tends to wander outside. my grandmother has been staying with my family and i since early march due to covid. my aunt has been in the process of relocating to my grandmothers because she cannot afford her current apartment so she’s been renovating my grandmothers apartment before she moves in with her. for the past 7 months i have been stressed out and very irritated with my grandmother and i feel bad for it. i live with my mother and my stepfather in a two bedroom apartment, i gave my grandmother my room and i sleep on the couch. it’s been 7 months of me basically babysitting my grandmother. 7 months of me sleeping on the couch every night. 7 months of her taking things out of my room and misplacing them. i want my space back. she has ruined makeup palettes, taken down all of my decorative lights, gone through all of my drawers, broken an art piece my friend made me for a birthday, she wakes me up in the middle of the night around 2 am most nights confused and disoriented while i’m trying to sleep on the couch and sometimes she refuses to go back to bed. she’s peed herself in the middle of the night so my mother has to wakeup and get her to shower. i know that she is not doing this on purpose and i know she cannot help it but it’s really exhausting. but, i am not a healthcare worker i am not equipped with the skills to professionally help her. neither is my mother or my stepfather. when i do tell her things like hey don’t unplug that or, please put that back in my room she gets frustrated with me and does not listen because she knows i’m younger than her. i struggle with bipolar disorder and it has been very rough for me while my grandmother has been here. mania is easily triggered due to the stress of caring for her and i try to hide my irritability with her but sometimes it’s hard. again i feel terrible for feeling this way but it’s the truth. i want her to go home with my aunt so that my home can feel like a home again.", old people often have falls,https://www.reddit.com/r/dementia/comments/ixbog1/i_feel_bad_for_getting_annoyed_with_my_grandmother/,I feel bad for getting annoyed with my grandmother
"hi everyone, as the title states i'm living with my grandmother who has dementia/alzheimers. she was an avid gardener some years ago, however at this point she will turn a hose on and leave it running endlessly. i do my best to manage this, but its near impossible given that turning it back on is compulsory and she checks it every 15 minutes like clockwork to make sure its on. i installed some hose timers, however she has recently discovered that they can be switched on for 120 minute intervals. with just the timers i managed to bring her water bill down from $2000/month to $1500/month but obviously i need to shrink that substantially. does anyone know of a hose timer that can be switched on by hand and has a maximum duration of ~10 minutes before it automatically closes? hose timers aside, if anyone has best practices regarding the situation described i would be eternally grateful. thank you.", there are hose locks that prevent unauthorized use of hoses.  maybe she could still garden by having a container garden and a watering can?,https://www.reddit.com/r/dementia/comments/ixb6cn/im_the_live_in_caretaker_to_my_grandmother_and_im/,"I'm the live in caretaker to my grandmother and I'm looking for help relating to garden hoses (yes, hoses)."
my father is a type 2 diabetic in his late sixties and during the day he is very sharp! i would never guess he would have dementia (or perhaps early signs of dementia) and he refuses to talk to anyone about this.  with his moods sundowning symptoms have been gradual these past years  and hard for me and my mom to notice sudden mood shifts because he has a prickly personality to begin with... anyway around 430 pm he gets irritable (sundowning i’m guessing). around 7 pm he settles for bed and will yell ga gagagaga or yayayayayya. it’s like an elongated yawn but he is shouting. it’s sort of like a tic but only at night and also during movies. it’s a series of these “shout yawn-outbursts” sometimes they’re five minutes apart and sometimes they’re 20 minutes apart.  he won’t explain why he does this but it’s every night for maybe a year or two now ?  .. my guess is it soothes him? he did disclose to my mom that he can’t help this shouting “ahhh yayayayay ya ya “ but he doesn’t want to talk to me about it or a doctor.,,https://www.reddit.com/r/dementia/comments/iwt6qi/disruptive_vocalization_in_dementia/,Disruptive vocalization in dementia?
"thought this might be useful. (one of these)it is an internship through my master's program. it's my first semester there, but not in the social work master's program.", do patients do any activities while they’re at the clinic to keep up with their memory?,https://www.reddit.com/r/dementia/comments/iweg04/i_work_at_a_memory_disorder_clinic_currently_ask/,I work at a memory disorder clinic currently. Ask me anything
"i was just wondering, if any of your relatives are in/ have been in care, when did you decide to do so? and would you still make the same decision now/ did you regret it?"," i'm a psychologist seeing families struggle with this exact decision. none of them take this decision lightly, and nearly all of them are struggling with guilt and being completely overwhelmed. try to think of it this way: you have tried your best to keep your loved one safe and happy, but their needs have started to exceed your capabilities. moving them to a place that tries their hardest to ensure their safety and meets their physical needs will free you back up to fulfil the original role you were meant to have in their life. you are not giving up, you are getting back what was quietly lost along the way: time to love and care for eachother. and the harsh guidelines are: client is a risk to themselves, others or their surroundings. this can be malnutrition due to forgetfulness, danger of lighting the stove and forgetting it, aggression, extreme loneliness, mental illness, caretakers being overwhelmed and at the end ought their rope, loss of decorum,  etc etc.",https://www.reddit.com/r/dementia/comments/iwdoqn/advice_on_care_homes/,advice on care homes...
"i’m sure many of you use the ipad free puzzles app with your loved ones, but in case not, you can load your own pictures and hit one button to make it anywhere from a 4-piece to 1000-piece puzzle. by using your family photos instead of the stock ones, they reveal people in their lives. you can even edit the photo to have text captions that give the names or relationships or event in the photo. just thought i’d share in case it’s helpful. my mom is in early/mid stages and lives doing the puzzles with another person. each goes back and forth to drag a piece in and then we discuss the photo when done."," that is such a great idea. there is a wonderful free puzzle site, jigidi.com , where you can upload your own pictures and they automatically cut them into jigsaw pieces.",https://www.reddit.com/r/dementia/comments/iwcb66/puzzle_idea/,Puzzle idea
"hey ya'll. so, my grandfather (87) has mid stage dementia. i come home from school every week and it hurts my heart that i don't know what to do to interact with him other than talk to him. i want or feel i should do more to spend time with him. his life everyday is the same. he wakes up, we feed him and give him his medicine, he'll sit of the sofa and watch tv all day, or walk outside or back in forth through the house, we feed him again, and then dinner and his medicine, and it starts all over the next day. i want him to be able to enjoy his life. he may not have the quality of life he did 10 years ago, but it's saddening to simply see him just exist. i wish we could take him somewhere but we can't. i was thinking maybe i could read to him. do ya'll know any good books? but then on the other hand i think he'd enjoy something more hands on. part of the problem is i don't know what he'll enjoy until we try it. what are some successes you've had with your loved ones? he used to work on the railroad and did construction. i'm just not sure how to go about it. anything would help. thank you!"," not sure if i'm allowed to link on here but there are [some quizzes]( that my gran finds really interesting, they're quick fire so keep the interest, the whole channel does loads of different types. might be worth a look :)",https://www.reddit.com/r/dementia/comments/iw60bv/any_suggestions_on_things_i_can_do_with_my/,Any suggestions on things I can do with my grandfather that he would possibly enjoy?
"my husband has had a ph.d since 1998; his father certainly knew about it before this. but he’s forgotten a lot. last night, my husband was talking to him on the phone, and the subject of education came up. my fil said, “you never know, you may want to go back to school one day to get a ph.d,” and my husband said, “well, actually...” it made him so happy! he said to my mil, “did you know that j has a ph.d?” (she also has some dementia, but it’s manifested in different ways. she said, yes, she knew.)our son was supposed to start college this year, but deferred his admission until next year because of covid. we’ve also been able to give my fil the happy news of what school he’ll be going to, many times over. each time, he’s so happy and excited...education is something he’s always valued above anything else, and it’s kind of a funny silver lining that we can always make his day by giving him this kind of news all over again.", so nice to have good news to convey.,https://www.reddit.com/r/dementia/comments/ivxrt0/my_fatherinlaw_was_so_delighted_to_hear_that_my/,My father-in-law was so delighted to hear that my husband has a Ph.D!
"my fil had to get new tp last night and this morning was worried that we would run out of tp. i made sure he knew we have plenty and where to find it. eventually he seemed to get it and calmed down (not that he was very aggitated but obsessed). avout 20 mins later, he was telling my husband about the tp issue and then retold everything as though he remembered that we had plenty of tp and wasn't worried about it ever. lol sigh"," dad used to do this a ton, we found if the object he was obsessing about was pretty in-view or close to it he'd do it less at least. that might help. in his case it was manwich, i ended up having to hit the nearest dollar store for a few dozen cans and stacked them in the living room. he'd go and play with them lots and usually stay calm, but his worrying at the cans eventually destroyed the labels on all but two of them.",https://www.reddit.com/r/dementia/comments/ivuzye/changing_stories/,Changing stories
"my mom is not really in need of too much yet. just what the title says, she has a nice home and the person wouldn't have to do much, we can even pay a little on top of free rent. but how do you find such things? i don't want to run some craigslist ad, but find someone where this is what they are looking for. any ideas?"," if you are to the point of wanting to have somebody move in with your mom, then things are already fragile and could get even more fragile very fast. what are you going to do when you are out of the country? if you can my advice would be to get your mom into assisted living with varying levels of care before you leave the country. then you know she is safe, and it will be much easier to deal with things from afar.since you are considering a live in caretaker then i am assuming your mom owns her home. time to sell it to pay for her assisted living and elder care. good luck.",https://www.reddit.com/r/dementia/comments/ivqj35/new_here_im_sure_its_been_discussed_here_before/,"New here, I'm sure it's been discussed here before. But, has anyone found a live in person that would do light house cleaning, meal cooking and a bit of companionship for their parent in exchange for rent?"
"my mil (66) is the one with some form of undiagnosed dementia, as well as what appears to be untreated mental illness. she has always been the sort to distrust medicine, instead believing she can cure herself of whatever ails her by manipulating the spirits of plants. she's always been off kilter in regards to reality, and her dementia is making everything worse. she has hallucinations, delusions, extreme paranoia, hoarding behavior, poor nutrition, poor hygiene, you name it. it has gotten to the point where my partner got durable power of attorney, in order to manage finances and help ensure his mom get medical treatment. after a huge power struggle, he finally gets her in to see a doctor. here is where things are really frustrating us. he attends the appointment with his mom, who if course downplays her issues, assures the doctor that she feels happy and safe in her home, and that everything is totally fine. this of course goes against everthing she says to us on a daily basis. we anticipated this, which is why my partner contacted the dr. ahead of time to let them know of the various issues going on. what we didn't expect is for the doctor to essentially go along with the downplay of issues - and to just suggest to focus on calming down and getting more sleep. on top of that, she is not being communicative with my partner in regards to his mother. while we understand that his mom is the patient, he is her carer and we really need to know what's going on medically with her, or what the doctors gameplan is on how to approach things. the conversation cannot end with just suggesting she gets more sleep, when the reason she doesn't get more sleep is because she thinks a dark figure is peering into her room every night. we would try to get a second opinion, but it was such a battle to get her to see this person that we are afraid it would never happen. so i guess my ask is this - how the hell do you get the doctor to listen to your side and work with you. is this basically impossible unless he has guardianship? i should also point out that my partner is 27, so i suspect there is less respect afforded to him due to his age. we are just so frustrated and honestly scared - this was the light at the end of the tunnel for us and we don't want to be told to just turn around and walk back into the darkness.","  i'm not sure that it's possible to find a doctor who pays attention to elderly patients or their caregivers no matter how much legal authority the caregiver has.i had both durable power of attorney and medical proxy in husband's advance directive and it didn't make a bit of difference to any of the providers seen.first-line failure was primary care doctor who declined to investigate medical problems unrelated to dementia, symptoms shrugged off as dementia related. also declined to seek imaging which would have confirmed caregivers' ignored listing of behaviors specific to a particular type of dementia.skipping these details, doc's next stop was sending patient to dementia psych units to 'establish regimen of behavioral therapy drugs' which means drug the patient into submission. appears to be a 'one size fits all' treatment plan since two different dementia facilities did the exact same thing.neither were interested in patient medical status or history, meds were started, switched, doses raised and lowered without informing the caregiver of anything. the covid pandemic was utilized to the utmost to block caregiver's ability to monitor progress. in both facilities doc/staff failed to recognize or address serious adverse reactions to medications.so, seek an expert? good luck with that.  maybe it's the luck of the draw - my experience has been that no matter how nice they talk they do the same thing.outcome may have been better had husband been suffering from any type of dementia **except** lewy body. they can't tolerate psych drugs. i tried to tell them but none would listen.lewy body dementia confirmed at autopy.",https://www.reddit.com/r/dementia/comments/ivp3r0/how_to_get_medical_professionals_to_take_you/,How to get medical professionals to take you seriously?
how long it takes for afib to cause dementia ???, atrial fibrillation is a risk factor for dementia but doesn't invariable cause it and certainly not on any consistent timetable.  you'll need to consult with your physician about the best treatments.,https://www.reddit.com/r/dementia/comments/ivlaoe/how_long_it_takes_for_afib_to_cause_dementia/,How long it takes for afib to cause dementia ???
"i just felt like i needed to share this story for anyone who may be struggling with family members that have been diagnosed with dementia. my grandmother was always a lovely woman, a school teacher years ago who taught at an elementary school in a tiny little town in the middle of nowhere. we would go out as a family to visit her every week. at one point my parents sold their home, and with 7 children, they didn't have much of an option at the time other than move in to her home. we lived with her for a few years. about the time i was in high school she was diagnosed with dimentia which was about 5 years before she passed. at first i didn't notice anything different about her, and don't think i was even told about it for a year or two. she got to the point where she couldn't care for herself, and we moved her in to live with us. it was one of the hardest things to watch as she couldn't shower by herself, my sister's would have to bathe her. she would eat everything we give her, which normally wouldn't be a problem, but everything included napkins, paper towels, anything that was on her plate she ate because she didn't know they weren't food. the hardest part to watch, was the day she looked my dad in the eyes and had no clue who he was. i could see my dad's eyes tearing up knowing that the woman that gave him birth doesn't recognize him. that part still hurts me to think about. in all of the hard times in helping care for her, there is still one thing that has never left me. she did the same thing she normally did, she would grab one of us and start asking questions. she had no clue what was going on and all of us knew that, but after having the same conversation with her multiple times a day, some of us had just gotten to the point of halfway listening and giving short answers to carry on with our day. which is the biggest thing i regret doing now that she's gone. now that day was somehow different. she grabbed me and i expected her to ask me something simple, but not this time. she looked at me, called me by name, which she hadn't done in a long time, and started telling me a story about when she was in her 40s, as a school teacher. telling me all sorts of things she would do in her classes, and funny stories about some of the children. this conversation lasted about 20 minutes, and then as quick as it all began, the stories stopped. from then on until she moved in with my aunt, i payed alot more attention to what she had to say, even though back then i didn't think that her story ment as much to me as i know it does now, but sadly that was the last time she had those kind of memories pop back. to the people who are struggling with family members who have dementia, hold on to those moments while you have them, and don't get yourself to the point where you're not actively trying to listen to them and answer questions 100 times a day. that one question they might have, might be the one story that will stick with you forever. i don't know how many moments like that i missed out on due to my ignorance in not putting 100% effort into helping her understand, but i wish i could go back just to hear one more story from her life."," wow, thanks for your story!  bless you for being there listening to her, and bless your grandma up in heaven!",https://www.reddit.com/r/dementia/comments/ivhqvm/my_grandmother_who_passed_away_8_years_ago/,My Grandmother who passed away 8 years ago
"i've posted before, my mom is 78 and pretty far gone mentally, especially with hallucinations and delusions as well as long standing anxiety. we're in the process of getting a diagnosis from a neurologist but i'm wondering how much i should even tell her. i don't know that she can really understand what it means, and at this point i wonder if it really matters. maybe it's best just to continue tweaking her meds to hopefully reduce the hallucinations and anxiety, rather than stress her out with what's an (eventual) terminal diagnosis. how have you handled this with your loved ones? i feel like if it was in the early stages it would be important but now it's just one more thing for her to be fearful of."," telling people about a diagnosis is really hotly debated. a lot of people feel like even those with dementia/alzheimer's deserve to know at any point, but i personally feel like that can be dangerous, especially in later stages. it's one thing to go to the doc because your mom stopped bringing her cell phone out and they catch it early, it's an entirely different thing for someone who is already beyond comprehending more than a few words at a time.",https://www.reddit.com/r/dementia/comments/ivh5fy/how_much_of_a_diagnosis_should_i_share/,How much of a diagnosis should I share?
"before i say anything, i just want to point out that i'm not exactly an expert on this topic and issue. i've never had to care for or knew anyone with dementia or any of the related forms of it. there are plenty of things that i am blind to and am not knowledgeable about, so if i say anything that's false please correct me so i can edit.i'm very worried for my mom. she's 57 and over the past maybe 2 or 3 years i've noticed that her memory is pretty spotty, both long term and short term. her twin sister remembers a lot of stuff from their childhood, like the stories of them and the things they did with their friends, but she doesn't remember any of it. she remembers some stuff from long ago but that's it. short term, she forgets many things. one minute she will ask me how life's going and my job, and then 5-10 minutes later she will repeat the same question as if she didn't just ask it. my dad thinks it's selective memory maybe because he said that he told her about lawn care coming over in 2 days at 3pm, and she remembered and called him saying that they didn't come at 3. also her arms are pretty shaky, but i don't know if that's because of her high blood pressure or maybe it's related to this.she's out of work at the moment so hopefully soon she'll be able to get a job (she plans on retiring in 3-4 years) and be able to get insurance so she can get a physical and get tested. all i know is that it is worrying me. i guess i just posted this here to get it off my chest. thank you"," sorry to hear that!  it's impossible to know, your mom really needs to see medical professionals soon as possible - sooner better than later, with health issues! good luck to y'all!.",https://www.reddit.com/r/dementia/comments/ivfd5v/i_think_my_mother_is_developing_in_the_early/,I think my mother is developing in the early stages of dementia
