submission,comment,url,title
"we are in the oregon.  my parents had gifted us some assets about 2 years ago so we still have 3 more years before we can apply for medicaid.would it be a mistake to talk to a social worker right now?  i want overall big picture help.  want to understand if i should be doing something now to help make sure my dad can get into a good care home covered by medicaid when he qualifies as i understand the waitlists are enormous.  want to know if medicare or some other funding source can help in the meantime.  want help knowing how to best take care of my dad in general.but i’m afraid, if i’m open about the assets we transferred that since she works for the government, we’ll be disqualified even after waiting another 3 years to be out of the look back period.  am i concerned for nothing?"," i'm in oregon too and i second the recommendations to seek an elder law attorney. social workers most likely don't have the information you are looking for  -  at least i haven't found any who has financial experience in regards to long term care. contact your county department of aging for a list of all kinds of resources in your area from housing, to respite, to elder law referrals. i got a lot of info from the clackamas county department when we were just starting out on this journey.",https://www.reddit.com/r/dementia/comments/j1qzhq/can_i_and_should_i_speak_with_a_social_worker/,Can I and should I speak with a social worker?
"i've never lost anyone real close to me before last year. my grandmother was diagnosed with dementia in 2015 and lost that battle in 2019. throughout those years, there were so many ups and downs, so much frustration and love, so much anxiety and fear of what we didn't know. she luckily had no serious comorbidities so she was able to pass at home. but it doesn't feel real. even almost 1.5 years after her death, the journey, the diagnosis, and her passing feel....traumatic. i never truly thought i'd have to bury her and that sounds insane. i knew on a surface level of ""yeah, i'mma out live my grandmother"" but i never really sat and thought about it happening and i certainly never pictured her being diagnosed with dementia. even thinking about it makes me tear up. i don't know if this is just grief or what, but part of me feels as though i'm processing trauma too and i feel guilty because compared to so many here, our journey was simple. but damn it, i lost my grandmother twice-both times slowly. i don't know if i'll ever get over this and i hope i never have to see another family member take that journey."," harsh reality of life. everyone goes up to the chopping block, but often not before the suffering of losing everything we loved. the knowledge of being at the precipice with all that grief and loss is enough to push an old brain over the edge into dementia. that's what i believe from what i have seen.",https://www.reddit.com/r/dementia/comments/j1gyys/trauma_from_living_through_a_family_members/,Trauma from living through a family member's dementia journey?
"i live at home with my wife, mother in law, and my grandmother-in-law. my grandmother-in-law has severe vascular dementia, like she is in stage 6-7. she can't sit up without help, she can't suck from a straw, she can't remember how to swallow, she hardly says any words that are actually words anymore, she can't control her bowel movements, she can barely walk... it's even harder than having a baby because she doesn't even have baby reflexes anymore like sucking. i try to give her sips of water by holding it up to her mouth and getting some in and tilting her head back and rubbing her throat but it still sloshes out half the time. she can barely chew. she never likes anything that she's capable of eating. just last night she used mom's bed as a toilet- just dropped trou and let loose right on the mattress. i spent hours with bleach and a toothbrush trying to make it to where mom could sleep somewhere other than the floor. grandma's room smells like dog shit and death, and i spent another few hours this morning trying not to gag as i saturated every surface with pet febreze, disinfectant, and lavender oil so hopefully she goes to sleep at night. we found grandma stealing knives, scissors, and even nail clippers. she has threatened and attempted to kill mom in the past. my wife and i stay up until 5am to make sure grandma doesn't get up and fall, try to escape, steal knives from the kitchen, or try to hurt mom. she can barely walk, but that doesn't mean she's stopped trying. we wake up at 10am every morning to help mom with grandma and the chores. we're fucking exhausted but we really don't have a choice. we need to watch the house, but we also need to help. she's wasting away even though we're trying our best. this is a living hell and i'm not sure how much more we all can take. mom has already had a breakdown. wife and i are only holding on so she doesn't have to.  we're all so tired. how much longer can this possibly go on?  *when will it end?*", i’m so glad to hear you are getting the help you all need. this sounds exhausting and so hard. take care of yourself.,https://www.reddit.com/r/dementia/comments/j1g8lt/its_so_hard/,It's so hard.
"i'm sorry if this is a bit messy. i'm a bit of a mess right now. today, my grandmother passed out while being washed with a washcloth. we put her on the couch. she kept fainting and stopped breathing. we were able to wake her up several times again when we were trying to wake her up by yelling, nudging her, massaging her chesr or gently hitting her. when she was unconscious, she regularly stopped breathing or had a very shallow breath. whenever she woke up, the first time she'd do is scream, as if she was in extreme pain. she'd try hitting and biting everyone and everything around, definitely  more aggressive than usual. and she was insanely strong when she did this. she didn't actually say anything though, just scream. when the paramedics arrived, she was of course trying to hit and bite them too, but they managed to rehydrate her with an iv, that really improved her condition. she started talking again, told the paramedics that we broke her arms. they aren't broken, as the paramedics say, but she still can't really lift her right arm, which is probably why she thought we broke them. aside from that she's okay. she's still home with us, as we agreed with the doctor that taking her to the hospital would do more harm than good. we've had this happen several times over the past few years, even though it has never been this bad before. she usually didn't stop breathing before, and except for when she had a stroke her limbs were fine. every time this happend it was because she was dehydrated. but it's so hard to get her to drink. drinking together with her has worked for a while, but she's not drinking a lot anymore even if we do it. we've tried giving her juice and hot chocolate, which sometimes works. it also sometimes works to tell her that she must not drink it, so she drinks out of spite. we tried soups, but she hates them. no matter what we do, she never drinks enough. usually she drinks less than 0,75 l per day. so if anyone has an idea of how we could get her to drink more i'd really appreciate it!sometimes, at days like these i just wonder if what we're doing is right. she was in pain, she was scared, she cried, she clearly didn't know what was going on. i felt incredibly sorry for her. it was so painful to watch. and now i wonder if what we're doing is the right thing. she still lives at home with her daughter and a caregiver that lives in the house as well, i live nearby and come for a few days to help pretty often. and sometimes she really seems okay. she's usually relatively alert, even though the dementia obviously shows. she can even go for walks every now and then.but then she's also very aggressive from time to time, in a very testy mood, like she's constantly angry for hours at a time, or hallucinating strange things. and then of course what happened this morning happens every few months. it's just so bizarre: she can be almost like a happy little child, happy and cheerful, joking and playing with her favorite stuffed animal, and suddenly for no reason she turns into what would be called extremely abusive if she didn't have dementia. it's almost like two separate persons living inside her mind.it just makes me wonder if what we're doing is right. to me, her life seems painful, especially in those moments. i personally wouldn't want to live like this. but then, my will to live never was nearly as strong as hers, so maybe that's just me.to me it doesn't look like she's happy now. sure, she sometimes is. but most of the time she's weak, angry, aggressive or in pain. she's in her mid ninety's, so she also has a bunch of health issues aside from the dementia. sometimes i wonder if the her from the past would have wanted to stay alive if life is what it's like for the her from the present. sometimes i wonder if it wouldn't be better if she died. but thinking this makes me feel like an extremely cruel human. it makes me feel selfish too, because while i truly believe that dying would be somewhat better for her, i know that if you'd just look at the facts it would also make my life easier. it's just so hard sometimes, to hear her insult all the things i'm insecure about anyways, to have her try hitting or biting me or spitting on me, or grabbing my privates. but that's honestly not why i think she might be better off if she was dead. it just was so sad to see her this morning. it was like she was barely even human anymore. the way she screamed... it was so full of fear and pain. i honestly wouldn't wish all of this on my worst enemy. of course i don't actively want her to die. i'll still call the paramedics every time. but sometimes i wonder if it's really the right thing. i just feel like all choices we could possibly make are either wrong or even wronger. she always was scared of going to a nursing home, plus the nursing homes in my country aren't good at all. but having her here... she's not living a happy life either. it's probably the best choice, but it's still awful. there is no way that she will ever live a happy life again. it's always getting worse and worse with her. i had to quarantine for two weeks about two month ago so i couldn't come see her.  and after those two weeks she was so much worse than before. it's like watching her die piece by piece every single day. it will never be better. it will only become worse until she inevitably dies. and if death is anything like what happened today, she will die in an awful way. and i feel cruel because there is nothing i can do."," she has a progressive disease and will never get better. it will only get worse. it's a horrible feeling to stand back, but it's okay to let her go next time. her stopping her intake could be a sign she's just done, and ready for that next step.",https://www.reddit.com/r/dementia/comments/j1a8ed/she_almost_died_again_today_i_wonder_if_were/,She almost died again today. I wonder if we're doing the right thing. I just feel cruel.
"my husband was diagnosed with dementia 2 years ago. cleveland clinic found that he has right posterior cortical atrophy. it’s a variation of alzheimer’s, and not much is known about it’s progression. he finally accepted that he has to stop working, he’s an attorney, and his driving is getting worse. i’m terrified. i have lost my partner and have transitioned to caretaker. his moods are awful and i try not to engage when he is angry and arguing. this is very challenging!any tips on coping?", sorry to hear about your situation. what does he have to say about it? it sounds like it's still possible to have a discussion with him. is he in denial? does he want to take aggressive steps to slow the decline? is he resigned to the situation?,https://www.reddit.com/r/dementia/comments/j19v5e/dementia_in_hubby_getting_worse/,Dementia in hubby getting worse
"problem 1 - mom has now changed posture and tilts towards her right, this has caused her back aches and falling or walking into things. we try to tell her but she doesn't understand and sticks to it. she keeps walking throughout the house the whole day which increases her chances of falling and banging into the walls. did you people have anything similar and how did you manage it?&amp;#x200b;problem 2 - she has been very adamant with everything we ask her to do. things like sitting on a chair or eating her food or wearing her clothes. she says she knows everything and is not doing what we tell her at all. it has been very stressful getting her to do day to day activities. how do you guys deal with similar problems when they wont listen at all. we have tried to guide her by holding her hand but she snaps back saying she doesn't need help."," i am so at the beginning of this. i can gleen snipets. finding another way to answer is thee hardest. i still catch myself and sometimes it is too late and then i feel guilty and he gets a bit upset. hopefully i will learn, as i am continually frustrated and can’t even look in the mirror. i am not much help here, sorry.",https://www.reddit.com/r/dementia/comments/j18k96/need_help_with_your_experiences/,Need help with your experiences
"my names kaiden and i’m 16 i stay at home with my grandmother (70+) who’s dementia and off-set alzheimer’s has gotten ( forgive me if any factual information i have is incorrect about the diseases that i stated ) she has been a handful emotionally for me since i’m here 24/7 all day and night watching over her i feel as if this is what all my life is now and i don’t have barley any friends to talk to so i guess it doesn’t make a difference anyway but she has now gotten to the stage of wheres she’s dingily convinced that she doesn’t live here that she’s juts “staying till whenever” or some off the top excuse she always uses and today she was packing almost anything she found &amp; basket of her clothes into the old run down camry in the garage and multiple arguments raised between me and her today. 100% of the time always ending in me punching the hall walls and getting angry i am if not almost at my wills end i don’t know if i can mentally deal with all this anymore i don’t do anything eles but see my 1 friend i have here and there and all my other time goes to staying in my house making sure she’s ok. i have  depression and vary bad anxiety and taking care of her has taking a toll on me that i didn’t think it would i doubt anyone will read this all the way through i’m tired exhausted and don’t have any will to help anymore but i will keep helping her regardless of my feelings towards her, most times it’s as if i don’t even know this woman as if she wasn’t my grandma i’m sorry for bothering anyone reading this i don’t mean to i hope you have any amazing night!", respect. call the alzheimer’s association. there may be some resources in your area even with covid. it’s possible you could qualify for medicaid that pays for some in home help so its not all on you. also get in touch with your states agency on aging. ,https://www.reddit.com/r/dementia/comments/j14gr6/my_grandmother_insists_shes_doesnt_live_at_the/,My grandmother insists she’s doesn’t live at the house she’s been at already for years
"this has probably been answered but i don't know how to look for it.my grandmother (63) who has fibromyalgia is considering taking in her nearly bedridden (84?) mother to care for her... i'm really afraid of this, but grandmother has explained there's not a good option she can find.my great grandmother suffered a stroke which i guess triggered dementia 2 years ago. my grandmother had her in a senior home that refused to take her back from the hospital after another of many falls she had trying to go to the restroom by herself, and other homes are refusing to take her because of the state she's in.. great grandmother has been in rehab for wound care, but medicare(? whichever one the elderly get) only pays for so long in there and even they have let her fall out of bed..she bruises easily, tries to do everything herself, teeters then falls, and can't communicate her needs properly. basically she needs 24/7 care. she won't use a button, and ""escaped"" a bed with rails.is there a reasonably affordable way to get help in this situation? i feel so helpless for everyone involved. it shouldn't be this hard to take care of the elderly..tl;dr 63 y.o grandmother is considering taking in and caring for 84 y.o great grandmother with dementia but i don't think she physically or mentally could/should. need affordable 24/7 care options or programs to assist with pay. great grandmother has some va benefits and medicare, grandmother can't contribute much more to getting help.", you might see if your ggm qualifies for [va assistance](  i'd call around to memory care units as they specialize in dementia care unlike assisted living.,https://www.reddit.com/r/dementia/comments/j0vot6/how_to_affordwhere_to_get_care_for_80_year_old/,How to afford/where to get care for 80+ year old
"we all need to feel psychologically safe. if elderly people in nursing homes feel they are in a world devoid of familiarity and reassurance they will feel unsafe.fear and frustration is one of the main causes of [distress behaviours]( in the elderly. not knowing where you are, why you are there and new faces around you cause distress. the person may want to go home.nighttime can be very traumatic, with shadows, loud noises and no recall of where they are to comfort them. night sedation is not always the best way for sleeplessness.being helped by many different staff that don’t introduce themselves or explain their care, may lead to further insecurity.“mrs jones has been wandering into other residents’ rooms this afternoon,” the focus should not be on the wandering into other rooms but why""**points to consider**imagine that mrs jones has a white door on her bedroom, but so do all the other residents, this becomes more confusing for mrs jones as she does not know which door leads to her room.[view poll](", why are you asking this question?,https://www.reddit.com/r/dementia/comments/j0qa0d/the_need_for_security_for_a_person_with_dementia/,The need for security for a person with Dementia
"mom 71 narc showing signs of paranoia is starting to live in her car and make poor choices. its time for me to try to help but i dont know where to start. frankly i dont like her as she is not nice, she is very triggering to my ptsd and out of her 4 kids i am the only one that speaks to her. i feel guilty because i dont actually want to help her/ i have to help her or she will be all over my life.. i should care...  she just fights and argues.  its such hell.. but its so unsafe..  im afraid im going to be stuck w her. that im going to abandon her. i have no idea where to begin. help..", hi there op. just checking in.  how are things with your situation?  i wanted to circle back and check in.,https://www.reddit.com/r/dementia/comments/j0othb/where_do_i_start/,Where Do I start?
"i'm 46.  my family has a long history of dementia.  i've noticed a sharp change in my dreaming habits when i was about 45.i used to be able to dream regularly, sometimes vivid dreams.  but i don't have vivid dreams anymore.  and i can rarely remember my dreams.  the moment i wake, the dreams which i could barely remember to begin with start to fade and disappear completely.the only times my dreams seem to last for a bit longer are when they are nightmares.is this a sign that i'm going to be getting dementia someday as well?other things that are happening with my mind seem to be that i used to be able to remember songs very quickly.  and i could almost hear the music when thinking about a song.  each instrument i could hear on their own.  but i can't hear the instruments at all anymore playing behind the singer.  and even the singer, i can barely hear his voice when trying to remember a song.  and it takes me much longer to remember the lyrics.  is this another predementia suymptom?i'm 46 now."," smoking weed will do that to your dreams. i know this from experience. i don't smoke any more, don't drink, no caffeine, exercise regularly. i am on a state of cognitive decline, and experience to a certain degree what you do with not remembering dreams like i used to. i used to be able to control my actions to a certain degree in my dreams, to where i was somewhat invincible. but not any more. i dream just about every night, but rarely remember them. i'm 49. good luck! and yes, go see a neurologist! i have seen a few, but they were pretty much dismissive and full of shit. i now have a caseworker through my health insurance who will be calling me in a few weeks, and so i hope to get the help that i need to get.also, the thing with the music i can relate to as well. i have good days and bad days. i can still hear the instruments etc without listening to a song, but sometimes songs seem different than what i remember them to be. then another day, the songs are exactly as i remember them.",https://www.reddit.com/r/dementia/comments/j0o4s7/sign_of_future_dementia_changes_in_my_dreaming/,Sign of future dementia? Changes in my dreaming
has anyone found a bed alarm to be helpful? this would be for someone who tends to fall at night when getting up for the bathroom., the floor pad with an alarm worked for us. wish i had gotten it sooner. when the fall on their head it can cause a brain bleed. a baby monitor also helps. i have several cameras around the house so i can see if she’s getting up. people also recommend hanging bells from door knobs.,https://www.reddit.com/r/dementia/comments/j0j47t/bed_alarm/,Bed alarm
