submission,comment,url,title
"does anyone have advice for visits at this stage? we bring her a fancy coffee and flowers from our garden, and keep conversation light. she enjoys the visits.i was thinking of bringing a photo album next time. now i’m reconsidering. she will likely remember the people, but not the events. my dad passed away years ago. i’d hate for her to ask where he is. i would love to play her some music, but our visits are outdoors. just looking for advice on later stage visits. mom can’t really engage in conversation due to very limited memory, but she listens."," my husband & i have been visiting my mom through a window since march. we tried one outside, in a special area where the residents are in their enclosed garden & we were separated by a fence & plexiglass but mom became heartbreakingly possessive of the visiting ""spot'. she became really anxious if any other resident had family there, because ""that's where my kids come to see me"". so back to the window visits we went as she seems less anxious surrounded by her things in her room. all this to say, mom loves music & it soothes her & brings her joy in a way few things do now. we used to have ""dance parties"" before we would leave prior to covid - we'd put on an abba song & we all danced around for the duration. what we've been doing since covid is playing an abba song on our phone & dancing for her through the window (she boogies on the other side but all anyone outside can see is my husband & i gyrating like we've lost the plot) & it really caps off the visit for her. i would try playing something on your phone for her if you can (headphones might be an option if the music would disturb others).  we also come with jokes planned or funny stories as she loves to laugh at silliness now. i focus heavily on my expressions & keep my voice light because while she may struggle understanding the words, she picks up immediately on facial expressions & tone. my mom loves photos & we have both photo albums and a digital photo frame in her room for her. she too has forgotten who the majority of people are & doesn't always know who we mean if we talk about my dad (who passed in 2014). we have tried putting together smaller photo albums with the family members she recalls too, to try & avoid some of the issues you brought up. it's all such trial & error but the important thing is that you're trying & the fact that you're asking speaks volumes about how much you care  i'm beyond happy that your mom is content in the assisted living home, but i know none of this is easy. i have found (the hard way) that with this condition, i have to have my problem solving hat on at all times. it's all about how can i work around this difficulty to keep mom as happy & safe as i can. your mom is lucky & blessed as she clearly contributed to an awesome child who loves her very much. best of luck & know that this sub is here, if you ever need us.xo",https://www.reddit.com/r/dementia/comments/ir5f4d/my_mom_is_very_content_and_happy_in_her_assisted/,"My mom is very content and happy in her Assisted Living. I should count my blessings. But the last time we visited (socially distanced), it seemed to shake her up, like we were a reminder of the outside world she has largely forgotten."
"my grandma is living with us and she has been doing things that are slightly concerning.... (we do have an appointment with a specialist but no clue when thats happening, so i figure i'd ask here) she lost her husband 2 months ago, so we aren't sure if that's causing this to get so bad, so fast...- she asks us the same questions (every other day, about us, stuff we do etc) - she doesn't shower.... when asked she told us that ""old people dont shower every day, its not normal""... - today she actually told us she showered, she didn't.... she came out of her bedroom...-she is very stubborn so when we say things to her she just argues and argues....- she also uses pads for bladder leakage but we don't think she's using them properly, or not changing them. we're unsure if that's because she forgets or because she just doesn't think it needs to be done..... what do we do? how do you know what warning signs are? * she plays crosswords all the time but really thats all she does. which i know is a good thing.."""," my mother had early signs looking back but we didn’t realize because she had (at that time) recently lost her husband. this included taking care of the house type things. just thought it was odd, regular part of being a single woman at the time. ultimately for us, we saw she was struggling to add up deposits and checks in her check book. my mom had always meticulously balanced her check book to the penny",https://www.reddit.com/r/dementia/comments/ir445p/what_have_you_noticed_as_earlier_signs/,What have you noticed as earlier signs?
[removed],,https://www.reddit.com/r/dementia/comments/iqtxch/my_grandpa/,My grandpa
my grandmother has not slept for 3 days. i don't know how she can do it with all the sedatives she takes.did your lo experience similar issues? what medications or strategy did you use?," speaking with a doctor today, rather than give her melatonin, it might be best to give her 5htp.this article gives you an idea of the difference:[",https://www.reddit.com/r/dementia/comments/iqsmtv/severe_insomnia/,Severe insomnia
"i absolutely adore my mother in law. she’s the nicest lady around. over the past 5 years i’ve watched her decline. at first when i was getting to know her, i thought the repeated questions were normal. but over the years it’s become much more than that. we don’t live in the same city as our parents, but we come down and visit as much as we can. i tend to be the kid spending the most time with her, especially one on one. we come down multiple times a year and when my husband goes off with his dad, i’m with her. i see it first hand how bad it is. finally at the beginning of this year i convinced my husband it’s something the siblings need to sit down and talk to her about. i was really hoping someone would take this seriously and get her into a doctor and maybe we could do something to slow the decline down. they all sat down and in my opinion, beat around the bush. told her she needs to get healthy and go to the doctor and maybe get hormones. they agreed it would be the first step. but here we are months later and nothing has changed and no ones talking about it anymore. during the whole conversation that took place with her, i was at the house but not in the room, and she kept saying i needed to be apart of the conversation too. i really am like one of her own. but i’ve never felt comfortable talking to her about this. both of her parents had memory issues, one dementia and the other alzheimer’s. i know she’s scared. she forgot the garage code last time we were here and when i put it in she said “please don’t tell them i freaked out” talking about her husband and son. i just don’t know what to do. i am tired of feeling like nobody is taking this seriously but i don’t want to step on anyone’s toes. i truly know if this was my mom i would not be able to sit around without trying everything. i think everyone feels like there’s nothing they can do because they watched it happen to her parents. she’s not even 60.."," honestly, this is (quality of) life or death, stepping on peoples toes here is insignificant in comparison. do what needs to be done.",https://www.reddit.com/r/dementia/comments/iqqy68/mil_memory_loss/,MIL & memory loss
my mom has alzheimer's and every year i do the walk and get donation. this yr i have been doing amazing! i am almost to my goal of 500. i am 65 away! i really want to reach this goal this yr bc of covid the walk is suffering. i hope you have it in ur heart to donate to a great causehere is the link and ty,,https://www.reddit.com/r/dementia/comments/iqhj1l/my_mom/,My mom
"i’m surprised and relieved and a bit overwhelmed that my mom (71) agreed to go, after i called and made an appointment today, to see her gp. it’s a start. she’s had some odd behaviour, which i’ve posted about before. but this past monday, her actions were more worrisome. the fire alarm went off in our building (we live in adjacent apartments) and she had no idea what it was. i don’t know what to think. thanks for listening.", we saw the gp this morning and shares my concern. mom is getting lots of bloodwork done and she’ll be getting an mri.,https://www.reddit.com/r/dementia/comments/iq9s6f/were_seeing_the_doctor_tomorrow/,We’re seeing the doctor tomorrow
"treading unfamiliar territory here and trying to understand all these new terms. i hear these words a lot: poa, guardianship, &amp; conservatorshipim trying to help my mom figuring out the best way to deal with my dad's condition, we've been suspecting he has dementia. my mom is 55 and my dad is 85. i am not yet fully equipped with knowledge about dementia and elderly care, but even more so my mom so im trying to do my research myself so i can explain things to her in a way that won't overwhelm her.pardon my ignorance of the law but id like to better understand how a low income family, in this case my stepdad and my mom can benefit from getting guardianship/conservatorship when my dad's condition worsens. i could be wrong, but based on what ive been reading so far, im under the impression that those who get guardianship/conservatorship are mostly the upper class, wealthy family, with lots of properties or those people with will and testaments.my stepdad doesn't have a lot. he's retired and he has his pension which is 700/month, and then his house which theyre still paying mortgage on and that's pretty much it, they don't have properties or businesses. my mom works a job that pays $13 an hour. and as much as i want to help them, i am not yet in the position to financially support them either. i would if i could, no doubt about that.so i understand that poa is a lot cheaper than the two. we plan on getting poa granted to my mom. my dad has been exhibiting symptoms of dementia. she's always been so reliant and dependent on him ever since. she has always let him do all the financial stuff. however, right now the rest of the family just agrees that he can no longer oversee/take care of their finances. ive been encouraging and motivating my mom to take action, and step up. constantly reminding her that the rest of the family is here to help her throughout this whole thing.i guess my question is how is guardianship or conservatorship beneficial/useful to those low income families? can my mom just get the poa and if my dad states hed like the poa to remain active even after he's no longer capable of making his own decisions, will that be better choice than getting the other two since it is a lot cheaper?i guess im trying to know the reasons why we should or why it is still necessary to get guardianship/conservatorship eventually for my dad despite it being so expensive. does my mom need it still even if theres not a lot of ""wealth"" involved?does the government offer any assistance at all when it comes to the expenses getting these arrangements made?thank you so much. i really appreciate everyone here."," everyone’s answers here is correct, poa is goodthere are 2 types and sub catagoriesour focus is on medical and financial poa, contact your local notary for the financial one i cannot stress this another, you need to get this done before the dementia advances, for financial poa a notary has to stamp it to be effective, a notary cannot grant poa on a client mentally handicapped, please don’t waitmedical poa only requires 2 witnesses for it to be valid outside of immediately family, you can get that document for the notary office as well they usually provide both if not a social workeranother suggestion is start researching for at home hospice care, i have a nurse check on my great grandma once a week and helps us with medication it’s usually covered if they have full medicare or just part a send me dm if you have any questions, iv been in the later stages now for over a year and had to really make changes, i can help with advice",https://www.reddit.com/r/dementia/comments/ipxp4j/how_is_guardianshipconservatorship/,how is guardianship/conservatorship beneficial/useful/worth-getting to low income families?
my grandma now has dementia and she smokes. my mom has been dealing with trying to reduce the amount that she smokes but has had some difficulty. she has had pneumonia and copd. are there any kind of resources that may help my mom understand and deal with managing that particular issue? much appreciated for any insight y'all can give.," nicotine has been explored as a [treatment for alzheimers]( for decades. switching her to vaping will remove the fire risk.>as far back as 1988, newhouse demonstrated intravenous nicotine could hold promise to treat alzheimer’s. now, he’s spearheading the memory improvement through nicotine dosing (mind) study that focuses on transdermal nicotine patches as a viable treatment for people at risk of alzheimer’s",https://www.reddit.com/r/dementia/comments/ips0f8/i_would_like_some_advice/,I would like some advice
"hi guys, so i was wondering...this whole thing is so new to our family and in an effort to help him, we want to make sure we aren't doing anything wrong or illegal. he's fallen for so many scams thru phones, and thankfully i have been able to set up selective call acceptance on his phone. so for now, temporarily, only his essential contact can get through. most days, prior this this, all his calls come from these scammers and no matter how many times we tell him not to engage, he still does and in fact, he seems to even love the interaction with these scammers :c but he ends up becoming a victim each time. and i feel bad for my mom, who's the sole working spouse and their money ends up in the hands of these scammers. i decided to finally step in and help her as she isn't that savvy when it comes to these things, researching and technology.anyway, so we managed to find a temporary solution to the spam calls, however now... we have the mails. like actual letters. but most of the letters my dad receives are junk/scam. from letters saying he won millions of prize, to medicare stuff, charities, offers... apparently he's been writing checks for all these charities that ranges form 5-10 dollars but there's a lot of them and they add up each month.my question is, is it illegal for us to sort out his mail, stash away the junk ones from him?i eventually want to report all these junk mails and its senders.do we need to get poa first to sort out his mails?sorry if its a dumb question, in an effort to help my dad, i just don't want to get into trouble for it.thank u."," i think, scams are illegal, therefore, it's not illegal to dispose of scam mail.  as for legitimate charities & whatnot, if the same ones sending mail again again, which they will do once they get donation from you (and some of them even share that information), contact them politely and *firmly tell them* to please immediately put the name and the address on the ""no contact"" list due to elderly vulnerable relative *on a govt pension*. we had a few charities that ignored that, i contacted them again and told them politely and firmly 1. they'd already been notified by us to stop, therefore,  if they continued to ask for donation, 2. *our lawyers would be in contact* (we don't particularly ""have lawyers"") and 3. *i would tell every newspaper & elderly organisation* that they are trying to trick money out of vulnerable elderly *on govt pension*. they stopped.  i sort of felt bad threatening charities, but the thing is, some charities have contracted with sort of private companies or something, to gather donations for them. plus, they ignored after we already asked stop.   i had to be very firm!  in our country (australia) there is a phone line you can call to put your name on the national ""do not call list"", that legitimate businesses have to observe.  therefore, anyone else who calls or sends mail, is scammer. the conversation about poa, just the truth - ""actually, most people over middle-aged have already done the paperwork with lawyers, due to *if someone has an accident or sudden illness and is unconscious, then it's too late to do it*.  *lawyers, doctors and hospitals prefer people to have it done already*. it's foolish not to.""  in my country, there are 2 - poa & pog. power of attorney & powers of guardianship.  poa for financial stuff, pog for personal care-related issues (if they need operations, procedures, therapy/treatment/medications, which facility, etc) my mother had not done that when she got the diagnosis already.  her doctor plus the specialist both provided us with letters for lawyers stating something like ""whilst this person has diagnosed memory loss issue, i am of the firm opinion that *at this time* they still have faculty enough to fully understand poa & pog and to make those decisions for themselves in this matter.""  the lawyers accepted.  we had to do it within a few *weeks* of those letters though - in fact, like immediately - not months later.  sadly, because we have one relative who is very extremely difficult (and mean and greedy) & wants to control everything. check out all the resources online at alzheimers org & dementia org for your country.  they also have telephone helplines.best of luck!",https://www.reddit.com/r/dementia/comments/ipk9iv/is_it_illegal_to_sort_my_stepdads_mail_before_he/,"is it illegal to sort my stepdad's mail before he gets to them? he is 85, vulnerable target of scams."
"hello, all :) so this is something that has been going on for years and years. my grandma is 88 years old. she lives downstairs in her own house, because we have an addition. when she goes to bed at night, she is safe and sound. all of a sudden, she hears knocking that wakes her right up out of her sleep. she gets up out of bed, grabs her walker, and goes to the door to see who is there. (the door opens to her living room. couch, tv, chairs) nobody is ever there. ever. she is so adamant that someone is knocking on her door. even when i tell her nobody is there, and it is quiet as a mouse in her living room. “believe me when i tell you”, she says. i tell her nobody was knocking. “well i heard it, and it was loud!” she refuses to listen, and is so insistent about this. that someone knocks on her door, then when she sees nobody is there, it is peaceful and quiet. does she think someone knocked and ran? you enter the living room to stillness and calm.i have told her that i can hear over the intercom any noises. plus trying to reassure her that nobody can gain access to the inside into her living room. and that i am able to see and hear from my room upstairs, and that she is safe. but that never works, because she says “someone was there, they knocked really loud” but then opens her door to no one in sight. you cannot reason with dementia. she is so serious about this, someone being there and knocking, you cannot change her mind. no one is ever there, and trying to give her that reassurance is hard when she does not believe you.", maybe say you had the a/c (then furnace) checked and it’s what’s making the knocking noise?,https://www.reddit.com/r/dementia/comments/ipjhuz/hearing_knocking_at_nighttime/,Hearing knocking at nighttime
my 89 yr old gma has had two nights in a row of only a cpl hours of sleep. she’ll get up and rearrange everything in her drawers and then starting btwn 2:30-3:30 she starts wanting to come out of her room. i take her back show her clock and explain its time to sleep. she doesn’t take big naps through the day. she’ll doze off for just a cpl minutes a few times. yesterday we sat outside for 4 hours. i put her gait belt on her and gave her her cane and walked her around the yard til she said she couldn’t anymore. i thought for sure she’d sleep good last night  nopei feel bad because i’m irritable from no sleep and she has no clue she’s been up all night," my mom doesn't really sleep, she takes cat naps throughout the day sitting in her chair in front of the tv.. it's strange that they can go on like that for long periods of time",https://www.reddit.com/r/dementia/comments/ipe08h/how_long_can_she_go_on_a_cpl_hours_of_sleep/,[deleted by user]
has anyone tried this on their loved one? i’m a bit new to my dad having benson’s syndrome (alzheimer’s primarily affecting vision). i feel a strong need to fix it. he’s becoming delusional. i just want him to enjoy his time here and hold onto his memory and sanity," you love your dad, and will always have that even if he comes to forget everything. he will live in you. i'm a dad and was a son and i know this.",https://www.reddit.com/r/dementia/comments/ip9apx/transcranial_magnetic_stimulation/,Transcranial magnetic stimulation
"hi, it's my first post here.  my mom (72 yo) was diagnosed with dementia with lewy bodies about a year ago, and has been on aricept since then.  fast forward to this april, and her husband died unexpectedly after a surgery.  after several months of staying with her every other week, it became clear she needed help and could not live alone.  my husband and i decided that we were going to need to move in with her as none of her other children will be able to participate in her care, and we lived 90 minutes away.  we moved in permanently one month ago.  so that is the very quick back story.my mom talks to her husband's photo on her iphone, and although she says she knows it's just a picture and she knows that he's been buried, it's not the reality we see.  she talks with him all the time and talks about how his facial expressions change.  she also started talking to other pictures of people, and it becomes like she's at a party, socializing with all the people.  it's pretty strange to experience for us, although in some ways i'm becoming used to it.  i don't know, i'm not sure what i'm looking for or asking, but maybe just wondering if anyone has experienced these types of delusions with their family member?  besides this, she's just mostly very forgetful.  doesn't accomplish much but has a positive attitude for the most part.thanks, and glad to have this resource to turn to!"," not talking to pictures but talking about pictures. she also made up a fake routine, this is when she was living alone. what she seen or read, she would turn it into a conversation of what she's been up to. she can barely walk..  yet she'd say she's been playing tennis all day. she would also make up stories about hanging out with neighbors, their made up lives.. i find out they haven't spoken to her for months nor did she answer the door. she was saving random pictures that didn't belong to her, pretending she was hanging out with that person. or pictures of babies because she was babysitting for neighbors... i was told to play along with her or she'd feel stress.  i found out she was showing pictures of me to family members overseas and making up false stories. it's alarming. the disease talking. i sometimes wonder if she actually believed it.",https://www.reddit.com/r/dementia/comments/ip5128/mom_diagnosed_with_dementia_with_lewy_bodies/,Mom diagnosed with Dementia with Lewy Bodies
