submission,comment,url,title
"hello everyone! i don't know where to ask this so... here i am. also, english is not my first language so please bear with me, i know it's kind of rusty.i (18f) just started today the last year of high school, with a hybrid system - both online and in person. during the lockdown, my grandma(84) who i'm living with developed dementia, i think - it has the symptoms. she forgets who i am, thinking that i'm one of my cousins, belives that i'm 6 or that i'm younger than actually am, she wants to go home despite being already home - she believes that she has other flats around the city, she wants to go to her parents in the countryside, she wants to go shopping for food or medicaments despite having them here (also i'm the one, along with my mother, that gives her her medicaments), etc. she has these crises where she wants to leave with a bag and starts crying and begging me to let her go if the door is locked and after a few hours she can't remember anything. the worst one so far was last week, when she wanted to go home and cried and screamed at me for 6 hours. when she has these crises her head hurts and i don't know if it's related or not.the problem is that neither i nor my parents know how to help or calm her. we can't really afford to go to a specialist or hire someone to help us, and if in the summer i could take care of her, now i can't, because of the school - i have to prepare for both the final exams and college admission - and i have online classes. i can't stay in my room because i don't have my own room, and i'm scared that i will have difficulties regarding my school activity because of her. i know that probably i will stay in the hall of the block of flats, next to my door so i would have wi-fi for the online classes, but that is a temporary solution. i have chosen to go to school so that i would still have to learn in peace and well, for my mental health. but after 2 weeks, my group will switch and i will have to learn 2 weeks exclusively online, and i don't know what to do. how can i help her? how can i calm her? i can't just go to school for 6 hours, come home and give her food and medicaments and leave again to do my homework and outside (i still have to search for a place where i can write - i can't stay in libraries bc of covid). i know that there is no way to calm her quick, but i don't know.. i would appreciate a lot if someone could give some advice on how i can help her.thank you in advance!", benadryl,https://www.reddit.com/r/dementia/comments/isiq0y/can_someone_give_me_some_advice/,Can someone give me some advice?
"i knew next to nothing about dementia. then i came across this webpage. i loooove the videos from past events. once you click a link, the video will show up on the same page towards the bottom of the screen.my 2 favorite videos are ""behavorial expressions"" and ""staging dementia"" like wow i am much more at ease nowadays because of all i have learned from the videos.also look up ""teepa snow"" on youtube to watch her videos.good luck to all of you. (i am not affiliated with any of the things or people i listed.)", thank you so much for sharing.,https://www.reddit.com/r/dementia/comments/ishbdt/very_informative_dementia_vids/,Very Informative Dementia Vids
"family care giving in oregon has sucked hard this week. actually,  even if you aren't a caregiver it's been horrible. our household hasn't  gone up in flames so far but not for mother nature's lack of trying. [all orange on the western front](", love this one. i’m in wa and everything looks like typical fog. you don’t realize it’s smoke til you step outside. we’re all thinking of our or neighbors. stay safe! i love your blog!,https://www.reddit.com/r/dementia/comments/isczi6/wow_and_i_thought_august_was_bad/,Wow. And I thought August was bad...
"my mom thinks my grandma is losing her hearing, but i think it's dementia related. it doesn't matter if there's no distractions, sometimes it takes calling her 5-6 times before she even answers ""what."" even if you're right there in her view/holding her hand/staring her dead in the eyes like all the articles day you should. if you ask a question (""do you want oatmeal?""), she gives a blank look or looks away like she's choosing to deliberately ignore you (i know she's not, i'm just describing to show why i think it's dementia related instead of just hearing loss.), or responds with a non-sequitur like ""do you want oatmeal?"" ""that pillow has my name on it;"" ."," this could be dementia, but also something else. a check up at the doctor is never wrong :)",https://www.reddit.com/r/dementia/comments/iscgll/takes_longer_to_gain_attentionget_response/,Takes longer to gain attention/get response
"hi everyone, i am an undergraduate student in the psychology department at california state university san marcos in san diego, ca. i am a research assistant to a graduate student, sean griser, who is leading a study on the impact of covid-19 on family caregivers of individuals with dementia. i’m hoping to gather participants to take part in this study in the form of a survey. please follow this [link]( if you are interested in learning more information and/or participating. thank you and i appreciate you taking the time to read this. feel free to direct any questions to grise001@cougars.csusm.edu. have a lovely day/night!",,https://www.reddit.com/r/dementia/comments/isbuvp/study_for_family_caregivers_of_individuals_with/,Study for Family Caregivers of Individuals with Dementia
"i spent an amazing week with her in a hotel and eating all the things she loves without being able to communicate what was coming. i also wasn’t able to tour the facility beforehand thanks to covid. during admission the staff didn’t realize that my mom was the patient (and i didn’t catch on to this so i was very confused why they weren’t helping me get her into her room). my mom looks super young. they even had to alert all the staff not to let her walk out once they knew she has dementia. the thing is i managed to escort her to her room after they just left her behind in the lobby and my mom got confused. so i took her arm and walked her back to the room. the facility was clean and everyone was nice but her room is so cold and dark and hospital feeling. it crushed my soul. my mom was catching on that i was sad and started to get really nervous. i knew i’d need to soften it a bit with items and stuff but this felt like a room in the er. cold floor, hospital bed with a curtain, crt tv that barely works with a high pitched buzzing noise. i went to ikea and purchased a carpet that looks like her old one, new bed set, some cute items, a lamp with a switch that’s easy to use... but now they won’t let me in again to help her set it up. i’m just really destroyed. i want to know she is comfortable and everything is cute. i want to hang some pictures and make sure the bathroom has everything she needs and looks nice. does anyone have any advice?", this is heartbreaking. many hugs to you. my mom has early onset too.,https://www.reddit.com/r/dementia/comments/is9myg/my_mom_has_early_onset_dementia_she_went_into_a/,My mom has early onset dementia. She went into a nursing home this weekend and she isn’t even 60.
"so my grandmother (94) has lewy body dementia. she’s become increasingly worse over the last two years with delusions and hallucinations. she moved in with my aunt at the very first signs of it.at this point she can still talk and walk, but had totally random behavior and doesn’t really understand anything. unfortunately there’s a lot of arguing as she’s absolutely sure of things that aren’t real and there’s no convincing her if things. she lives with family and it’s really really hard on a daily bases. how do you all cope with similar situations?"," not gonna lie, it’s hard. therapeutic lying and redirecting help, but sometimes they get fixated on the delusion or hallucination, so then it’s more difficult. i have moved a gorilla out of her bedroom and chased two small girls out my kitchen today. hopefully the antipsychotic medication will kick in soon. i think the hardest part is dealing with family that just doesn’t/can’t understand and think your exaggerating. or they do see it and make excuses. it’s exhausting on all kinds of levels. so many people just don’t understand.",https://www.reddit.com/r/dementia/comments/is7rx1/how_to_cope_with_the_later_stages_of_dementia/,How to cope with the later stages of dementia
"so i recently moved to be my grandmother's (93) full time caregiver. we actually bother moved so she could be closer to the rest of the family. in our new place me and my mom have put up lots of pictures of her family, but it seems to be giving her a lot of grief. she thinks they all abandoned her. and explaining to her that she's the only one left of her siblings, and that my grandfather passed a few months ago just makes her more upset for obvious reasons. me and my mom have tried taking the route of trying to distract her by telling her that we're still here, and we love her and are here for her. but that only seems to make her more upset, i think because she doesn't really know who i am at all, and even though my mom comes ever other day, to my grandma it feels like she's never around. almost all of this seems to be triggered by the pictures we have up. her memory of her family is definitely better with them up but my mom and i have started to wonder if we should take them down because they seem to upset her so much. i was wondering if anyone had any experience or advice on how to navigate this situation, or if anyone had any advice on how we could try and make the pictures have a more positive association."," leave them up, take them down it doesn't matter.  try putting them all upside down and see if she notices",https://www.reddit.com/r/dementia/comments/is1pji/should_we_take_the_pictures_down/,Should we take the pictures down?
"hello,i'm sure this question must come up all the time, but i'm not sure when i should correct my grandmother. i moved in with her and my grandfather a few weeks ago, after she had a bad seizure and the extent of her confusion became clear, so that she has someone to talk to, a hand around the house, and someone to be around in case she has another seizure.she hasn't got a diagnosis of dementia, but it seems fairly clear to me that it's some form or another. my grandfather is resistant to getting her looked at, or perhaps her gp isn't co-operating, but i feel very strongly that she needs some medical help. still, he recognises that she needs some help, now. she's begun mistaking me for an old friend of hers, who is now married, and is much older than me. i gather from my grandfather that we look very similar, haircut, glasses, build, etc. the problem is that she will often ask me about my husband or sons, who don't exist, or speak to me in spanish, and i don't speak any spanish. she will often also ask whose house we're in, or who is coming to dinner/how many she should be cooking for, or do her daughters need picking up from school. i've been correcting her, but i've since done some research, and because correcting her just makes her more confused and upsets her, i'm going to try to redirect her instead. my grandfather gets very upset when she mixes these things up, and especially when she confuses me for her friend, and sometimes shouts, at which point i try to take him out of the room to calm down, because he isn't helping anybody. it's very upsetting to her, of course, which just makes him more distressed.it's difficult to respond to questions she asks when she believes i'm her friend, though, because they're often about life in spain, or children, which i can't answer in any satisfactory way, and which it's difficult to redirect from. i'm not sure what to do. i would appreciate any advice.", at all costs have your grandmother's health evaluated as soon as possible. hopefully her gp has given her a detailed check-up to make sure that something else is not causing her difficulties.ask gp for a referral to a neurologist. it is so important to know what type of dementia she is suffering from.,https://www.reddit.com/r/dementia/comments/iry1xs/when_to_correct_my_grandmother/,When to correct my grandmother?
"my dad is i. late stage; he had very specific songs that he listed to for certain tasks. for example, doing dishes after having a dinner party? we listening to “in the city” the eagles. i’ve made myself a playlist of his songs. have any of you done the same?"," yes.  after my mother died i made a playlist of the songs she'd sing around the house.  guantanamera, the girl for ipanema, my cherie amor, the eyes of texas.  sigh.  on her good days, she'd sing and dance around the house.",https://www.reddit.com/r/dementia/comments/irq6n5/playlist/,Playlist
"pops is a long time type 2 diabetic. stroke survivor.  has horrible short term memory. great long term memory. recently he couldnt find a few items. he blamed a relative that stayed with him for a few days last year for stealing it. . he was normal just last week. now he cant sleep , slowed his eating and just wants to call the cops. it's eating him up. eyes red. he wakes up with rage.  normally it goes away but it seems this time it is much more severe. this happened 10 years ago as well so it isn't new. it also happened last year.  it's been about a week now where hes been in this state. he's staring into space. his sugar has been high lately. 200-300 after meals.. taking a dementia test next week. would taking him to the hospital help?  would iv and detox from the sugar help?"," play along with him. don't argue. get a broad spectrum blood test done and consult with a respected nutritionist to form a meal plan. address any nutritional deficiencies. consider replacing sugar with stevia.i found that mainstream docs were not able to help my father with his alzheimer's. functional medicine is the way to go. that doesn't mean you should avoid the gp. get help from both. unfortunately, insurance pays nothing. music has been a huge help for my father's moods. get an amazon echo and have music play on a schedule.",https://www.reddit.com/r/dementia/comments/irp4ii/need_advice_with_pops_he_thinks_someone_stole/,Need Advice with pops (he thinks someone stole from him - diabetic and stroke survivor)
"my friend keeps wondering off.  is there a phone watch?is there one with a sim card?one that i can either gps him down or call?  took him to pizza and he wondered off.has done this 3x now and its exasperating. he removed the gps from his wallet and cant use a phone now.cant be trusted to carry a bag, wallet, phone,i thought something like a smart watch i can call and login to an app or have him paged on cellular?", iv decided to go with  # samsung galaxy watch3 - lte it makes calls!  it can receive calls!   it has gps!!!,https://www.reddit.com/r/dementia/comments/irlmhe/my_friend_keeps_wondering_off_is_there_a_phone/,My friend keeps wondering off. Is there a phone watch?
has anyone here had to put a loved one in emergency respite? if so how was it for you and the person with dementia.backstory: father has bvftd and is 56. he has started getting more aggressive and mean lately. the other day he kicked in the suv front windshield in a fit. he is still very aware and would be very upset about being in a care facility for a few days but his violence is getting to be to much.," if possible have his health carefully evaluated - many dementia patients 'act out' when they aren't feeling well, and this point is often overlooked.then it could be that the disease has progressed to a point of no return.when my husband went to emergency care it proved disastrous for him.best wishes...hang in there.",https://www.reddit.com/r/dementia/comments/irhw1z/emergency_respite/,Emergency Respite
"my mil has always been a difficult woman with narcissism... before dementia, she wasn't as argumentative. she was aware she had to pretend to be kind to me or her grandchild or we'd leave and end the visit.  the latest behavior is pickings fights. it's actually nice to see because for awhile she couldn't talk much, if she did, it was childhood memories. those vanished. then it was hallucinations and expressing in clear sentences who broke into our house or stole vehicles. that diminished. this is the latest...if i say look at that beautiful blue sky. she'll say no it's green.if i talk about a friends mental health struggling after a heart attack (it was a conversation between hubby and i). she'll say she only had a mild heart attack (she actually has no idea the severity of the heart attack was, i never told her).if you say i love bananas for potassium, she'll say they don't have that much potassium.if you try to teach her, she will actually turn it into a debate.it's so interesting because this is the only communication she has. it's all day, everyday. i've told company to say ""i don't want to argue with you"" or ""please stop turning what i say into a debate"" surprisingly she stops. do ppl in general with dementia tend to do this or is it the narcissism? it's confusing. am i doing right by telling family members who visit to suggest to her to not turn it into a debate? i don't want her to lose her voice though..  yet she isn't being nice. we've tried changing the topic but she continues to argue. at a family members house, i noticed she rudely told the home owner she should clean her toilet. the toilet was clean... her behavior has thrown me right off.is she doing it subconsciously wanting to argue?"," it’s tough to know. my mil was a very kind lady and when she came to live with us in another state, she was just down right mean. she made nasty comments all the time and was also very argumentative. she also suffered mild hallucinations and made up stories about things she just couldn’t remember, like saying someone stole something. then one day she just refused to get out of bed, like at all. we had to make her wear diapers because she would just mess herself and blame us. but we couldn’t get her to leave the bed because she would just throw a toddler level temper tantrum. well, we noticed she hadn’t poop in a week and her taken to the er, because she had been so fiercely private about her medical records, the hospital had to do a complete work up. well they found that her para-thyroid was not working and had it removed. she had been selective on what medicines we were giving her to take (hiding the others in her shoes under the bed) and had a been self medicating with her dead husbands old prescriptions(hidden in her purse). wow. we thought we were being nice letting her have her space. after the surgery and the meds were cleared up she became her sweet self again. we don’t let her have any control of her meds at all anymore. she is not what i would call a very educated person, maybe even has an undiagnosed disability, and she is very hard of hearing. so mix that all up with dementia and it’s hard to know if she heard you, or just doesn’t understand. i feel your pain, everyday.",https://www.reddit.com/r/dementia/comments/irgx37/dementia_or_her_narcissism/,Dementia or her narcissism?
"you may remember me selfishly complaining about the frustration and lack of solutions i felt to my problem. i remember praying for god to help us. i didn't expect the solution i got.this disease slowly, and yet both quickly, drained my father. between the parkinson's and the dementia, it was stealing more than his mind.about a month ago i noticed my father, when i woke up, had what appeared to be an asthma attack, to me. after the standard treatments not catching, i called 9-1-1. it was pnemonia.that fear, that, ""we will do everything we can."" that call, ""he's okay!"" was enough fear to get our asses together. he came home completely bed bound, eating nothing but baby food, babbling, this powder to thicken his water, pill crushers, schedules. but we got it. home health aides, pt therapists, a doctor who came to us. then he stopped peeing. and the way he layed, despite moving him (for his stubborn self to move back no matter what we did), obviously created a bed sore. we sent him for fluids as instructed by the nurse who came out to look. and hopefully they could prescribe something stronger to help with the bed sores because he just wanted to be stubborn despite our best efforts. at least that's the dad i always knew! lol.except it was pnemonia. worse. despite the best precautions food got into his lungs. at first we were told a ventilator, but they said it was possible once it breathed for him he may not breath on his own again with the parkinson's. the muscles' rigidity hanging onto the machine pulling the work. plus the pain of incubation. they said he would be in pain, and they couldn't give him anything as it would interfere with the other treatment.that's when we learned he was dying. that's the first time we heard those words. ""you have to understand, even if treatment works, he'll be back in a few days. you're just prolonging the process.i was mad, because how can you expect me to make a decision on the spot. i never yelled at a doctor before, but i said you don't have to do the ventilator, i was against that when i was told the risk, but don't you dare tell me that you don't recommend treating him, for me to sign a goddamned paper handing him over to hospice and die, *right now*. because they did. they absolutely did. they called us that night. that morning. my sister finally cursed them out. and then i got on the phone. ""no, it sounds to me like you want the bed. i don't care about covid and the damn pandemic, this is my father and we need to be on the same page and until then you can stop fucking calling.""maybe it was denial. or anger. but it was decided, finally, this will be over and over. he doesn't recognize us in the hospital with masks. to keep going like this. he wouldn't want to be this way. and as selfish as this sounds, we couldn't keep going this way. that's one of the most selfish statements i think i've ever said.but, he's dying. on friday we came to understand that his body was shutting down and there was nothing we can do to stop it. we are prolonging the inevitable for the selfish want of daddy. of my mother's want of her husband. on monday he is coming home to us to die.my understanding of hospice is still blurred. but i'm sure as equipment comes in and more things get explained to me, with this stuff in front of me to look at, not my hypothetical imagination filling in the gaps, i will understand more. i actually dislike the sympathetic people who tell me to breath, that this will all be under control, not to worry. i want to know what i'm looking at, i want the plan. i'm the caretaker. i want the plan now! one of the nurses said, ""i'm going to take a guess here. you worked in the healthcare industry caring for people?"" yes. i took care of 5 developmentally disabled women in a group home. i constantly wonder what i said that tipped her off. what made it so obvious that this training for years in the industry, despite it not being the same type of care, that my questions resignated a control that i was refusing to give up.i know i'm all over the place. but my father is coming home to die. on monday. a date when treatment stops. like a death penalty."," i stumbled upon your post, and it feels like i could have written this. i am currently going through the exact same thing with my own father. the decline with parkinson’s, dementia, and a recent stroke has just happen so fast and i’m at a loss. i’m currently looking into hospice myself - doing the best i can but keep on wondering what’s the right thing to do. my thoughts are with you...",https://www.reddit.com/r/dementia/comments/irgttz/my_father_is_dying_i_just_need_to_talk_this_out/,My father is dying. I just need to talk this out. Please. This disease took his life away.
"is it normal for a dementia patient to look confused and lost at times.  you can see it on their face.  yesterday my mil couldn’t find the living room, her bedroom nor the bathroom.  she’s always liking for my wife.  this morning. lots of bathroom visits.  lots.  no fever though.  walking around the house like she doesn’t know where she is.  some days seem to snowball.  is this normal?", [removed],https://www.reddit.com/r/dementia/comments/irgfe9/looks_lost_most_of_the_time/,Looks lost most of the time
