submission,comment,url,title
"hi all,i want to preface by saying i realize there is a faq and that a lot of the problems i might depict in this post are common, but i want to tell a little of my family's story in hopes to get feedback and connect with anyone who has dealt with a similar situation.my father developed dementia and later alzheimers about 5 years ago after i took him to the hospital to be detoxed from alcohol. his alcoholism had gotten so out of hand it was my last resort to try and save him. this unfortunately set off a chain of events that lead to his dementia and alzheimers. he was about 64 years old when this happened and recently retired (forced to due to the alcoholism). my mother is 11 years his junior and is his primary care taker. i live a few hours away, my only other sibling is my brother who lives in the same city as them with his wife and children. my mother has alcoholic tendencies as well and uses it as a crutch to de stress, along with smoking cigarettes. she has anxiety and depression, and sees a therapist (irregularly) to try and alleviate. she takes an anti depressant and i believe that is all. i am extremely concerned about my mothers well being. she is under a great amount of stress dealing with my father, who is fairly far along in his alzheimers progression. we are surprised when he forms a complete sentence or thought, wears diapers that he uses, and my mother helps him bathe. unfortunately, he stays at home alone for the 5 hours in the morning / afternoon that my mother is at work. he is able to feed himself with whats in the kitchen and watches tv/naps while she is away. she has a camera installed on her phone that she uses to watch him while shes at work because its difficult getting him to answer the phone.as you all are aware, in care home or elderly care homes are all very expensive. we are not wealthy, but firmly lower middle class. i don't make a lot of money, my brother and his wife make decent money but have a child and one on the way. they live near by and help when needed but we are all a bit at a loss of what to do and how to help my mom. she is so stressed out constantly, understandbly so since she has to work part time and take care of my father when shes home, rarely getting time for herself. at the moment, we don't really have the funds to put my father in a care facility or anything like that. we may be able to afford it by some way of a small inheritance me and my brother will receive from my father's mother who recently passed, though i fear it is not quite enough to sustain him for the long term there.essentially, my mother is forced to watch my father deteriorate slowly as she sacrifices her life and happiness for him. i have guilt about living far away from them but i had been living in the same city as them for several years and felt stuck and depressed. i moved away for myself and to start my own life (i am 28), as i feel my father and mother wouldn't have wanted me to sacrifice my life to take care of them, though i do second guess this decision all the time and wish i could do more for them. me and my family have reached a plateau the past couple of years where my mother takes care of him, but i feel she is close to a breaking point mentally. she is so anxious, stressed, depressed, talks about how she is lonely, isolated, wants to date, etc. she is committed to caring for my father however and is steadfast in that. she gets frustrated and isn't perfect but she believes it is her duty to help him.partly i just wanted to tell our story, but i also would accept any advice in way of programs or financial aid or anything that could help me and our family out. my father gets worse everyday, it would break my heart to put him somewhere but i do feel sometimes that it would help my mom immensely to be relieved from that duty and stress. thank you for reading, and god speed to anybody out there dealing with this condition. it is the darkest part of my life, has changed who i am as a person, and in some ways helps me appreciate life for what it is - a temporary experience. love and peace to you all."," did you dad ever serve in the military during wartime?  if so, there's veterans' assistance for in-house care or assisted living.",https://www.reddit.com/r/Alzheimers/comments/ed1tl1/fathers_alzheimers_weighing_down_on_my_mother_and/,Father's Alzheimers weighing down on my mother and family
"hi all! my grandma is starting to lose her memory (and i believe was told that she is developing alzheimers, but i'm not sure). anyway, what do i do? should i correct her? she never says she doesn't remember things, she just says things that are untrue with regards to recent, current events, and often forgets the year. for instance she thought she was 75 and not 86. she thought my brother was turning 17. he was 21. she says she didn't vote when she did. it was the week after the election. she said she hasn't been to the special exhibition at a museum. my mother took her there the week before. i always just let the moment pass and agree with her, i.e. 'yes, it's a very interesting exhibition, you should go, i know you like that sort of stuff.' my mum on the other hand is like:' remember we went last week? we went together and you said xyz.'which approach is correct? she means a lot to me, and it pains me to see this happening to her. this is a terrible disease. the only plus side i see is that it's happening so late in life and that she had 86 good years. :)"," my brother with alzheimer’s would also just lie about things. we had dinner every evening together with two other family members. we all would chat and talk about the day, my brother never swore. the three family members would often say we didn’t believe what he said, but in a joking manner, not mean spirited. one evening my brother said out loud to all of us, “i’m just a damn liar!” we just broke out laughing! all of us including my brother, it’s a line we still use as a joke often to each other.",https://www.reddit.com/r/Alzheimers/comments/ed1ltv/gently_correct_my_grandma_or_allow_her_to_believe/,Gently correct my grandma or allow her to believe what she wishes?
"5 years ago my grandmother was diagnosed with dementia, and roughly 2 years ago, alzheimer's was tacked on. it's been quite the journey to get to where we are now with her. there's been multiple home moves, many doctors/specialists appointments, and a lot of family meetings with my mum and her siblings. my mum is currently off work, and has spent the most time making sure my grandma is well taken care of. none of her 3 siblings make the effort as, and i quote, ""what do you want me to do about it?? i have my own life to think about"" my mum goes multiple times a week with my grandpa, and knows how to effectively redirect my grandma when she's on a ""thr nurses are hitting me/my husband's sleeping with other women/he's beating me too"" line of thought. these nurses are an absolute god send, and my grandpa has never laid a hand on her, nor would he ever. they don't even live together, as my grandma is in a wonderful ltc facility and grandpa is on the wait list to get in the same place. anyways, my issue is this.. my aunts and uncles all want to take my grandma out of the home for a big family get together (where grandma will recognize maybe 4 people) and i believe this to be a horrid idea. not only because of how big (and confusing) our family is, but how badly she will lose her marbles when they have to take her back in. she has fought nurses screaming ""help me [my mum]!!""when my mum has taken my grandpa to see her, and they were leaving to bring grandpa home. my grandma thought she was going with them, and it was heartbreaking just to hear about. i think it's selfish of my aunt, and detrimental to my grandma's mental health to bring her out for a few hours. i have made it known how i feel, and that i won't be a part of it. my mum is disappointed that i won't be coming, but i have nothing nice to say to a lot of my extended family, and i refuse to watch my aunt try to guilt my mum into bringing my grandma back (which my mum has already said no to. but who respects no, right?) am i the bad guy for refusing to go, and making it known that i think they're selfish ? i'm sorry this is long and all jumbled up, i'm overwhelmed and don't have anyone to talk to about any of this."," definitely ask. i know when my mom's memory care housing holds holiday parties for families and friends, my mom flips out. she finds the noise of more than a few people to be alarming. i've sat with her through far too many anxiety attacks to do that to her anymore. our new plan is to whisk her away to a smaller gathering outside of the memory care building where she knows the handful that are there and isn't subjected to all that noise. she will fight us going back in, but the staff are great about coming out and helping us if we need it.",https://www.reddit.com/r/Alzheimers/comments/ecul6c/am_i_the_bad_guy_for_my_decisionthinking/,[deleted by user]
"do alzheimers patients experience a deterioration in language skills of their secondary tounge? if they do remember both languages, are they aware they are speaking different languages?", my understanding is that first and second languages are stored different places in the brain. (side note: there’s actually cases of people with brain trauma losing their first language but still speaking their second). so it seems pretty reasonable for a language learned later in life to probably fade away as the disease progresses.,https://www.reddit.com/r/Alzheimers/comments/ecitte/bilingualism_loss_after_alzheimers/,Bilingualism Loss after Alzheimers
"in reading these threads, i always wonder about the timeline of events leading up to a person’s diagnosis. for instance, my mother’s journey would look like this:2014: father gets leukemia, mom has trouble visiting him in the city. later, my nephew is born and she seems somewhat apathetic. he’s born in the city as well, and she gets lost trying to visit. we chalk it up to her being a nervous driver. she is 64. 2015: gets lost going to mcdonalds in the dark... a drive she’s made dozens of times before in an area she’s lived in for 30 years. we chalk it up to cataracts, which she has removed later in early 2016.2016: my aunt is placed in assisted living with advanced alzheimer’s in august. i knew she wasn’t quite right, but i had no clue it had gotten so bad because mom had never indicated as much. driving back from the hospital alone, mom ends up on the wrong side of the road and enters an army base. she’s pulled over by a half dozen cops. at this point i’m in denial, but i urge her to get a mental health exam. she gets a referral from the doctor, but between my aunt and life, nothing ever comes of it.2017: mom continues to slip. she’s still independent but she no longer understands how to gas up a car, she refuses to cook, and she’s been escorted home several times in the dark from church. i tell her she can’t go out at night anymore. in october, she can’t remember when her next drs appointment is, so instead of calling, she drives there and ends up lost. the dr drops her off, leaving me to find her car, which she can’t remember where she left.2018: i start receiving late notices in the beginning of the year. she’s writing the checks but the written amounts don’t match the numerical amounts. when leaving to go to target she’s gone for hours at a time. target is 2 minutes away. when questioned about why she’s been gone so long, she gets defensive. i have a panic attack every time she leaves. i ask her to let me know where she’s going but she rarely does. i force her to go to the drs for another referral, where the dr clearly states that she has dementia. i’m stunned that he didn’t think it was important to tell her family that. in april we have our first neurologist appointment. in june, she’s officially diagnosed with alzheimer’s at the age of 67. in july, my brother and i make the decision that it’s no longer safe for her to drive. in late august, she gets angry with me for not sharing a personal pizza with her. this aggression happens a couple times a month. in december, my aunt passes at 73. mom won’t let me help her pick out an outfit; she decides on the same black jeans she always wears and a sweatshirt. from this point on, her aggression and paranoia have a marked increase. in january 2019, her sense of taste change, and she starts throwing out food i make her unless it’s sweet or bland. over the next several months, her behavior worsens, including tantrums and physical aggression. her hygiene begins to suffer, and she aggressively cuts her own hair, leaving both sides patchy but the top long. she refuses to let me take her to get a cut. in may, my brother and i place her in an assisted living community. she still speaks poorly of me, despite not having seen me since june. she turned 69 in december.that’s about it for me. what does your timeline look like?", my mom went pretty quick.. there were some odd things in 2013-2014and she couldn’t find a job for a few years before this.  she had applied for ss and i helped her move to subsidized apartment in 2012. she had trouble holding a job for several years we realized much later that may have been related. she was also a heavy smoker and huge carb addict.  rail thin always but ate sweets like crazy.  2016- she was ill with pneumonia in may and unable to care for herself - ended up in hospital for a week.  she got lost every time she tried to come to my house which was odd as she had at one time been a realtor and very comfortable driving anywhere. then july 2016 she fell and broke wrist at our sons graduation party trying to climb a rock retaining wall.  she didn’t understand this was a poor decision on her part to follow the grandkids.  she also tells doctor she’s never had any other broken bones (not true).  she is finally dx with mci in september 2016. tried cognitive and speech therapy but she won’t do it - calls it stupid. 2017. my sister or i began providing meals she could microwave.  she didn’t stop at a stop sign a block from her apartment and caused another elderly driver to swerve and roll over to avoid t-boning her.  we reluctantly fixed the car but a week later she said it stopped working.  the oil pan was torn off the bottom but she insisted she didn’t hit anything.  we told her it was totaled and she couldn’t afford a new car...az meds caused hallucinations but telling her she has alz and copd is heartbreaking - every time we have to tell her.  late 2017 she developed shingles on her face and we realize she couldn’t manage meds on her own.  all this time she is not ack any problems and getting angrier with me and siblings.  she insists she is smoking only 4 cigarettes a day but is gong thru more than a pack a day.  apartment warns her again that smoking is not allowed. 2018 - she was always an avid reader and shingled resulted in eye doc visit and dx cataracts.  after discussion with primary doc we schedule surgery.  first surgery she is a mess after and says the doc was mean and hurt her on purpose. a month later 2nd surgery is better but she is childlike - sitting in waiting room that morning with her winter coat on backwards and hood over her face because we wouldn’t let her smoke cigarettes since the night before.     it is clear she needs more help so we apply for ma and find assisted living.  she refuses.  we finally just tell her it’s temporary.. then that she was kicked out of her old apartment for the smoking.   she moved in assisted living november 26 2018. she was too far gone with alz to get to know anyone there though staff said she was pleasant when i wasn’t around.  she was always angry at me for putting her there.  it wasn’t until this time that my brothers acknowledged she was getting bad.  she wanted to go with us always but as soon as we took her anywhere she wanted to go home.  september 2019 - the doctors and staff said she needed memory care soon but our dad (her ex) died suddenly of a heart condition and we put it off.  she became ill overnight the day before thanksgiving and we took her to emergency department.  she couldn’t articulate what hurt but reacted to stomach probe.  mri revealed acute appendicitis.  my sister and i talked to doc about her alz and copd & asked that we try to treat with antibiotics as there was no way surgery would be understandable for her and the copd made it dangerous too.  she seemed to bounce back after two days but my sister or i had to be there 24-7 as mom didn’t know where she was or why and just kept asking to go  home.   we scheduled surgery for saturday morning but friday evening her heart went haywire and eventually we moved her to hospice after learning the appendix had also burst.  surgery would result in stomach and anal tubes - possibly permanent and she already tried pulling out ivs and catheter whenever she was awake.   she was rail thin the last several months and always insisted she wouldn’t go to memory care.  in this she was right - she passed away the morning of december 4th.  we are just grateful she is not suffering or sad and confused... or angry and confused... any more. i tell everyone i don’t wish alz disease on my worst enemy.  this has been one of my most difficult christmas ever....but if this story helps one person then it is worth sharing!,https://www.reddit.com/r/Alzheimers/comments/ecb2a9/what_was_your_diagnosis_timeline/,What was your diagnosis timeline?
"my fil put my mil in memory care last week. since then, he has been sending messages in a group text with his sons and their wives detailing what she is going through during her adjustment. things like... she's refusing to change her underwear and it took 5 caregivers to do it because she was fighting it. now, i do understand that this is an immeasurably painful experience for him. but it is for my husband too, and getting these intimate and really upsetting messages is completely wrecking him. my fil sends these messages all day, throughout the day, and i don't feel like it's healthy. it's like he doesn't acknowledge that this is traumatic for his sons, too.am i being too high maintenance here? is it wrong for me to think that sharing this information this way isn't doing anyone any good, and should be communicated a about in a healthier way? or am i pushing him away because it makes us uncomfortable? has anyone experienced this? i don't want my fil to be alone in this, i just don't know what to do.", can your husband mute the alerts on the group text so he can check it only when he's mentally prepared to read them (maybe once per day)? that might help enough to keep it feeling manageable while still allowing fil the outlet during this tough adjustment period.,https://www.reddit.com/r/Alzheimers/comments/ebyvwu/fil_sending_upsetting_updates_need_guidance/,"FIL sending upsetting updates, need guidance"
"so, my grandmother is possibly showing signs of alzheimers/dementia.  for quite a while, probably a year at least, she has made small comments about people doing things around her home.about 6 months ago, she got into an argument with my mother, saying that people were coming and going from her home, and said that my stepdad was doing weird things in her home and that she didn't want him there any more (he is never there and is not doing any of the things she is saying).  about a month ago, that happened again, where she was gone for awhile and when my mom brought her home, she thought someone had been there.my mother has told me about this things, but i had never seen it firsthand.  last week, grandma had a surgery, so yesterday i stayed with her for the day.  everything was fine all day, she seemed to be herself.  at some point in the evening, all of the sudden she was at her front door, then basically running from window to window looking outside.  when she finally sat back down, she got upset and told me that her outside light had blinked and everyone thinks she's crazy, but she's not crazy, and someone is messing with her electrical systems and she doesn't know who it is but is she could catch them she'd kill them.  earlier in the day, she had been telling me how mush she loves her house and will never move.long story short, she is widowed and lives alone and we don't have a clue how to go about getting her help.  she obviously doesn't think she needs it, and i'm at a loss.  my mother is the one who is with her the most and is dealing with it the most.  my uncle, who lives in another state, thinks we just have to wait for something to actually happen that will force her to get help.  i'm going to look into support groups, and maybe even counseling for myself.  how did all of you go about getting the diagnosis?", i hope you understand you guys are in for a possible lengthy process.  i’ve been caregiver for five years.,https://www.reddit.com/r/Alzheimers/comments/ebvh7i/how_to_get_a_diagnosis/,How to get a diagnosis?
"so quick nondescript info: my mom is late-night 60's just diagnosed wit with early onset alzheimers. me: late-ish 30s, two kids who are nearing 10. so before i get to deep in, my mom has an amazing support  system around her. since her diagnosis, everyone has really answered the call (really hoping it stays consistent with some of my siblings). anyways, i'm looking for advice, when is the right time to start talking to my bearing 10-year-olds. i'm not sure that they'd really notice anything at this point, but i can only assume its a matter of time before the see changes. i dont want to over inform them, i dont want to scare them, and i don't want them to think they need to act differently (they absolutely love spending time with nana, especially since she is about 2 hours away and we cant see her as much as we'd like). i guess i'm just looking for advice. this is all scary to me and i feel like i'm lying to my kids and but i want to try and make the best of a horrendous situation. any thoughts?", ignore the label and discuss the behaviours. you might just tell the kids that her memory is getting bad. make sure to let them know that this only happens to some elderly and 'wont' (as compared to 'probably won't ') happen to your kids.,https://www.reddit.com/r/Alzheimers/comments/eauuur/my_mom_has_early_onset_alzheimers/,My mom has Early Onset Alzheimers
[removed],,https://www.reddit.com/r/Alzheimers/comments/eabck3/what_do_you_think_of_this_study/,What do you think of this study?
"hi, well i’m a student of filming and i’ve been interested in writing a story from the point of view of the family. i’m looking for happy moments, maybe something funny?, and sad moments. i want to write from the very beginning. if anyone is interested please send me a message.",,https://www.reddit.com/r/Alzheimers/comments/e9l1e3/looking_for_true_stories_for_a_short_film/,Looking for true stories for a short film
it is not a solution but maybe it could make a different in the life of many., thanks for this.,https://www.reddit.com/r/Alzheimers/comments/e9jfyt/new_approach_in_treatment/,New approach in treatment
"my grandad (82) has early onset dementia. he’s had a few falls that have hospitalised him, leaving him weak, with swollen feet (his heart isn’t pumping so fluid doesn’t move) and with delirium due to infections. he came out of hospital after the first fall in august and he was home for a little while but then he had a really bad infection, which caused another fall 3 weeks ago and he went back into hospital, a week ago he was transferred to the rehab hospital so he can get better with physio as he is incredibly weak. when he was in the big hospital, he had such bad delirium and he could barely even feed himself. he went through a really dark period where he was saying he didn’t want to go on and everything is so much effort. now he’s in the physio hospital and it’s a lot closer to home so we can visit him more but he seems to have just *given up*. i mean - he doesn’t seem to do a thing in the hospital, just sit and stare at this tiny tv. he keeps saying he is gonna just home for a few days because he gets confused about where he is. he gets angry when we try to help him... like i mentioned that his new electric chair arrived and that if he works really hard in physio then he’ll get home to it soon. he snapped at me which he’s never done. anyway - my point. i’m scared that being in hospital is going to hasten his dementia to deteriorate faster. **and**i’m scared he isn’t going to ever come out and he won’t be here for much longer. he’s... *really* lost. :("," well... i don't know about anybody else, but every time my dad was hospitalized for whatever reason (usually like stomach ulcers or something) his dementia did get acutely worse while in there, and he'd sorta recover when he came out, but never back to how he was when he went in. so yes, i think hospital stays make dementia worse. for the other worry... i dunno man.. each person will have their own level of quality of life they want.. so its sad but to some extent, i sometimes don't see it as something to fight them on.. on the other hand, dementia does come with mood and personality changes.. and hey, maybe he will feel better about it over time. its hard to predict the future and tell whats really going on sometimes. im sorry you are going through this. i know after awhile it will seem like all you have left are bad or worse choices, and sometimes no choice at all. it sucks but i hope you don't feel too alone. this subreddit has bunches of people who have been through similar. take care.",https://www.reddit.com/r/Alzheimers/comments/e9f1yy/i_dont_know_who_else_i_can_talk_to_about_this/,I don’t know who else I can talk to about this...
