submission,comment,url,title
"a relative has ad. me being a biohacker and really inspired by david sinclairs book, ordered some nmn for him to test. background: nad+ booster cured ad in mice in this study: [ sure he is not a mouse, but he shares 92% of dna with a mouse and i figured as the disease progression is pretty bad so he doesn’t have too much to lose by trying something that has not passed human trials yet. nmn seems to be the most potent/least bad nad+ precursor and high dose resveratrol seems to improve nad+ boosting effects. put him on 0.5g nmn + 0.5g resveratrol per day orally, nmn in pill and resveratrol mixed in turkish yoghurt. (will not post any links, don’t want to make any money on this, but be aware that the supplement industry is full of products with questionable contents). no other major lifestyle changes, it’s hard to teach old dogs new tricks.  3 weeks later i get a report back. after about 2 weeks he noticed greatly increased energy levels and mental clarity, memory seems to be ”improved”. 4 weeks later at the doctor he passed the memory and numbers test, not sure if this was better than before, but he seemed proud of this. partner reports noticing much improved memory, he still struggles to remember events from the months before, but new things seem to stick better. just wanted to share this promising result. anyone else doing nmn for ad?"," pardon my ignorance, what’s nmn stand for?",https://www.reddit.com/r/Alzheimers/comments/e4fibs/nmnresveratrol_great_success/,NMN+Resveratrol = Great success
"he was diagnosed a few years ago and has progressively gotten worse, he would always talk about the old days but mix it up with some current events, now it seems he doesn't remember anything but the past.i talk with him daily and he repeats himself a lot, sometimes the same thing every 20 seconds for 5 minutes. when he does this i don't interject, i let him repeat himself. is this the right thing to do? i feel like it is but i'm not sure."," my grandpa also repeated himself many times. i call it 'looping'. if theres a break in the repeating try to change the subject to something different! sometimes when my grandpa couldn't talk well or finish a sentence i would just sit next to him and talk about current events, other family members, etc and let him listen and laugh. during my rambles i would ask him a related question, something that could be answered yes/no if thats all he was up to.",https://www.reddit.com/r/Alzheimers/comments/e4d4w9/talking_with_my_grandpa_am_i_doing_the_right_thing/,"Talking with my Grandpa, am I doing the right thing?"
"i'm not sure if this is the right place to post this but i'm not sure where else to ask for help. i believe my father may have early onset alzheimers. he is 61 and his mother had alzheimers when she was in her early 80's before she passed. he has been drinking beer/smoking pot on a daily basis for most of his life so i feel that may have something to do with it but i'm not entirely sure.he has been having problems with his memory for a few years now but lately he has really been scaring our family. i've looked up some symptoms of eoa and it doesn't seem like he has many of them but his forgetfulness is on another level. he will ask the same question several times. for example, when he got home today he had asked me if i had fed our dogs. i told him yes. he then asks my mom the same question multiple times to ""make sure."" my mom gets annoyed after a while and says ""do you realize you've asked me that five times?"" and tells him how odd that is of him. after my mom had already made a big deal about it i hear him in the kitchen feeding the dogs. i go confront him and ask him if he remembers us telling him five times that they've already been fed. he says yes but no one gave him an answer. he does things like this on a daily basis.we got into an argument yesterday and already talked about it and he just randomly comes up to me and brings it up again. i tell him all of my points again from before and he acts like he can't believe what he's hearing like it's the first time we argued about it.does this sound like alzheimers?? he does things like this all the time. we all try to tell him that his behavior is really scaring us but he laughs it off and acts like we're crazy for thinking that about him. i've tried talking to him about going to see a doctor and he gets super defensive and he doesn't believe his memory is bad at all. i feel really hopeless because he refuses to listen to any of us and i don't think there's anything else i can do. my mom blames it on his drinking which he also refuses to acknowledge is a problem. how can i get him to acknowledge any of this? it really scares me thinking that he may end up as bad as his mother was towards the end of her life and he is only in his early 60's.", it took my family five years to get a diagnosis. be persistent and try to be patient. i’m sorry your family is going through this.,https://www.reddit.com/r/Alzheimers/comments/e470di/i_think_my_dad_may_have_early_onset_alzheimers/,I think my dad may have early onset Alzheimers
"hey - i'm not really sure what i'm doing, but i need some help and am not really sure where to go or who to reach out to.my mother was diagnosed with alzheimer's about a month ago by her pcp. i went to the appointment with her for support, as we feared she may have alzheimer's already (it took her father several years ago). the doctor put her on some medications, but they ended up not working out for her (they caused a syncopal episode).my mom lives with my father about an hour away from me. i'm 33, married, and an only child.i guess... does anyone have resources or some kind of guidebook on how to deal with a parent having this disease? a book recommendation or.. anything? i know that's probably asking a lot, but i feel totally lost and alone here. i don't know when symptoms require intervention, what to look out for, and what steps to take as things progress.the doctor didn't say if her symptoms were mild, moderate, severe, etc, but it sounds like maybe he should have? she seems coherent most of the time, but just does or says things that don't make sense now and then, so i'm hoping her case is still mild.i'm getting worried about her hurting herself in her home, especially after thanksgiving when she nearly burned herself in the kitchen. she gets very upset if the topic of alzheimer's is brought up, the same thing with my father. i think they want to continue on like nothing is going on, but i feel we should be taking a more proactive approach on how to handle this?for example, my father told me yesterday that my mom had had a couple checks bounce (she's in charge of their finances and that kind of thing never happens). we know something needs to be done, but are just not sure what, and are trying to be very delicate with anything we do or say as to not upset her more.sorry if this is a bit rambly, i'm just a bit upset and confused after the holiday. any insight is appreciated. i really don't know what to do.", thank you so much.  my mother has dementia. i heard about teepa snow and was going to look into it. this will be so helpful.,https://www.reddit.com/r/Alzheimers/comments/e3rahw/my_mom_has_alzheimers_and_i_feel_a_little_lost/,My mom has Alzheimer's and I feel a little lost
"i went out to eat with my grandparents today, it was lovely. my grandma has alzheimer’s, and while we were eating she asked if i wanted her grapes. seeing she didn’t want them, and knowing she’d get frustrated if she couldn’t get rid of them, i let her put them on my plate. less than 5 mins later, she’s asking me “can i have some of your grapes?”, which i never wanted in the first place. i happily let her have some, my mom and i laughed about it later.",,https://www.reddit.com/r/Alzheimers/comments/e38iy1/happy_thanksgiving/,Happy thanksgiving!
"we moved mom into assisted living back in late may, and boy, it’s been a big relief for me. as her main caregiver, i was the main recipient of her paranoia, delusions, and abuse. she’s in the mid/late stages at this point. while my brother visits her every other week, i haven’t been since late june when she told me leave; she still regularly talks about how i’ve stolen her money and put her in the home, and how she doesn’t belong there.when we put her in the assisted living community i made the decision that if she’s still going to be angry at me spending holidays with her are out of the question. she made my last several (before entering assisted living) holidays/birthdays kinda miserable and i’m just not willing to endure that again, especially when we’re going to spend all day at my brother’s in-laws. still, it makes me sad thinking about her without her family. i compromised many years during the holidays, making sure we could all be together, and it’s hard to accept that, for now, she won’t be a part of that.  i wish, for just a day, she could understand what was happening to her, so we could enjoy some time together as a family.", alzheimer's puts everyone in a lose-lose situation. :(,https://www.reddit.com/r/Alzheimers/comments/e2tiiz/first_holidays_without_mom/,First Holidays without Mom
," i'm a bot, *bleep*, *bloop*. someone has linked to this thread from another place on reddit:- [/r/alzheimers] [modified ketogenic diet is associated with improved cerebrospinal fluid biomarker profile, cerebral perfusion, and cerebral ketone body uptake in older adults at risk for alzheimer's disease: a pilot study. - september 2019](&nbsp;*^(if you follow any of the above links, please respect the rules of reddit and don't vote in the other threads.) ^\([info](/r/totesmessenger) ^/ ^[contact](/message/compose?to=/r/totesmessenger))*",https://www.reddit.com/r/ketoscience/comments/e1v07g/modified_ketogenic_diet_is_associated_with/,"Modified ketogenic diet is associated with improved cerebrospinal fluid biomarker profile, cerebral perfusion, and cerebral ketone body uptake in older adults at risk for Alzheimer's disease: a pilot study. - September 2019"
"as the alzheimer's progresses my fil will struggle more to look after mil. we don't want to separate them, he wouldn't want to live in a care home anyway. what's the alternative? a live in carer? how do we go about finding one (based in uk)? is there anything else we should look into?"," ms, we went the memory care route with our mom but it did not work for her, or us, so we pulled her back home and decided on live in care. my sister and i still have our hands-on-mom days, but now we have a 4-day a week live-in and it has been the right solution for our situation. i used [care.com]( and i've also heard that carelinx is good, to find qualified candidates for a small fee (i'm in the states so i'm not sure those sites are available to you or not). but in the end we hired a gal my sister and mom met at a nail salon! because of her experience she immediately recognized a daughter hanging out with her dementia mother and struck up a conversation. we started  by just having her come for one 24-hour shift a week, that gave us time to see how well she and mom did together and to also figure out if she fit into our household (i moved in with my mom to care for her). three years ago we tried agency help. didn't work out so well. a over a year ago we tried memory care. it was a disaster. we've been really pleased with in-home care, even with having to deal with payroll and such, i'm really happy we did it.good luck whatever you decide!",https://www.reddit.com/r/Alzheimers/comments/e1o2v7/whats_the_alternative_to_putting_someone_in_a/,What's the alternative to putting someone in a care home?
"she fainted on the toilet and told me something hurt so i panicked and called an ambulance. we were in the hospital from 7pm to 4am. which, honestly, is the shortest hospital visit i've ever been on. they ran a bunch of uncomfortable tests and gave her fluids. i turns out that she was just pushing too hard and made herself faint. anyway.... that was fun. i""m going to go commit suicide via coffee and donuts now.", vasovegel(sp?) syncope! it’s what i’ve had for a decade now. gotta love it! (note the sarcasm) in all honesty it’s ruined my life. i hope that it doesn’t happen again for her.,https://www.reddit.com/r/Alzheimers/comments/e1mgk7/i_just_spent_the_night_in_the_hospital_because_my/,I just spent the night in the hospital because my Great-Aunt took a large dump.
"my 59-year old mother just got diagnosed with alzheimers for a few months now. the symptoms have been there and badly worsening for around 5 years now, though. that's because doctors suspected her brain tumor/chemotherapy/medication were the cause of all of them until not that long ago.well, i'm 17 now and i feel like i never really got to know my mother. i didn't have enough time with her, and she's lost her real personality a few years ago. and she's getting worse rapidly.today she came home bloody and crying with a deeply split lip. she was super upset and kept telling us that a big branch had fallen on her while she was gardening. only that it's almost winter now in our country (the weather for gardening is definetly over) and when we looked at the garden there was absolutely no big branch on the ground. only a shitton of blood. but there was a broken off gardening tool but we didn't find the spike that broke off (that could've hurt her). apparently she had a really bad fall, my dad assumes. when i came home today, the person sitting there looked like a whole different human. she looked so small, sad and confused, sunken in like it was just a shell. when i entered she flinched. i asked her how she was feeling and her voice while speaking sounded like she would start to cry any moment. i just couldn't take it. she was in desperate need to be comforted but i just did not know how to do it. i wanted to cry so bad.now i feel guilty. guilty for not being there for her, for leaving my completly emotionally exhausted dad alone with her. worried because her alzheimers has been progressing so rapidly lately and sad. sad that apparently she isn't even able to go outside by herself anymore/ride her bike somewhere and has lost all independence now. i'm sorry this is so long. i just don't have anyone to tell, because i just don't now how to. i also can't tell a therapist right now because i'm in the midst of getting admitted to a clinic for various other mental health issues and we have other priorities (finding the underlying issues and not the obvious reason: i lost my mom really young and it destroyed my family and all my ability to form healthy friendships/relationships). i guess this is just a rant, dunno if anybody reads this :)"," i’m 18 & my dad was diagnosed when i was 9. he was 51. i have older brothers who were in their 20s when he was diagnosed. i have memories of him but not a childhood worth like my brother did. i understand the struggle with feeling like you don’t know this person. even though their your parent and you know them, you don’t know the small details of their lives or their personality very well. watching a parent look so old even though their young is such a confusing thing. it’s also hard being our age and having a parent diagnosed with alzheimer’s bc it feels like no one else our age can understand. it’s such an isolating disease. this is a great community to reach out to for support & don’t beat yourself up over needing a break. being a caregiver, at any age is hard, but especially ours.",https://www.reddit.com/r/Alzheimers/comments/e1m1l8/my_mom_just_had_a_bad_fall_and_split_her_lip/,My mom just had a bad fall and split her lip
... sometimes the littlest of moments can turn it around. have to...,,https://www.reddit.com/r/Alzheimers/comments/e1cakh/when_your_life_feels_like_one_big_dementia_have_to/,"When your life feels like one big dementia ""Have to..."""
"i think i posted a month ago about my grandma (68). my goal was to visit her every saturday from the moment i found out she was in the nursing home.this is a rant/somewhat need advice(?)one, i feel like crap because i’ve visited a total of 1 time. it’s been a month or maybe 5 weeks. i’m such a crappy granddaughter for this. two, i think the second time i was going to visit her, i was promised by older brother that he would take me and his son to see her at 10:30 am. i drove to his home at 10:30, got there at 10:45 &amp; his car was still there. i knocked like a billion times and his wife answered and said “you deal with him.” he wasn’t awake and when i asked him about it, he said he wasn’t going to go.i think i felt crushed at that moment, i kinda lost it and i haven’t seen him since. now that thanksgiving is coming up, i have to see him, but i want to see my grandma because it’s a holiday and because i love her, but i want my brother to go with me.i’m just upset with myself, my brother, and this whole situation. why is it so hard for me to go see her? why am i being such a pos granddaughter and already doing it? why won’t my brother see her at all?"," you can’t control your brother’s behavior. don’t use him as an excuse - just go visit without him. it’s hard, but it’ll get easier each time, and you’ll get to have peace of mind knowing you were there for your grandma.",https://www.reddit.com/r/Alzheimers/comments/e1bnba/im_so_mad_about_this_whole_situation/,I’m so mad about this whole situation.
"my 90 year old father has been in a facility for about 2 months.  his alzheimers has made his already abusive behavior increasingly more frequent.  my mom, sister and i,  mostly mom, were the victims of his rage throughout our lives. there were good times but the pain of my almost 60 years is still very real. mom has visited once and he immediately became verbally abusive.  my sister visits at least once a week but it always includes him yelling. he barely sleeps.  his doctor is not attentive to his needs. although i love him because he is my father my fear is i visit.  he becomes abusive and i can handle that,  but then leaving the staff and more importantly the other residents with his rage. i feel quilty not visiting but i'm trying to find peace too."," it’s tough to visit when you expect to be yelled at for the whole visit.  there is a strategy that will allow you to visit but still puts you in control instead of him.  please explain it to the rest of your family too. no one should be try to do the right thing, by visiting, and have it blow up in their face.visit but be prepared to leave.  be nice and polite.  at the first sign of anger from him, tell him that you won’t listen to that. give him a chance to calm down, but if he doesn’t, tell him goodbye. leave. he may or may not figure out what you’re doing, it depends on how advanced his dementia is. but either way, it puts you in charge of the visit. do it this way every time. you’ll find that you don’t dread visiting as much as you use to.",https://www.reddit.com/r/Alzheimers/comments/e1b3e1/i_havent_visited/,I haven't visited
"i hope none of you dementia caregivers can relate to this post, but i'm guessing some of you will.[my ugliest truth](there are some caregiver truths i just don't wanna know.", [deleted],https://www.reddit.com/r/Alzheimers/comments/e1a92o/my_ugliest_truth/,My Ugliest Truth
"hi! i’d like to know what are the most effective method for preventing alzheimer’s progress...i know aerobic exercise, just like walking, is very effective for slowing alzheimer’s progress, but what else can we do?my mother is in an early stage (between 3 or 4, in a 7-scale), and i’d like to do everything i can to slow progress...she’s been in stage 3-4 for a year, now. i’ve read that some people can stay up to 4 years before progressing..."," brain games, puzzles, reading",https://www.reddit.com/r/Alzheimers/comments/e172x7/effective_ways_of_slowing_progress/,Effective ways of slowing progress
"title really says it all... my dad (69) is now in a state where he's unable to function on his own, forgets who people are, does weird stuff, and all the usual alzheimer-y stuff. my mum (66) is the one taking care of him, essentially babysitting him 24/7, and she's mentally and emotionally exhausted.every time i call her, i can tell that she's been crying recently. it breaks my heart and i have no idea what to say or do to somehow make it better for her.so if anyone has any experience with this, i'd really appreciate some advice... :("," i am in the same position,my stepfather also has early onset and is the same age as your father. my step sister comes over to watch her father once a week (that will never not feel weird to say), i live far enough away from them that i cannot be of much assistance. the one thing i do because i can is i call my mother every few days to check in, let her vent, and just make sure that she has had a conversation that day with someone functioning on a normal cognitive level. if you are closer maybe you could get someone to watch your father for a bit and take your mother out for a meal occasionally? something to let her have an hour or two of just being a normal person and not a caretaker for a little bit.it sucks, there are not any better words to describe it that i have found at least, and i'm sorry you are in this boat with the rest of us here.",https://www.reddit.com/r/Alzheimers/comments/e170gy/how_do_i_console_my_mother_whos_taking_care_of_my/,How do I console my mother who's taking care of my dad with early-onset alzheimers?
"my mother has been diagnosed with early onset alzheimer's, and i know a lot about the disease, but nothing about how she is able to support herself while living with it in her later stages. if you guys don't mind, i'll list some of my questions below (we are in ohio for reference).1. how would she be able to support herself when she is no longer able to work? she has no retirement or savings, and disability will not let you file and make a livable wage at the same time. 2. she didn't recognize me for the first time while visiting. how could i help her from suffering through that scare again? 3. what could i do to help her? the internet hasn't given me many options, if there are any."," sadly your case is similar to mine with mother in law. we had to move her with us and deal with it. we pay and so one of my sisters in law.here is early to mid alzheimer's plus vascular dementia, plus depression plus a bad knee which requires surgery she is 72 and final diagnosis was back in december.now  the down votes will come after what is below.after 6 months with us a  mix of better diet, no meds, cbd, coconut oil and lion's mane she  has shown improvements. i don't care what others will say, she has gained weight back, sleeps better, has very little sundowing, she is less stress, confused and does ask for chores to avoid being bored, she has learned new things and can remember stuff from yesterday or a week ago. is 7pm and she is reading a book, something she wasn't doing 5 months ago or during  last year.the knee is the only thing keeping her from doing more stuff. we do have the occasional confused day,but is mostly when she is tired or the knee giving a pain. i rather have her like she is now than how she came to us.",https://www.reddit.com/r/Alzheimers/comments/e15d34/mothers_recent_diagnosis/,Mother's recent diagnosis
"i'm 26, and i have a horrible word retrieval- for example, i forgot hillary clinton's last name one morning and i just couldn't remember as it was on the tip of my tongue. i also forgot robin william's name while i completely knew him.my mother also seems to be developing dementia at 62- she doesn't know words she knew a year ago along with bad problem-solving skills.the only other thing i can say is that i have pretty good logic and reasoning skills.are there any studies that conclude bad memory at a young age leads to higher likelihood of dementia/alzheimer's?"," i'm sure there is.  maybe google and see what comes up, plus webmd. you could also ask your doctor,  i'm sure he can give you some info also.there is early onset of alzheimer's.  my husband was diagnosed at age 69 in 2009. he's had it for 10 years now and is now on hospice at our home because we make too much for him to be in a skilled nursing facility.  he's been on medication for it since oct. 2009. that's the thing,  you have to get them on meds and start right away because the ending months of this are horrible seeing them that way.",https://www.reddit.com/r/Alzheimers/comments/dzs63s/bad_memory_when_young_higher_likelihood_of/,Bad memory when young = higher likelihood of developing Alzheimer's?
"just got off the phone with my grandmother who, for the first time, didn’t recognize me right away.  all four of my grandparents have had or have the disease so i know it will only get worse. i was looking for folks who know what it’s like to lose loved ones in this way. i was so frustrated scrolling through the alzheimersgroup seeing that stupid garfield comic thinking it was the right subreddit.  glad i eventually came across this sub"," hmm must check it out, haven't seen that sub before. glad you found your way here.",https://www.reddit.com/r/Alzheimers/comments/dzr1uq/anyone_ever_accidentally_go_to_the/,Anyone ever accidentally go to the r/AlzheimersGroup instead of this one?
[removed],,https://www.reddit.com/r/Alzheimers/comments/dzb1m4/im_18_years_old_and_my_father_had_alzheimers/,I’m 18 years old and my father had Alzheimer’s.
[removed],,https://www.reddit.com/r/Alzheimers/comments/dytd53/alzheimers_study_in_la_area/,Alzheimer's study in LA area!
