submission,comment,url,title
"my grandma has been dealing with alzheimer's disease for about 5 years. for the last year shes been in stage 5, she still had full sphincter control, she knew when to go to the toilet. but two nights ago she woke up wet.  i'm assuming she's stage 6 now she's pretty far down , she's completely dependent on my grandfather. they're both 79 and i can see how it's consuming him.  she still eats and talks a lot , but lately  none of it makes any sort of sense. i'm afraid of having to put her in a place to help my grandfather take a break for once , because she'll feel abandoned  and will probably be angry at my grandfather"," at 79, i suspect he doesn't have the physical strength to lift her and do diaper changes, especially if she's uncooperative. and what we found with my mother was that once she was at the point where she needed adult diapers, she was in denial about needing them and noncompliant, or if i demanded she wear them (like before i allowed her in my car), she was confused about how to put the on, putting them over her underwear, for example. that was the point where she needed assisted living - and to be honest we waited a little too long to force that issue due to distance and legalities of forcing her to move against her will. but the some of the tipping points regarding toilet issues are when cleaning and compliance becomes enough of a hassle that your grandma ends up staying in wet pants or bedding or not showering after wetting herself because your 79 year old grandpa can't lift her, can't get up at 3am to get her into the shower, launder the bedding, etc. it's just easier for them both to sleep in urine soaked sheets and mattresses and hide it from the rest of the family. and the furniture or floors end up with urine or feces soaked into them for hours/days or longer for the same reason. it becomes a health issue and a risk for infections, and of course is unsanitary for him as well. the family dynamics played into this all too for us. my mother viewed herself as the matriarch even as she was unable to handle her own most basic hygiene tasks. so she wouldn't take orders from the rest of us. i got lots of angry reminders that i am her daughter, i need to learn my place, blah blah blah, as i was insisting she had to shower after shitting her pants. :)the assisted living place mercifully took that part of the equation out of our relationship. the aides there are saints. if my mom has to shower, or change clothes, they have that argument with her. and now my visits aren't focused on battles, we just visit. you might think about a cover story for her eventual move, if you are worried about her being angry. is there a reason she could be moving there ""temporarily"" for some sort of ""physical therapy rehab"" without telling her it's permanent? or some other reason like she could be going there now while your grandfather stays behind to ""get their house ready to sell and once it sells then he'll be moving in with her""?",https://www.reddit.com/r/Alzheimers/comments/eg9u2l/when_do_you_think_is_definitely_time_to_put_an/,When do you think is definitely time to put an Alzheimer patient in a residence ?
"my sister goes to college while dealing with her dad. we're not sure he's diagnosed with dementia because his pcp won't help us, even though he's showing mental declination. she broke down crying because she couldn't take it anymore.his behavior:1. combative- he has pushed, slapped, tripped, punched, grabbed us. 2. can't form complete sentences.3. he doesn't make sense in his native language4. hears and sees stuff that is not there.5. doesn't take a shower anymore6. verbal abuse, even threatened to kill us. the list goes on, and i've documented his every behavior in case he actually hurts us. my stepdad has always been a jerk. this disease he has have amplified it."," those are all things that can show up with dementia but i dont think they qualify as a diagnosis of dementia, and especially not any diagnosis of the reason for it (alzheimer's vs parkinsons vs stroke or whatever else).is your sis the primary caregiver? if yes, she might consider getting medical power of attorney (or maybe total power of attorney), so that doc will have to work with her. if he's got another primary caregiver i guess id ask them whats up. good luck.",https://www.reddit.com/r/Alzheimers/comments/eg8lbq/is_this_dementia/,Is this dementia?
"so a couple weeks ago i made a post venting about the rough weekend i had with my mom.  well,  we went to the doctor and he changed one of her meds.  she was on lyrica for diabetic leg pain.  he changed it over to gabapentin.after a rough couple of days with the new meds,  she is doing so much better.  anxiety is down. pain is down. she isn't acting out nearly as much and even she does its a whole lot easier to redirect her.  we also have a respite nurse coming once a week for now. getting away for some alone time is a huge help for me. thank you all for the support and kind words.  it means so damn much to me!", [deleted],https://www.reddit.com/r/Alzheimers/comments/eg4wum/doing_better_with_mom/,Doing better with mom
[removed],,https://www.reddit.com/r/Alzheimers/comments/efonno/is_it_wrong_to_like_some_changes/,Is it wrong to like some changes?
"i know this isn't as heavy as some of the stuff posted here, but i just needed to vent. yesterday at breakfast i was casually told that my grandad has alzheimer's. he's in his 80's so it's not a huge shock, but it still sucks. he's always been forgetful, but i guess i just didn't realise how much. he has a beach that he likes to drive down to, but it's a fair way away and recently he got so lost on his way home that the police actually had to be called because my grandma just didn't know where he was. i believe he arrived home at about 9pm. now he probably won't be able to drive down to the beach anymore (he still has to get a test to see if he can drive, but the area he's allowed to will probably be limited) and i just feel rea sad for him. he's such a great guy. he also has hearing loss, but he refuses to get hearing aids. i'm visiting my grandparents' place for christmas, i got here today and really realised how forgetful he is. and on top of that i'm not even sure he knows he has alzheimer's. anyway, well done if you're reading this far, i really just needed to vent. have a wonderful day!"," your grandfather may realize he has some issues, but may never really understand his diagnosis. that is ok. there is nothing much he can do about it. i simply told my father he was having problems remembering things and he could accept that. you may think that going into more detail would be good for him, but it won't help, and could cause him to become upset.",https://www.reddit.com/r/Alzheimers/comments/eejh0i/some_news_i_got_yesterday/,Some News I Got Yesterday
"my father's partner has had some kind of dementia for awhile. i saw signs at least a year ago. now she gets lost on a 2 mile drive to the supermarket. she can't remember many events or activities, stays in the apartment all the time, repeats things often. can't remember my dad was in the hospital for 2 months about 3 months ago. my dad has later stage parkinson's. he can't argue with her about her mental state or get her to understand she has something going on.  he doesn't have the energy and when he tries to talk to her she stresses him out so much his parkinsons goes into hyperdrive.she absolutely denies a single thing wrong. her son talked to her and said maybe her hearing needs to be checked. she went to a doc with a prior conversation about the concerns by her son to the doc. he ordered an mri but she refuses to move forward. ""you all are crazy, there is nothing wrong""anyway. i am not sure if it's so necessary to get a diagnosis but i worry because she is with dad all the time.", both my parents were diagnosed last year. they both deny and refuse to accept the is a problem. we had to 'take dad's car to the garage to be fixed'. was the only way to get the car keys from him as he wasn't far off being a danger to drive. he occasionally mentions the car we say it's being fixed. sadly you can't make them understand they are ill. you need to get support from the doctors and dementia team as they are used to dealing with the denial and have ways of getting things done with upsetting the patient. you also have to be firm at times if they keep up with dangerous actions wandering etc and find a way to divert attention etc. get as much official support from the dementia teams. having both my parents with it is a nightmare as you are dealing with two different needs but they think they are capable and well. the top priority is to keep them safe.,https://www.reddit.com/r/Alzheimers/comments/eeh02j/how_to_get_a_diagnosis_when_they_are_dead_set/,How to get a diagnosis when they are dead set that nothing is wrong.
"she had alzheimer’s for the past 5ish years and the decline has been fast and heartbreaking to watch. she lost so much weight. there was a time where she would scream in agony all day. she couldn’t do anything for herself and towards the end she even forgot how to eat, drink water, walk.even though it has been five years, it feels like it all happened so fast. i remember one day she was telling my dad how she had been driving her car and somehow ended up in the middle of nowhere. and at the time, no one thought anything of it really. but after that, things subtly and gradually got worse. she would forget how to use a tv remote, forget where things were. and eventually she got diagnosed and i still didn’t really take it seriously. all old people forget stuff. but it just got worse and worse. she started to forget who my grandad was and would be aggressive towards him, she started having seizures...it’s like my grandma was 3 different people. there’s the grandma i grew up with who was an intelligent, streetwise, quick witted lady who was the centre of our family, the glue that held us all together. then there is her as the alzheimer’s was in the early stage, the goofy, adorable, silly grandma who always thought our front step was a huge drop when it was actually tiny and giggled at silly nursery rhymes. then there was her at the late stage, an unrecognisable shell. she spent the last year of her life sat in a chair, a far off glassy look in her eye, being completely reliant on other people. i had started university by then and so i wasn’t around much. but if i’m being honest, i didn’t visit her enough. my grandad and my aunt and my cousins all had a role in taking care of her and when i was there, i felt like a spare part, useless. i was only close to my grandma, i wasn’t close to any of them and i’m a quiet person by nature, so i wouldn’t ever really have much to say. when i was there i felt so out of place...it’s so odd to feel that way when surrounded by family. as if the situation wasn’t depressing enough. not to mention it simply caused me so much pain to watch her suffer the way she did, to see her dignity taken away as people helped her use the bathroom, to see her slipping away. sometimes she would sit and just sob in agony. and that broke me completely. i think i mourned her death long before it happened. she’d been gone a long time, her physical body just had to catch up. i’m angry that this disease exists and there are so many scumbags who will continue to roam the earth in perfect health while my beautiful grandma won’t. i am trying to hold onto the precious memories i have with her before this disease got her. i never want to forget the songs she would sing to me, the sound of her laugh, the way she would always tell me my eyes are bigger than my belly when i couldn’t finish my dinner, her beautiful smile, the way she smelt when she would hug me, the way she could fix anything, the stories she told me, the way she would always say “goodnight, god bless and remember those three little words: i love you” as she tucked me into bed. no one will ever be able to fathom how much i loved her and how much i still do. i would give anything to hug my grandma one last time. i hope that one day i will get to do just that. goodnight god bless grandma, remember those three little words: i love you.", my sweet brother passed away tonight. he was 76.we had an awful time dealing with how alzheimer’s affected him the past four months. i’m so happy he’s at peace now. i pray no other families have to deal with combative loved ones. there’s no magic answer to dealing with that aspect of the disease. he would never have hurt anyone in his right mind. pray for a cure.,https://www.reddit.com/r/Alzheimers/comments/ee6wfh/my_grandma_just_passed_away/,my grandma just passed away
"okay so with xmas coming up my moms side of the family is doing a huuge (37 people) get together at my grandparents house. they definitely have enough room for us all but there is one issue. my grandpa. for a few years now my grandpa has been suffering from alzheimer's. he has his good and bad days, but whenever there is a large crowd he just kinda shuts down. is there anything i could do to help him feel more comfortable or help him in anyway?"," the noise level from that many people is hard on someone with alzheimer’s.  a lot of people can be confusing too. if your grandpa seems overwhelmed, have family members visit with him in a quieter room, one on one.  it doesn’t have to be a closed room, so he feels isolated. then let him come out again at important times, then back to the calming place.",https://www.reddit.com/r/Alzheimers/comments/ee30ck/christmas/,Christmas
"so my  mom is basically my grandma’s caregiver. she manages her money and takes care of her. so today my mother her my grandma talking to her sister who lives far away. she was telling her sister that my mom does not feed her,thats shes hungry,she(my mom) has took my card. all of this is a lie. my mother has been busting her butt trying to take care of her. my mom fixes all of her food. there are days that my mom tries and begs to make her eat something but she tells my mom shes not hungry. my mon brings her plates of food everytime she cooks.another problem, she has been faking that her back is hurting. she leans over when someone is around but my mom has seen her walking normally during the night (my mom has a monitor in her room). my mom and grandma live in the same yard so its not like shes being left alone for long periods of time. my uncle who is a alcoholic and is basically deaf without his hearing aid.she sits around watching tv looking for things to order. she has ordered alot of stuff by calling. she has promised alot of people that she’ll give them money and gets mad when my mom tells her that she doesnt have the money to be giving away to people. my uncle is taking advantage of her illness by asking for money.my mom and i try to get her to go places all the time. ive asked her to go for a ride amd will say “ill go next week”. it comes to that week she puts it off. she wont even walking on the car porch or sit in the living room.my main problem is thats shes telling people that shes not being fed when my mom buys or cook her food every single dayi know this isnt the place to look for professional help but i want to know what you guys suggest. i told my mom we may have to put her in the nursing home. if she keeps telling people shes not being fed this could possibly get my mother in trouble. something has to be done."," i take care of my grandmother. she tells everyone i won’t take her anywhere, hard to get her out of the house when she refuses to go. she always says she doesn’t feel like it today. i have a cousin who was formally a prostitute, she’s been coming and staying with us a few days here and there with my grandmother peeling off $100 bills like she’s grandma warbucks. i had her come to work with me doing catering two days this week to help her earn money before confronting her about taking money from my grandmother. now she’s trying to get a full time job at my job. my grandmother had some money go missing that she’s had for over a decade from a deceased child. she confronted the cousin and she tried to blame me. my grandmother raised me and my mom is deceased. her daughters and i are equal in her will and they are happy with me being her caregiver. you have to sometimes burn bridges to keep vultures away from your loved one. i may even quit my job if they let her continue to work there. i can find another. sorry to go into so much detail, but along with taking care of my grandmother, i have stage 4 cancer and i know how difficult it all can be. your mom needs all the help she can get and anyone who doesn’t spend the time to know better than what her mom is saying doesn’t matter. screw them. take her credit card away and disable any auto payment for anything other than bills so she can’t order overpriced bs online. she can shop online when your mom is there to help her. publishers clearing house and other websites popular with the elderly take advantage of their dementia, so block them from being able to let her shop. also, if she has at&t; you can go online into settings and they have a scam blocker. it doesn’t work 100%, but it does help. they also have scam and spam phone blocking devices to hook up to landlines you might be interested in. tell your mom she’s a great daughter and mother. f’k relatives who are trying to take advantage of her or aren’t supportive of your mom. where are they when she needs them? sitting comfortably at home judging? again sorry for so much detail. rant over!",https://www.reddit.com/r/Alzheimers/comments/edy1o2/my_grandmothers_alzheimers_has_gotten_bad_what_do/,"My grandmother’s alzheimers has gotten bad, what do you suggest?"
"i posted on here a little while ago for support and man did i get it. i love you all. we’re all going through something horrific in life, but we’ve all got each other to confide in. today, i just watched harry potter with my mom. when i was young she used to read the books to me. now, whether or not she realizes what happening, it comforts me to watch the movies with her.", sweet. i'll bet your mom still enjoys harry potter with you!,https://www.reddit.com/r/Alzheimers/comments/edm1o1/not_alone/,Not alone
"my mother was diagnosed with alzheimer’s around ten years ago. she’s is late stage now, can’t walk or talk or manage solid foods. yesterday she was the most alert i’ve seen her recently. she made prolonged eye contact with me and looked puzzled. after i talked to her for a minute or so her expression cleared and she struggled to smile. it affected me more than i thought it could have. it was such a precious moment. i thought she’d never recognise me again. maybe it’s wishful thinking on my part, but i choose to believe that even if she didn’t know exactly who i was, she was happy to see the face of someone she loved.", lovely.,https://www.reddit.com/r/Alzheimers/comments/edm1e4/i_think_she_recognised_me/,I think she recognised me!
"i (20f) think my (65m) father has alzheimer's, but im not quite sure so i've come here to ask what y'all think about this. i have already told him that we need to go to the doctor and even though he's stubborn about that i think he will go sometime this week.  at around 18:00 he calls me downstairs and tells me that he's ""losing his memory"". i pressed him further and he told me that he ""forgot a conversation"" he had with a family friend that came by to our house today. so i sat there consoling him for an hour. he told he never felt like that before, but couldn't remember certain things between 13:00 and 17:00. things were ""blurry"" and ""scattered"". he could remember yesterday and the days before well though apparently. i was asleep and i thought he was too, but at midnight he calls me downstairs to the kitchen. i asked him what's wrong and he said he can't remember things. he asked me questions he already asked before today and i acted as if i haven't already heard them. he reiterated that this is the first time he felt like this.  i sat there and told him that things are going to be okay along with other affirmations. we both went to bed and now i'm typing this up... if anyone has any input that would be great. thank you!"," do you have siblings and other family that could help you decide your next course of action and help persuade your dad to get checked? i agree that a doctor's exam is essential, but please go with him and speak to the doctor ahead of time about your concerns. many general practitioners & family doctors only assess cognitive issues on a superficial level, as a first step to further examinations by specialists (neurologists, geriatric doctors, etc.) -- and it's important for the family to insist on an examination in case your father tries to insist ""he's fine,"" which isn't unusual. best wishes!",https://www.reddit.com/r/Alzheimers/comments/edhwt6/i_20f_think_my_65m_father_has_alzheimers_help/,I (20f) think my (65m) father has Alzheimer's. Help?
"she suffered a massive stroke about 6 hours ago. she is on seizure medication, is intubated, and is currently unresponsive. if she is unable to breathe on her own in 48 hours, we are going to honor her end-of-life wishes and remove all life-saving measures. i knew this day was coming, but i'm not ready to say goodbye."," i'm sorry as awful as it sounds, you need to let go. we are the ones holding to them no matter the illness and we forget they are in pain and suffering.my mother only sister had a huge stroke and every one holded on to her for six long years with no real sign of progress on her part, it destroyed her family. six year on and they still on the mend.",https://www.reddit.com/r/Alzheimers/comments/ed5wm0/mil_is_on_her_way_out/,MIL is on her way out
