submission,comment,url,title
"greetings,&amp;#x200b;my grandma who has been showing symptoms for the past 10 years or so (getting progressively worse) always feels the need to apologize for her actions/rambling/symptoms/forgetfulness.&amp;#x200b;it really breaks my heart, because i always let her know it doesn't bother me and i always try to brighten her mood by making some jokes about it (i've always had a joking relationship with her).&amp;#x200b;i'm kind of at a loss, because she has always been the type of person who is apologetic and feels like she is always a burden, even before her symptoms. i've never really had experience being around a family member with alzheimer's, outside of my great grandmother (her mother), albeit i was never really around for it.&amp;#x200b;i feel helpless, and i just want to communicate that her symptoms don't bother or annoy me. she's always been a sweet and caring person and i hate to see her have to apologize for something she has no control over.&amp;#x200b;&amp;#x200b;regards,&amp;#x200b;a grandma's boy", redirection. anything positive you can share about your life? a new baby? a wedding you attended? pictures and stories about little kids or pets. even a funny or cute youtube video of animals. my dad had alzheimer's. we kept him at home for about 10 years before it got to be too much. the nursing home he was in during the final few months allowed me to bring our dogs in to come visit. walking onto the dementia ward with a dog or child was always like being on parade. i had to stop and talk to every single person i encountered before finding my dad and some of them would hover around our visit once i did. i know the personal annecdote might seem irrelevant to some. but i guess the point was that sometimes the thing that makes people most happy or reduces anxiety is having something other than themselves to focus on. also if she's still at home i agree with u/tre-x about jobs you can thank her for and that will keep her busy especially if she's a wanderer.,https://www.reddit.com/r/Alzheimers/comments/ejgx8t/what_to_tell_grandmother_who_is_apologetic_for/,What to tell grandmother who is apologetic for her illness
"hello r/alzheimers,memory loss sucks. if you know of any person or family that suffers from dementia/alzhiemers and you live in the greater philadelphia area, please read and share this post.i’m working to enroll participants in the continuation of a clinical trial which explores a ***non-invasive*** approach to the treatment of dementia/alzhiemer’s. in collaboration with texas a&amp;m university’s dept. of neurosurgery, the quietmind foundation is enlisting individuals between the ages of 50 and 85 years who are experiencing memory problems and have been independently diagnosed with early to mid-stage dementia to participate in this trial.after two successfully completed trials, this expanded trial takes place in elkins park, pa and only requires 3 visits to the location. each visit is also eligible to compensate for time and travel.if you know anyone that might benefit from this treatment and would like to participate please feel free to send me a message or click to learn more: [", my sister is already participating in a clinical trial which will be completed in june. is she eligible?,https://www.reddit.com/r/Alzheimers/comments/ejeo0s/memory_loss_clinical_trial/,Memory Loss Clinical Trial
so my dad's memory has gone to shit. he is always repeating himself and never remembers things. he's in his early sixties and i'm thinking he has early onset alzheimers or dementia. he refuses to see a doctor about it. has anyone had simliar experiences?, lmao good,https://www.reddit.com/r/Alzheimers/comments/ej643a/i_think_my_dad_has_alzheimers_any_opinions_or/,i think my dad has alzheimers. any opinions or help appreciated.
"hi everyone. we lost my grandma to alzheimer’s last december and now my grandpa is progressing into mid/late stage alzheimer’s as well. he is extremely bored all the time and i want to find things for him to do. right now he pretty much just watches tv. the problem is we have gotten him word searches (his favorite pre-alz), easy puzzles, simple games, etc but he refuses to use them. he is very stubborn and still lucid a lot of the time, so things that are too “childish” like busy boxes offend him. he is also still struggling a lot with not being able to drive. i feel helpless because every time we talk he brings up the fact that he is so bored and can’t do anything. does anyone have any ideas how i can help? i live on the other side of the country so just visiting more isn’t currently an option. (background info: he is about to be 87,  formerly a mechanic and handy man, mid-late stage alz, and lives in a small nursing home with round the clock care.)"," i wish i could find other caretakers near me, so that maybe my mom would be able to meet up with someone that's going through the same thing as her and be more social. the alzheimers centers are on a wait list and ibhighly doubt she will like going there but i have to try.",https://www.reddit.com/r/Alzheimers/comments/ej45ni/enjoyable_activities/,Enjoyable activities?
needing help with my wife(69) who was diagnose last january with ad. since the end of october she has had difficulty recognizing me as her husband and confusing me with someone with the same name and very similar (in her mind). it does seem to come and go but often when she doesn't recognize me she wonders where i am and where i've been. yesterday it kind of came to a head when she confronted me (she knew who i was) with where i've been. she also thinks she's not living in her home where we've lived for almost 35 years. how have some of you handled this type of thing? is it possible to ask her to identify something on she and i would know for her to understand who i am? very frustrating and any help or advice is appreciated. thanks in advance.," thank you all for these suggestions. heard at the movie ""little women"", when the sick sister described her illness and said, ""it's like the sea going out for low tide"". similar to the inevitable progression of ad.",https://www.reddit.com/r/Alzheimers/comments/eio57i/needing_help_convince_reality_of_identities/,Needing Help convince reality of identities.
"hi all, what do you guys do to keep an alzheimers person busy/interested/occupied? i know my family member does not seems phased my tv or music anymore. also a lot of things you give her she wants to eat. i try to talk with her. i wish there was something i could give her to play with. i'm not sure if i am describing this best but any idears would be great."," go to amazon and search alzheimers gifts or for alzheimers patients, there are lots of great activities and helpful tools!",https://www.reddit.com/r/Alzheimers/comments/eil1a8/what_do_you_do_to_keep_someone_with_alzheimers/,What do you do to keep someone with alzheimers busy/interested?
"my late mother had alzheimer's for 10 years and at the time i thought i would feel little more than relief when she finally died, and that i'd already done my grieving when she lost the last vestiges of her personality; i even felt guilty about my callousness on the subject.however when she died the grief hit like a brick. it was like the last 10 years didn't happen, and i thought about the person she used to be and all the things i missed about her, which was something i almost never did while she was still alive. it was a confusing, disjointed type of grief too, because the painful memories were from so long ago.", i’m sorry for your loss. i felt exactly the same after my mother died and almost felt ashamed of feeling that grief but it’s natural and not something that can be controlled.,https://www.reddit.com/r/Alzheimers/comments/eihjo0/surprised_by_the_level_of_grief_following_loved/,Surprised by the level of grief following loved one's death
"hi, i’m not sure if this is the right place to ask. i’ve been taking care of my grandma for the last 4 months. her alzheimers gets a little bit worse everyday, but so far we’ve managed. today i noticed she doesn’t remember who i am anymore, that hurts like nothing else i felt before, but my main concern right now is that i can’t make her to take her pills.i think maybe she doesn’t trust me since i am now a stranger. (?)any advice would be great.happy new year everyone."," maybe look into a pill crusher (i got one for my dad, who has some arthritis issues, from amazon). he puts it in her food (i would recommend limiting her portion so you ensure she eats what you want her too, then give her any additional food i.e. if you are giving her turkey and corn/stuffing, mix the meds in the stuffing, giver her that first, then give her the corn and turkey)it may not be the “optimal” way to give it to her, but it gets her something.",https://www.reddit.com/r/Alzheimers/comments/eibp3c/help_with_grandmas_pills/,Help with grandma’s pills
"honestly a bit more of a ""just want someone to hear me""   visited my parents for christmas and my grandma in her assisted living home. i haven't for a year as the last time i did she didn't remember who i was, and it tore my heart to shreds. toughened my nerves and promised myself i would go see her this year, and it hurt just as much if not more. she remembered me a bit this time, but would instantly forget, but would say how i was quite a nice young man. i got a hug this time but it was during a "" not sure who you are"" moment.  my dad is also starting to show signs, at first i thought i was just paranoid but just in the last six months my mom has agreed he's slipping and it scares her. it scares me too and to put it lightly i've been mentally exhausted since the end of the summer. i'm an only child and the concern and worry about my dad becoming like how my grandma is, and the possibility that my mom may also, since it's her mom in the home, along with them having me later in life and being generally older (my dad is pushing 70 while i'm 24) doesn't help.  trying to cope and figure these things out but it's stressful. i've loved being an only child but at 24 i really wish i had a sibling who could help with this and not leave it all to me."," i'm not an only child, i have an older brother and older stepsister, but they both live out-of-state and never visit. my friend has siblings close by, but they refuse to help or see their alzheimers parent's needs and changes. i understand your need for support, it's scary and overwhelming, but having a sibling isn't the automatic support you imagine it to be, your close friends or joining a support group can be more beneficial. this isn't meant to belittle your feelings and experience, just sharing some other experiences",https://www.reddit.com/r/Alzheimers/comments/ehzv0m/saw_my_grandma_for_the_first_time_in_over_a_year/,"Saw my Grandma for the first time in over a year, and only child stress."
"i try so hard for a glimmer of remembering. thinking if i just do the holidays like we always have for 60 plus years there will be a light, instead i am a bitch (yep mom called me that) (does she remember nope) (am i crushed yep) because they misunderstood i wasn’t taking them somewhere.",,https://www.reddit.com/r/Alzheimers/comments/ehvhn0/pure_exhaustion/,Pure exhaustion
"been with my wife since i was 19 and had an overall happy marriage until this dreadful thing hit. recently (last 6 months) i've become really friendly with another woman and we enjoy each other's company and are both keen to progress our ""friendship"" within the constraints of my domestic situation. i trust her implicitly. i fully intend to be there for my wife but for the first time in a couple of years i feel genuinely alive again. i've told my adult children about it and although they don't want details, they are fine with it and want me to find a little happiness along the way, but whilst being discrete and respectful.i'm not after permissions and validation from anyone just wanted to gather peoples thoughts on the matter, as my loneliness was starting to hurt.thanks for reading.reggie"," no. you won’t love your wife any less. and you will miss her forever. having someone who knows what you are going through, and who will support you, can only help you be a better caretaker/husband. people who judge you for this have no goddamn idea what you are going through and therefore have no right to an opinion on your life.",https://www.reddit.com/r/Alzheimers/comments/ehi68q/wife_of_34_years_at_late_stage_5_of_alzheimers_is/,Wife of 34 Years - At late stage 5 of Alzheimer's - Is it wrong to have a girlfriend?
"our specific details are below, but tl,dr: i would love to hear from others about ways that you’ve gotten your stubborn loved ones to accept in-home &amp; companion care services. what worked well? what totally failed? what recommendations do you have for getting them to accept the new normal?our mom is entering middle stage alzheimers. she’s still highly mobile and that’s our biggest concern. she has gotten lost on walks, lost her keys on walks, got in a car with strangers that stopped (and asked her to buy them groceries…), and neighbors told us they witnessed her nearly cause an accident jay-walking across the busy road a block from her house. my brother lives nearby, but they have three young kids, his wife is in school, and he’s got a demanding job – they help out as much as they can, but coming by daily to go on long walks simply isn’t an option.we want to get her companion care to accompany her on walks and errands. as rapidly as we can, we want to also add homemaker care: she needs help/supervision in the kitchen, her never-stellar housekeeping skills are vastly diminished, and she’s quit doing laundry because she doesn’t want to waste water. i suspect she’ll be needing personal care within a year or so – she’s showing signs that incontinence is approaching. it is important to get her acclimated as quickly as possible.she has so far been very resistant to outside help. for example, she lost her license a year ago &amp; we arranged for a family friend that she’s known for 20yrs, who works as a lyft driver to be her on-call ride. she only uses him for one ride a week and the rest of the time she expects someone to offer to pick her up, she’ll sometimes ask for a ride, or she just won’t go. she rejects any assistance that feels “outside” of family or church – the church folks really only give her rides to church activities.we have so far erred on the side of trying to respect her desire for independence even though that’s resulted in a lot of wasted time and money on services she’s rejected. but we are past the point where she’s able to make good decisions for herself, so this one isn’t optional. we anticipate she’ll resist this too &amp; we’re trying to think of ways to help her accept that this is the new normal without resorting to command and control tactics. suggestions on how to play it?", we also erred and waited too long to move stubborn mom to an alf.  she had much the same reaction you describe.  eventually my sister and i picked a place and started bringing her for lunch and pointing out the benefits which were huge.  she finally agreed to try it.   we did all the packing (do not ever try to let alz patient help) and only took what would fit easily.  but we kept everything else and brought it if she kept asking for it.  part of the downsizing is if they can’t see it they forget about it... very obvious when we packed up her old apartment.  she did try to back out on day 1 and we told her she needed to give it a month.  then we said let’s wait till spring...then just change the subject.  alz is a horrible insidious disease that robs us of our loved ones. they are not the same as they were and it is hard to separate.  and they are not children - i always resisted that description.   i have an uncle with a major brain injury from a mv accident 35 years ago - that is what it is.  when my mom asked to go home or said she was unhappy or when she lashed out at us we recognized it was because her brain was dying.   “fuck alzheimer’s” became our go to phrase.   good luck and god bless!,https://www.reddit.com/r/Alzheimers/comments/ehffgd/how_do_we_introduce_inhome_care/,How do we introduce in-home care?
"my grandma had alzheimer's or some form of dementia, i'm not sure if it was ever confirmed but i did unfortunately watch her mind deteriorate and run into cycles of having the came conversations over and over again. i was wondering when would be an appropriate time/ age where i should try and get ahead of any symptoms and try to have an mri or speak to my doctor about it."," my mom was diagnosed early this year and her neurologist said the only 100% conclusive tests for alzheimer's are performed either by a painful spinal tap, or post-mortem. we decided to avoid my mom the pain of a spinal tap and go with her neurologist's diagnosis given the non-invasive cognitive tests she performed. if i were you, i would take them to a neurologist asap because there are some prescription drugs (like aricept) that can help (but not cure) and they can advise on care.",https://www.reddit.com/r/Alzheimers/comments/eh17w7/when_would_be_an_appropriate_time_for_someone_to/,When would be an appropriate time for someone to get tested/ an MRI to see if they have Alzheimer's?
"hi everyone, i’m looking for some advice. my grandma who has dementia/alzheimer’s ( not exactly sure)  lives with my grandpa alone together. he is her main caregiver, although she doesn’t recognize that he is her husband ( she thinks they were married at some point but not now ) and that she isn’t in her home. she will try and walk out the door to “walk and find her house”. my mother and i don’t live with them but we are close, we use a ring doorbell to see when she tries to leave and go over to help intervene although grandpa is usually able to handle it. my fear is that one day nobody will notice that shes left and we won’t be able to find her. the thing is that she always takes her purse with her, does anyone know of a gps tracker that doesn’t need to be charged too often and works well, maybe that is compatible with an app. all suggestions are welcome. thanks in advance!", medic alert works too. also notify local police just to make them aware.,https://www.reddit.com/r/Alzheimers/comments/egtlyt/looking_for_recommendations/,Looking for recommendations
"my 82 year old grandmother was recently diagnosed. her long term memory is incredible, but she is completely dependent on my mom and i for day to day living. she cannot eat by herself, she cannot dress herself, she can’t put on a jacket or turn on a light switch or put her foot inside a shoe. today she walked into a fence and tried to pee inside a trashcan. my mom is a single parent and i am so worried about her. she hasn’t seen a doctor in 7 years because she has not been able to. i can see my mom burning out. she has lost her patience for caring for my grandmother and almost thinks that she is faking it sometimes. she sometimes hits her out of frustration. i don’t know what to do. i’m worried for my grandmother and my mom. my uncle does not help at all. we don’t have the heart to put her in a nursing home. how do you guys deal with the pain of watching someone deteriorate, how do you overcome caregiver burnout? i know that my moms behavior is unacceptable but i understand what has pushed her to that state."," it's good that you've defined the problem (your mum needs a break) and that you're looking at solutions.  i suggest seeing if there are day visits where grandma can go somewhere, to give mum a break.",https://www.reddit.com/r/Alzheimers/comments/egmces/caregiver_burnout/,Caregiver burnout
"my mother is 70 and has recently been forgetting things (recent memories mainly) for the mast year and a half and it’s getting worse. here’s a little bit of context :-she has diabetes type 2 (since she was 50-55yo), that is treated with metformin. her diabetes acts up sometimes but it never got too bad. although recently (last month) she had to start taking metformin in the evening too. -she had half of her thyroid removed 10 or 15 years ago. she’s been taking levothyroxine since then. it’s quite stable now even though she had some troubles with the new formula for a while. she still has mild hypothyroidism sometimes but never anything serious.-she had breast cancer in 2012 but it has been successfully removed with surgery. she then had to go through radiotherapy and take meds (don’t know what) for 5 years. -she’s also treated for osteoporosis with prolia every 6 months and vitamin d. **-she’s been having bad insomnia for a year and a half now. memory loss and anxiety started at the same time.** she will basically sleep quite late, around midnight and she’ll wake up between 2 and 4 am. she then usually manages to sleep some more between 7 and 10am. so yeah, she now forget a lot of things. mainly content of conversations that happened recently. any new information is quite hard to remember. or at least the details of that information, for example she’ll remember that my sister who lives far is coming for the holidays but she’ll forget when exactly and will ask over and over again. she also find things confusing. things that she would understand before, like some settings on the tv etc. it generally takes way more time to explain things and we actually have to explain things over and over again. the weirdest thing happened recently. she’s muslim and prays 5 times a day. she always has and she’s always used the same calendar to know at what time she has to pray as there are no muezzins where we live. she’s never had any problem with that but recently after coming back from a trip to visit her family in algeria (where there are muezzins and where she didn’t have to use a calendar), she started doubting the calendar. she now thinks it’s inaccurate and she’s really anxious about it. she asked me and my sister to check several times that it was ok and prayed accordingly. she then asked almost everyone around her who told her the same thing. and last week she asked me and my sisters again but she still doubts for some reason and feel bad about it. or yesterday she said that « from now on until march the days will keep getting shorter ». i had to explain several times that the winter solstice was december 21 and that it was the opposite until june 21. she knows that she’s forgetting more and more things. she notices all those changes and is frustrated and when i ask her for example why she feels that way about the calendar she’ll tell me something she always says now : « i don’t know, i don’t feel right, there’s something wrong with me ». she of course told all this to her doctors but so far she’s got no answers at all and is still waiting for an appointment with a specialist. my question is : could it be something else than dementia/alzheimers? could it be the lack of sleep?could it be just a symptom of her other conditions or a side effect of her medicines? (sorry if it’s not clear/concise. it’s super stressful...)"," one thing that is super important to check for in elderly people, particularly those with alz, is uti.  these can seriously affect memory as well as other serious health issues and can happen very fast. travel and interruption to her normal routine might also affect her behavior if it is alz, as well as sleep. i imagine this is what her doctor will tell you. have you asked her what her concern about the calendar is? is there something plaguing her about it? maybe it would help to talk it over or if you could identify some key phrases to remind her that it’s okay based on what she says is bothering her about it. good luck to you guys.",https://www.reddit.com/r/Alzheimers/comments/ege7bw/could_it_be_something_else_than_early_signs_of/,Could it be something else than early signs of Alzheimer’s?
i was just wondering if this is a thing or if there's something else she's picking up on. i have a pit-boxer mix and am visiting my family for the holidays. my dad (73) has been diagnosed with alzheimer's....he's of course very forgetful but also prone to making weird faces and howling...creepy laughter..etc. but when he walks into the room even not doing any of that my dog goes ballistic and barks and growls. dad never displays any hostility towards her she just acts like she's on full defense mode when he's around. is that something that anyone else experiences? thanks in advance!," so your dog considers your dad a threat, interesting.  your dog could certainly pick up that something about him is different than everyone else. maybe your dog senses your dad’s chaos and confusion.  dogs can detect cancer and diabetes in adults, why not alzheimer’s.  pretty cool.  now, you just have to convince your dog that dad’s not a threat - which you may not be able to do. - since his number one job is to protect you.",https://www.reddit.com/r/Alzheimers/comments/egdipd/dogs_barking_at_people_with_alzheimers/,Dogs barking at people with Alzheimers?
