submission,comment,url,title
"hello all,thank you for reading. i'm really hoping for a bit of advice on how to get care for my dad. his condition is getting worse (suffering for 8 years, aged 67), and was locked out the house the other day and the police needed to help get him in again; just forgot how to work the door, and he's lived there for 25 years, but remembered nothing from it, minutes later.he did have a companion to go on walks with, but said ""he can go out on his own"", and didn't want/need that person. my mum works in the mornings, and sometimes has other things to do in the afternoon. she doesn't want to give up working. so i'm wondering how to get some care and support to him when she's out, without making him feel watched. my mum isn't really proactive and i feel she just won't actually do anything about this. they used to have gp support at the start, but that's stopped for some reason. but i'm having a telephone chat with the gps on fri to voice my concerns. i'm really rather worried that he's going to step out in front of a bus/car/van, or get lost in the city (we live in a big-ish city) and not come home one day. he has a simple mobile, but cannot remember how to use it or what it's for.but help.....how can i help him without making him feel more like crap? my mum already belittles him constantly and just gets angry at his behaviour, i know it's tough, but it hurts me when she hurts him. i've put up with her shit all my life and it's a shame that he's getting the worst of her now.thank you :-)"," we're in uk too. the main problem has been, in all honesty, our denial. we effectively painted over the cracks which meant that those carrying out assessments didn't see the true picture, or the real extend of my mil's problems - e.g. we cleaned and tidied her place before an assessment rather than letting them see she was happy to live with a pile of clothes on the settee.we've learned that we will only get support if we know what to ask for, but it's utterly frustrating when we get things in place only to find that my mil has sent stuff back (equipment to help her with day to day stuff) and refuses to let carers help her bathe etc. but the carers still go in each day and, as this is her new normal, she is gradually letting them do things to help.i think you should start to get social services involved and maybe your local community mental health team. it takes a loooong time for things to kick into gear, but they will give advice and support over the phone whilst the referral and making assessment appointments etc is happening. check online for local services, including age concern and dementia action.if your dad needs a carer, or somebody to sit with him or take him for a walk, then he may be eligible for care allowance. the forms are a nightmare but there are local support groups that can help you fill them in - specially trained people, with a lot of experience.my mil goes to a day centre twice a week, there are some men there too. it's run by age concern. maybe there's one in your area that he could go to? she's collected in the morning, has a cup of tea on arrival, lunch and then more tea before being taken back home. there are various activities throughout each day, but we never know what they are - and we never know what she had for lunch either. sometimes they go out for lunch, sometimes they go out for a day trip, sometimes they have entertainers in. it's all quite low key and very friendly, almost like a playgroup for grown-ups.your mum needs support too, she's in the firing line and it's exhausting to have to be a carer, try to run a home, and keep down a job. it's no wonder she's short tempered. she probably needs a shoulder to cry on too.good luck*edit: removed 'short because i haven't got time' and added some more, now i've got more time*",https://www.reddit.com/r/Alzheimers/comments/6b9tyo/how_to_provide_care_when_the_sufferer_doesnt/,How to provide care when the sufferer doesn't think they need it?
"my grandmother is in a nursing home. she has some lucid days, some not. the home is ok but she doesn't get a lot of pleasure out of life and the staff have very limited time to spend on residents. i want to make her some kind of setup where she can have access to music thats she enjoyed in her youth. i thought about a cd or mp3..maybe even cassette player that has a label like 'press play for your favourite music'. it needs to be something small, that she won't have to learn to use and can be plugged into the wall, for the same reason (that she doesn't have to work out how to charge it). has anyone seen something like this? i'd love to hear your suggestions. thanks in advance : )", okay so i have the radio.  it's compact and when you turn it off it remembers the previous mode.  the on off switch is on the back so it probably doesn't matter.  it won't play off a usb drive but apparently it will play mp3 from a memory card.  as i didn't have a memory card i just used the bluetooth function to test the sound.  it has a charming accent as it says tuner mode and bluetooth mode switching back and forth.  i'm not completely old on it but for the price it seems amazing. ,https://www.reddit.com/r/Alzheimers/comments/6b7hc8/advice_wanted_how_to_give_my_nanna_music/,Advice wanted: how to give my nanna music
"so my mom has had early-onset for 7 years, lives with my dad, is bed-ridden &amp; has ear-piercing wailing and screaming fits that go on for a very long time, often for no reason (aka her diaper is changed, well fed, my dad is talking to her, environment is calm). she is already on psychiatric medication for alzheimers &amp; i'm just wondering if anyone has experience with alzheimers and marijuana used for relaxation/calming sufferers down. i was thinking that edibles might be helpful for her and increase her sense of well being at this advanced stage but i'd like some advice from people who have ventured into this territory", you should look into cbd oil. it is the part of the plant that people with pain or seizures like to use. bop on over to /r/cbd/ for more advice and places to buy it.,https://www.reddit.com/r/Alzheimers/comments/6b2e24/does_marijuana_help_with_negative_disruptive/,"Does marijuana help with negative, disruptive alzheimers behaviors?"
i am an only child and my mother has alzheimer's. i have 4 year old twins and really wish they had the opportunity to know my mom. i know i am not alone in feeling such sadness on mother's day.," you are not alone. my mother has early onset dementia, and she's been going downhill pretty rapidly. i broke down in the middle of cvs today when i was buying her mother's day card. i really wish my nieces and my husband had a chance to really get to know her before everything started to go south. she's such an incredible woman, and it's a shame they'll never be able to witness this first hand. this disease is cruel and unfair. it's a painful battle full of heartbreak and despair. there are good days and bad days, but just know you are not alone. ",https://www.reddit.com/r/Alzheimers/comments/6ayadc/mothers_day_is_hard_when_your_mother_has/,Mother's day is hard when your mother has Alzheimer's.
"my grandma (73, diagnosed 6 months ago but declining over the past several years) has always loved tv/movies and has always loved telling stories. she used to tell everyone the plots of soap operas like it was happening to her friends. ""did you hear what happened to rose? it turns out her boyfriend was cheating on her with her twin sister! so sad."" lately, she's started telling me stories that are obviously movie plots from the 80s/90s, but she believes are about her family. complete with dialogue straight from the movie, attributed to whoever she has assigned into the story. it's usually heart-wrenching dramas that she loved 20-30 years ago, and she gets tearful in the retellings. i mentioned it to the neurologist who said she's never heard of such a symptom. can anyone else relate?", this was one of the first 'certain' symptoms i noticed about my mom. she took a show she was watching on tv and inserted my sister's death into the story as if it was about her. but she was adamant. i booked her in to see the doctor within a few days. ,https://www.reddit.com/r/Alzheimers/comments/6atp7d/grandmother_is_telling_movie_plots_with_names_of/,Grandmother is telling movie plots with names of loved ones
"i am going to be volunteering at a community whose residents have alzheimer's disease. this is the first time i will be around people with this condition, and i just don't want to say something insensitive or seem like i'm an out-of-touch ""outsider."" are there any terms that i should avoid?i found a few language guides online that said things like don't say ""patient"" or ""seniors"" and say ""care partner"" instead of ""caregiver."" are these good guidelines or are they well-meaning ""outsider"" guidelines that no one actually follows?example: "," no arguing about anything. their reality is quite different than ours and we can't see their truth. yesterday when i visited my mom, she was very sad my brother died last week.  but it's all a figment of her imagination since he's alive and well. and i can't convince of her of anything else (i don't even try.)  i've also learned to simply sit with her and allow her to repeat herself over and over. when i've had enough, i leave.",https://www.reddit.com/r/Alzheimers/comments/6aga46/what_words_are_not_respectful_to_use_around/,What words are not respectful to use around people with Alzheimer's?
"i'm going to start this soon, the patch. anyone have any experiences they can share. thanks"," my mom was on it for a while (until she progressed to the point where she forgot to put them on; now she's on namzaric (namenda + aricept in one) and i have an aide give them to her daily).  i've heard that the way alz drugs work is that you don't see the benefit while they're on them, but once you stop the change becomes more evident (faster decline for a bit).edited to remove meds comment not directed at op.",https://www.reddit.com/r/Alzheimers/comments/6a9toh/exelon/,exelon
"focus pointe global seeks people, ages 50-80, who have been diagnosed with early or mild alzheimer's for an upcoming paid interview on their experiences . this study will take place this week (week of may 8th)!participants will be compensated $75 for 1 hour of their time. all interested participants must answer a series of screening questions online to be sure they qualify and can be scheduled.answer the questions online. click through to sign in and take the eligibility survey to see if you are able to participate. if you are not currently a focus pointe global member, you can create a free profile and then proceed to the survey: about us: focus pointe global is a national market research agency that pays people for participating in focus groups and interviews. these are legitimate opportunities to make extra spending money, and usually take less than 2-3 hours of your time. **there will be no solicitation involved, please feel free to comment or message me with any questions or concerns you may have!",,https://www.reddit.com/r/Alzheimers/comments/6a6xrs/focus_pointe_global_is_seeking_patients_diagnosed/,"Focus Pointe Global is seeking patients diagnosed with Early or Mild Alzheimer's, ages 50-80 for a paid web interview. Participants will be compensated $75 for 1 hour of their time this week!"
"i'm 24, currently live with just my grandparents, and my grandma is at the beginning stages of alzheimer's. she's in her mid 70s, repeats questions/statements, forgets what she's talking about mid-sentence, illogical conversations, walks into rooms and doesn't remember why, and worst of all has very frequent mood swings and outbursts. very likely sundowners as she will start yelling and throwing things around sunset. she always had depression and has a terrible habit of blaming and nagging my grandfather about everything. she was diagnosed about two years ago and takes aricept but i don't think it has any effect. &amp;nbsp;just today she broke her first bowl by throwing it against the sink, and for the first time refused to take her medication. she used to cook dinner for the whole family for decades but since last year, my grandfather has been taking care of everything. she will still go into the kitchen and start yelling and nitpicking at him for very minor and sometimes nonsensical reasons. for example, not wiping the stove while he's cooking at the same time or for using the wrong type of napkin. she literally looks for things to nitpick or makes something up to yell at him about. this behavior is normal though, as i've witnessed it my entire life, but it's several times worse now that she repeatedly verbally abuses my grandfather over the same thing multiple times a day/every day and completely lacks the cognition to reason through any conversation.&amp;nbsp;today, she picked up a pot lid and handed it to my grandfather for no reason while he was cooking. he didn't see or hear her so she throws it against the stove, frightening everyone. i removed her from the kitchen. she comes back and starts washing the dishes on her own and starts yelling about how she has to do everything in the house (we tell her frequently not to do many things around the house including washing the dishes, taking out the trash, etc), and breaks the bowl. after dinner i handed her some stomach medication and she threw it down the sink, saying she's almost going to die anyway. &amp;nbsp;anyway, tonight's episode was the worst and that's why i wanted to let it out and make a post. **my goal right now is to start a conversation with the rest of the family about what to do going forward and what sort of topics or options we need to explore in that conversation.** the question that comes to mind is - what are the next steps in preparation for long term care? i'm talking about legal things like wills, power of attorney?, anything that may need to be done while she is still ""there"". and i think we'll need a caretaker later on since my job keeps me out of the house 12 hours a day and my grandfather is getting old himself, though still mentally sharp. he's not going to be able to take care of her if she goes into the advanced stages. what are some options - in-home nurse? long-term care facility? at what point will she need to go under their care? she's still able to take care of herself right now, but i'm planning several years down the line and i'm totally clueless about where to begin. i'd like to do as much as i can to help, but since i'm at the start of my career and the lack of family availability in the area, it doesn't seem to be a feasible thing to do when she progresses into the advanced stages. i know it's a full-time job to be a caregiver and i wouldn't know what to do if it gets to that point. also any advice on these emotional outbursts would be appreciated. her whole life she was the caretaker of the family and refused to let anyone help her, but now i know she means well but she simply can't do it and she is reacting badly to that. thank you"," we have been taking care of my partners 78 year old mother for 6 years now. she's on year 13 of a very slow progression of alzheimer's. i just posted several of the tricks we use to make things easier on my post at the top of the sub. i hope that helps. probably the best advice i could give you at this point is not to argue with her. logic doesn't work with alzheimer's patients. you have to go to their world. if she asks you the same question over and over, don't remind her that she just asked you that. in her mind it's the very first time.  just go along with it and answer. at first it will drive you nuts but you'll get used to it.  the loss of independence can be very frustrating for the patient and it's important to let them feel like they are making some decisions. when your grandmother says she's doing everything in the house. just agree with her and offer to help her so she doesn't have to do everything.  going into her world will ease so much stress for everyone involved. i promise!!!  ",https://www.reddit.com/r/Alzheimers/comments/6a3ju3/what_steps_do_i_need_to_take_as_a_caregiver_at/,What steps do I need to take as a caregiver at the beginning of this long journey?
"register for a free digital advance review copy [here](more info: independent publisher of berkeley, ca is distributing digital review copies of [the alzheimer's prevention food guide]( by sue stillman linja rdn ld &amp; seanne safaii-waite phd rdn ld.",,https://www.reddit.com/r/Alzheimers/comments/69zy5w/alzheimers_prevention_food_guide_available_for/,Alzheimer's prevention food guide available for free from rockridge press
"which phones do you recommend for a patient with altzheimers? my dad just came home with a diagnosis and he can't even use his phone (motorola, without a touch screen). and he is living by himself so i can't be there to help with memorizing the usage of a cell again. "," i got my dad an ownphone ( it's just a preset quantity of numbers, and all that needs to be done is push the name of the person you cant to call. we got it too late for him, he can't remember what it's for or how to use it. but it is super simple.",https://www.reddit.com/r/Alzheimers/comments/69eu8o/phone_for_my_dad_with_altzheimers/,Phone for my dad with altzheimers?
[deleted],,https://www.reddit.com/r/Alzheimers/comments/69cr5o/question_regarding_namenda/,Question regarding Namenda
[removed],,https://www.reddit.com/r/Alzheimers/comments/693dj5/interview_amy_berger_on_defeating_alzheimers_with/,Interview: Amy Berger on Defeating Alzheimers with Ketogenic Diets
"my mom is 69 years old. she has been having some basic memory issues. that isn't my concern. the other day she had an episode where she became extremely disoriented and had to sit in the car. she drank a 32oz. bottle of water and then could not remember anything that happened earlier that day. on a couple occasions she has become confused (over the phone) and had to hand the phone over to my dad. i'm very concerned. i live out of state and am planning to go visit and take her to a doctor. does this sound like early-onset? any opinions would be greatly appreciated, i'm so worried.", [deleted],https://www.reddit.com/r/Alzheimers/comments/68yytm/question_about_my_mom/,Question about my mom
[removed],,https://www.reddit.com/r/Alzheimers/comments/68k1d8/dementia_care/,Dementia care
"because of unfortunate circumstances, 1.5 years ago my brother (now27m) and i (now22f) became the primary caretakers of my mother (now58f) with early onset alzheimer's. she's currently towards the end of stage 4. she lives with us full time and we have a hired caregiver who comes in and assists her when we're at school/work. the issue: mom loves sugar and anything unhealthy for her. since mom has moved in with us she's definitely gained a bit of weight (nothing drastic, just enough to be noticeable). this is likely because she's now in a situation where she can afford to eat out or stop for ice cream, whatever. we are happy to make mom happy. after all, it is the little things, right? the thing is, at first she had a good balance. we kept a veggie and fruit tray fully stocked in the fridge and she would eat as much of that as she would anything else. but now she's gotten to the point where it's the same each day. breakfast: sugar filled coffee, pop tarts or a different sugary pastry. one time i came in to find her dipping oreos in her coffee. lunch: a local sandwich shop. she gets one loaded with beef and cheese and dressing and requests and second one for dinner. dinner: second greasy sandwich from earlier. she drinks 3+ cokes a day. lots of sweet tea too. we'll try and encourage her to drink water but she gets mad at us and says she drinks it constantly and we don't know what we're talking about, so most days we just leave it be. my concern: her bad eating is going to create more health problems that will ultimately cause her more stress. my question: how hard do we push? is it worth trying to create healthy eating habits at this point or do we just let her enjoy her time?"," >my concern: her bad eating is going to create more health problems that will ultimately cause her more stress.probably, especially if you let this pattern continue because it's easier all round for it to continue.i wouldn't, for example, ever dip an oreo into coffee because i don't like oreos, but i might dip a different biscuit into a drink because i like the taste. there's nothing wrong with that, but eating too many biscuits one after the other won't do any good in the longer term.a little question - does she have problems with her teeth, is this why she seems to be preferring to eat softer food?>my question: how hard do we push? is it worth trying to create healthy eating habits at this point or do we just let her enjoy her time? of course it's worth it. do you have a family meal in the evening? if so, then why let her have just a sandwich when the rest of you are eating something that's both more nourishing and also nicer.drinks? if somebody offered me either a fizzy drink or water i'd probably take the fizzy drink because it tastes nicer. there's more to drinking than quenching a thirst. maybe offer fruit juices, or have a bit more choice - and reduce the number of fizzy drinks in the cupboard. somebody who drinks a lot of liquid will be filling themselves up with empty calories and 'feeling full' for a short time, but will soon feel hungry again - so will drink more, because it's the easiest way to feel full.diet in general is quite important, so is enjoying food. can you get the carer to take your mother to a different place for lunch, or at least to vary where she goes, so she has to choose something different?my mother in law is a lot older than your mother, and she has her meals delivered. her lunch is a hot meal, every day, and with a dessert. she really enjoys this. along with her lunch she has her 'tea' delivered. it's a sandwich, a savoury pastry, a cake, a piece of fruit, a yogurt or similar. all in all it's a fairly balanced diet, along with her toast and marmalade for breakfast, in fact it's a better diet than she was eating before because she was reluctant (unable) to prepare a decent cooked meal and often forgot to eat - part of her condition that she tried to hide.",https://www.reddit.com/r/Alzheimers/comments/68a83a/healthy_eating/,Healthy eating?
[removed],,https://www.reddit.com/r/Alzheimers/comments/67x6dp/help_me_find_people_in_the_early_stages_of/,Help me find people in the early stages of Alzheimers who want their life story documented!
[removed],,https://www.reddit.com/r/Alzheimers/comments/67rwve/wanting_to_document_peoples_life_stories_during/,Wanting to document people's life stories during early onset stage
[removed],,https://www.reddit.com/r/Alzheimers/comments/67iuqh/the_big_a/,The Big A
"does anyone know if a device exists that is a gps tracking device within a watch that looks like an old school regular watch? my grandpa has alzheimer's, and he is still living in his own home with his wife (also failing mentally) and a frequent caretaker. however, we are getting worried about him wandering off or getting hurt somewhere without anyone knowing his location. he refuses to carry anything he isnt familiar with, so something that looks like a normal watch would work well. does this exist? everything i find is very futuristic looking..."," we used [this ankle band]( made by the people who make the lojack car recovery system. it looks *somewhat* watchlike. in case you haven't figured it out yet, avid lifealert because it is only a panic button that works within a certain range of the home.",https://www.reddit.com/r/Alzheimers/comments/67ebbv/gps_tracking_for_those_with_alzheimers/,GPS tracking for those with Alzheimer's
"i learned recently our mom has been using our deceased dad's c-pap since hers stopped working. she's newly diagnosed with dementia and she's in rehab after a nasty fall that has grossly caused her symptoms to escalate. she'll move into a memory care unit as soon as we get her approved for medicaid. we're selling the house, obviously. how can i get her a new c-pap while we wait? she's clearly impaired from the fall, but i also know she's not sleeping well. the social workers seem to think it'll happen down the road, but mom is miserable. i'm hoping one of you can offer advice. thank you! "," maybe ask the prescribing doctor for options or if they know of any assistance programs?  i don't know anything about cpaps, but maybe there is a way your dad's can be adjusted to work for your mom?",https://www.reddit.com/r/Alzheimers/comments/67bedq/getting_my_mom_on_medicaid/,Getting my Mom on Medicaid
[removed],,https://www.reddit.com/r/Alzheimers/comments/675zf5/the_big_a/,The Big A
[deleted], good grief. if that's the worst you have to deal with so far then count your blessings. you're at the easy stages right now so you need to get support for yourself so you're better prepared for what's coming.,https://www.reddit.com/r/Alzheimers/comments/66tmsd/having_a_selfish_vent_mother_forgotten_my_birthday/,Having a selfish vent - mother forgotten my birthday...
