submission,comment,url,title
"dad is 64, early onset dementia. he's afraid to be alone now. he's over at my house a couple of times a week until my mom is done with work. he can't stop crying. he sounds depressed. he's fixated on his health. he doesn't like to be alone.  i could go on. so he comes over to my house to not be alone while my mom works, but he doesn't want to be a burden. i have a 4 and 7 year old. i'm just not sure how to handle this. i'm trying to be supportive and empathetic. he's so sad he won't remember us. he also monopolizes my time, and my kids need me too. he's too cognizant to give a menial job too. he doesn't really have hobbies. he's always just worked and watched tv. any suggestions will help."," are there any day centres he could go to?my mil goes to one twice a week. she gets collected and returned home, has contact with people of her own age, has lunch. she loves it and wants to move in. ",https://www.reddit.com/r/Alzheimers/comments/5y9cdo/looking_after_dad_some_this_week_he_got_diagnosis/,Looking after Dad some this week. He got diagnosis 2 weeks ago and can't stop crying.
"my father is 75 and my mother is 73. my mother has mid to late stage alzheimers. she is in remission stage 4 breast cancer in 2012. unrelated to her cancer care she has a very serious fear of hospitals and doctors and will not get a checkup. they live together and my father is the sole caregiver. the problem is my father had a mild stroke in september last year and was in the hospital for five days. it turns out he is doing well now with mild post stroke symptoms. he has since returned to work four hours a day monday thru friday. anyway, my fathers stroke was a wake up call for my family to have to rush to pick up the pieces at thier home. my father is private person and refuses to accept any help regardless of situation. my father was not able to refuse our help. me and my brother and sister spent two weeks at thier home cleaning, fixing, installing new dishwasher, refrigerator.my mother does not recognise my father as her husband, doesnt recognise her home of 30 years. she does not stay in the same room and has declared her room off limits we found my mother is not well taken care of. he leaves her alone in the house for 4-5 hours every weekday. she is prepared food ,whatever​ my father makes. he washes some of her clothes and cleans around the kitchen if he can. back in september 2016 we all found out my mother had not  been showered or bathed in many weeks or if at all. her room was not cleaned, sheets not changed regularly and she had a pile of garbage next to her bed. she had rodents. she is not heathy, likely diabetic, likey high blood pressure, signs of asthma or allergy to dust/mold. she has swollen painful legs and feet, fungus on bottom of her feet. my father was pressured by family to find a doctor and get an appointment for my mother. he had her assessed by a visiting nurse in november but did not follow thru with a doctor.  my mother gets verbally and physically violent when she is told she is to see a doctor. he did get his estate in order, create power of attorney of my mother, hipa, wills and a irrevocable trust.my father had agreed to hire a cleaning service to visit but never arranged. he said he doesnt trust people coming in the house. he said he would hire an aid for mom but didnt arrange that either.my mother should be in 24-7 care. my brother, sister and i are wondering what to do. what can we do?", not sure if this is state specific but adult protective services or elder services can be called. i know it doesn't seem fair to your father but its necessary at this point. your father cannot take care of her and she should be on medication to help with the violent outbursts. any facility she goes to will put her on something to help stabilize moods. it must be very hard for him and some emotional therapy may help although it doesn't sound like he would be receptive. this sucks and i hate this disease. so sorry you and your family have to go through this. good luck. ,https://www.reddit.com/r/Alzheimers/comments/5xeulv/75_year_old_husband_is_sole_caregiver_for_73_year/,75 year old Husband is Sole caregiver for 73 year old wife
"hi allmy mum, who has had alzheimers a few years now, has started becoming really critical of me and the things i do. i know she doesn't mean it and its not her but sometimes i struggle and today is one of those days. ive just spent the last hour being criticised for my lifestyle etc etc etc and i'm struggling with reminding myself that its her alzheimers talking and she doesn't mean it and i shouldn't take it personally - and then of course i start feeling guilty as well. ugh.... as many of you probably know there arent many people that understand. i'm thankful for a reddit thread like this where i can sit down and type out my frustration. today is just one of those days...thanks all..."," i find my father criticizing me and i just take it as an assertion that he thinks he can make judgements and maintain some self esteem that way. the alternative would be that he accepts the situation and that isn't going to happen.  it stinks because a parent has unique abilities to push your buttons, but i find it helps to look at the complaints more analytically.  its like this: he doesn't like dinner because some pieces of chicken were a little too large and one dropped off his fork - and supposedly i ""should know"" he doesn't care for that food, but it is more a way to mask that he's having trouble with eating utensils. other things relate to how he is no longer the boss - he does not like it when i'm on a conference call and speaking authoritatively because i'm ""just a dumb girl"" and it's hard for him to accept he is not in charge.  i'll show him respect, but i will indicate when i think he's crossing a line or being uncharitable, though, because i need to show there are limits to the way i am treated (even if they are forgotten in 15 mins.) and as a way to show myself respect also. ",https://www.reddit.com/r/Alzheimers/comments/5xehg0/having_a_low_day_and_feeling_selfish_for_it/,Having a low day... and feeling selfish for it.
"# **what is this?**i've found that when my wife (who has early-onset alzheimers) wakes up to music, and we can dance together, she generally has a much better day -- a more optimistic outlook, with more energy and abilities. it's somewhat ironic that throughout my life i have *hated* dancing, but it took our current predicament to change that for me.i'd encourage all primary caregivers to try this. it's not an intellectual exercise. it's not a *pain in the ass* (her words) behavioural exercise. it's just fun and invigorating. and it anecdotally seems to work for us. that's right, **us**. it helps me too.[previous wake up and dance post i]([wake up and dance post ii](------# **week 3.4**• **thursday:** [sister sledge -- we are family](teenage me is cringing, but i'm warming up to disco. waking up my wife to this, making silly john travolta type dance moves makes us laugh and start the day just right.• **wednesday:** [bee gees -- to love somebody](my wife's behavioural therapist gave her an assignment this past week to listen to this song while reading/singing along with the printed-out lyrics. i think it was a great idea! the bee gees are my wife's favourite band, and she has otherwise stopped reading anything. so this combines something she loves with something she struggles with. lovely.• **tuesday:** [the police -- message in a bottle](another blast from the past, with a vague subtext relevant to our plight. but it has a great beat!• **monday:** [eric clapton -- cocaine](we just love songs that lay out such great grooves to start.• **sunday:** [sir mix-a-lot -- i like big butts](what?? something naughty for a sunday morning? why not! my wife always cracks up to this song, and likes to sing along. i'll surprise her with this song this morning, and i'm certain she will wake up with a smile. yesterday she was very needy and vaguely unhappy, so i hope this will pick her up at the start of the day.• **saturday:** [the beatles -- yellow submarine](some days it just seems right to play a silly singable song!• **friday:** [scott joplin -- magnetic rag](this is one of those pieces that deserve to be on the voyager mission which define the best of what western culture has to offer. joplin does *so much* with *so little*. the emotional trip he takes us through in such a short amount of time, with the minimum of complexity but with a maximum of graciousness and elegance never ceases to amaze me.my wife and i can dance 'ironically' to this piece, making pretend we're old-timey folks. but sometimes i have to stand stock-still and just listen. pure joyous melancholy beauty.# **week 3.3**• **thursday:** [deep purple -- smoke on the water](sometimes what you need is head-banging rock. my wife's eyes lit up and she just laughed when i blasty-blasted this!• **wednesday:** [chicago -- if you leave me now](i swear i wanted to start the day with enthusiastic optimism, but then i encountered this song. it's a love song, but filled with regret and melancholia. so today my wife and i will have a slow romantic dance to start the day. she might not interpret the lyrics as i do, but that's ok too. alzheimers is a hell of a thing.• **tuesday:** [right said fred -- i'm too sexy](way back in the day, my brother who was a dj played this song to me. i must admit it both amused and bewildered me. nowadays, i love the injection of non-sequiturs into our life. as a guy in his 50's who never really lost his teenage awkwardness, dancing with my wife to this song is beyond ridiculous -- but a heckova way to start the day!even though sex has mostly been out of the picture for a while now, my wife still appreciates feeling beautiful and sexy, and appreciates seeing that i appreciate her. she can still do a lovely sexy dance when motivated!• **monday:** [creedence clearwater revival -- suzie q](man, this band can lay out a groove, can't they? i also like easy-to-sing lyrics that my wife and i can groove together and sing to each other with. beginning the week affirming to each other ""i love you"" is so nice, too.• **sunday:** [chuck berry -- johnny b. goode](so sad to hear chuck berry is gone! let's all wake up and dance to celebrate his incredible contribution to our musical culture!• **saturday:** [sidney bechet -- blue horizon](what a great way to start the weekend. a slinky sinuous dance to begin the day. to me, this is the best expression of a glamorous 12-bar blues. perfection.• **friday:** [smash mouth -- all star](this song was playing all the time when my wife and i were dating. it brings back happy memories!# **week 3.2**• **thursday:** [jean-marie leclair -- overture in d, op 13 and other chamber music](woo hoo it's my birthday, and that of course means that i will play music that i love and my wife loves to hate! she'll stand at my shoulder professing to hate it, all the while smiling at me, while still listening with me as i rock out to the music, not embarrassed in the slightest as i wave my hands in the air to the music.back in the '80s when i was a music student, musica antiqua köln were like the punk rock fringe of the early music movement. my violin teacher certainly disliked them. but their performances were so fricking *muscular*, and beyond that, every piece they play sounds like they are telling a story -- with a beginning, a middle and an end.anyway, i apologise for the lecture, but this is one of my all-time favourite recordings of one of my favourite composers.• **wednesday:** [the beach boys -- kokomo](turns out this is ""our song"". i remember when we were dating, we blasted this in the car, and yelled out of the windows ""i love [him/her]!"" when we play this song, her eyes just light up. she remembers that too.• **tuesday:** [the jackson 5 -- abc](nothing like a song with a great beat and simple lyrics in the chorus! the wife's a huge michael jackson fan, and this song brings a smile to her face, and she cannot help but move to it.• **monday:** [louis armstrong -- what a wonderful world](my wife and i love this song. the optimism brings joy to us both. i always get tears in my eyes when we're singing it to each other when we get to the words ""i love you"".• **sunday:** [blue oyster cult -- don't fear the reaper](classic song that we both enjoy. also, we can't help but laugh together, remembering [this]( sketch from snl -- ""more cowbell!"" -- this is my wife's favourite sketch. she even has a t-shirt with ""more cowbell"".every time i help my wife put on her clothes, we say together ""one leg at a time"".• **saturday:** [cheap trick -- i want you to want me](something more upbeat for a saturday! (well don't pay much attention to the lyrics).• **friday:** [shania twain -- still the one](it's always so nice to reminded that we love each other, and why we stand together. a nice close dance. damn those tears -- it's sad because it's true!# **week 3.1**• **thursday:** [the cars -- just what i needed](continuing the boston theme for now… we love the nostalgia, but in fact the lyrics turn out to have a significance to me as a care-giver. isn't it weird that youthful love songs tend to do that?• **wednesday:** [boston -- more than a feeling](love this good ol' guitar rock/anthem rock. as a native bostonian, i can't help but feel pride, and my wife, as an adopted bostonian, loves it for the same reason. definitely makes us nostalgic for that great town.• **tuesday:** [michael jackson -- billie jean](my wife has always been a huge michael jackson fan. i love having a strong beat to start the day up.• **monday:** [gloria gaynor -- i will survive](my wife was such a disco girl back in the day. i was more of a classical nerd with a side helping of punk. nevertheless! she still loves the disco, and i love to see her so enthusiastic.• **sunday:** [david bowie -- space oddity](sometimes i like to play songs that are stories, to see if my wife can still follow along. no dancing this morning, we watch and sing this story together.• **saturday** [gene kelly -- singing in the rain](do you remember when you realised you were in love? perhaps you are still in love? here's a reminder.• **friday:** [the beatles -- twist and shout](ferris bueller's day off version of this. how can you not move to such a song?ok, so [here]( is the beatles performing it on the ed sullivan show.",,https://www.reddit.com/r/Alzheimers/comments/5x9rxw/wake_up_dance_iii/,Wake Up & Dance III
"sometimes it's good to vent and let off steam, which is really all i'm doing in this post. i can't scream out loud, it'd wake the neighbours.please feel free to add your own gripes - get those complaints off your chest.when my mil moved to be nearer us it was because the relationship with one of her children (the one she was living near) had broken down. she moved into 'independent living' accommodation, same as she was in before, but in retrospect it was all a terrible mistake.the 'child' she was living near may have had some inkling of her problems but they didn't share anything because, well, the siblings don't share much at all thanks to their toxic 'play them off against each other' upbringing. all we had from her were complaints about being neglected and, in the end, that she couldn't do any shopping (so had no food), hated the people she was living amongst (they're rude and mean, bang on her door when they know she would be in the bathroom) and she desperately wanted to move.when we visited her (which was often, despite the distance) she seemed okay but a bit frail - understandable due to her age - we had no real idea that she was such a good liar. it seems so callous to say this about an old lady (old ladies are meant to be sweet and to smell of roses) but she is, and always has been, manipulative and has always, up until now, been able to get exactly what she wants.i wish to goodness we had known the truth and/or that the 'child' she was living near had spoken to us a bit more, because within days of helping her move we realised that something was very wrong and, when she was taken to register with gp and he gave her a mini- mental-state assessment, it became clear that she had serious memory problems. we tried to tell ourselves it wasn't true, but those scales fell from our eyes very quickly.the first year we just about coped, in between work commitments etc, then there was a crisis that meant she had to have company almost all day, every day, for months and months whilst the 'authorities' got their act together. it was utterly exhausting, and we had not a single shoulder to cry on thanks to the way she has always played her children and other relatives off against each other.she was seen quite quickly by one group who made recommendations and gave her things to use, but it took almost half a year before we got a social worker to see her and before we could get the adult mental health team involved. during that time she got to 'feel better' because her diet dramatically improved - because we were taking her plated meals etc. every day. because of this she rejected all the assistance aids that the first group had given her, and made us get rid of them.almost overnight she let us know, vociferously, that she didn't trust us, that there were people in the complex who were rude to her so she refused to even attempt to socialise - even though, for example, she had paid for the christmas entertainment. in short she was back in exactly the situation she had moved from except now she was in our care rather than somebody else's - and my goodness, weren't the others delighted. they were so delighted that it took them two years to bother to visit her, and then they only managed to stay for three hours.we've reached the stage where she will no longer accept any support from us, in fact she doesn't even want to see us - although she isn't shy of making toxic phone calls at random times during the day; calls that are so toxic they make my other-half cry.she tells other members of the family how unpleasant we are to her - thank goodness they don't believe her because they are now aware of her condition, but it is hard to take.she has meals delivered daily; there are visiting carers to make sure she takes her medication and who should help with personal care but she rejects it. recent assessment, during which she was compus mentis enough to tell lies, has resulted in her being put at the bottom of the list for moving to a place with on-site support. she told the assessor she bathes daily, does her own laundry, is content, never bored, never lonely, sleeps fine etc etc - and that's what got written down - with the result that it's been concluded that she is 'safe' where she is and doesn't need additional care.you'd think, wouldn't you, that these so-called experts would be able to see through the charade and chip away at the scripted conversation. you'd think that they would stay long enough to hear the repetition, the raised voice and clenched fists and swinging arms when things don't go as planned and they might even check things like a new bathroom to see that some facilities still have their protective film, so have never been used - even though she says otherwise. but no, they walk in and write a few things down on a bit of paper and walk out again. paper goes into a file and will only ever get looked at if they have to see this 'client' again.so here we have an old lady who has alzheimer's who is now telling everybody she is moving to a nice new place, yet she's scuppered her chances because she can still tell lies, and we're even more evil than before because it's us who must have said something to 'the man' who came to talk about moving - because she was sure she would be in the new place by now yet she isn't.it does make me want to scream!", this was my grandmother. it's so hard. thank you for sharing. ,https://www.reddit.com/r/Alzheimers/comments/5x7wu2/letting_off_steam_thread/,"""Letting off Steam"" thread ..."
"my mother-in-law was diagnosed with alzheimer's in jan 2013.  it's fairly early onset as she was 66 at the time. my father-in-law was her primary caretaker until he died very unexpectedly in may of 2015, about a week after my husband and i learned we were expecting our first child.  i knew when we got the call that it meant it was going to be tough for us--taking on the care of his mom along with his three siblings--but i definitely didn't forsee just how hard it would be.  we are not even the primary caretakers (his sister lives with her), but we are the next closest geographically, and have dinner at least once a week, along with anything else that comes up (and it seems like something always comes up).  just this morning, the caretaker was having car trouble, so that means my husband is missing work in the morning until a backup caretaker can be arranged.  having a 14-month-old is hard, but made so much harder by all the stress revolving around taking care of mom.  i know i'm not alone, and everyone's lives have been impacted by this disease, but i feel so defeated right now.i suppose this fits into the category of bitch session...just looking to vent and hear from others who are fighting this awful disease."," and my sleep is just all screwed up! it's either getting up & down with her, or my mind is refusing to turn off. this is going to sound crazy, but i have a sporadically squeaky ceiling fan. if i'm wide awake, it is quiet as can be. the moment i start to drift off, it's ""squeak squeak squeak"". i've tried about everything with that issue. these are my three consistent night problems- just seems what can go wrong, will !",https://www.reddit.com/r/Alzheimers/comments/5wz0b5/so_tired/,So tired...
[removed],,https://www.reddit.com/r/Alzheimers/comments/5wp47n/neuroimaging_helps_distinguish_depression_from/,Neuroimaging Helps Distinguish Depression From Dementia
"my mother was diagnosed with mild cognitive impairment due to alzheimer's about 4 months ago. that was after going through the medical chain of command and testing for about 6 months before the dx. she is 72 and is not in the greatest of health. the thing that throws everyone off is that she looks so young. anyhow, she is semi-functional. she can still care for herself daily to a point. she barely cleans and has to be reminded to bathe but she can taxi to run errands without getting lost. she has forgotten to pay bills, and has a nasty attitude often which was not her normal personality. it started when the symptoms first started. anyhow, this is the second month in a row that her bank account has been overdrawn. she sells things on ebay and etsy and now she is being super irresponsible in shipping them. i can't do it for her because of my work/transportation situation. i caught her washing her dishes with her hand yesterday instead of a sponge, etc.she is in denial and won't let anyone take over for her.  she even lied to me about the alzheimer's at first because i couldn't go to the first neurologist appt with her. i figured it out because he put her on aricept and then i asked him at her second appt. her insurance won't pay for any care until her alzheimer's is worse and she goes to the doctor and tells them she's fine. she makes appts and goes to them without me and then tells me afterwords.anyhow, please comment if you have experience with a person who was in denial and was still semi functional and fighting it. i'm so frustrated."," my mom has also had personality changes, is still mostly functional and in some cases in denial. i'm actually not really sure if she's in denial or not, but she does forget a lot of things that we'll decide. i unfortunately have no advice on the accounts. i've heard that you really have to monitor, and i'm not sure what can be done to prevent it from getting too bad. i agree with /u/sotomoto that the doctor will get paid no matter what and should be on your side.",https://www.reddit.com/r/Alzheimers/comments/5whzti/mom_is_in_beginning_stages_but_is_still_aware/,Mom is in beginning stages but is still aware enough to think she's OK and is fighting me on everything.. advice?
