submission,comment,url,title
"a friend of mine's father is fairly late stage alzheimers. he has recently entered hospice care. i would like to get her something for father's day, a little something for support.i am not very good with gift ideas, i could use some ideas. if there is something that would maybe be good for someone with late stage alzheimers, and maybe i could get her a card or write a note?"," any gift will make her feel cared for.  i would suggest something that would make her leave home for a short time.  i have a feeling she needs a break, but takes few.  perhaps a gift certificate for a movie, salon, restaurant that she likes?  if you want to include something for the father, fuzzy non constricting socks can be a great gift.  making sure his feet are warm will give her a feeling of accomplishment when surrounded by so much that she can not change.",https://www.reddit.com/r/Alzheimers/comments/6h0srp/gifts_for_alzheimers_caregiver_daughter/,Gifts for Alzheimers caregiver / daughter
"mom (over the top the best one ever - three masters degrees while raising 3 kids under the age of 7 and putting husband through law school- was awesome through all crazy ness - somehow...she was so great...) - was diagnosed with dementia years ago -and alzheimers a year ago.  it doesn't usually happen, because the onset is so slow, but tonight - i really miss her.  she was a mom that was fantastic (not the cool mom,but a great mom) through teenage years.  she was smart. when i talk with with my sisters about her -  who are also working with kids -we can't figure out how she did what she did. woke up at 3am to feed horses. wake us up at 5a to get to school (and her to work). all back home / ride/ feed/ muck / homework - and she as a teacher - had homework too...she probably slept 4 hours a night.  i miss her insight. i miss my friend. i miss my mom.  she is happy - i know this deep in my soul ... she is so joyful still...and this makes it somehow easier i think...but tonight...tonight i'm sad. i miss sharing life my life with her. tonight i'm sad."," i know how you feel.. i cried so much when i realized i was losing my best friend. but then i realize the new person she became with someone that was wonderful in a different way and i loved her also. it made it easier for me to think of it that way.  sorta like the opposite of watching your children grow.  you love your 5 year old as much as when he was 2, but he is very different. she is probably now on the her fifth different personality, and i love this one too. i was also caregiver of her youngest brother who passed from alzheimer's first. at end , though he didn't know who she was, her company was a great source of comfort for them both . i hope at the end she will appreciate my holding her hand also.",https://www.reddit.com/r/Alzheimers/comments/6gwdat/its_a_hard_night/,It's a hard night
saw this and thought you guys might like this video of a flash mob at the indianapolis airport last week to support alzheimers awareness. it's pinned on this facebook page: cheers!,,https://www.reddit.com/r/Alzheimers/comments/6gty9f/alzheimers_awareness_flash_mob/,Alzheimer's Awareness Flash Mob
"it's been a tough 48 hours. my mum is struggling to make sense of the situation, although is more often understanding it's her husband of 64 years who has died. she still wants to tell his mother and aunt, both of whom died 20 or more years ago, and her own mother who died 40 years ago.  it's hard to see her feeling so lost. we're being super patient, and helping her cope, but it's so tough to have to keep reminding her that we're it now. i also have to move her into a home now, as dad was her carer. so much change in so little time. we lost him suddenly, with little warning. as mum keeps saying, you never what is going to happen next."," i'm so sorry for your loss. what stage of the disease is your mother at? i feel like past a certain point, like 6 (moderate to severe) or later, it's better not to remind the patient about the death of a loved one, because remember, they can't retain any information, and will get upset every time.as for you, please stay strong and take good care of yourself. take a vacation if you need. i gather that you're in the uk, so try counseling or give a call to  for support, they're a godsend. ",https://www.reddit.com/r/Alzheimers/comments/6gqqa6/father_85_passed_away_saturday_mum_86_is/,"Father (85) passed away Saturday, mum (86) is struggling to make sense of it all. It's sad."
"# **what is this?**i've found that when my wife (who has early-onset alzheimers) wakes up to music, and we can dance together, she generally has a much better day -- a more optimistic outlook, with more energy and abilities. it's somewhat ironic that throughout my life i have *hated* dancing, but it took our current predicament to change that for me.i'd encourage all primary caregivers to try this. it's not an intellectual exercise. it's not a *pain in the ass* (her words) behavioural exercise. it's just fun and invigorating. and it anecdotally seems to work for us. that's right, **us**. it helps me too.lately it's been difficult to wake up with optimism. you all know what i mean. but i need to man up and show my wife a smile and a silly (or otherwise) dance to get her up and about in the morning.[previous wake up and dance post i]([wake up and dance post ii]([wake up and dance post iii]([wake up and dance post iv](------• **wednesday**: [the beatles -- please please me](during last week's sargent pepper's celebration, we both loved the artsy nostalgia trip. but but singing together the more ""pop"" beatles tunes cleanses the soul too!• **tuesday**: [kool &amp; the gang -- celebration](we're in the realm of reruns. for my wife, she thrives on repetition. the comfort of the known. i love how she still lifts up her arms yelling ""yahoo!"""," thank you for sharing these very intimate moments with us.  i felt like i was reading a beautiful novel.  you should consider turning your unique journey in to a book.  it could be very therapeutic for you, and a wonderful read for people living similar circumstances.",https://www.reddit.com/r/Alzheimers/comments/6fpcd2/wake_up_and_dance_v/,Wake Up And Dance V
," is she in late stages & does she scream a lot? if so, how do you manage it/cope? and have you tried medical marijuana for her?",https://www.reddit.com/r/Alzheimers/comments/6fo0ad/my_partner_and_i_take_care_of_his_78_yr_old/,My partner and I take care of his 78 yr old mother who has had Alzheimer's for 13 years. Feel free to ask me anything.
[removed],,https://www.reddit.com/r/Alzheimers/comments/6ew41u/false_memories_insanity_bursts_recurring_episodes/,"False memories, ""insanity"" bursts, recurring episodes.."
[removed],,https://www.reddit.com/r/Alzheimers/comments/6etwg1/alzheimers_technology_not_the_best_mix/,Alzheimers + Technology = Not The Best Mix
"hey there! so as i was watching a new lecture on alzheimers this morning, i decided to look what kind of comments and reaction there was on dr bredeson's research. i was amazed to find not one mention of dale bredeson anywhere on reddit, since my family has been following his research (hopefully) for quite a while now. i realize it is cutting edge stuff, and probably not near as popular as the idea of some 'magic drug' that can fix anything. is this because the community is not aware, or because his research is being rejected?anyways, thought i'd go ahead and link a couple of articles, journals and presentations along with his basic tenants of treatment.if there's one video you should watch to get a good overview, it's this: [video](some of his beliefs:1) beta-amaloid plaques/ tangles are not the cause of alzheimer's but are simply a symptom and possibly the body's defense against alzheimer's. using drugs to treat plaques are like giving someone tylenol to treat a fever coming from a leg infection. it won't help, it's not the root cause.2) alzheimer's is caused by multiple factors. hundreds of years ago when people died, their cause of death was that they had 'the fever'. now a days, we would of course ask, ""well okay they had a fever, but what caused the fever? was it the flu, chicken pox ect."" he argues that alzheimer's is the same way, and in the future they will ask, ""sure they have alzheimer's, but what caused alzheimers?"" 3) diet/lifestyle changes are currently the only ways to influence all/most of the factors that cause alzheimer's. image a roof that has 40 leaks in it. currently, just taking a drug will patch one or two of the holes, but the rest of the holes are left open. 3a) a summary of the bredeson protocol: ·       eliminate all simple carbohydrates·       eliminate gluten &amp; processed foods·       increase vegetables, fruits, and non-farmed fish·       reduce stress with yoga &amp; meditation·       increase sleep from 4-5 hours per night to 7-8 hours per night·       taking methylcobalamin (methyl b12), vitamin d, coq10, and fish oil each day·       optimize oral hygiene using an electric flosser &amp; electric toothbrush·       fasting for minimum of 12 hours between dinner and breakfast·       exercising for a minimum of 30 minutes, 4-6 days per week.3b) more details - the first 25 interventions used in the bredesen protocol to reverse mild alzheimer's1. optimize diet2. enhance autophagy, ketogenesis3. reduce stress4. optimize sleep5. exercise6. brain stimulation7. homocysteine less than 6 (earlier version of the protocol was &lt; 7)8. serum b12 greater than 5009. crp less than 1.0; a/g greater than 1.8 (earlier version of the protocol was &gt; 1.5)10. fasting insulin less than 5; hgba1c less than 5.6 (earlier version of the protocol was fasting insulin &lt;7; hgba1c &lt;5.5)11. hormone balance12. gi health13. reduction of aß14. cognitive enhancement15. 25oh-d3 = 50-80ng/ml (earlier version of the protocol was 50-100)16. increase ngf17. provide synaptic structural components18. optimize antioxidants19. optimize zn:fcu ratio20. ensure nocturnal oxygenation21. optimize mitochondrial function22. increase focus23. increase sirt1 function24. exclude heavy metal toxicity25. mct effects26. inhalational alzheimer's[memory reversal](anyways, you can see that the bredeson protocol is not easy. it's not a simple drug that you can take every morning and you're magically cured. thoughts on this? does anyone else follow his research and have any insights?"," hi all,my mother was diagnosed with early onset about a year ago. after the initial shock and tears we start looking what really could be done. we tried to enroll to couple of trials but some of them were not available where we live and some others  just didn't work out.we have read dr. bredeson's research with a lot of reservation. if you read from his published paper, you can see it really seems over optimistic given the whole statement is made based on a study with 10 people and no control group. we discussed with my mothers doctor and decided to adopt some of the recommendations from dr. bredenson and keep her regular medication. i don't wanna say my mother is cured or anything but we did notice (at least noticeable to us) that some improvement has occurred.my advise for anybody who find the research interesting is to talk to the persons doctor and sees what make sense to apply. don't expect magic but for sure there are some good points in this research.",https://www.reddit.com/r/Alzheimers/comments/6efknc/dr_bredesons_research_the_first_reversal_of/,Dr. Bredeson's Research- The First Reversal of Alzheimer's
[deleted]," my mother-in-law, who passed a few months ago, was aware of the changes in her brain before anyone else. she wrote several pieces describing what it was like. she described it as being in a room as the light slowly dim and shapes become harder and harder to make out. she was very aware of the process and she prepared herself for it but i don't think it slowed it down any.",https://www.reddit.com/r/Alzheimers/comments/6e5k8u/is_it_possible_for_someone_to_be_selfaware_of_the/,Is it possible for someone to be self-aware of the Alzheimer's and attempt to remember?
"pee on the bed, in the trash can, on the floor, but really that is nothing.  what i'm really tired of is the smell of poop and the days i have to spend a couple of extra hours cleaning poop off my dad, the bed, the chair, the floor, the walls, his clothes.  unless i'm careful to use the garden hose to spray all the poop off his clothes, sheets etc, our washing machine smells like and has bits of poop in it also.  luckily today is a holiday so no work but this is two days in a row now. 😞i had been trying to get dad to live with us for years.  he liked the freedom of living on his own even though he knew his mind wasn't working the same.  he finally agreed and moved in with us 4 years ago.  last week i was told he was 7c on the fast scale and he qualifies for hospice.  he has not been able to understand anything or speak a single intelligible word for some time now.it is such a relief to get some help as i work full time (from home) also.  but today is a holiday and i just wanted to vent a little before taking care of his breakfast now. 😞"," my husband never reached the point where his dementia caused loss of bladder or sphincter control. but at one point in his downhill slide he contracted clostridium difficile (""c. diff""), a potentially deadly bacterial infection of the colon which in his case caused profound diarrhea over many days. he spent five days in the hospital, with the staff all wearing disposable gowns, masks, gloves, and eye protection. back at home, it was 20 depends a day and constant cleaning of all surfaces with bleach.i was grateful that he could not remember any of it. on his last day in the hospital, while sitting up awaiting discharge, he looked at me and produced the most beautiful smile. i snapped his picture. later, when i showed it to him, he said, ""looks like i had a good time.""i guess what i'm saying is that — and i know this is anathema to many in the caregiver community — his forgetfulness was a blessing. i'm happy that, ultimately, it was i and not he who suffered through it.",https://www.reddit.com/r/Alzheimers/comments/6e0s4u/im_tired_of_the_smell_of_pee/,I'm tired of the smell of pee...
"we had a conversation a few weeks ago, and we spoke again today, but she doesn't seem to remember what we talked about and is asking the same questions. she's in her 60s, so i guess it's not uncommon, but it's very scary. from what i've read online, it sounds like stage 3, when friends and family start noticing memory problems. i'm sure my dad has noticed, and just hasn't said anything about it. i also noticed a few little things when my parents came to visit a few months ago.what can doctors do about it, in 2017? are there any new treatments we can try? is it possible to fly to the us and sign up for some kind of drug trial, or somehow get early access to a new drug? i keep hearing that the cure is right around the corner, so i don't want my mom to miss out by only a couple of years. i haven't told my parents any of this yet, but i might call my dad tomorrow."," i don't have any real answers for you regarding medications etc, but i wish you all the best for the journey ahead. whatever is going on for your mum could be so many things - hopefully it is something 'simple' related to that stage of life rather than alzheimer's disease.we started noticing signs in my mum when she was around 61/62 & we got the diagnosis at 66. if you can, talk to your dad about it. my dad was relieved when we finally brought up our concerns with him - he thought he was the only one who noticed. it would be beneficial if your dad can go to the doctor with your mum to discuss the concerns. my mum wouldn't let my dad go with her & so it took a lot longer for us to finally work out what was going on as she kept saying that the doctor said she was fine (although we knew otherwise & she just wasn't bringing it up with the doctor at all).a horrible sundowning episode led to her being taken to hospital (we were worried she was having a stroke) & we finally got the diagnosis.she now takes aricept & she was on another medication to minimise the sundowning symptoms, however that has been dropped back due to side effects.my parents haven't been interested in looking for trials etc.  however, every now and then info about upcoming ones comes through alzheimer's support groups on fb etc.if it does turn out that your mum is diagnosed, and if you're interested in learning more about it, university of tasmania runs free massive open online courses on dementia - you can enrol from anywhere in the world. the one i'm doing finishes up in a couple of weeks, but enrolments are currently open for the 'understanding dementia' one that starts in july. i've found it to be a valuable source of information & extremely beneficial for my understanding of the disease.again, i wish you and your family well for whatever lies ahead - look after yourself so you can look after your mum and support your dad if/when you need to 😊[understanding dementia - university of tasmania mooc]( ",https://www.reddit.com/r/Alzheimers/comments/6dgex7/i_think_my_mom_might_be_showing_signs_of/,I think my Mom might be showing signs of Alzheimer's
[removed],,https://www.reddit.com/r/Alzheimers/comments/6debbl/in_need_of_advice/,In need of advice.
"i'll try to keep it short.   tl;dr i am curious to know if alzheimer's is at fault in anyway for what appears to be our grandma feigning serious illness for three weeks in an attempt to guilt and coerce her daughter into staying home and caring for her - forcing daughter to miss a major trip/vacation. could she have been ill and alzheimer's made her appear lucid/healthy. or do you think it was a guilt/manipulation?grandmother recently fainted and fell. it wasn't major. doctor sent her home with simple instructions that she only needed two days to recover. however for the three weeks since, grandma won't eat, can't walk to the bathroom, needs help sitting on the toilet, help wiping, help washing and bathing, help into and out of bed, needs meals in bed, moans and groans from pain - ""i want to die, i want to die"" etc. three weeks...in this time, her daughter has been 100% on call. she herself is ill, and is being driven to exhaustion taking care of grandma. she wipes her butt, does the cleaning, lifting, everything. since january, this daughter has planned to take a trip to another family-member's house, which she did yesterday.   grandma is insistent throughout the three weeks that the daughter has to stay to care for her. she's complaining, begging, even offering to pay everyone who will be impacted by the trip cancellation the money they will lose ($5,000 usd) if her daughter doesn't take the trip. daughter says she can't stay and arranges professional care for grandma for the trip. --this is where i need help, please--the night daughter leaves, grandma freaks the f out. she starts shouting about being abandoned, crying, screaming, threatening to throw herself down the stairs again and again. she won't take medicine, won't calm down. curses the entire family (in this culture cursing is not foul language but actually putting a curse of sorts on people - you are wishing them personal harm. grandma is old school like that, it's the worst thing people her age can say to another person). she takes the medicine only when threatened with hospitalization.this continues for 3 hours. finally, they have to get the other adult daughter to come take her. when the other daughter arrives, grandma hops out of bed, carries her own belongings, and walks downstairs unassisted and into the waiting car. ... hours before this she was bed-ridden, needing help to wipe her own butt. on the way out, grandma is still cursing everyone and says to the son in law, ""sorry about earlier my mind was crazy."" she was still yelling about being abandoned, so we believe she was talking about being so ill for the last few weeks??is alzheimer's at play here? was she always healthier and able to move like this and just faking it? did the alzheimer's cause her to go into a fit that led to the aggression and the extra mobility/strength? knowing this grandma and the chain of events, everyone's conclusion is that she was trying to manipulate everyone since the accident to get the daughter to stay and would have probably suddenly made a speedy recovery when the daughter missed her trip. does it sound like alzheimer's is the culprit here?thank you, sorry for the long message."," > on the way out, grandma is still cursing everyone and says to the son in law, ""sorry about earlier my mind was crazy."" imo, a person with alzheimer's will pretty much never say this (maybe if they're super super early stage, but then they'd be able to wipe their own butt, etc.).  this is because they don't remember ""earlier.""",https://www.reddit.com/r/Alzheimers/comments/6dabnp/grandmother_with_alzheimers_health_rapidly/,"Grandmother with Alzheimer's health rapidly degenerated in recent weeks. When her primary care giver left on a vacation, Grandmother went into a rage/fit, suddenly seemed healthy again and then left the house altogether. Does this sound like Alzheimer's symptoms?"
"i moved back to live with my parents after my mom's condition worsen. right now it's just my mom my dad and me.  we have a wonderful dog that's been stolen a week ago in a burglary, i'm very active in trying to get her back. my mom is never alone. she's either in a program for relative young people with alzheimer, which is 2 times a week for 5 hours,  or with my dad or with me. today i spent all day with her and i'm so exhausted.  whenever we're alone we just end up watching t.v having random chats but i find myself completely fatigued. it's all those small interactions of explaining what we're doing,  figuring out what she's saying,  telling her we're home... for the past half year i wasn't able to go pass second gear.  i guess i'm half venting but i'm assuming a lot of you are going through through something similar and found done helpful mechanism to cope. i exercise often,  which i think keeps me from depression and also become much more connected with my extended family for support,  especially my aunt from my mom's side. so what works for you?", [deleted],https://www.reddit.com/r/Alzheimers/comments/6cvoig/my_mom_has_alzheimer_and_im_so_exhausted/,My mom has Alzheimer and I'm so exhausted
"i found this app that's great for finding music og conversation topics when connecting to people with dementia or alzheimers. to keep it short, type in the age of the person you're with and you can get conversation topics or music suggestions based on their birth year", cool! thank you! ,https://www.reddit.com/r/Alzheimers/comments/6cah98/psa_memorybox_app_for_anyone_working_with_or_have/,"PSA: Memory-box app, for anyone working with, or have family with Alzheimers"
