submission,comment,url,title
"my mother has ad (10 years or so) and my dad keeps getting frustrated when she doesn't do what he asks. he talks to her as if she is going to remember to put her clothes on when she can't even string a conversation together.most of what she says are snippets of sentences. she can say full sentences and they come out, but only if she is mumbling about the dangerous person in the mirrors or if she is not engaged in anything apparent.if you ask her something she starts to talk and the sentence ends with some type of noise halfway through, then a smile and a laugh.i feel like my dad thinks that he can let her be semi sufficient as long as he keeps an eye on her, however, he is constantly getting frustrated. he doesn't go to any ad support groups and says that the alzheimer's association doesn't have any help for them.i live out of state and only get to see a small portion of their lives. my brother still lives at home and helps out tremendously, but he is the same way. it's like they don't understand that she won't remember/make the connection to shut the door behind her or to stop telling at her reflection.not sure what to do.**edit:** i will be coming back today to respond. you guys are awesome."," when my dad would get frustrated about her forgetting things, or doing things he didn't like i suggested to him that his frustratiin was his problem, not hers.  that his frustration was because his expectatiins were unrealistic and that she wasnt going to get better, no matter how mad he got. so, it served no one. he did get it and has gotten better. ",https://www.reddit.com/r/Alzheimers/comments/66ti23/what_to_do_about_my_father_that_still_thinks_he/,What to do about my father that still thinks he can rationalize with my mother?
"specifically the e4 allele (an e4/e4 pair drastically increases your chances while an e2/e4 or e3/e4 pairing increases your chances by 2-3 times).[more reading](also, i derped on the title..yeah...", [deleted],https://www.reddit.com/r/Alzheimers/comments/66ozm8/fyi_if_you_use_23andme_there_just_started_doing/,Fyi: If you use 23andMe there just started doing testing for Alzheimer's linked genes
"shrink said morning. felt horrible, like had mono when starting in am. internist suggested pm until i became acclimated to it. i've seen online they seem to advise pm. when do you take it or your loved one?"," my mom is on namzaric, which is aricept + namenda in one pill.  i have her take everything (namzaric, cerefolin nac (a prescription supplement), statin, antidepessant, antihistamine, baby aspirin) in the evening, right after dinner.  doc said this was okay.",https://www.reddit.com/r/Alzheimers/comments/669rfp/aricept_do_you_take_in_am_or_pm/,ARICEPT do you take in am or pm?
"hi all,to keep it short and simple...my godmother (63) for about three years has been slowly showing symptoms of alzheimers/dementia. her mother died from it and it runs in her family. it started out small with forgetfulness, but then got bigger very recently (last 4 months) with forgetting passwords, how to use facebook, (she's a computer whiz), as well as getting lost while driving. she also could not recall conversations and from further talking with new people in our life, she had been asking some bizarre questions like: ""did you know my dog when he was a puppy?"" (when the person in question hadn't even been in the picture for a year and the dog was 13...)we were keeping a journal on her quietly with the recommendation of her doctor. he said we would know when it's time to break the news.anyway, my godfather and i woke up one morning and she was gone. she took our older dog and drove all the way ""home"" to pennsylvania (9 hour drive) to break up with him and start a new life. they had been together 20 years.there was absolutely no warning to this and she didn't even appear to be upset in the days prior, but she had been planning this for two weeks because we discovered some emails.unfortunately, she is trying to hit my godfather pretty hard with only giving him a very small compensation for the split, leaving him with a brand new puppy and 3 year old beach house. it seems that this is all very strange....we believe that her family has a big part in this...(we're not sure if they were putting this in her head to leave him or what) but it seems to be very $$ oriented.the odd thing is that she is still texting him goodnight and sharing pictures of our puppy on facebook as if nothing is wrong..though the legal notice says differently as if she was angry at him and left him like he was beating her.my question is; has anybody ever seen anything similar to this? a sudden divorce or personality change? would love to hear thoughts and experiences.thank you.", it sounds kind of like frontotemporal dementia. would also be good to have a ct or mri to check for brain tumor because she is young to get alz. ftd hits younger. ,https://www.reddit.com/r/Alzheimers/comments/6608u5/not_yet_diagnosed_alzheimers_godmotherunusual/,Not Yet Diagnosed Alzheimer's Godmother--Unusual Personality Change? Looking for input...
"59, cognitive problems for a long time. recently gone south. curious about the above. thanks"," yes, my mother had a battery of tests including an mri to determine if it was ad (it was) and then a battery more to be accepted into a trial. if it is determined to be ad, try to get into a trial asap. it could slow down the disease.good luck!",https://www.reddit.com/r/Alzheimers/comments/65k3qk/have_dementia_w_most_ad_symptoms_having_mri_and/,Have dementia w most AD symptoms. Having MRI and spinal tap to explore whether I have AD. Did your your loved ones have this?
[removed],,https://www.reddit.com/r/Alzheimers/comments/65g0q0/the_closetohome_reason_this_usc_brain_scientist/,The close-to-home reason this USC brain scientist is trying to figure out Alzheimer’s: USC's Arthur Toga saw the disease ravage his family
[removed],,https://www.reddit.com/r/Alzheimers/comments/65et9x/help_us_create_an_aid_for_dementia_with_a_quick/,Help us create an 'aid for dementia' with a quick survey!
"the director of the independent living where my folks are right now suggested that we get a second opinion on my mom.  (apparently dad told her he didn't think there was a problem with mom...  -_-  denial is a...)she had the mri and is in the 1 percentile of hippocampus volume for her age.  she isn't oriented to time (no clue what day, month, year it is, but she's okay with place and person for the most part, though pictures are hard).  she ""fails"" the clock test every time we go to the neurologist.  she's on namzaric.  her neurologist isn't the type to go ""she has alzheimer's"" (part of dad's denial, imo) - he mostly speaks around it when she's there, but had me call him to talk privately and confirm that i know something is up and asked about her progression to ensure it was consistent with alzheimer's instead of, say, ftd.i operate under - she has alzheimer's.  but i have thought before about whether i should get a second opinion.  did you for your loved one?  and if so - how does it work?  like - just bring the mri results to the new neurologist and see what they say?  do you say you're seeking a second opinion on the way in?  any tips appreciated."," we didn't get a second opinion for my mom, we just jumped into phase 3 trials. i feel comfortable, though devastated, with the diagnosis and i never thought about getting a second opinion. it's not a bad idea. do you think the diagnosis is accurate? i would call another neurologist and ask them what they need for a second opinion. the current neurologist won't be offended. second opinions are routine.  and you may find another approach works better for your family. bear in mind these appointments can be stressful on the patient.it's not uncommon for loved ones to be in denial. my mom is a twin and her sister is similarly in denial. just remember that it's likely fear, rather than ignorance, that feeds the denial.good luck to you and your family.",https://www.reddit.com/r/Alzheimers/comments/656vkh/did_you_get_a_second_opinion/,Did you get a second opinion?
[removed],,https://www.reddit.com/r/Alzheimers/comments/64u3nl/would_you_want_to_know_if_you_were_going_to/,Would you want to know if you were going to develop #Alzheimers or any other form of #Dementia??
"a friend of mine's brother died and i emailed my parents about it. she's responded pretty much the same way each time.her short term memory is really bad.  anytime she sleeps she forgets what has happened that day for the most part.  i don't know how to address that she's already responded to this, but i don't want her reliving the bad news over and over again.  what do i do?", make an appointment with a neurologist and get her checked for a memory issue :),https://www.reddit.com/r/Alzheimers/comments/64mb3a/i_sent_my_mother_an_email_yesterday_morning_shes/,I sent my mother an email yesterday morning. She's responded three times so far.
"my dad has been the primary caregiver for my mom (58) for a couple years now. last week there was an incident at home where my mom got violent and my dad had to call the police. took three cops to restrain her and they ended up going to the local hospital. it's been about 8 days in the hospital and the restraints have been off for a few, but she still gets very agitated at times with hitting and spitting when we try to get her to eat, go to the bathroom, take meds, etc. the docs and nurses have been advocating on her behalf to go into a skilled nursing facility, but we found out that insurance has now denied coverage to stay at the hospital any longer, and they also denied the skilled nursing facility. it seems like all the care facilities we have talked to will not take patients that exhibit violent behavior.it seems like we're running out of options now. what can we do at this point? the idea of my dad having to take her back home and care for it doesn't sound safe for either of them.i think ideally we want her at a care facility for a couple weeks until they can sort out the meds and get the violence resolved, then get her back home with dad with some in-home assistance."," i know anti-anxiety meds have helped my dad - and the aricept he was given brought the anxiety and aggression back, so he's not taking aricept now.  if any of the meds your mom is taking has any hint of that as a side effect see if the dosage can be reduced or stopped and gradually re-introduced.",https://www.reddit.com/r/Alzheimers/comments/63x9y2/lack_of_options_after_violent_behavior/,Lack of options after violent behavior
"hello everyone,i am a second year university student currently studying how alzheimer's disease affects a persons ability to play an instrument. if you have ever known somebody with alzheimer's disease who could play an instrument, i would be interested in hearing your experiences.here's the link to the survey: thank you! joy"," …as a classical musician whose wife has early-onset, i find the concept of this study fascinating! please get back to us on any conclusions you have reached!",https://www.reddit.com/r/Alzheimers/comments/63qujm/musicians_and_alzheimers_looking_for_people_to/,Musicians and Alzheimer's; Looking for people to complete survey
"my grandmother has alzheimer's. she lives with my grandfather and their caretaker. she's lately been getting more aggressive with her caretaker. she threatens to kill her, hits her and says she wishes she would die. the only thing that calms her down for a bit is when i call and we talk for a bit.her daily outbursts are really affecting the caretaker and i don't want to lose her. she's been with us for over a year and even though i keep explaining that it's the alzheimer's, at times i can hear the exhaustion in her voice. i feel she might want to leave soon, which i don't want to happen. the medicine she's been prescribed just tires her. doesn't do much for her mood swings though. she has a drs appt next week so hopefully they can help us out somehow. my question is what point should i consider the possibility of a home for her? my grandfather doesn't want to separate from her so he would want to go with her. just not sure what my options are at this point.any help or advice would be greatly appreciated. thx.", hi! does grandma get fractious late afternoon/evening? if so look up sundowners.often behavior escalates later in the day from too much stimulation/emotion/frustrations. i served dinner in the alzheimer unit long time ago and this is pretty commonplace.,https://www.reddit.com/r/Alzheimers/comments/63bxh5/hi/,Hi.
[removed],,https://www.reddit.com/r/Alzheimers/comments/634990/510_minute_dissertation_survey_for_caregivers/,5-10 MINUTE DISSERTATION SURVEY FOR CAREGIVERS BETWEEN 18 AND 64 YEARS OLD
my dad has early onset accelerated alzheimer's.  it sucks and it's unfair. he has gone through so much in his life and this just seems like it's the icing on a cake made of shit. it started when he was 8 and his big brother died. then his 1st wife (my mum) cheat on him and left him for someone else. after this she died in a car accident. being a single parent is never easy. he then had to deal with his only child joining the navy and going off to war. not to mention getting bowel cancer 2 years before getting diagnosed with alzheimer's. why does it always seem as those people who have a lot happen to them get the short straw every time?," i too have been up close and personal with this disease. my mother had the accelerated variety but her two sisters did not. mom cared for the middle sister until she had to be put in lock up alzheimer unit(still there, 15 years). after being so involved with what is apparently the family disease mom accepted it when it was her turn, and i think that helped enormously.  you didn't ask but this is what i learned: stress speeds it up.never ever ask if they remember something, it makes them sad. going for drives is calming. read up on sundowners, it can be pretty shocking. showers are scary, stay in the bathroom and don't let strangers attempt to bathe him. i told mom funny stories. stories about her, us, history in general...everything had a happy ending. there is no shame, it's just the disease. she lasted 4 years. she made it easy to parent a parent. good luck, be nice to yourself, it's important",https://www.reddit.com/r/Alzheimers/comments/6344hb/my_dad/,My Dad.
"this is probably an issue that gets raised often on this subreddit, so i'll spare most of the details.....my grandfather got lost today, in the only city he has ever lived in...  what is the best, non confrontational way to take way his car keys?i know this is an incredibly hard thing to do..thank you. "," my mom, who has bad knees and also fell and broke her hip in addition to having alzheimer's (you try teaching a woman in second stage to use a walker!), is angry saying she is a good driver who never had an accident and my sisters stole her car. but when we take her to the grocery store and let her ride the scooter cart, she steers it into displays and such.",https://www.reddit.com/r/Alzheimers/comments/62xqew/car_keys/,Car keys
"# **what is this?**i've found that when my wife (who has early-onset alzheimers) wakes up to music, and we can dance together, she generally has a much better day -- a more optimistic outlook, with more energy and abilities. it's somewhat ironic that throughout my life i have *hated* dancing, but it took our current predicament to change that for me.i'd encourage all primary caregivers to try this. it's not an intellectual exercise. it's not a *pain in the ass* (her words) behavioural exercise. it's just fun and invigorating. and it anecdotally seems to work for us. that's right, **us**. it helps me too.[previous wake up and dance post i]([wake up and dance post ii]([wake up and dance post iii](------• **monday**: [jean-luc ponty -- new country](i loved this rock-jazz fusion guy back in the day. i'm sad to hear that alan holdsworth died today, so i wanted to revisit a band he was a part of. let's have a hoedown!• **sunday**: [norah jones -- don't know why](i'm not sure why on this easter sunday that a song full of melancholy and regret speaks to me. norah jones' voice is exquisitely subtle and gets me right in the heart. i know i've not been perfect in being her man through this ordeal, but i'm trying my best. if this song lets me hold my dear wife in my arms for a sweet slow dance, then all is good with the world. if i hold her close enough, she won't see the tears in my eyes.• **saturday**: [the beach boys -- god only knows](today is the day we tell our loved ones that we love them. they need to hear it, and we need to hear ourselves say it.• **friday**: [marvin gaye -- let's get it on](oh golly -- marvin gaye! we hold both hands together and do a super slinky wake up dance. remembering the days we were dating; innocent and free.# **week 4.2**• **thursday**: [the upstarts -- boppin in the 80s](ok, so this is a completely selfish entry. while a (classical violin) music student, i played keyboards in this band for maybe 3 months or so -- but not a member when this video was recorded. i eventually had to quit because: 1) i was a *terrible* keyboard player. 2) after a gig, i'd wake up with liquid coming out of ears, accompanied by a dull ringing. i realised that i was in danger of losing my hearing.anyway, my wife enjoyed watching this, and laughs at the thought of geeky me being in a rock band.• **wednesday**: [j. geils band -- give it to me](so sad to hear j. geils has died! as a bostonian, i've always felt pride about this awesome band.• **tuesday**: [blondie -- hard of glass](another great classic, one that we can't get out of our heads. it's almost like some days have their own theme song.• **monday**: [eric clapton -- layla](how bout we start the week with some good old rock 'n' roll?• **sunday**: [blue swede -- hooked on a feeling](sorry, no easter-themed song today (although i was *sorely* tempted to post [st john passion]( which is an amazing piece of music). so let's start the day with a nostalgia-ridden song with a great beat! time to make some french toast with hard-boiled eggies on the side for breakfast!• **saturday**: [the village people -- ymca](my wife is *such* a disco chick! she loves this song, and i have to admit, it's quite catchy, and a great way to start the day.• **friday**: [barry manilow -- can't smile without you](a sweet love song for a friday! a nice slow dance where we can hold each other, and look into one another's eyes while singing the chorus to each other.# **week 4.1**• **thursday**: [dave brubeck quartet -- take five](these guys are cool. how are they not cool?when i grow up i want to be as cool as these cats.• **wednesday**: [bob marley -- one love](i love finding/remembering feel-good songs. clapping and singing is such a sweet way to start the day.• **tuesday**: [eric idle -- always look on the bright side of life](i guess there's a metaphor hidden in the song… but it's got a singable melody and a positive message, basically. i know we'll be singing bits of this to each other through the day today!• **monday**: [peter frampton -- baby i love your way](this is a specific request from my wife. she knows i like to play a different song to wake her up every morning, and several times yesterday she asked me to find a frampton song. it is so glorious to see her face light up when we listen and dance to music.• **sunday**: [the beatles -- help](this song is so completely apposite to our dilemma; it's like they were writing for alzheimers suffers to sing to their significant others. the music is so energetic, while the lyrics border on desperation. i have to admit i sometimes have to avert my eyes when singing this with my wife.• **saturday**: [paul mccartney &amp; wings -- band on the run](no subtext here. however, this is a great song. how is it you can always tell a paul mccartney song?• **friday**: [yes -- roundabout](this is some quality progressive rock. we both love choral rock. it's not necessarily danceable, but we can still rock out to this song!"," we went off menu today and played [midnight train to georgia]( although i can't carry a tune, today had a surprising moment where my partner sang the 🎵choo choo🎶 noise.  although he was around when this song first became popular his love in life has always first been classical music so i was shocked that he might know that part of the song existed and that he remembered it.  ",https://www.reddit.com/r/Alzheimers/comments/62k1t0/wake_up_and_dance_iv/,Wake Up and Dance IV
"hey guys! i'm not sure if any of you can help, but i'm worried for my mom. i think she might be showing signs of alzheimers, but i'm not exactly sure.she is currently 52 years old and has fibromyalgia which, by the way, i have researched and it seems like it's still unknown whether it's real or not. lately she's been forgetting things. they're little, but i've been noticing it. whenever she forgets something she just blames ""fibro fog"". it's basically her scapegoat at this point for when she can't think of something right away.anyways, just a bit of back story. i am one of 3 siblings, and my parents are divorced. so as of right now, it's me, my mom, and my brother and sister living in a house together. my two siblings have jobs, and my mom does not as she was recently fired in january. i'm with her all day as i graduated from high school early and are waiting to go to college in the fall.now on to why i might think she has alzheimers. one of the first examples that is the most prevalent is that she frequently gets me and my siblings' names mixed up. she gets it after a second or two like she just misspoke, but i think this is worth mentioning just in case.in addition to this, i'm repeating my conversations with her quite a bit. i'll tell her something in the morning, then by night time i'll be telling her again. then again the next day.another small thing i noticed. our mom does all of our laundry because she doesn't trust us not to mess something up. because of this, she ends up sorting our clothes for us and has been doing this all our lives. she is also there whenever we buy clothes, and she is often the one to just buy clothes for us on her own. lately though she's been mixing up our clothing and asking me what's mine and what isn't. she's never done this before, so it raised a red flag.she also can never remember times or days no matter how much you repeat them. for instance, my brother has had the same work schedule for about a year and she still can't remember it. she also has to pick him up from work every single day, because she is the nobly one with a car in my family.just a specific example that has happened just this past week involves movie titles. she's been looking for a certain couple of movies for about a month now but can never remember the title correctly. we've told her the correct title every time, but she can never remember.she also will often not be able to finish her sentences. she'll have to wait a couple seconds before she gets her bearings again, and even then her sentences are full of mistakes and she mispronounces simple words occasionally. keep in mind the only language we speak is english. but all she ever says for all of these instances is ""it's my fibro fog"".if it matters, he father had alzheimers before he passed away about a year ago. i'm not sure if that gives her a predisposition to it or not!i'd bring it up to her, but i think it's a sensitive topic for her since her father passed fairly recently and also around the same time as her mom. i also feel like she might laugh and just tell me she's fine and that it's fibro fog, yet again.we are also not a family that goes to the doctor for a regular check up or anything. we normally only go if something is wrong, so she probably won't be going anytime soon.thank you for reading and helping! sorry for the long post, i'm just worried and wanted to include as much as possible."," my mom has alzheimer's and she has had it since she was 52, but diagnosed at 54. my sister was in hs at the time and i was just graduating college. my mom's dad died from it in his late 70's so i don't know how she got it so early.  i would definitely get her into a neurologist.  my mom kept denying anything was wrong so it will take a while to get her in, but you all have to keep pushing the issue. again, it could be something with her fibromyalgia, but i would rule out alzheimers as soon as possible.also, let me know if you ever want to talk about it! it's tough to go through especially at your age.",https://www.reddit.com/r/Alzheimers/comments/62cr8t/worried_for_my_mother/,Worried for my mother
