submission,comment,url,title
"hey guys, i'm looking for a little advice. my grandmother is one of the most intelligent people i know, she's an accomplished lawyer, a self sufficient woman, and an all around great person. i love her dearly, but i'm becoming concerned about her cognitive abilities. she's beginning to repeat the same stories over and over, sometimes only a day apart.  she often forgets her wallet, her phone, or the location of her car keys. she's even starting to forget the names of the streets she drives on every day. my accounts have all been confirmed by other people in her life. so i guess the root of my question is, am i right to be concerned. and if so, how do i bring it up to her? do i go over her head to her sons who live many states away? i'm just feeling a little lost right now, and any advice you guys could give me would be greatly appreciated. "," what you describe are relatively minor memory problems, which may just be age-related, or caused by things like stress, medicine side effects or a medical condition not necessarily a dementia. however if you and others have noticed a change then it is best she gets herself checked out. there is a fair chance that your grandmother is aware of any changes in her cognitive abilities. i think i would try an honest chat, and establish her view first. things like offering to go along to any check-up or assessment might help. if she is open to talking about these things then you can stress that early intervention and monitoring of any dementia can play a massive part in continuing to lead a full life. although there are no cures, certain medications can slow the onset of symptoms. a diagnosis would also possibly open the door to help and support (in britain there are community mental health teams and memory clinics, etc) and areas like occupational therapy can sometimes help. there are lots of ways you could help your grandmother maintain a good life. as your grandmother is a lawyer she probably has her affairs in order, but sometimes a diagnosis of dementia is a good time to review financial and legal decisions about the future. finally of course, she may be told that there is no dementia present. which if she is aware of recent memory issues, would be a relief to her as well as you.",https://www.reddit.com/r/Alzheimers/comments/5au0vr/making_my_fears_known_to_a_loved_one/,Making my fears known to a loved one.
"my dad is currently 64. he had me when he was about 50 but he got really upset and confused several days ago when i was disagreeing with him, saying i told him to buy some computer cable. he's been rather weird lately and forgetful, but his mom (my grandmother) had alzheimer's a few years ago and couldn't even remember that he was her son. i am very sad right now tuft my dad may be getting it.what should i look for, and are there any early warning signs?", personality change was the big thing we noticed.  he was apathetic to everything. next was his doing things wrong like trying to turn on the headlights in the car with his foot. ,https://www.reddit.com/r/Alzheimers/comments/5ani8m/symptoms_to_watch_for/,Symptoms to watch for?
[removed],,https://www.reddit.com/r/Alzheimers/comments/5ag4y3/the_cure_for_alzheimers_is_edta_immucyst_and/,"The cure for Alzheimer's is EDTA, Immucyst and avoiding aluminum"
, all you need to know:     what you need to look for:  what needs to be done:  also  ,https://www.reddit.com/r/Alzheimers/comments/5a915t/doing_a_short_30_second_psa_on_alzheimers_for_a/,"Doing a short 30 second PSA on alzheimers for a class, and was wondering what is the most important information people should know about alzheimers? What needs to be done?"
[deleted],,https://www.reddit.com/r/Alzheimers/comments/59iyj5/tabloid_paper_giving_false_hope/,tabloid paper giving false hope
"the last 3 days i've forgotten 2 separate passwords for two separate accounts/systems. and these weren't recently changed either, i've been using them for 5 months now.this really has me worried. this isn't simply forgetting where i left my car keys, i straight up forgot something i've been doing for 5 months now. i kind of forgave myself for the first one... but two times in the past few days is too much to ignore, in my opinion. i've never been considered the sharpest tool in the shed, but i think it's time to start worrying.is this a sign of mci, dementia or alzheimer? my grandfather was diagnosed before he passed away 3 years ago at 76."," pretty normal feeling.  my grandpa died of it and now my dad has it and i'm living with him as his caretaker, he's 69.  i'm 30 (male) and have had the same worries, but i also have smoked a lot of weed in my life so i'm attributing it to that.  they both got alzheimer's in their 60s so i'm just guessing that that is when i will get it too.  but, i do have a friend whose wife started having symptoms at age 28, so... shrug, it could happen.",https://www.reddit.com/r/Alzheimers/comments/599cuy/29m_and_worried/,29M And Worried...
"hoping to get some much needed advice. to start, my father is 55 years old. over the past year or so his memory has been getting noticeably worse, to the point where it's beginning to seriously concern my mother. for example, just the other day, my parents were in the kitchen and my mother brought up how his sister called and needed to have her pilot light fixed in her house. she seemed to have his full attention and he responded with, ""yea, i'll get on that."" 20 minutes later the phone rings and it's his sister, and after the conversation my father acts like this is the first time hearing about this pilot light issue. even though my parents had a conversation about this only 20 minutes earlier. it had been like that conversation had never happened. that's just one example of a series of on-going incidents that has begun to seriously worry our family about my father's memory. to make matters worse, my father's mother (my grandma) recently just passed away a few months ago after battling alzheimers herself for the past 5 years. so there's that grim reminder about how my father could have a genetic predisposition to this disease, which would make any conversation about his deteriorating memory even harder to bring up.i just want some advice on how to approach this topic up with my father. he's always been a very prideful and independent person, so i fear any any attempt of broaching this topic will be incorrectly seen as some attack on him personally from his perspective. and for all we know, his memory issues could just be a result of stress (he's got a lot on his plate) which i hope to god is the case. any advice you folks have would be greatly appreciated. thanks"," hello, a very nice episode for you :  a man in this episode is similar to you. he has a father with alzheimer’s disease. he gives an advice on how to deal with that chronic disease..",https://www.reddit.com/r/Alzheimers/comments/596pms/how_to_approach_the_topic_of_alzheimers_with_my/,How to approach the topic of Alzheimers with my father
"so last year the mil got scammed out of something like 20k$. that was actually recovered and there was some kind of investigation. fast forward to now, we live next door and she's been restricted to have no access to financial stuff.  yesterday we're having a nice dinner together and she goes ""oh the us government called me, and asked me to help south america, but i told them no."" when we asked if she gave her social security number she said ""well they have that.""  she talks about one time she had tea with queen elizabeth in the 70's ad nauseam but can't recall what country she's queen of. she frequently rereads, or really just holds, the story ""the unexpected mrs pollifax"", which is a novel about an old woman that's recruited as a spy after society is ready to toss her into a nursing home.  so either she's made this one up in her head (very possible, she also thinks a blind jazz bass player lives up the street), or some disgusting sociopath is calling her and trying to get useful info from her ""uh, we have your ssn as this, is that correct"" (also possible), or the government is starting operation pollifax and wants to send her to honduras (one time i guessed a locker combination on the first try!).  has anyone had experience with this? is lifelock still a think? i was considering getting her incoming call log from the local provider..."," your mom is not being specifically targeted. they have an auto-dialer that is calling everyone. they may also be ""spoofing"" the caller id read out to make it look like they are calling from some place official.consumer reports reviewed call blockers last year [robocall blocker review]([cpr v5000 call blocker]( is the number one call blocker on amazon",https://www.reddit.com/r/Alzheimers/comments/58t4i5/dealing_with_scams/,Dealing with scams
"my dad is still wandering out in the evenings. but, i discovered if i feed him snacks he will stay put and watch bob's burger with me sometimes. yay!", what sort of snacks does your dad like best? i love that bob's burgers makes him stay put sometimes. ,https://www.reddit.com/r/Alzheimers/comments/58n5y7/on_friday_we_vent/,On Friday we vent!
"as the title says, my grandpaw was diagnosed with alzheimers by a neurologist a couple of months ago. he was actually diagnosed nearly two years ago by his primary care physician, and he chose to keep that information private due to his pride and independence. he is a successful business owner in the flooring industry, and he has created jobs and a successful life for so many people over the past 35 years. he is technically retired, but he always stays close to the shop doing little knick knack jobs to keep himself busy throughout the day. he is the type of person who grew up with nothing and created a great life for himself and his family. my mom, dad, sister, and i all work for his business, so that is saying something right there... well, we just got a call from an old friend of his who is also in the flooring industry, and he told my mom he was going to be awarded with a lifetime achievement award for everything he has accomplished. i honestly couldn't be more proud, and i am so excited for him to gain knowledge of this. the diagnosis has be very hard for him to accept, and i think he has a lot of pent up fear for what the future holds. i really feel like this award is going to do so much to lift his spirits, and allow him to feel like he has done what he needed to do in this life."," that's great, and great it came at such a good time.  congrats to your grandpaw!",https://www.reddit.com/r/Alzheimers/comments/58cfcv/just_got_word_that_my_grandpaw_who_has_just/,Just got word that my grandpaw (who has just recently got diagnosed a couple months ago) is about to receive a lifetime achievement award for his work!
"when visiting with my mom this past weekend i started thinking about the relationship between her pre-alz personality and the challenges of being her caregiver now.  it made me think what might be easier now if she were different then.for example - she was always ashamed of her body (and a bit critical of mine).  some of her go-to conversations now are ""i've been perspiring so much my hair is wet"" (5-10 times per day) or ""i hope you didn't inherit my fat thighs"" or ""i wish you could have gotten my hair instead of your father's"" or constantly wanting to compare height with me (3-5 times per day).  sometimes i think if she'd been a bit more self-confident during life then these wouldn't be her go-tos now.  another example - she was always worried about doing things wrong.  as a result now, she won't participate in the activities in her senior community (bingo, chair yoga, crafts, brain games, etc.), ""been there done that"" she says, or she'll claim a headache before or during activities.  while she isn't aware she has alz, i think she knows on some level that she's not 100% and is afraid to look bad/fail at trying something, so as a result she won't try.  she also hates when anyone tries to help her with self-care.  she's generally in good spirits but will rage if i float the idea of taking a shower.  sometimes i think if she'd not been afraid to fail or less worried about how she is perceived by others during pre-alz life, that she'd be a little more willing to do things now or accept help.  my takeaway from the first example is that it might be good for me to not get in the habit of saying negative things about myself or my body now, lest it become a go-to for me should i develop alz.  my takeaway from the second is to not care what others think of me or what i'm doing, and to accept help when offered now, lest me refuse help at a time when i most need it.  both of these are good, positive life changes to make anyway, imo.has anyone else had thoughts like this?  obviously, with alz if it isn't one thing it is another, but - it was interesting for me to think about the connection and wondered if others did too."," interesting conversation.  my mom was a 'good catholic woman"" who now curses like a sailor, stabbed a fellow resident and tried to stab a staff member (with her knitting needles in both cases) and refused to wear 'that damned bra'.  talks about sex and rape all the time.  she's often like a different person.  on the other hand, her anxiety and depression from pre-alz are still there and still causing problems.interesting to think about.  thanks",https://www.reddit.com/r/Alzheimers/comments/584myx/link_between_caregiving_challenges_and_patient/,Link between caregiving challenges and patient personality (Pre-Alz LPTs?)
[deleted],,https://www.reddit.com/r/Alzheimers/comments/57jfuv/grandpa_jones_freestyle/,Grandpa Jones Freestyle
"my grandma passed away in her sleep the other night. she had been under the care of hospice for two years. death is ugly. i have watched her lose her abilities over the past eight years. i have watched her die. i was her primary caregiver and after her fall two years ago she refused to eat. our other caregivers force fed her, i hated them... my dad couldn't see what he was doing by allowing them to feed her. people can be so selfish, she was kept alive for other people. fuck. she passed peacefully, we had been giving her morphine so she could rest more comfortably. we've been holding a bedside vigil since monday. and now i'm selfishly worried about what i'll do now, i've put my professional career on hold to care for her... i've been out of the workforce for four years, what the fuck am i supposed to do now? i'm relieved she passed, bedridden and incontinent is no life. she was in pain, she was tired. fuck alzheimer's."," i wish you a lot of luck. kudos for all you did for your grandma.  no particular insight, but i agree: fuck alzheimer's. ",https://www.reddit.com/r/Alzheimers/comments/57hrjh/its_finally_over/,It's finally over.
"we are caring for my mother-in-law (alice) who has end stage alzheimers. we have a perplexing problem as i am reaching out to see if anyone has encountered something similar.two things:1. alice very rarely speaks, but when she does say words, while they do not make sense they are pronounced correctly. when she is in duress (see below) or frightened she will sometime speak short sentences like ""please don't"" or ""thank you lord."" it seems that alzheimers is not affecting her vocabulary but her understanding how and willingness to communicate.2. in the last month alice has been walking less and less. she used to walk around the house a lot. in the last week she has not wanted to get out of bed to go to the bathroom. she is not in pain, she will attempt to get up but then stop and then look around. sometimes she will stand up with help, other times she will get half-way up and then seem to be in great distress and attempt to sit down and be grabbing onto anything/anyone for support like a drowning person. she will keep her knees bent and not fully support her weight. it takes two of us to rotate her around to the potty chair. we go through the same thing getting her back into the bed. sometimes, like this morning, it clicks and she stands up and pulls her diaper up without a problem. later, she will still get up on her own and walk around the house from time to time. it seems like all of the functionality of walking is still there, but the conscience use or understanding of that functionality is going. needless to say this is exasperating especially when there is clean up to be done. having her stand has been the easiest way to get her clean because she will actively resist any attempt to roll her over in the bed, bracing herself against anything she can get her hands on.it would almost be better if she were more incapacitated. as it is now, we know that she is on one level of capability physically, but cognitively she is on another... sometimes.we don't want to distress her too much, but at the same time we need to keep her clean and healthy.i'm looking for some advice from anyone who has dealt with this before. is this a normal stage in the disease?", i don't know what to say to you other than i feel your pain. my grandmother is going through almost the same. much love and strength to you. ,https://www.reddit.com/r/Alzheimers/comments/56t8cy/end_stage_care_question/,End stage care question.
[removed],,https://www.reddit.com/r/Alzheimers/comments/56kcn5/donating_proceeds_from_our_bbq_sauce_to_alzheimers/,Donating proceeds from our BBQ sauce to alzheimers
guilt. i feel guilty when i'm not around to help my mom with my dad. ," stopping into last week's thread because i need to vent, and the topic is appropriate.  i'm so mentally tired by my own life right now, and i'm going to see my parents this weekend.  i mostly just want to go on a hike and forget about the rest of my life for a weekend, but - i can't.  i have it easy, i'm only a remote part time caregiver.",https://www.reddit.com/r/Alzheimers/comments/56b3h6/its_venting_friday/,It's venting Friday!
"i'm 25 and live with a coworker. we're in florida and as you might know there's a hurricane about to hit. my grandmother who has alzheimers lives in a trailer park 2 hours from me. they're evacuating the area so my mom (who lives 5 hours away) asked if i could go get my grandma.i did. the ride was rough. full of repetitive questions. the worst is the ""what day is it"". she's asleep now but i'm worried about her waking up in an unfamiliar setting. also i'll be at work from 12 to 8 and my roommate will be gone from around 10 to 2. i'm just so worried something could happen in those few hours neither of us are home.i've never been responsible for her like this so i'm pretty worried and i don't have anyone else in town in can ask to help me. any advice is greatly appreciated.my grandmother isn't too bad yet but her short term is definitely off."," how did it go with you being away?  that is what would worry me the most, thinking about my mom in an unfamiliar situation.  although - my mom seems to have better short term memory when something intense is going on.  like - she was evacuated, too, and knows why, but if we were just going to the store she'd have no idea where we were going and why.umm, hard to offer general practical tips without knowing more about your grandma and your home.  someone once suggested removing the knobs from the stove to help prevent them from cooking (e.g., causing fire hazard - though if your grandma lives alone this might not be needed).  a black doormat can discourage some (probably more advanced patients) from going out.  a note *might* help - explaining where you are and when you're back, along with an easy to read clock.  anticipating needs is also helpful.  leave out snacks in a visible place, maybe leave the tv on in case she doesn't know how to use your remote, call her and check in often.oh - almost forgot.  head off the repetitive questions by asking her about her past, or asking her opinion on things.  bonus is you get to know them better.  another tip for repetitive questions is to figure out *why* they're asking.  for example: someone who keeps asking what time it is might actually be hungry and really just wants to know if it is dinner time.  ",https://www.reddit.com/r/Alzheimers/comments/563szd/first_time_in_charge_of_my_grandmother/,"First time ""in charge"" of my grandmother"
"my grandmother is 96 and has been in memory care about 3 years now. she has been becoming more and more agitated, visits just seem to freak her out and cause distress. i heard a story on npr the other day about doll therapy and i was thinking huh, maybe we should try that, but she's never been into babies, maybe i could find a realistic looking cat. she loooves cats and still talks about allie, who died probably about 20 years ago.so i found this hasbro robot cat, and it had amazing reviews so i ordered it and it gets here friday. i'm a little nervous  about how to introduce it to her. i think she'd love it, but the introduction could go really badly and she could reject or destroy it, or maybe be scared? she's also becoming more physical when upset. from the reviews it sounds like it's really calming and enjoyable and i really want it to work out and help her.does anyone have any experiences, or ideas for introducing the cat to her?", [deleted],https://www.reddit.com/r/Alzheimers/comments/563l6i/joy_for_all_companion_cat_from_hasbro_any/,Joy for all companion cat from Hasbro - any experiences?
"my mum is 60. she is constantly on her smartphone, playing games, texting, internet. often when me, my dad or brother are talking to her, she's so engrossed she doesn't listen, unless we make a point of telling her she's not listening to us.occasionally she forgets stuff, but i know as you age your memory isn't as great as it was, and she always remembers what she was going to say later. today, she asked my dad about a bottle of wine they had bought in the supermarket. my dad said they hadn't bought any, yet she was convinced they had. later, dad said ""oh sometimes i wonder if she's losing it"". me panicking asked what he meant. he said that she never listens because she's always on her phone.what do you guys reckon, simply she is too engrossed in her phone or that there's something untoward going on here?"," with my dad- diagnosed with alzheimer's at 53- it started off small like that but then became much more obvious that it was something more. if it's just those two small signs, i wouldn't worry about it. i would compare it to yourself and ask yourself ""is this something that i could forget about, too? or is this exceptional.""brains get old as people get old. it could just be normal forgetfulness- especially if it's something they do all the time like go grocery shopping. keep an eye out for her forgetting things that she would never forget otherwise. or maybe her being unable to complete a task that she always completed in the past. i'm no doctor, so take this all with a grain of salt. but i do want you to be encouraged and not live in fear of the uncertain. pm me if you need to talk more. ",https://www.reddit.com/r/Alzheimers/comments/55uryw/mum_always_on_her_phone_occasional_forgetfulness/,"Mum always on her phone, occasional forgetfulness. Is she simply distracted/not listening?"
"so i had a couple questions regarding alzheimer's because i am doing a project on it, if there is anyone knowledgeable on the topic and would mind me asking them some question i will be ever thankful.", post the questions here and ill try to answer as best i can. currently a 4th year phd student studying alzheimers disease and my grandfather had the disease when i was in hs.,https://www.reddit.com/r/Alzheimers/comments/55rjom/i_had_a_couple_questions/,I had a couple questions
[deleted], this is a homework question isn't it... 😉,https://www.reddit.com/r/Alzheimers/comments/55gk96/alzheimers_and_action_potential/,Alzheimer's and action potential
"my aunt has started fidgeting constantly. she has taken to scratching at herself, and peeling wallpaper, fiddling with doorknobs, etc. i wanted to make a twiddle muff that helped to sooth her, so i picked up a stuffie (for those of you who dont know, they are stuffed animals full of pockets, zippers, velcro) and sewed on some toys. she especially likes the crinkly ladybug, and the jingle bells. small, shiny, and textured. i have found unused cat toys to be the best sensory toys to give her, and they can all be attached with ribbons and elastic to any stuffed animal. it saves a lot of money on twiddle muffs, and allows for customization, so you can attach whatever your loved one will use the most.", can you please share some pictures?,https://www.reddit.com/r/Alzheimers/comments/55fu24/psa_cat_toys_make_great_twiddle_toys/,[deleted by user]
[deleted],,https://www.reddit.com/r/Alzheimers/comments/55c08s/i_had_a_nightmare/,I had a nightmare
nearly forgot about it. same ol same ol with my dad.  he's pacing back and forth.  i got him some popcorn and he's finished it and keeps picking up the bowl to see if there is more. i also have to encourage him to get off the toilet and that he's not really pooping. super exciting friday night! anything frustrating y'all?," not friday, but i'll get this one out.my mom's in the hospital with an infection.  i stood outside the room as they washed her and put a catheter in.i don't think i'll ever forget the sound of her crying out.if i ever meet a nurse in a bar, they're getting a free drink.",https://www.reddit.com/r/Alzheimers/comments/55axin/vent_friday/,Vent Friday.
