submission,comment,url,title
"free to play, preferably offline games, that are easy to start up and play. solitaire is okay for now, but she gets bored/frustrated with that sometimes. i was hoping this community had some advice on particular things like this she could use to pass the time with my grandpa."," my mom had an ipad that i would download games on for her. she loved puzzles. i downloaded multiple puzzle apps for her. they were her favorite. she also liked coin dozer and claw games. when she started declining more, she liked little kid games that had colors and sound. ",https://www.reddit.com/r/Alzheimers/comments/5h9bnp/my_grandma_has_early_stages_of_alzheimers_she_is/,"My grandma has early stages of Alzheimer's, she is still comfortable using a computer, looking for simple games."
"i'm looking for any advice on a tough situation. my dad has had a failing memory for years but over the last seven things have gotten progressively worse. he's been having ""bad days"" where he doesn't remember where my mom works, that she works,  or what's even going on around him. he asks the same questions repeatedly within the span of minutes and doesn't remember most things for longer than ten minutes tops although he still knows family members. to add to this my mom has been fighting ovarian cancer for years now and is on a lifetime treatment plan of chemo and that's been playing havoc on her but she's still able to work at her (mostly) desk job at the local hospital. i live two hours north of them and to be quite frank have never gotten along with him due to his temper (which still flares up at times when he gets emotional or confused) so i'm of little help other than morale. does anyone have any suggestions of options we might have for my dad? we're at our wits end and i'm worried that he will either wander off (up until earlier this year he refused to stop driving and would get lost on a regular basis, not knowing where in town he was) or do something that will endanger himself or the house before long. are there programs out there or care options that don't take in the fact that my mom still has an income (not enough for anything we've found as far as pay care). thank you for any help. "," have you checked the ""in my area"" tab on alz.org? in addition to in-home care, there's also adult day care which is generally less expensive. i never used this with my husband, but i have a close friend who did with her father. she said her dad loved it because the staff understood him, the activities were geared toward people with memory impairment, and he found some new friends.",https://www.reddit.com/r/Alzheimers/comments/5h80ls/one_parent_with_alzheimer_the_other_with_advance/,One parent with Alzheimer the other with advance Cancer.
[removed],,https://www.reddit.com/r/Alzheimers/comments/5h187c/telecalm_is_offering_a_specialtry_for_3_months/,teleCalm is offering a special.....try for 3 months for $1
"my grandmother probably won't make it til christmas. she has alzheimer's and had a possible cancerous tumor in her neck that was removed last week. she stopped breathing today. she can't eat or swallow anything. so, baby and i are headed to see her tomorrow to prepare to say goodbye. my family is very religious and i'm trying to think of some comforting words for them, as well as what to say to my somewhat vegetative grandma as we're preparing for her to die. i'm also having a hard time dealing with her death because i don't believe in a heaven or hell anymore. this really might be the last time i will ever see her beautiful face again. i'm at a loss and don't really know how to start grieving...thanks for reading update. granny passed december 21,2016. we buried her two days before christmas. it was the hardest day of my life. we watched home movies from 15-24 years ago all day yesterday and relived lots of memories. she's at peace. her funeral was beautiful and she looked as beautiful in her casket as she did 5+ years ago before alzheimer's. i've never felt so close to my family as i have this christmas. what a wonderful time to leave this earth. thanks for all the kind words and wishes in the past weeks, my reddit family is awesome :)"," ""i love you.""",https://www.reddit.com/r/Alzheimers/comments/5gppqi/any_ideas_on_how_to_say_goodbye/,Any ideas on how to say goodbye?
"made a playlist of her favorite songs and put it on when she was upset. the response was pretty amazing. her face lit up and she was so happy. she's been singing along all day, remembers all the lyrics. quite awesome! just wanted to share something that was working for us.", my dad will hum music from old westerns during the day.  then in the evening mom puts on old classic music to help him wind down.  it's great. ,https://www.reddit.com/r/Alzheimers/comments/5g6v5r/music_is_a_powerful_thing/,Music is a powerful thing
, ,https://www.reddit.com/r/grassroots/comments/5fzb9d/call_your_senators_to_support_alzheimers_research/,
"i'm looking at gps trackers for my dad. he won't carry a smartphone, but we think we can get him to carry a tracker. just wanted to know if anyone had any insights.  location is illinois.", hello all.  thanks for the replies.  we've decided to try the yepzon brand.  i'll update in a few weeks to let you know how it goes.,https://www.reddit.com/r/Alzheimers/comments/5fmxhd/gps_tracker_for_elderly/,GPS tracker for elderly
"my mother lives alone and has started showing signs of progressive memory loss.  she's mostly able to care for herself, but frequently forgets to take her meds (including memantine for her memory), and forgets to pay her bills.  it seems like much of the caregiver support information presumes that there is someone else living in the home, and i'm a bit confused about my options for getting her support at this stage.i've started taking on her money management and getting legal documents in order, but i'm not sure on the best path forward for her medically.  here are the questions i have and if anyone has any other recommendations i'd appreciate the guidance.* is it better to keep her in her own home or should we start thinking about moving her to assisted living?* what is the right type of in-care assistance for her now, and will that change?  does she need true medical care or just someone who can drop in to confirm she's taken her meds?* if she needs in-home care, will medicare cover that?  what diagnosis would be needed for that coverage?* is there any advantage/disadvantage to a formal alzheimers diagnosis?"," there will come a time she cannot stay alone in her home.  best you start thinking about that and looking into it, before the need is high.  your local support organization can help.  alzheimer's is a terrible illness and eventually they can forget the basics of survival, like swallowing.  so living alone is impossible.",https://www.reddit.com/r/Alzheimers/comments/5fihh0/widowed_mom_with_early_stage_memory_issues/,Widowed Mom with early stage memory issues
"my grandmother says things like, ""did you lock the trailer out front?"" (she's the one with alzheimer's.) my grandfather will reply, ""we don't have a trailer anymore dear.""is it bad if i reply with a simple yes rather than telling her she doesn't have a trailer anymore?edit for clarification: it's been about 2.5 years since she was diagnosed. she believes her home is not her own home some days and the other day while doing yard work for my grandparents she walked outside and we asked her what was up and she said ""i don't know."" so she's starting to wonder and wanting to go ""home."""," always play along, and try and redirect attention when things like her home come up.there was a study that showed that reminding people their loved ones were dead when they thought otherwise left long lasting negative feelings, even after the memory of the conversation is gone. basically, even if they forget your arguments a few mins later, the emotional state that came with it stays around. knowing this, it's best to keep a positive attitude and try and redirect any conversations away from negative topics.",https://www.reddit.com/r/Alzheimers/comments/5eyfbh/should_you_answer_to_their_delusion/,Should you answer to their delusion?
[removed],,https://www.reddit.com/r/Alzheimers/comments/5ee33m/a_little_help_insight/,A little help / insight
my grandmother just passed at 146am this morning...don't think i'm insensitive for immediately posting to reddit about it but i have to tell you guys. seeing her fall through alzheimer's and knowing she's at rest is such a bittersweet feeling. i would have given anything so she wouldn't have suffered. but i can't help but feel relief that she's not suffering anymore either. it's almost unexplainable but to you guys who have dealt with it....i know now the true burden of dealing with it.those who are currently dealing with it....be there for them. spend every moment you can. let them hear you. reminisce. hold their hand. anything. ive been lurking this subreddit looking for any type of info about alzheimer's relief. i've read some incredible stories of life and loss. know that you are not alone., sending love and hugs to you. i'm in the process of losing my grandma to alzheimer's. i know it won't be long...just cherish those memories ,https://www.reddit.com/r/Alzheimers/comments/5dx49t/passing/,Passing....
"while she's been having trouble for a while with remembering the words she wanted to say, and occasional memory lapse on minor things, hearing the diagnosis hit me pretty hard. she's 75, so it is not unreasonable. she currently lives in her house, with my dad staying in a guest house in the backyard, so hopefully she'll be able to retain her 'independence' for a while. her doctor started her on a medication that shows good results for early stage alzheimer's. i want to know as much as possible and get her access to as many resources as possible. we are located in az. where do we start? what do i need to know? i have interacted with other people with the same affliction, but never someone so close to me, so i have an idea of what can happen, and i know it's different for every patient. any advice would be greatly appreciated! edited to add she was prescribed donepazil"," read the 36 hour day. lots of good info. she and dad need to have a conversation about her wishes- finances, at what point should she be placed in a care home, living will, etc. she needs to sign over poa and guardianship to a trusted family member or friend. ",https://www.reddit.com/r/Alzheimers/comments/5dwznx/grandmother_diagnosed_this_week_with_early_stages/,Grandmother diagnosed this week with early stages.
[removed],,https://www.reddit.com/r/Alzheimers/comments/5dsgzv/alzheimers_disease_slowly_affects_memory_and/,Alzheimers Disease Slowly Affects Memory and Other Brain Functions
"i'm 23 years old and living with my parents to help take care of my dad who was diagnosed with early onset 3 years ago. everyday i watch as the man who raised me loose himself and losse his touch with reality. i don't know what to do anymore it is just so hard to deal with and i have noone i can talk to. my brother and sister just expect me to keep helping without really caring how terrible it is for me to watch as our dad because just a shell. i know it's selfish to want to leave and not have to worry about weather or not my dad will know me or if he's going to freak out about the ""strangers"" who come in and steal his stuff."," i'm in the same boat, my father is a shell of who he once was and declining all the time.  it is very hard and we have to remember to take care of ourselves so we can take care of our loved ones.  have you attended a caregiver's support group?  they can be very helpful.",https://www.reddit.com/r/Alzheimers/comments/5dhpbp/it_gets_harder_everyday/,It gets harder everyday
[removed],,https://www.reddit.com/r/Alzheimers/comments/5czc3k/my_grandmother_died_last_week_but_her_funeral_was/,My grandmother died last week- but her funeral was magical
"okay, this will probably be a long one. my friend is 26. his mom is 62. within 1.5 years or so, she went from a fully-functional college professor to near-invalid. some of the things that have happened...- she has zero short-term memory left. she remembers her childhood and whatnot, but her memory is blank for the past 10 years or so.- she frequently digs out old bills and mail and insists that she just got them.- she screams and cries all night, every night. - she sees people who don't exist in the house, and believes that the family is conspiring against her in many different ways.- she will randomly switch to a ""baby talk"" voice in the middle of conversations, and will begin speaking gibberish here and there.- she will take out all of the food in the fridge and scatter it all over the house. friend can no longer keep anything in the fridge.- in her nightly rage fits, she has smashed a tv, numerous appliances, and a glass stovetop, as well as turned the oven on high and stuck wads of old mail in the toaster (but didn't turn it on.) all small appliances and sharp objects have been locked away.friend has two brothers, he's the middle one. dad basically isn't in the picture. neither of the brothers live at home, and never help with care.friend keeps the house via his job and mom's disability checks, but she's becoming increasingly dangerous to herself and the house, and it's more and more of a risk to leave her home alone. she went to the doctor once, got a vague diagnosis of alzheimer's before she threw a fit and they had to leave. it's basically too dangerous to take her in public at this point. she needs round-the-clock supervision and care, and friend is prepared to put her in a home. however, he has no idea how to find out about her insurance situation, etc. we're sure there's no nursing home insurance, her disability definitely won't cover it. what are their options, if any?thanks, everyone."," my grandma, among a few other concerning things, has actually started to baby talk more and more often. and im just realizing that this might actually mean something.",https://www.reddit.com/r/Alzheimers/comments/5cy5of/friends_mom_hassomething_and_its_wrecking_their/,"Friend's mom has...something, and it's wrecking their lives"
"hello all, my grandmother was diagnosed with alzheimer's over a year ago, although we suspect she had it longer, but she refused to go in and see a doctor for fear that she had it (her mother and brother both had it, and i can completely understand this fear). long story short, a year later she is currently in a hospital and will shortly be moving to a memory care facility (adult protective services got involved, long story). i'm having a lot of difficulty dealing with this emotionally, not least of which because it has progressed so fast. are there any good resources to find like a therapist or group in my area so i can talk this out with someone? i would like to be ok to visit her without crying, and right now i don't honestly believe i could do so. any help would be greatly appreciated. "," i feel for you.  i saw my grandmother decline and my mother now has dementia.  i would find any sort of alzheimer's family help group.  you aren't alone.  i think the greatest comfort for our family with my grandmother was that she didn't seemed to be distressed.  my mother is another story.  if you do ever have a moment to share it, i would be interest in how adult protective services got involved and if you had a choice.",https://www.reddit.com/r/Alzheimers/comments/5cwfer/difficulty_dealing_with_grandmothers_rapidly/,Difficulty dealing with grandmother's rapidly progressing alzheimer's.
"hello everyone, my fraternity sigma alpha mu is involved with “beards for brains”, which is where we grow our beards out for all of november. we do this to raise money for the judy fund ( which was founded in 2003 to aid in alzheimer’s research and to this day has raised over 6 million dollars for this cause. unfortunately, i know this disease all too well. as a 20 year old i was lucky enough to grow up with all four of my grandparents, but as i got older their health started to decline. my grandmother was diagnosed with breast cancer and just before she passed she said (talking about her husband) ""you have no idea how bad sandy is. i've been able to hold him together in front of you all but i'm not going to be able to anymore."" without his wife around to keep him company my grandfather started to progressively get worse and worse. it got so bad that he got forgot where he currently lived, and ended up driving 45 minutes back to his childhood home. the only thing that he consistently remembered was that i loved the sunday comics, so every sunday day when i would go see him with my parents he'd have the comics open on the coffee table waiting for me. i kept every single one. i knew things were getting seriously bad when he stopped remembering to put out the comics. by the end of his life he couldn't remember the children he raised or the grandchildren he helped raise, and i never want to see this horrible disease effect anyone the way it did me and my family. you don't have to donate to my cause, but any amount is incredibly generous and very appreciated. my donation link is:", i commend you and your brothers for your efforts.  the many philanthropic events organized and executed by greek life goes mostly unnoticed by the general public.  i lost my grandmother to alzheimer's and parkinson's.  she lingered for 12 years with these horrible diseases.  i too hope more can be discovered about this disease and something can be done. ,https://www.reddit.com/r/Alzheimers/comments/5cj9b9/beards_for_brains_noshave_november/,Beards for Brains! (No-shave November)
," today i'm feeling the financial burden of alzheimer's disease. the medications, caregivers for when i'm away, bed pads and other incontinence supplies, adaptive items etc. seem to never end!  not much seems to be covered and guilt/concern makes me try anything that could help.  ",https://www.reddit.com/r/Alzheimers/comments/5chlnz/its_friday_lets_vent_get_it_all_off_of_your_chest/,"It's Friday, let's vent. Get it all off of your chest!"
"my grandmother is in her 3rd year after being diagnosed with possible lbd and she has been having a hard time lately. she has been very tired and even falls asleep often while sitting up when she's not engaged in any activities. we currently have her in a rehab facility, to see if they can help her get her motor functions going again. the only problem they (and i) have been having, is that she will not eat unless we literally hold a spoon to her mouth and get her to take a few bites. but even when we do that, she won't take more than 2-3 small bites before she is done. i always ask her if she is hungry, and the answer is always no and ""i never have an appetite."" i am afraid that because she is not eating well, that it is bad for her in the long run, and could be the reason why she has no energy on most days. she has also lost around 30 lbs in the past year or so.how can i get her to eat more and eat healthier, *without having to force or pressure her?"," you could experiment with high calorie nutritional drinks like ensure, boosted up with ice cream and fruit. have they tried an antidepressant? depression can sometimes cause a decrease in appetite. ",https://www.reddit.com/r/Alzheimers/comments/5c5fve/whats_the_best_thing_to_do_when_it_comes_to_a/,What's the best thing to do when it comes to a person with LBD/Alzheimer's who will not eat at all?
"my mum was diagnosed today with alzheimers (mid early onset) my grandmother had it before she died and it was horrendous.  i can only hope that some cure/cessation is found.  i can't stand the thought of losing my mother,  especially to this horrendous disease. does anyone have any coping /acceptance skills that they could share with me?"," outside of the great advice already here, is take care of yourself.  my grandmother had alzheimer's and parkinson's.  my mom never would take a break or anytime for herself, and ended up with other health problems of her own.  if you want to be a caregiver, you have to be in good physical and mental health yourself.  accept some help. spend a weekend away. it is ok to do something for yourself, even if it is something small. ",https://www.reddit.com/r/Alzheimers/comments/5c4y88/diagnosed_today/,Diagnosed today
"pretty much the title, im just really worried", literally got the same news today ,https://www.reddit.com/r/Alzheimers/comments/5bp3hr/serious_my_dad_just_got_an_mri_scan_and_they_said/,"[Serious] My dad just got an MRI scan and they said he ""might"" have alzheimer's, can this possibly be false and mistaken for something else? Thanks"
"my dad has early onset alzheimer's and is in the early-mid stages (about 2 years since ""diagnosis""). i'm looking for some fun games to play with him and my number one priority is to make sure he doesn't feel discouraged or frustrated by his inability to play. i want him to feel included and on the same level as me while we play (even if that's not the reality). he has great long term memory recall and loves music. he doesn't do well with math/sequencing and has a very short attention span. i'm thinking a game like trivial pursuit might be fun for him. any suggestions?", trivial pursuit i think will work well and it's not that hard since questions are general and about popular culture. you can also try other board games with colorful surface and objects that can be held like cards or dice. ,https://www.reddit.com/r/Alzheimers/comments/5bnzic/games_for_people_with_alzheimers/,Games for People with Alzheimer's?
"hi there. we're having real trouble getting my mom to shower. she's refusing, says she doesn't need to, and makes excuses. she lives with my dad [83]. anyone got any suggestions?"," she is possibly afraid of water or afraid of water in her face, ( common with people with alzheimer's and dementia).if you can't get her to shower at least maybe get her to wash her  armpits and lady bits  and bottom. companies  make bath wipes that you can  warm up and use to clean up they are pleasantly scented and have a deodorant property.  other options  is not asking her it's simply telling her it's time to take a shower  or getting  her  to follow you  into the bathroom  and  get her into the shower.  ",https://www.reddit.com/r/Alzheimers/comments/5bldo9/how_to_get_my_mom_84_to_shower/,How to get my mom [84] to shower
"some useful info: her parents live on the other side of the world, so she's feeling really guilty about not being there for them. her father is in the very early stages. luckily, my wife picked up on some weird behavior and took him to a doctor during her last visit, so he was diagnosed very early. so far, the only two symptoms he's shown are that he's having a bit of a hard time following some things (complex movies, for example) and a hard time driving at night. he hasn't shown any signs of memory loss yet. honestly, i don't know much about alzheimer's yet, but i'm learning. ", check for a local support group at www.alz.org both for your wife and look for one where your mother in law lives. loosing someone to alzheimer's is a strange grieving process and it's not always easy. i would suggest she visits home when it's possible. not necessarily to help but to spend time with her after before things change too drastically. she may regret not spending time with him later if she doesn't now.  ,https://www.reddit.com/r/Alzheimers/comments/5bjx47/my_fatherinlaw_was_just_diagnosed_my_wife_is/,My father-in-law was just diagnosed. My wife is taking it really hard. What tips do you have for supporting her?
," my mom was never an outdoors person, generally content to stay in the house and not look out the window much.  i don't notice much change in her in poor weather.",https://www.reddit.com/r/Alzheimers/comments/5b6nga/question_how_much_do_the_weather_changes_impact/,Question: how much do the weather changes impact your loved one with Alzheimer's?
[removed],,https://www.reddit.com/r/Alzheimers/comments/5b55qk/is_my_grandpa_rip/,Is my grandpa rip?
i have guilt. i have guilt about making steps to move on with my life and not be there to help my mom 100% of the time. i have major guilt about that. she says to not let her or dad hold me back...but guilt creeps back in.," i had moved about 500 miles away three months before my mother was diagnosed with alzheimer's. i called and visited as often as i could. my stepfather kept me up to date on all of her appointments and any research trials he could get her into.just make sure to keep the lines of communication open. live your life, go to work, sleep, eat, go out. she wouldn't want you to languish at home. she knows how you feel, trust me.",https://www.reddit.com/r/Alzheimers/comments/5b3hah/need_to_vent_do_it_here/,Need to vent!!! Do it here!!!!
