submission,comment,url,title
"hi everyone i was hoping for some good ideas for a care gift package for a man and a woman with alzheimer and dementia. my bf's great gran and a close friend of mines grandfather both now live in facilities and sadly are to faraway to visit often. both wanted some help in figuring out good gift bundles. we are all agree that food isn't a good idea since they are not sure of all of the possible food allergies their grandparents may or may not have due to new meds and possible bed mates having equally allergies from various food. so outside of food, what other items would be good idea? any help would be great. thank you.  "," if they live in an assisted living complex (or even some nursing homes) they may have a beauty parlor, or the activities coordinator may plan outings and both of these generally have costs attributed to them. many people and their families spend so much on the care that these extras are few and far between. you may be able to purchase a gift certificate for these. ",https://www.reddit.com/r/Alzheimers/comments/554uhl/monthly_caregiving_gifts_for_a_people_with/,Monthly Caregiving gifts for a people with Alzheimer?
"mums forgetting grandchildrens names, tried drugs, didnt like them. sister told her she was 25 when she's actually 42. mum said i cannot believe your that old, sisters eldest is 22. sister sees her for 5 hours on a weekend, i watch her everyday. asked my mum if she wanted to go, and she said no as she is afraid of people finding out locally. sister said she would go with her, but whats the point? just dont want to upset my mum. mum afraid in the past that sister will stop her seeing grandchildren, which she has done before diagnosis. what should i do?"," is the memory clinic like adult day care you can go to every day?  or are we talking more like going to the doctor periodically?if the former (day care) - there is supposed to be a benefit to alz patients engaging in activities to keep their minds sharp.  socializing is also beneficial.  i imagine the day program would incorporate both.  i'd advocate for her going.  the pride issue is a tough one - my mom has gotten to where she won't take any help - the earlier you can get her in a program and used to it, the better.if the latter (doctor's office) - definitely go.  if she hasn't had an mri or other workup - it could be something other than alz (friend's grandma had alz-like symptoms, turns out it was a weird brain cancer that is super treatable, go figure).  offer to make the appointment first thing in the morning where people are less likely to see.  or your sister can offer to pretend like the appointment is for her if you bump into anyone on the way.and talk to your sister about the cutting off of the grandchildren.  hopefully now that she has a medical diagnosis (other than grandma is being weird) she'll not withhold the grandkids.",https://www.reddit.com/r/Alzheimers/comments/54z71c/mums_getting_bad_im_main_carer_my_sister_pushing/,"Mums getting bad, I'm main carer, my sister pushing for her to re-attend memory clinic"
hello! i am writing a play about a person who gets dementia at around the age of 20-30. since getting dementia in such young years is extremly rare i struggle with finding good information. i was wondering if someone here has experience and/or know a direction to point me in. i am generelly looking for information regarding effects on his/hers social life and also the transition after getting a diagnosis. thanks in advance!," you might consider reading still alice.  the protagonist is 50s-60s iirc, but should still give you some insight.",https://www.reddit.com/r/Alzheimers/comments/54mz24/theatre/,Theatre
my grandfather who has alzheimers wont stop picking away at his skin. his arms and legs are red raw and look so sore. he's started picking his head and face now too.. has anyone experienced this situation before? any advice as to how i can help him would be appreciated. i'm scared of him getting sepsis. thanks," i have seen things like this before when i worked as a caregiver in a dementia facility . it sounds like a boredom/anxiety problem. there are these stuffed toys that have a lot of buttons and other things on them to pick at and touch that are made for alzheimer's patients. they are made to give the patient a tactile experience. i can't remember their name, but google alzheimer's dolls or stuffed toys. you may also try keeping music playing for him in order to get him some stimulation. if these measures fail consider discussing a medication with his doctor to address anxiety and agitation. also, after he showers, make sure a lotion is being applied such as lubriderm in order to alleviate dry skin that may be causing him to feel uncomfortable.",https://www.reddit.com/r/Alzheimers/comments/5471gp/alzheimers_and_skin_picking/,Alzheimers and skin picking
[removed],,https://www.reddit.com/r/Alzheimers/comments/545emk/preserve_memories_and_assess_alzheimers_using/,Preserve memories and assess Alzheimers using machine learning
"i live in a major city and was able to take some classes from the alzheimer's association, where i learned some very valuable strategies for caregiving and coping - and understanding what the disease is about.  there are also support groups available here.my stepdad, the primary caregiver, lives somewhere where he can't access the resources that i was able to.  he's getting so frustrated with my mom as the disease progresses.any ideas for how to help him understand?  (he can't focus for long periods, so a complicated book wouldn't work.)"," hello, this is the best advice for you..how to deal a person with alzheimer’s disease.  hope this would help...",https://www.reddit.com/r/Alzheimers/comments/545da8/how_did_you_learn_your_caregiver_strategiescoping/,How did you learn your caregiver strategies/coping skills?
what can i say...i am a family member caregiver and this is hell on earth!," it sucks.  i try to visit at least a couple times/week and talk to my family who are there 24/7.do you have anyone who can help out, maybe give you a few hours off once or twice a week?",https://www.reddit.com/r/Alzheimers/comments/53wh9k/hell_on_earth/,He'll on Earth
"so, i'm 34, and i am the primary caretaker for my grandmother with alzheimer's. she's got moderate to severe alzheimer's, at this point. over the last year, she's started having seizures and a lot of falls.  in fact, i've held her in my arms for at least 8 seizures. every seizure makes the dementia much worse.yesterday morning, i woke to her screaming. she got up earlier than usual and somehow ended up laid out on the kitchen floor. i think she had another seizure. i had the paramedics come (which is not our first rodeo, unfortunately), and spent 12 hours in the er. no broken bones, but the doctor wanted her to go to a skilled nursing facility for 20 days to help her strengthen her muscles through physical therapy to minimize her falls. we have never put her in a facility. she already called me this morning in a state of total confusion. it's heart wrenching, and i don't know if i did the right thing.does anyone have experience putting someone in a short term facility? i could use any advice."," my mom was no longer safe to live at home alone and we all work full time, so there was no choice. she had to go into a full time care facility. not what i would have wanted but it was necessary. she's safe and so is everyone else who lived in her condo. she can't start a fire or do anything that might harm anyone but her. her meals are served to her and her meds are handed to her at the appropriate times. we all visit when we can but in truth, her dementia has progressed to the point that visiting her causes her great distress because she doesn't know us.  sometimes she's sad because she knows she should know us and sometimes she's mad because we're strangers and she doesn't want us around.  doesn't matter.  it is the disease. if she doesn't want me around i leave because she will not remember if i was there or not.  that's part of the disease. i visit for my sake - to make sure she's well cared for and that she's doing ok.  so don't feel guilty. if she had cancer, you wouldn't feel bad that you couldn't cure her. you would let the experts do their thing.  and that is what you're doing right now.  ",https://www.reddit.com/r/Alzheimers/comments/53nx4d/had_to_take_my_grandmother_to_a_facility_for_the/,Had to take my grandmother to a facility for the first time yesterday....
i am currently exploring the idea of creating an app for people with alzheimer's and the problems that they face. what are some problems that people with alzheimer's face and their families face?," i can't think of one person with moderate to advanced alzheimers who would know anything about using a tablet.  they can't hold anything in their memories including the most basic things, so the idea they could use a tablet is beyond possible.  my mom insists she listens to music on her stereo and shows me the microphone, which is the electrical cord for the darn thing. she has lost the memory of all nouns, so every noun is 'walker'.  she wants me to change the walker behind the walker and she's pointing to the bathroom. i make my way to the room trying to figure out what she wants and eventually figure out she wants me to turn out the light in the bathroom which is behind the television. with this kind of confusion, there's not a chance she could remember the instructions for using an app.",https://www.reddit.com/r/Alzheimers/comments/53aofe/what_are_some_problems_that_people_face_with/,What are some problems that people face with Alzheimer's
[removed],,https://www.reddit.com/r/Alzheimers/comments/539j79/a_friend_of_mine_just_completed_the_trans_america/,A friend of mine just completed the trans america cycling trail!!
my dad gets distracted on the toilet and always buckles his pants again...then struggles to get them back on. we need to buy more stretchy pants. , my husband eventually had an all-stretchy-pants wardrobe. he loved them!,https://www.reddit.com/r/Alzheimers/comments/53306b/venting_friday/,Venting friday!!!
a doctor in new hampshire is prescribing tasigna and wants more patients now. my mother inlaw has been on tasigna for 35 days and is showing wonderful improvement. there are some requirements so please if you are interested contact me tomthung@yahoo.com or reddit's inbox. while georgetown and mjfox foundation fight over who gets credit for tasigna this doctor is helping.," this is neither and endorsement or condemnation of the drug or trial. before starting any trial or medication make sure to do the research yourself. [here]( is an article about the one of the studies. [here]( is one of the studies, this one is a small study group (12) and no control group. [here]( is the original rodent study. [here]( is the fda guidance for selecting patients for ad studies. [here]( is the fda's info sheet on the chemotherapy drug in question (it should be noted that the trials use a smaller dose for alzheimer's).   it's possible that i have missed a study or important article so make sure you do your own research as well. ",https://www.reddit.com/r/Alzheimers/comments/531smk/parkinsons_lewy_body_demetia_alzheimers_disease/,"Parkinson's, Lewy Body Demetia, Alzheimer's Disease Read This."
"just like seth rogan (hilarity for humanity), i've learned that laughing is a great way to avoid crying about my dad. i'm giving my senior thesis at baylor on the mechanism and biochem underlyings of the disease, and it's boring stuff to most people. i've got some funny stories of my own from my dad, but what do y'all have? anything your loved ones have done/said that you couldn't help but laugh at? help me out!"," my dad quote elvis now.....yeah.. he never liked elvis but now he says ""thank ya, thank ya very much"" then chuckles to himself. ",https://www.reddit.com/r/Alzheimers/comments/52x1b8/laughing_the_pain_away/,Laughing the Pain Away
"u/angrydroid has been a long time participant in r/alzheimers, in fact angrydroid asked to take over r/alzheimers after noticing the previous mod abandoned it but enough time had not yet passed.  like the rest of the mod team, angrydroid's life has been personally effected by alzheimer's disease. having been a mod of r/wwii angrydroid will be a welcome addition to the mod team at r/alzheimers!", woooooo! welcome!,https://www.reddit.com/r/Alzheimers/comments/52oohx/join_me_in_welcoming_uangrydroid_to_the_mod_team/,Join me in welcoming U/AngryDroid to the mod team!
"this is a story about my depression, what caused it, and how i am working to conquer it.  bear with me. it's pretty elaborate.  i am posting this in several subreddits so it might feel somewhat broad, but i want to help as many people as i can.i am 30. i started smoking weed when i was 13. it started innocently, like most of us. in today's culture it's pretty difficult not to be a little curious as to what it feels like to be high if you have never done it before. when i started, it wasn't nearly as accepted as it is today, so i could only imagine how the kids feel today.i was expelled from high school my freshman year in only the first week for possession, which pretty much sent my depression into a downward spiral. people think they're fixing the system by ""getting rid"" of the bad kids, by throwing them in alternative school or whatever your county may have, but really all it did was put me in a room full of kids who abused drugs. i was extremely depressed: none of my friends' parents would let them talk to me anymore, my parents were extremely disappointed, and i pretty much squandered every chance of getting into a good school. this lead to suicidal tendencies and a depression that would lead well into my twenties.i had older parents, and my mom was diagnosed with early-onset alzheimer's disease while i was in high school. i was 16. i was really embarrassed by this in a weird way: she would forget my friends' names, she would say really off-the-wall shit, or she would ask us about things that didn't happen or things that happened a long time ago in her childhood. because of this, i didn't let anyone into my house and never had friends over. years later, my psychologist friend helped me understand that ultimately this is because i was trying to protect her, because i didn't want people to think she was stupid or to embarrass her. admittedly, it was a little selfish, too.weed, alcohol, and drugs became my best friends, and i stopped hanging out with the kids that were clearly destined for success, and started hanging out with the ""bad kids"", similar to those from that school i went to, who were abusing drugs and alcohol just like me. if anyone says that weed is not a gateway drug, they're wrong. ultimately my weed use connected me with people who used lsd, xanax, vicodin, oxycontin, percocet, valium, klonopin, cocaine, mushrooms, dmt...pretty much you name it. and i wanted all of it, and in excess. i wanted to be numb.my mom's health continued to deteriorate, and when i was 18 my dad had a heart attack, a stroke, and had an aneurysm on his aorta. i was delivering pizzas at domino's while taking care of him.my older brother and i were forced to put my mother in a nursing home. before she was really sick, she told me that if she ever got a point where she couldn't take care of herself, then i needed to put her in a home. so that's what we did, and it's a decision i still struggle with to this day.this whole time, i was heavily abusing alcohol and drugs. i had developed a painkiller addiction and was taking up to 10 percocets a day, and was hanging on by a thread. i overdosed several times. i was smoking an 8th a day of weed. i was drinking whiskey by the fifth. amazingly, i got straight a's at a local community college while dealing with all of this. i was studying art and loved to draw and just being creative in general. but man...i loved to be messed up.a week before i was going to university, my dad passed away. he was my best friend and is still the person i have been able to connect with the most in life. my family was extremely poor because of all the illness, and the bank repossessed my family's house. at 22, i was homeless, i had a drug addiction, i was an alcoholic, and the only family i had was my brother who was in the navy in japan.i tried to tough it out and do the right thing and go to school anyways like i know he would want me to do. i moved into the dorms at 22 because i had nowhere else to live. i barely left my dorm room, didn't talk to anyone about what i was going through, and was drinking and smoking weed heavily every day. i had a few friends, i guess, but it was only friends that would drink with me. we never talked about what i was going through.the first semester i got all a's, but the second semester i pretty much stopped going. this is probably the lowest point in my life. i failed almost every class. i was forced to drop out, but at the same time, there was a tinge of hope: i played guitar in a band with some friends and it was actually have some success. i met an amazing girl named amber, and things seemed to be on the come-up, at least emotionally.just as things were getting better, i got the phone call that my mom was about to pass away. i went and saw her in the home one last time. amber had become concerned with my drug abuse and alcoholism, and flew me to live with my brother in virginia while he was stationed in norfolk. my brother had married a woman from japan. she wasn't very understanding: ultimately, she kicked me out of the house after a month because i wasn't going to get a job. i went and stayed with some friends of my family a couple of hours away, where i stayed sober for an entire week and tried to pull myself together. ultimately i went back to amber.at this point i was 25, i was in debt over $20,000 from school, i had no parents, no money, no house, no car. i was started smoking weed and drinking again. but amber still believed in me. she saw the person that i really was beneath the veil of alcohol and drug abuse, someone that i myself barely knew was there. after she received her degrees in psychology and music, we moved down to florida where she was from.my time in florida has been pretty good, honestly. i have grown a lot as a man since i was 25. i learned to program in php and started a career building custom wordpress themes for small businesses. i now own my own business, and even though i still struggle and don't make a ton of cash, i am so proud that i am even here and still trying.i have been alcohol-free for a month, narcotic-free for several years, and haven't smoked weed in about 10 days. it's funny to me that weed has been the last thing to go, and i will be honest, i am having a harder time not smoking weed than anything else i have had to deal with. i am reading tony robbins' book awaken the giant within, which is helping me challenge my core beliefs about myself and to rewire all of the negativity i have had my entire adult life.i proposed to amber a couple of months ago and she said ""yes!"", which was and still is the greatest feeling in the world.i am posting this because i want to help. if you are depressed, or are abusing drugs or alcohol, or one of your parents has cancer, or one of them has alzheimer's, or you are feeling alone...i can tell you from the bottom of my heart that things are going to get better and things will be okay. i truly love you, and i don't say that as a shrink or a counselor: i say that because i have been there, and i needed someone to tell me that really badly some days.  i still deal with the regret of leaving my mom in that home.if you need me, i want you to find a way to message me right now. let's figure it out. i will gladly do anything i can to help you figure things out, even if it's just listening. at this point in my life, i feel there's very little i can't handle or conquer. i know i can help you.thanks to anyone who reads. this is been very helpful to me this morning.j", [deleted],https://www.reddit.com/r/Alzheimers/comments/52l7u5/lost_my_mom_at_25_i_am_here_to_help/,Lost my mom at 25. I am here to help.
"so my nan has this cruel illness and has for about 8 years.my grandfather became her carer all being fine at first.over the last two years he's cut off all access from our family. my mum hasn't seen her mum since xmas last year until last week. when we found out shed been in hospital for over 5 weeks and he didn't say a thing to anyone. he gone nuts, driven a wedge throughout our family and my nan is so bad now she's gone, totally gone.none of us got to see her, the real her, one last time.now my grandfather is telling everyone the inheritance is going to his real children and has been cruel and nasty about everyone in the family. no one cares about the money,  we only care about my nan.how can this happen? how can he be allowed to lie to social services and doctors making it seem as if everything is fine wheb he's not been coping for years. he is her next of kin so has the final say this is why we've not been able to do anything. we were supposed to be banding together not splitting up as a family.nan had a fall and broker her ankle, then he tries to take her on holiday the day after.my parents have done nothing but offer help, offer to pay for anything generally help out since day one. he's thrown it all back for some reason.now she has a tumor, is too weak for a biopsy, and is in the final stages. she only went into hospital because he couldn't cope. selfish old loon.so this is how it ends, a family in tatters.fucking wonderful. thanks granddad.i'm telling you, if you know someone with this condition being cared for by another older person.... intervene asap. no matter what. sorry rant over", i'm sorry you are going through this. i've had something similar in my family. wishing you well. ,https://www.reddit.com/r/Alzheimers/comments/52eqms/our_story_i_hope_no_one_goes_thru_this/,Our story - I hope no one goes thru this
"hello again, /r/alzheimers!  this will be my last reminder post.you are invited to take part in a research study regarding dementia caregivers. this study is being led by amy olzmann, m.a. and amy houston, m.a., and supervised by john barrett, ph.d. at xavier university.the study involves answering a series of online questionnaires designed to increase our understanding of caregiving. we are inviting participants (age 18 and older) who are primary caregivers for friends or family members with dementia to complete an online survey. caregiver participants must be able to read english. it is anticipated that this survey will take approximately 30 minutes of your time to complete. the survey is completely anonymous. however, if you would like to enter a drawing for one of sixteen $25 amazon gift cards as thanks for participating, you will be asked to enter your email address at the end of the survey. email addresses will be collected on a separate survey, and your name will not be linked with your survey responses.in addition, we request that you forward/share the survey link with other individuals caring for friends or family members with dementia who may wish to participate in this study so that they may have the opportunity to assist us in gathering information about dementia caregiving.please click on the following link if you are interested in learning more about the research study: amy olzmann, m.a. email: olzmanna@xavier.eduamy houston, m.a. email: houstona1@xavier.edu",,https://www.reddit.com/r/Alzheimers/comments/52bvdo/caring_for_a_friend_or_family_member_with_dementia/,Caring for a Friend or Family Member with Dementia?
[deleted],,https://www.reddit.com/r/Alzheimers/comments/528qb4/my_mom_told_me_my_dad_is_at_risk_of_alzheimers/,My mom told me my dad is at risk of Alzheimer's and idk what to do
once 7 o'clock hits my dad just wanders around the house. front to back. i just can't think of anything that can hold his interest so that he isn't wandering around.," my s.o. has spent the day in front of the t.v. watching movies.  i welcome the break but at the same time know that it will result in additional confusion in the end as all the stories and worlds meld together.  turning it off will result in anger, so i have to find something more interesting to take its place and that's not always easy.",https://www.reddit.com/r/Alzheimers/comments/51ydv2/vent_it_out_friday/,Vent it out Friday!
