submission,comment,url,title
"hello again, /r/alzheimers!you are invited to take part in a research study regarding dementia caregivers. this study is being led by amy olzmann, m.a. and amy houston, m.a., and supervised by john barrett, ph.d. at xavier university.the study involves answering a series of online questionnaires designed to increase our understanding of caregiving. we are inviting participants (age 18 and older) who are primary caregivers for friends or family members with dementia to complete an online survey. caregiver participants must be able to read english. it is anticipated that this survey will take approximately 30 minutes of your time to complete. the survey is completely anonymous. however, if you would like to enter a drawing for one of sixteen $25 amazon gift cards as thanks for participating, you will be asked to enter your email address at the end of the survey. email addresses will be collected on a separate survey, and your name will not be linked with your survey responses.in addition, we request that you forward/share the survey link with other individuals caring for friends or family members with dementia who may wish to participate in this study so that they may have the opportunity to assist us in gathering information about dementia caregiving.please click on the following link if you are interested in learning more about the research study: amy olzmann, m.a. email: olzmanna@xavier.eduamy houston, m.a. email: houstona1@xavier.edu", completed - interesting questions,https://www.reddit.com/r/Alzheimers/comments/50x1j6/caring_for_a_friend_or_family_member_with_dementia/,Caring for a Friend or Family Member with Dementia?
"my mother is 76 years old and today i alker her to the bus and she forgot her husband's phone number.. even though i repeated her the number she just keept repeating ""no, no.. that can't be the number i'm sure."" she also suggested that she may have alzheimer.. at first i thought.. nah.. you don't get alzheimer just because you forgot a number right?.. but she was lost in it trying to remember.. she didn't pay attention to me because she was 90% focused on remembering the number,, that's when i got really scared.. she went up into the bus and i inmediately came here to ask this and search for info.. should i be worried?", [deleted],https://www.reddit.com/r/Alzheimers/comments/50tgh9/my_mother_forgot_a_number_and_got_scared_should/,My mother forgot a number and got scared.. should we be worried?
"this is actually about all the ""news"" that has been popping up recently about alzheimer's. those who have a loved one with the disease do you become happy about those type of stories or do you ignore them? i ignore them. all the stuff that being discovered can't help my dad...so while its great for the future...it doesn't effect me at all. "," i have thought about this a lot. my mother-in-law is so far down the path that i don't think that there is any cure available. and if it were, what would it be like to 'come back' and find so much of your life gone. your husband dead, your body deteriorated and you're in a strange house in a strange city.i am very glad that there are advances being made, but i don't think they are an option for us.",https://www.reddit.com/r/Alzheimers/comments/50tgb8/vent_friday_again/,Vent Friday again!!!!
i am always looking for people going through this but particularly children who are going through it alone with no 2nd parent. i kind of feel like it is different for us. please feel free to comment below on this or pm me if you are. i want to start a group of us to chat.," just moved back into mother's home in preparation for putting her into some type of assisted living/memory care unit - dad died last thanksgiving - it's hard.  it's unbelievable hard.the paranoia, money, frustration and anger now that she can't drive - it's time and the scary part is that we're not certain how we're going to pay for it all.",https://www.reddit.com/r/Alzheimers/comments/506r8k/does_your_last_living_parent_have_alzheimers/,Does your last living parent have Alzheimer's?
[removed],,https://www.reddit.com/r/Alzheimers/comments/5056e7/new_phone_service_launched_designed_for_loved/,New phone service launched designed for loved ones living with Alzheimers and a mobile app for their caregivers
my place of work is having a family picnic. unfortunately taking my dad to a park was not an option.,,https://www.reddit.com/r/Alzheimers/comments/4zqqff/venting_friday_again/,Venting Friday again!
"hello!you are invited to take part in a research study regarding dementia caregivers.  this study is being led by amy olzmann, m.a. and amy houston, m.a., and supervised by john barrett, ph.d. at xavier university.the study involves answering a series of online questionnaires designed to increase our understanding of caregiving.  we are inviting participants (age 18 and older) who are primary caregivers for friends or family members with dementia to complete an online survey. caregiver participants must be able to read english.  it is anticipated that this survey will take approximately 30 minutes of your time to complete.  the survey is completely anonymous.  however, if you would like to enter a drawing for one of sixteen $25 amazon gift cards as thanks for participating, you will be asked to enter your email address at the end of the survey.  email addresses will be collected on a separate survey, and your name will not be linked with your survey responses.in addition, we request that you forward/share the survey link with other individuals caring for friends or family members with dementia who may wish to participate in this study so that they may have the opportunity to assist us in gathering information about dementia caregiving.please click on the following link if you are interested in learning more about the research study:   amy olzmann, m.a.email: olzmanna@xavier.eduamy houston, m.a.email: houstona1@xavier.edu", does it have to be a friend or family member you are caring for?  i am a memory care  caregiver as a job and would  love to take the survey as long as that is allowed. ,https://www.reddit.com/r/Alzheimers/comments/4zq2rj/caring_for_a_friend_or_family_member_with_dementia/,Caring for a Friend or Family Member with Dementia?
"with us just moving to nova, getting supports set back up for my mil like we had in pittsburgh is proving to be  a challenging and lengthy process. we just got approved for her to go to a day program 2 days a week. some background is...in pittsburgh she was going to a day program 6 days a week. with the move she is all upside down and the confusion has increased greatly. there is also no set schedule. she doesn't recognize our house as home (she's been living with my husband and i for almost 2 yrs now) and has had a hospital stay already to add a med to even her out from sun downing terribleness. my question is...will 2 days a week help her or make things worse? she really thrived at the day program where she was. she thought she was going to work and absolutely loved it. thanks in advance for your thoughts.",,https://www.reddit.com/r/Alzheimers/comments/4z3g7z/need_input_on_day_program/,Need input on day program
[deleted],,https://www.reddit.com/r/Alzheimers/comments/4yzx6d/hello_i_am_25_years_old_and_i_am_very_very_afraid/,"Hello, I am 25 years old, and I am very very afraid."
"my boyfriend (much older than i am) has shown many signs of alzheimers, but i am afraid to just come out and say that he might have it because he gets enraged at the snap of a finger. i would like to mention it to his daughter so she could bring it up, but she doesnt come around very much and has many problems of her own. any suggestions would be appreciated. ", the anger/sensitivity is a sign too. if we had gotten my dad diagnosed and on blood pressure meds a long time ago he would have been much better off. sooner rather than later with this. also. record conversations or use a nanny cam if you can. ,https://www.reddit.com/r/Alzheimers/comments/4yrg7w/how_do_you_tell_someone_they_are_getting/,How do you tell someone they are getting alzheimers?
"how would one pay to access any of these trials? my father is in oklahoma, and there just aren't any promising trials in the area.he has the money to self-fund it, he just needs the opportunity. how would one go about self-funding a trial?"," i'm not how you can self fund your own trial - but im working with an organization that is crowd funding the best and most promising alzheimer's trials around the world.  might no be an exact fit, but wanted to let you know there are options to give to clinical trials that have real scientific promise. www.givetocure.org @givetocure /givetocure",https://www.reddit.com/r/Alzheimers/comments/4ykfgx/patientfunded_trial/,Patient-funded Trial?
i think sometimes that people who aren't going through something similar don't understand fully when you have to get something off your chest .," i have had a frustrating week of doctors appointments. it not that they aren't needed, or are a waste of time just plentiful.  we went to the primary care office, went for blood work, went to urology, went for e.k.g. and went to a swallow study. it's difficult because currently we also have home health coming for pt and ot twice a week each.  it's normally not this bad, just happened to need a bunch of things done after a recent hospital stay, but man is it frustrating! ",https://www.reddit.com/r/Alzheimers/comments/4yjkui/venting_friday/,Venting Friday!
[deleted],,https://www.reddit.com/r/Alzheimers/comments/4yidw3/full_moon_sun_downing/,Full Moon - Sun Downing
"every 66 seconds someone in the us develops alzheimer's disease. over 5 million americans are living with it. alzheimer's disease is the only disease among the top 10 causes of death in america that cannot be prevented, cured or even slowed.alzheimer's and other forms of dementia are something i encounter on a daily basis through my work. i see people every day who are scared, angry, sad as they feel their minds slip away from them. i see people struggle to form sentences, words, thoughts. some are just an empty shell of the person they once were. i see family members cry watching what's happening to their loved ones. some are in denial. some abandon their parents or grandparents altogether. some stay by their side all the way to end just hoping to catch those few clear moments on a good day. it's an absolutely devastatingly sad disease. i'll be participating in this walk to fight alzheimer's to help raise money for research and to help families struggling with the cost of caring for someone suffering from alzheimer's and other forms of dementia. please support this cause with a donation of any amount and/or come out to join the walk.",,https://www.reddit.com/r/Alzheimers/comments/4yde4r/walk_to_end_alzheimers_2016/,Walk to end Alzheimer's 2016
"my grandmother will attempt to sneak food from the kitchen fridge if her door is left open, we've resorted to installing a lock on it if no one is able to supervise her when outside of the room.because she's in her room for extended periods of time she has a commode chair (porta potty) next to her bed if she has to go during the night. we'd like to install a privacy barrier of some sort that can connect her room to the bathroom which is directly next to her room, it would have to be undefeatable for a elderly that will attempt to bypass locks and such which she has a tendency to do. this would allow us some peace of mind as we all want her to be able to have the simple pleasure of using the normal restroom whenever she wants but cannot due to guaranteed attempts at making multiple attempts at sneaking food from the kitchen."," tbh, if the only problem is stealing food - the lock sounds like a good plan.  or maybe keep some snacks she can have whenever (fruit cup, crackers, etc.) in her room or out on the kitchen counter so she's less motivated to go searching for food?  depending on how advanced she is, you might try disguising the refrigerator as something else (there are adhesive door disguises for people who tend to wander - stickers that make the surface look like a bookshelf or something; i imagine you might be able to work with one of those).",https://www.reddit.com/r/Alzheimers/comments/4y9sic/privacy_barrier_to_block_grandparents_access_to/,[deleted by user]
hi everyone!  we have discussed setting up a faq section with common questions and answers and we need to increase our resources section as well.  i will be adding [the national council on aging]( and [veteran's affairs](  what common questions and resources would you like to see answered and added?edit: a passing thought we should be on the look out for a national option for free durable poa and living will etc. ," like a ""getting started"" section - i suspect my loved one has alz., so i should do x, y, z",https://www.reddit.com/r/Alzheimers/comments/4y3xgp/ralzheimers_needs_your_help_to_make_a_faq_section/,/r/Alzheimers needs your help to make a FAQ section!
[removed],,https://www.reddit.com/r/Alzheimers/comments/4y2oiw/the_treatment_of_alzheimers_disease/,The treatment of Alzheimer's disease
[removed]," to the moderator: i just saw your email comments.  hopefully, this will address your concerns.",https://www.reddit.com/r/Alzheimers/comments/4y1lg1/misplaced_censorship/,Misplaced censorship
[removed]," please read the sidebar before posting.  you do not link a study showing alzheimer's has been successfully treated in humans, but you ascertain that we know the cause and can reduce the symptoms and link only an image.  your post will be removed soon if you do not change the wording or provide links to support your claims. ",https://www.reddit.com/r/Alzheimers/comments/4xu637/alzheimers_disease_connecting_the_dots/,Alzheimer's disease: Connecting the dots
[removed]," please read the sidebar before posting. please link the studies you reference and studies to support your claims. please do not link personal webpages, blogs etc. your post will be removed soon without appropriate changes. ",https://www.reddit.com/r/Alzheimers/comments/4xqrn7/putting_the_last_few_pieces_of_this_disease/,Putting the last few pieces of this disease together
"my grandma has been suffering from severe alzheimer's for a decade and his daughter, my mom, has been taking care of her. today i noticed my mom's memory is rapidly deteriorating. she was telling us some memories and she appeared to confuse many things and making up false stories. i'm so scared that my mom might end up losing her mind. is it already over? can i do something?"," i'm so sorry you and your family are going through this. dementia and general memory problems can be caused by many things including stress, medications and several diseases. it does not mean she has alzheimer's disease, but with a family history it is important to check it out. get her to set up a doctors appointment and if you can't be there with her, try calling or writing a letter to her doctor explaining what you have witnessed. if she is the primary caregiver, do what you can to ease the burden when you can. how long has it been since she took a vacation, went to the dentist, went to her own doctor or went out to lunch on her own?  it is very common for caregivers to neglect themselves as there is too much for a single person to handle. if you aren't able to help in that way because you live elsewhere or your schedule is restrictive search the internet for adult day cares, support groups, even just fun activities your mom might enjoy taking your grandmother to. i considered myself knowledgable in my area and discovered a program again the other day.  when i first took note of the program a few years ago it didn't fit our needs and i forgot about it until someone brought it to my attention last week and i realized it would be perfect. (last week i realized i no longer have to search out velcro shoes for my so, because while they were necessary at one time so he could put on and take off his own shoes but a friend pointed out i put on and take off his shoes so who cares if they tie or velcro). just try to be supportive of your mom personally as well. this is scary for everyone involved but even if she is in denial, it must be terrifying. if you can bring her favorite lunch by, or have a pizza delivered:) i have a dear friend who visits once a month and sits with my so for a few hours and pushes me out of the house to do something for myself. last month she was on vacation across the globe on the day of her normal visit. i received a call from her the day before and she asked me if i would be home. around the time she normally shows up the doorbell rang and it was a grocery store delivery guy with a few staples and one of my favorite candy bars. it was kind and i know that she spent less than a meal out, in fact the call may have cost more than the groceries! it doesn't have to be a grand gesture though, sometimes just a call or a card that says you are thinking of her will do it!",https://www.reddit.com/r/Alzheimers/comments/4xq95f/today_i_noticed_my_moms_memory_is_deteriorating/,Today I noticed my mom's memory is deteriorating. It's so scary
"my dad keeps trying to go in the garage.  which would be ok but he messes with the cars and crap out there.  he'll go to the door.  i'll tell him it's too dark/hot. he'll open the door and say ""oh, ok"" and walks away then comes back and does the same thing. -fun", [deleted],https://www.reddit.com/r/Alzheimers/comments/4xevzu/venting_friday_again/,Venting Friday again!
"i feel terrible for not seeing her every day (2 hour drive). my father is in a similar state. i am the only child available to help. they both blame me (at times) for their imprisonment. i can't take care of them myself. i would like my life back, so i can perhaps have kids of my own some day. my wife is almost as depressed as myself, as i have 'spread' it to her. sigh"," be still and know.a non denominational very quiet daily mental exercise.  give it minimum of a week and up to two than you will get it,at least i did nothing ventured nothing gained",https://www.reddit.com/r/Alzheimers/comments/4x98jr/im_33_my_mother_has_been_in_a_sl4_dementia_care/,Im 33. My Mother has been in a SL4 Dementia care for a year or so. My Depression is getting worse. I feel terrible so much.
"the video was beautifully shot and executed, about 5 minutes long, focusing on dinner parties hosted by an old man. at first his guests were plentiful but they slowly decreased in number, fewer places were laid, and the circle grew smaller and smaller. it was a brilliantly vivid illustration of the disease reducing his world bit by bit until nothing is left.i've not been able to locate the film/video despite a lot of googling - does this ring any bells with anyone? thank you.", [is this it?](,https://www.reddit.com/r/Alzheimers/comments/4x518x/trying_to_locate_a_short_alzheimers_videofilm/,Trying to locate a short Alzheimer's video/film
"hey. first time posting here, but i'm at a total loss.  my grandpa is 81 and has alzheimers. he can still do a lot of stuff, but he forgets stuff like what the plans for the day is, what he's already talked about (the same joke 8 times a day), can no longer drive a car, and because of alzheimers + hearing loss, he has a hard time keeping up with conversations.  my grandmother is taking care of him, and is doing her best, but she gets so frustrated - probably because he used to be so different from what he's like, now. unfortunately this turns into her snapping at him and coming off as insensitive towards him, as if she disregards the disease and makes it seem like he's forgetting on purpose.  i don't visit them often anymore, because it hurts too much to watch - the way ny grandpa is now, how my grandmother treats him, and how hard it is on her (they live just the two of them; ny aunts' families live in the same town but are busy with their own families).  honestly not sure what i'm even looking for. what bothers me the most isn't my grandpa and the disease, but my grandma and how she's treating him. i want to be able to visit without feeling like shit afterwards. a way to cope?"," i had the same problem with my mom dealing with my dad.  she gets tired.  she is tired of him asking 20+ times if we are going to the store. so we take over for her.  just keeping him in a different room watching a movie with him.  i'll take him out if i run to the store, picking up food or just out for a ride.  stuff like that allows her to breath and me normal again.  see if family members can help out maybe for an hour maybe once a week. you can come by and pick him up or even sit outside. just like with my mom & dad,  she loves your grandfather but this was not how life was suppose to be.  i hate to hear when she snaps at him...but the good thing is my dad doesn't care. doesn't phase him that he pisses her off.",https://www.reddit.com/r/Alzheimers/comments/4wkeja/caretaker_gets_frustrated/,[deleted by user]
"my grandma takes forever to eat food. she has her food liquified and moves her mouth like she's going to eat it, but it doesn't get in her mouth because she doesn't really widen it. it's like she forgot how. how can i feed her easily?"," my mother was like this as well.  it sucks seeing someone forget how to chew, swallow,  suck. we have her ensure as well and eventually bought a nutri bullet blender to blend her food with ensure, but that only goes so far. the real problem comes when she can't get liquids up the straw. can she swallow liquids without a straw? ",https://www.reddit.com/r/Alzheimers/comments/4wdnnb/my_grandma_takes_forever_to_eat_because_its_like/,My grandma takes forever to eat because it's like she forgot how to open her mouth or suck properly. Is there an easy way to feed her?
feel free to talk about stuff from the week. it can frustrations or silly things that have happened. ," vent thread.  i love it.mom's currently in independent living with her husband, but apparently she's been leaving her apt very early in the morning and wandering the halls.  i realized at her last doc appt that she doesn't even know what decade we're in.  i repurposed an old cheap android tablet to be a dementia clock and programmed in mealtimes and recurring activities.  i hope it helps.  free app - the facility people want me to move her to memory care but she says she is ""not interested; i'll just move back to [childhood town she hasn't visited since her parents died 15 years ago]!""  i dunno what i'm going to do with that situation.  plus we can't really afford one parent in memory care and one in assisted living.oh yeah, one of the other ladies saw us checking out memory care and was like ""what were you doing on the other side?  they don't want to put you there, do they?!  you don't need to go over there, have you seen the people there?!  i was across the street (assisted living) and it was terrible.""  thanks, ms. pat.  -_-visiting this weekend.  i usually crash on their couch but apparently they're both dealing with some stomach stuff (bathroom is in their lr).  fingers crossed.  there is a hotel nearby if it comes down to it.",https://www.reddit.com/r/Alzheimers/comments/4wb84q/on_fridays_we_vent/,On Fridays we vent!
"hello, i am hoping for some advice/guidance on where to start.  my dad was diagnosed by his doctor with alzheimers about a year ago.  since then he has gotten worse.  he still remembers everyone, but he is repeating a lot of things, and he forgets what he did just a little bit ago.  just last night he got into a car wreck which was his fault.  he is currently still in the hospital being observed for a heart arrhythmia (sp?)  my father has been on disability for the past 20 years or so.  he collects ss and has medicare only.  he just turned 64 years old and lives in western pa.  he lives with his long time girlfriend, but she cares for her recently disabled adult son full time.  i live 8 hours drive away, and with him getting worse i need to prepare for when he gets really bad.  i've seen both of my grandmothers go through this and i know it gets ugly.  this is all incredibly sad and i have no clue where to even begin.i am guessing i will eventually want power of attorney to make decisions for him.  i also know he will resist any kind of nursing home, but i feel his girlfriend will not be able to properly care for him.  some kind of in home type care would be ideal, but i know medicare is limited.  any advice at all is very much appreciated.  this is giving me such anxiety and its even harder not being near him to help.thank you so much in advance. i am grateful for a place like reddit where i can speak with others who have similar situations."," you definitely want power of attorney, including medical.  get this done sooner than later, while he still has capacity.  check with his doctor on how long it is safe for him to drive.  my mom's doctor sent a letter to the state fairly early; they in turn yanked her license.  she hated him for it, but i'm grateful she had to stop driving while she was able to remember she wasn't able to drive - i can't imagine trying to take keys from her now.",https://www.reddit.com/r/Alzheimers/comments/4w05rb/lost_on_where_to_start/,Lost on where to start
