submission,comment,url,title
"i just found this sub.  a backstory (sorry so long, but i intend to be posting a lot on here).  we were a happy family of 5.  three years ago, the head of my family, my brilliant older sister passed away at 48 from breast cancer.  my dad didn't go to the funeral, she lived out in cupertino (we live down south) and he can't leave the house, let alone fly.  he had no memory of her by the time she passed anyway.  we just found out my 40 year old younger sister in pennsylvania has stage 4 pancreatic cancer.  my dad has no memory of her either.  my family is falling apart.  my mom is his caregiver, they've lived in the same house for their entire lives and he will die here, no plans to move him anywhere.  he weighs about 75 pounds, but he still eats meals and can use the bathroom,  and he can walk very very slowly in a shuffling manner.  but he is rapidly declining.   my mom left last week to go up north helping my sis through her 4th chemo round.   i am taking care of my dad here by myself, i packed a bag and just moved in as soon as my mom left (he can't be left alone).  i live an hour away and by some miracle,  he definitely knows who i am and always tells me how much he loves me and loves my cooking when he sees me, so that is a relief.  he knows who my mom is.  he asks me 20 times a day where my mom is.  i just say out of town.  i lie to him about everything, i don't want to confuse him.  he wanders around when it gets dark and i just lead him back up to bed.  no major drama at all.well a few evenings ago (before he started sundowning this night), it finally happened.  he fell walking to the bathroom.  hard.  on his arm.  he lost control of his bowels, and started vomiting, unable to move but conscious.  i immediately called 911 and explained the situation.  i got my dad dressed on the floor and calmly explained to him an ambulance was coming but there is nothing to worry about.  i remained calm and told him i would be there the entire time holding his hand.  i showed him old photos of us together and he was smiling.   the paramedics showed up and i pretended to my dad that he was going on a fun excursion on a stretcher and he was totally at ease, everything was going smoothly.  until it wasn't.  they said i couldn't ride in the ambulance or even follow them to the hospital because i wasn't vaccinated.  they said stay home and wait for the nurse to call when he got into a room.  i understand, even though i had my mask on.2 hours hours later, the nurse calls to inform me he is in a room and she is about to give him the covid vaccine while he's waiting for the doctor to examine him.  what.  the.  fuck.  he hasn't left the house in 4 years, he weighs 70 pounds and was brought in on a 911.  i told her absolutely fucking not.  and if i find out they gave it to him, we were going to have a big problem.  he would never survive the side effects.  his blood doesn't even clot.  an hour goes by and the doctor calls.  said he didn't have a concussion but fractured his arm, which the doc bandaged up.  they said he's ready to go home and is being discharged.  it was 10pm.  i asked where do i park and, which room he was in.  they said pull up to hospital entrance and he is sitting outside in a wheelchair waiting for me to pick him up.  it was a 45 minute drive.  he sat out there alone at 11pm strapped down to a wheelchair in the freezing cold with nothing but a small blanket.  he was terrified and belligerent and said his arm hurt really bad.    i pulled up, got out of my car and banged on the door of the waiting room.  i demanded to see this doctor.   this douche doctor comes out with his discharge folder.  i said why is he alone in the parking lot, and where is the prescription for pain meds for his arm.  doctor says they ""do not give out prescriptions for opiates due to the potential for addiction.""  holy fucking shit.  i said ""he's 83 and has no memory of how he even got here.  give him some damn pain relief!""  dr. just said no and didn't even help me load my dad into my car.  is it normal to throw a dementia patient out of the hospital, alone, in the cold, strapped down to a wheelchair late at night, while sundowning, without so much as an advil?!!  they literally kicked him out of the hospital, alone at night in the cold.   he had soiled himself again when i found him.  he was terrified.  i cleaned him up when we got home.is this about the fucking vaccine or do hospitals just not give two shits about the elderly?  everything is fine now, he has no memory of it, but his arm is purple, he keeps asking what happened to his arm.  i've just been giving him advil with his breakfast and dinner.  he says he's not in pain so i stopped giving him the medicine."," best of luck op with your dad.  for your own peace of mind, please disable replies to this thread and do not come back here. unfortunately the topic of covid and vaccines are is split into two camps right now the right side or the other, its incredibly divisive and politicians, and bad actors are stoking the flames whipping the risk averse into a frenzy.  here's what the leader of my country said this week about the unvaccinated  [“they don’t believe in science/progress and are very often misogynistic and racist. it’s a very small group of people, but that doesn’t shy away from the fact that they take up some space. “this leads us, as a leader and as a country, to make a choice: do we tolerate these people? ""]( i'm double vaccinated, but not getting the 3rd shot because since i'm young and healthy and finally got covid latest variant. no covid booster shots can beat natural immunity, so i'm done with it.  best wishes.",https://www.reddit.com/r/dementia/comments/s21rie/my_dad_83_with_midlate_stage_dementia_and_his_er/,My dad (83 with mid/late stage dementia) and his ER visit. I don't even know where to start.
"mom is in a home now and spiralling downward quickly. my step-dad has said a few times recently how he can ""really see it now."" a year ago he was still saying ""possible dementia"" and that blew me away.tonight i was reminded of another moment leading up to this that was a sure sign that apparently went right over his head, presumably because he was too close to see the forest for the trees.we have norwegian roots, so we always had lefse at holidays. for the uninitiated, imagine a tortilla, but made with potatoes -- delicate and light.i made some over a year ago, and when i handed it to her, she stared at it and said she didn't know what to do with it.there was only ever one thing to do with it: spread butter on it, sprinkle it with sugar, roll it up, and eat it before your siblings got it.it took a lot of effort to make, even more effort to clean up, and was a cherished treat at holidays. and she didn't know what to do with it. all the while, her husband was saying ""possible dementia.""looking back now it just blows me away how the human mind works -- both sick and well."," hey, you can also roll it around a sausage",https://www.reddit.com/r/dementia/comments/s1zq6y/being_too_close_to_see_the_signs/,[deleted by user]
[removed],,https://www.reddit.com/r/dementia/comments/s1z8vn/just_some_words_to_anyone_whos_got_a_loved_one/,Just some words to anyone who’s got a loved one with Dementia
[removed],,https://www.reddit.com/r/dementia/comments/s1vchu/nursing_home_question/,[deleted by user]
"anyone have luck getting their loved one into one of these facilities? i’ve been calling it seems unless they are hospitalized they don’t want to take them in.i was trying to ballpark costs since she has no assets, her only income is ssi and she is covered through both medical and medicare but they don’t seem to want to engage unless she’s ready to go in at this moment. anyone have any guidance or luck with this? i’m in los angeles if that helps."," we moved my fil into an assisted living/memory care facility last week. we did not have any issues. several were toured, we decided, they came out and did an assessment to determine his level of care. that was on a friday. he moved in the following thursday.",https://www.reddit.com/r/dementia/comments/s1s5ra/memory_care_facilities/,Memory care facilities
[removed],,https://www.reddit.com/r/dementia/comments/s1pq8x/did_anyone_else_get_depression_living_with_a/,[deleted by user]
hi! my mom has fairly severe memory loss and “possibly” very early stage alzheimer’s. she’s still fairly functional but is definitely stumped by some unfamiliar/non routine tasks. recently she’s been talking about how blue the daytime sky is - she brings it up frequently (as if it’s the first time she’s mentioned it) and the sky looks pretty much the same to me. she’s also fixated on the street lights as they are very orange (as opposed to white). is this shift in her perception of color common?," this is interesting, my mum said to me look what’s that green bird in the garden…. it was a uk robin so brown and fawn with a red chest. it was in shadows but definitely not greeni also suspect there’s something else with the colours as she thought she had no toilet roll. it was in the holder white against white tiles",https://www.reddit.com/r/dementia/comments/s1p7v6/color_perceptions/,Color perceptions?
[removed],,https://www.reddit.com/r/dementia/comments/s1p52q/can_a_dementia_patient_have_a_psychotic_episode/,Can a dementia patient have a psychotic episode?
"my mom's doctors have never directly told her she has dementia. they screen her regularly for it, and she knows she doesn't perform very well, but i don't think she knows she officially has dementia. i don't mention it either, because i don't want to upset her. but i'm also wondering if there's any benefit to knowing? would it help her understand why she can't recall things etc? or would it just be upsetting?"," ... totally depends on how far along she is.  we (living with dementia symptoms) have support groups in text, zoom, etc.  i am very involved with ""dementia mentors"", but there is also ""dementia alliance international (much more into activism), and zoom group discussions with dementia action alliance (usa).  being a retired nurse, if there is a confirmed cause for her dementia (alzheimer's, lewy body, vascular dementia, fronto-temporal, etc) ... then being in a group with others who have the same type of dementia might be very nice for her, because she is likely to get into more of the technicalities for her specific type of dementia.  you might be interested in this article >> awareness of cognitive decline by truthful kindness at  ;",https://www.reddit.com/r/dementia/comments/s1o59w/are_your_loved_ones_aware_they_have_dementia/,Are your loved ones aware they have dementia?
[removed],,https://www.reddit.com/r/dementia/comments/s1mix6/i_became_a_caretaker_at_age_13/,[deleted by user]
, i talk about it a lot with my husband. it helps him understand what is happening to him.  i think it has allowed him to be less upset and frustrated at all of the things he can no longer do. he accepts it is part of the disease process.,https://www.reddit.com/r/dementia/comments/s1hj9g/do_you_tell_the_patient_they_have_alzheimers_or/,Do you tell the patient they have Alzheimer’s or Dementia?
"i’m 52 and suspect i have dementia, had this gut feeling for the past 4 years. these last few days have been awful with my family telling me ‘you told us hat 5 minutes ago’ but no recollection of doing so. going to get bread out of freezer but must have already been and done that, i could go on! i’ve plucked the courage to book a gp appointment for next tuesday to discuss it. i’m scared, i knew my chances of it is high, my mum and uncle had it, but they were in their 70’s, i’ve got hearing loss and never have slept an whole night in my life, 4/5 hrs on average. i don’t want to live through dementia, i have fibromyalgia, prolapses that i have to deal with on a daily basis but i can’t deal with my mind going, i’d rather end my life.   we put our dog to sleep so he doesn’t suffer so why can’t we have the right to die.sorry not sure what i’m asking, or wanting but maybe it’s just a rant to say dementia is a cruel disease"," sorry to read of your troubling situation. my wife at age 60 is going through the same thing… speaking from my perspective as her husband and partner, i have changed my thinking to look at myself as a support person and future caregiver. it’s only been 3 months since this came up as a likely diagnosis of ftd after a ct scan, and the first weeks were non-stop anxiety as i tried to get my head around what was happening, and then i came to terms with the reality that this was not an immediate death sentence and that we would have many more years together, albeit with a shifting balance in our relationship. make sure you are completely open with your gp. start writing out what you feel has changed with you; e.g. personality changes, loss of math ability, and difficulty with langauge and memory. ask for a full blood panel for the obvious things that might cause symptoms, and also a cat scan for any brain abnormalities (my wife has some left temporal lobe atrophy). best wishes to you as you come to terms with what is likely happening. i hope you have a good appointment and some conclusive testing from that, and i hope your husband will be able to adapt and be your loving partner and support going forward.",https://www.reddit.com/r/dementia/comments/s1guwz/feeling_lost/,Feeling Lost
[removed],,https://www.reddit.com/r/dementia/comments/s1d0nk/what_are_some_signs_that_the_end_is_coming/,What are some signs that the end is coming?
"i and my family think my mum (72) has some serious mental health issues, we think dementia is likely. she is a lovely caring person; the sort of person you'd bring a friend home to and she would fuss over them and make sure everything is perfect.in the last 2 years or so, she has changed, becoming fixated on odd topics (she watches hours of news everyday), become more moody and also very bitter. in the last week, she has been adamant it is the 28th of december, even tho my dad showed her a calender and tried to explain what day it was. she has had two arguements with people who were walking there dogs on the street past her house etc. it is so out of character. the problem is that she refuses to get help. my dad has asked her multiple times. i've mentioned it (in the guise of treating covid induced anxiety) and she told me my dad didn't want her seeing anyone. i’ve noticed these changes in the past couple of years, but it has swiftly accelerated in the past few months.i guess my question is, what is the best way forward? how do we get her help? i have not yet sat her down for a ""serious"" conversation as my concern itwill antaganoise her. any suggestions are much appreciated."," unfortunately for me and my mom (67), i raised concerns about her health and tried to urge  her to see a doctor for about 4 years. we had to schedule an appointment behind her back because she was losing so much weight, and so we used that as the focal point of the appointment instead of it being about her memory. it was a whole ordeal, giving the doctor warning about the situation, informing him on her refusal to seek care in the past, all this stuff we did behind the scenes, and we basically had to wait until we had an good opportunity to get her the care she needs. i don't know if this would have worked if she was more lucid, but the decline in the past 3 months has been more drastic than before so we had to work with that. they always say its better to get checked out sooner than later, but sometimes that's not always possible. keep advocating - if she gets upset by the proposition, looking back it was better for me not to agitate it. look for an opening and run with it if you can. the most you can do is speak up, you can't force anyone to receive care as much as we know they need it. in all my years of advocating, i know i did the best i could with the circumstances i was given.",https://www.reddit.com/r/dementia/comments/s18lom/how_do_i_help_my_mum_who_i_believe_has_dementia/,How do I help my mum who I believe has dementia (but refuses to acknowledge any issues)
[removed],,https://www.reddit.com/r/dementia/comments/s18age/last_resort_leaving_my_mom_at_the_er/,Last resort leaving my mom at the ER
[removed],,https://www.reddit.com/r/dementia/comments/s0u92d/research_volunteers_adult_children_and_parents/,Research volunteers: Adult Children and Parent's with memory loss
"i wasn't the right person when she was first diagnosed.  and 3 years later, even more so.what is the next step? i've been fighting with san bernadino ihss for over a year and can't get her a caregiver without a new hop to jump through just when i think we are close.i have to work to keep a roof over our heads. and when i am home, it is a constant barrage of her yelling fuck you at me or telling me just how awful i am to her or her cats. i feed her and the cats...it is far easier  to feed the cats. she goes through my belongings believing that i am hiding her random item of the day.i can't stand being near her. i can't relax at work because i am worried all day. the cameras i have to check on her well being through the day ar a constant source of stress. care facilities cost more nearly twice as much as i make. i am at wits end. and crying at work must surely be worrisome for my co-workers. i just can't do this anymore. i am ignoring chest pains, in hopes of it being ""the big one""."," others have you covered with the legal side of things. she also needs help with her yelling at you. talk with her doctor describe how she acts with you, and ask about anti-anxiety meds. you are in an area where medical marijuana is legal. look into thc gummies or cbd gummies. they can help mellow her out.",https://www.reddit.com/r/dementia/comments/s0ttkw/i_no_longer_the_right_person_for_this_job/,I no longer the right person for this job.
"so my father-in-law had a heart valve replaced about 4 years ago, then another heart procedure a year later. his mental acuity has been declining ever since. when his cardiovascular docs are asked about this, they essentially say he's lucky to be alive and it is what it is.without going into exhaustive detail, he's having a hard-time with short-term memory and generally how things work, where things are, what he walked into a room for, etc etc. but the main source of stress for him and his caregiver (his wife, my mother-in-law) is his daily insistence that he has to go to some kind of important event.the details are always a bit vague. it used to be a wedding. he would wake up every day thinking there was a wedding to go to. mil would tell him there was no wedding and he would accept it and move on with the day. sometimes he was more skeptical of there being no wedding, but it was more or less manageable.lately it has progressed to more difficult scenarios. last month it was a fight of some type involving men on horses, and he needed to go intervene. lately it's been an important presentation he needs to make, but he can't come up with the location or topic. the long and short of it is that he's having extreme anxiety about the need to physically go somewhere and do something that doesn't exist.his anxiety and insistence about these imaginary problems has been getting worse over the past month or so. he is able-bodied, meaning it may get to the point that he needs to be physically stopped from leaving the house. mil is at a loss about what to do, and i'm looking for any ideas. it's getting to the point that it's an all-day every day issue where he's constantly on the verge of a panic attack, which also has implications for stress on his heart.i suppose they could seek some kind of anxiety medication? playing along seems out of the question, as he has no concrete details on where these important events are taking place. so he can either be anxious and frustrated at home, or anxious and frustrated in the car or at some random location where these imaginary events are supposed to take place.what can they do? are there techniques for handling these kinds of delusions, either medicinal or otherwise? looking for something that can ease the burden on mil as well as stress for fil."," for my sister who had alzheimer’s, she would get upset if i disagreed with her. when she believed she had to go to work, i told her she was on vacation. when she wanted to go home, sometimes i’d get her in the car and drive around the block. by the time we got back, she’d forgotten all about her former home.",https://www.reddit.com/r/dementia/comments/s0pglf/fatherinlaw_has_daily_delusions_of_need_to_go_to/,"Father-in-law has daily delusions of need to go to a vague appointment, presentation, meeting. Causing high levels of anxiety. What to do?"
[removed],,https://www.reddit.com/r/dementia/comments/s0maon/how_do_you_guys_deal_with_long_delusions/,[deleted by user]
[removed],,https://www.reddit.com/r/dementia/comments/s0lgxd/grandma_becoming_stubborn_now_she_doesnt_want_to/,"Grandma becoming stubborn, now she doesn't want to drink water"
"hey all,i commented on another post about sleep and it got me curious. does anybody else feel really guilty locking their bedroom door at night? i've had incidents where either my mom would come into my room and freak me out, or somebody else would need help handling her. i dunno, maybe i'm just paranoid because i've woken up to use the bathroom and ran into her standing in front of the tv just staring blankly...honestly it creeps me out every time. like one of the paranormal activity movies. i just wake up periodically and check the cameras in the house from my phone to see if she's wandering, but her neurologist gave her a new medication that helps her sleep 10hrs through the night so the incidents have nearly stopped. i still lock my door though."," when i lock my door in her home she gets very angry. however, if i don’t, she will walk in while i’m showering, using the restroom, sleeping or just to pick a fight. bottom line, i need privacy & set boundaries. she’s angry most of the time anyways so why should we both be put out *shrug*",https://www.reddit.com/r/dementia/comments/s0ggjc/locking_my_bedroom_door_at_night/,Locking my bedroom door at night
[removed],,https://www.reddit.com/r/dementia/comments/s0b6xz/best_alexa_to_help_family_member/,Best Alexa to help family member ?
[removed],,https://www.reddit.com/r/dementia/comments/s09dtd/hallucinationsyall_im_kind_of_freaked_out/,Hallucinations—y’all I’m kind of freaked out 😳
[removed],,https://www.reddit.com/r/dementia/comments/s07clc/my_mom_is_getting_under_my_skin_again_with_her/,My Mom is getting under my skin again with her dementia. This is over 2 years of madness. It’s got me unraveled. Like pretty much demoralized.
"any advice for mil getting up at night, waking up fil, and both are exhausted the next day? it has been going on for a while. fil is thinking of nyquil or a benadryl to try to break the cycle for mil so they both can sleep.", benadryl and nyquil are two of many anticholinergic medications that can cause “permanent cognitive issues” even when taken for only a short time so i’d ask her doctor for a different medication.,https://www.reddit.com/r/dementia/comments/s07c8i/mil_up_at_night/,MIL Up At Night
[removed],,https://www.reddit.com/r/dementia/comments/s03t1d/is_anyone_else_struggling_with_alcohol_because_a/,[deleted by user]
