submission,comment,url,title
[removed],,https://www.reddit.com/r/dementia/comments/s7ksyz/early_onset_dementia/,Early onset Dementia
[removed],,https://www.reddit.com/r/dementia/comments/s7iatc/is_it_a_lost_cause/,Is it a lost cause?
[removed],,https://www.reddit.com/r/dementia/comments/s7gpuz/adult_daycare/,Adult Daycare
[removed],,https://www.reddit.com/r/dementia/comments/s7d2di/utis/,UTIs
[removed],,https://www.reddit.com/r/dementia/comments/s7b9xq/praying_for_my_grandmothers_death_every_second/,Praying for my Grandmother's death every second. [Vent]
[removed],,https://www.reddit.com/r/dementia/comments/s74os1/how_do_you_cope_with_alienation_and_loneliness/,how do you cope with alienation and loneliness?
[removed],,https://www.reddit.com/r/dementia/comments/s742p0/hiding_things_helpadvice/,Hiding things help/Advice
[removed],,https://www.reddit.com/r/dementia/comments/s73qlg/gp/,[deleted by user]
[removed],,https://www.reddit.com/r/dementia/comments/s73f3k/how_to_stop_my_grandmother_from_chewing_her/,How to stop my grandmother from chewing her medicine?
can assisted living with memory care handle patients with more severe dementia - or is a nursing home usually the ultimate destination? we have elderly relatives with mild dementia currently living in their home. they prefer to remain in their home but i have a feeling they will be better off elsewhere. i'm not sure if the typical assisted living facility with memory care is able to handle more severe dementia...or if al is just a temporary stop before a nursing home.," my mother has alzheimer's and is in an assisted living/memory care facility. the building she is in has higher functioning residents, some of them even have no dementia but are there for health reasons. this is wonderful in terms of stimulation for my mother.the other building has more of the late stage dementia patients. from what i can tell most of them just sleep most of the time, either in wheelchairs or on the sofa in the large living room area.there are a handful of higher functioning people in there, including my father, who seem totally fine with this.my parents will likely be out of money before my mom reaches that stage, but this place has agreed to keep her on medicaid.",https://www.reddit.com/r/dementia/comments/s706ab/assisted_living_with_memory_care/,Assisted Living With Memory Care
"hi! first time posting. my mother (70 f) has been diagnosed with moderate dementia based on her decline over the last 18 months and her score on the moca test. she declined 20% in the last 18 months. to compound this, my dad (70 m) passed 4 months ago, who was her sole caregiver, though he never saw it that way. he was the person who was with her all day, scheduling her appointments (which she is not capable of doing herself) and making sure she had all of her meds ordered and taken care of. we are looking for a way to tell her how impactful her memory loss is to us, her caregivers (my sister and i, 32 and 30 respectively, and her brother 76) and how we need her to accept some help. she has gotten lost while driving but had gotten better with using her phone’s gps to help her get around. she forgets many scheduled things and repeats similar stories upwards of 5 times in a short time frame. we are in the process of hiring companion care to keep her company and help her around the house a few days a week. along with being frustrated, we know this isn’t her fault but it does impact our lives by worrying about her daily. any suggestions for gently bringing up and reiterating how impactful this is for her family and how we can work together to make this journey a little easier for all of us?  thanks for your help!"," what's your objective?  to get her to worry about her impact on others?stress is not good, for anyone with mild cognitive impairment, as they have little enough cognitive reserve to have such an added distraction.  that she can learn a new process (use of her phone's gps) is good news.do you have time to invest in helping her eat more healthy?  i think much dementia is influenced by years and decades of poor dietary practices.",https://www.reddit.com/r/dementia/comments/s6zjsn/moms_impactful_memory_loss/,Mom’s impactful memory loss.
"they didn't ask for her social security number or credit/debit cards or anything. and what do i need to do about it? they apparently told her they were from medicare and were sending her a benefit, and since she'd just been to the hospital a couple days ago she believed them.", [deleted],https://www.reddit.com/r/dementia/comments/s6ykot/what_can_scammers_do_with_my_grandmothers/,What can scammers do with my Grandmother's Medicare card number and insurance card number?
[removed],,https://www.reddit.com/r/dementia/comments/s6oed7/grandmother_accusing_me_of_forgetting_to_do/,[deleted by user]
"she’s in her 90s. is this the beginning of the end? she doesn’t remember who i am, but i’m gonna facetime her. i’ve read is one of the symptoms that indicate not much time is left. i wish i knew the medical details but my family is the worst at relaying information. and i don’t have access to her doctor. she’s had dementia for the years or so i believe. should i be expecting the worst?"," my grandma has had noticeable dementia for about 3 years now. a month ago she didn’t know who any of us were, but she was still able to make small conversation and walk around with her walker and eat very small portions. she started losing her appetite about a year ago. fast forward to today, shes been in a comatose state for about 4 days now. we’ve tried everything including a sternum rub to wake her up and nothing. at this point we’re just looking in on her every couple hours to see if she’s still breathing. she probably has a week at the most left. she’s in her 90s a well. please cherish the time you have with your grandma…dementia is such a horrible disease and it’s scary how quickly someone can go from being *ok* to being near death. god bless x",https://www.reddit.com/r/dementia/comments/s6o5cy/grandma_stopped_eating_and_is_now_in_the_hospital/,[deleted by user]
[removed],,https://www.reddit.com/r/dementia/comments/s6nff9/safety/,Safety
[removed],,https://www.reddit.com/r/dementia/comments/s6jjzi/how_can_i_insist_that_my_dad_and_uncle_get_poa/,How can I insist that my dad and uncle get POA?
[removed],,https://www.reddit.com/r/dementia/comments/s6jf4t/mom_has_early_onset_how_to_deal_with_the_future/,[deleted by user]
[removed],,https://www.reddit.com/r/dementia/comments/s6er0p/dementia_patient_products/,[deleted by user]
[removed],,https://www.reddit.com/r/dementia/comments/s6dx2a/tax_prep_advice_for_wife_with_husband_who_has/,Tax prep advice for wife with husband who has dementia
[removed],,https://www.reddit.com/r/dementia/comments/s6c9ub/language_production_and_dementia/,Language production and dementia
[removed],,https://www.reddit.com/r/dementia/comments/s6asqg/why_so_mean/,Why so mean?
[removed],,https://www.reddit.com/r/dementia/comments/s68zma/oh_god_the_sneezing/,[deleted by user]
[removed],,https://www.reddit.com/r/dementia/comments/s67cko/i_found_this_video_that_i_think_is_worth_watching/,"I found this video that I think is worth watching. It has a few studies that are questionable but worth trying, if Dementia runs in your family."
[removed],,https://www.reddit.com/r/dementia/comments/s65qb4/caring_for_people_with_dementia/,[deleted by user]
"i'm scared honestly, my grandpa died some months ago and now shes crazy af, yet she refuses to go to care or something, shes not in good terms with my aunt so i need to be here while my parents are working. shit's straight out a horror movie, she starts by whispering stuff and then straight out screaming it"," just wondering, has she got a uti? sometimes these turn the most reasonable of people into the most scary individuals.my father has gone from aware, to delusional all because of a germ in his bladder.",https://www.reddit.com/r/dementia/comments/s65bgq/grandma_says_she_will_kill_us/,[deleted by user]
"i'm here to vent. i already have solutions in place and in motion. my mom was diagnosed with dementia late 2019.  her decline has been steady; however, the last six weeks her decline has been significant.she's wet her pants two days in a row, she's wandered the house twice, she has stopped eating some  foods she liked two months ago because they don't look right (she often thinks green veggies are bugs) she will argue about taking her pills, i have to hide bread and tortillas  because if i don't she will eat four sandwiches a day, i have to hide her slimfast ( she has one for breakfast) or she'll drink three or more a day, and she's forgetting more words.my anxiety is through the roof and, honesty, i'm really scared.if i can get through caring for her without completely losing it, it'll be a miracle."," get therapy stat. i actually started an additional day and new meds for my self and more exercise . it’s happening so fast i’ve been here two weeks and every day is different. i’m currently working on selling her home and moving her close to me into a nursing home. two days ago she just took her pants off in the middle of the room for no reason. and when i asked her she said i don’t know and i said did you go to the bathroom she said no. and she didn’t she just took her pants off. it is so scary and so upsetting and i’ll pray for you. in the meantime take his best care of yourself as you can! drink plenty of water sleep exercise eat well.i’m blessed that i have an asset where i can spend her money to get her really good care but there are lots of volunteer organizations that will come so you can have a break, there are daycare programs, etc. etc.you have to take time for yourself every day",https://www.reddit.com/r/dementia/comments/s5tsdb/its_happening_so_fast/,It's happening so fast!
"1st here is a little [back story](today i finally got up there. not only to see her but to give my aunt a break. my dear sweet aunt hasn't left the hospital since nan was admitted thursday. when i got there i told her to go home, shower take a nap do whatever you need to do i got this. but she stay at the hospital and hung out in the lobby incase the drs came. now i know where i got my dedication, compassion, patients might as well throw being stubborn in the mix. i took care of my nan for about 6 hours. and i enjoyed every moment. even when she was having aggression episodes. my nan is stage 7 of dementia so for her to communicate is nearly impossible. she can't tell where it hurts or why or what level of pain we (aunt and i) can only go by from her actions. she did have a heart attack but no blood clot! but she has compound fractures in 4 of her vertebrate. my aunt and i can't not figure out why or how. the home she was in hadn't reported a fall in months. i just so happy to be a help to her and my aunt. i brushed her hair helped with lunch and even bathroom moments. she laid in the bed for a good while happy playing with her doll folding hand towels while i sat next to her. she even reached out and held my hand for about 45 mins. i feel better now i got there talked to the drs and my aunt. don't get me wrong i love my dad and i love that he takes his time to call me with updates. but i get alot of ""i don't know"" when i ask that or this. to those who commented on my previous post, thank you for the kind words and support."," if she didn't fall maybe her bones have lost strength, so any harsh movement was enough to fracture them.",https://www.reddit.com/r/dementia/comments/s5sqgl/update_on_my_nan/,Update on my nan
[removed]," does anybody have experience with this?  my mom is a lifelong heavy drinker, and has dementia  for the past 5 years.   she's 70.  i'm wondering if the drinking brought it on, she really started drinking super heavy in her early 60's.  on the days she doesn't drink, which is rare, her delusions are really bad.  i'm wondering if it's the dts.",https://www.reddit.com/r/dementia/comments/s5n4w0/dementia_and_alchohalism/,Dementia and Alchohalism
[removed],,https://www.reddit.com/r/dementia/comments/s5lprf/my_lo_is_in_early_stage_he_has_begun_to_tell_me_i/,"My lo is in early stage, he has begun to tell me I told him something when I didn’t, acts like a was a part of an activity when I wasn’t. Is this normal?"
"this illness is so sad. i've (f39) just recently had to put my mum (74) into care. we lost my dad (72) back in february and didn't know mum had dementia. apparently, she was diagnosed back in 2018, but he kept her secret for her and took on her care. i've worked really hard to have a really fulfilling relationship with them both over the past 20 years. i grew up with their alcoholism and it really effected me, but i sought help and it changed my life and let me find acceptance for their drinking. when dad passed our relationship was wonderful and my heart was broken. my mum had lost her rock and the love of her life. the shock of realising my mum wasn't just drunk, but in fact had dementia as well was like a second blow. it was clear they had been struggling. i tried to take on the things my dad had been doing, brought in cares, set up a new poa and had my two brothers help with looking after her at night. she's prone to infection and sure enough this led to a bad fall even in strong antibiotics. after that i realised i couldn't keep her safe. the three of us were working during the day, had cameras installed, neighbors keeping and eye out, but she was still drinking, wandering and landed in the hospital. she always said she never wanted to got into a care home, but i really didn't have another choice. the decision was excruciating, but there was no way she would have made it to christmas. i found her a beautiful care home after months of hell., hospital, intermediate care and assessments. today i went to see her and she was looking amazing. she's out on weight, doesn't drink and was having a very low day. telling me she couldn't stay there and she wanted to come live with me. i live in a top floor flat and she would never make it up the stairs, but on top of that she would still be at home all day herself and we would be back to square one. it's so hard to not just bin my life and commit to looking after her. it's what my dad would have done. but i feel like it still wouldn't be enough. having to tell her that i can't take her home is heartbreaking. the codependent in me wants to scoop her up and take her with me, but in my head i know it's not the answer. some days this illness is just shit."," this reminds me of my struggle with my mother. my grandmother and i had discovered after her wericke's diagnosis that she would still go down to the liquor store and get wine. she would order it through apps on her phone, too. even after recovering from an acute stage where she couldn't even recognize the rooms in her own home.i struggle with the idea of bringing my mother home from assisted living as well. it's better for her. she doesn't get drunk all day. she's eating properly and putting on good weight.  this reminds me of my struggle with my mother. my grandmother and i had discovered after her wernicke's diagnosis that she would still go down to the liquor store and get wine. she would order it through apps on her phone, too. even after recovering from an acute stage where she couldn't even recognize the rooms in her own home.we can only do all we can. we can't give up our own quality of life in the process. and it was the most loving thing you could do.",https://www.reddit.com/r/dementia/comments/s5knob/dilemma_of_dementia/,Dilemma of dementia
she thinks no one understands what she is going through. ive vented on here a lot but my mother needs some support. she thinks no one can understand how hard it is to cope with everything she has to do for  my dad.he has vascular dementia got it after having a stroke.," my dad is the primary caretaker of my mother. i live pretty far but i skype him a few times a week, about every couple days, and just let him talk about whatever he wants to. i’m trying to visit more often, it cheers them all up and i can do little things to help. i know this is not what he wanted for his life, he’s worked so hard over the years and now he’s retired he’s taking care of my mother full time. truly devoted. she’s entirely dependent on him and only wants him. caretakers are truly living saints.",https://www.reddit.com/r/dementia/comments/s5hrf0/can_you_wonderful_people_on_here_please_show_my/,Can you wonderful people on here please show my mom some support
"my mother has frontotemporal dementia and i feel like i’m slowly developing it myself!! its very scary because i ’m only 32 and i have a family. i occasionally lose my train of thought. this used to never happen to me and it’s happening more frequently. i’m also forgetting names mostly of people i haven’t seen in a long time but i used to be really good with names. what’s most concerning is that i keep having vision problems and weird fog-headed “headaches”. it comes and goes but it doesn’t feel right.  ive always been physically active and my diet has never been horrible so it’s not some obese problem. i went to the doctor and i’m pending blood test results and she also scheduled me for a brain scan, or whatever is called. my sister and i are both so worried about getting it, that i am not ruling out paranoia, but they’re still a concerning symptoms.does anyone have any relatives that described their symptoms before they had full on dementia???"," i take care of my uncle, (he's on hospice now) he, my dad and aunt all have had or passed from dementia, i had his doctor do a genetics test to see if his was inherited, it wasn't. they all have type two diabetes, and lived isolated lives with no exercise. i did not take the test myself because it can mess up you getting long term care insurance,it was covered by medicare, so have your mom tested, i also can be forgetful but like others i feel it's stress.",https://www.reddit.com/r/dementia/comments/s5h18b/dementia_is_hereditary_does_anyone_else_feel/,Dementia is Hereditary. Does anyone else feel their cognitive and memory abilities decline!?!?
[removed],,https://www.reddit.com/r/dementia/comments/s57730/i_need_help_hes_awake_all_night/,[deleted by user]
my mother thinks people are taking her things. she has become violent and is verbally abusing everyone. i am not sure if they correlate., this very much sounds like both so it’s hard to say. i think it probably it very dependant on age and experience. obviously early onset alzheimer’s could be at play as well. it think definitely best to get her seen by a psychiatrist or even a gp if you are not able to access that sort of health care. best of luck to you and your mother.,https://www.reddit.com/r/dementia/comments/s55khc/does_schizophrenia_fall_under_dementia/,Does schizophrenia fall under dementia?
[removed],,https://www.reddit.com/r/dementia/comments/s53lkf/question_with_power_of_attorney_and_divorce_for/,Question with Power of attorney and divorce for my parents
[removed],,https://www.reddit.com/r/dementia/comments/s52c1w/you_all_helped_me_through/,You all helped me through
[removed],,https://www.reddit.com/r/dementia/comments/s51dou/my_grandfather_pulled_a_gun_on_my_grandmother/,My grandfather pulled a gun on my grandmother
"but he's not sure how to do it or what to do or where to do it. are there any online tools that can show memory care homes by region or by state that i could look up and give him some starting points. i had to find him his at home nurse care, he couldn't figure that out and i was happy to help."," as someone else mentioned, contact the alzheimer's association at [alzheimers.org]( they can help find care facilities, and can also help to find an elder care attorney to assist in applying for medicaid if need be. memory care facilities and/or nursing homes are expensive, and quite a number of mcfs are private pay only. my father drained his bank account in less than a year and a half and had to come home to live with my wife and me (we didn't know we could apply him for medicaid at the time). once he came home and eventually required a higher level of care than we could provide, we contacted the aa, who helped us find a lawyer and get him into a covered facility.",https://www.reddit.com/r/dementia/comments/s50aqr/my_mother_has_dementia_its_pretty_advanced_now/,"My mother has dementia, it's pretty advanced now and my father wants to put her somewhere with memory care."
[removed],,https://www.reddit.com/r/dementia/comments/s4xfhc/trouble_eating/,[deleted by user]
[removed],,https://www.reddit.com/r/dementia/comments/s4xf31/i_dont_know_if_im_in_the_right_place/,I don’t know if I’m in the right place?
"i really don’t know what to post here, i guess this is an “off my chest” moment. about four years ago she started having memory issues and she lost her job because of it. fast forward today, she can barely have a conversation with me. it’s even worse because i live on the other side of the world so i barely get to talk to her. the only saving grace is that my step-father is a tremendous help, beyond patient, and caring for her. i owe him a lot. when i came back for the holidays, it just crushed me. she used to be this brilliant biologist who had a passion for monkeys and apes, and now she just sits there on her ipad most of the time watching daytime tv. she and i are only children so most of our family is dead, and the family that is left has forgotten about us. she has friends that occasionally pop by to check in on her, but it’s not enough. i can see that in her eyes.there’s so many questions and “what ifs” that swim in my head on a daily occurrence. “how much worse is it going to get?”, “will she even recognise me when i come back for a visit?”, “is there anything that i could do to make this better?”, “what is the likelihood that i will have the same fate?”. i’m just lost. her and i are navigating through different fogs. it’s not fair. it’s not fucking fair. my want my mom back. i miss her so so much."," i think you should try to get her tested and diagnosed. if she resists, maybe you can contact her regular doctor and express your concerns. maybe the doc can request she come in for a routine checkup or something, and then do some testing. there are different types of dementia, and other conditions that have similar symptoms, so it would be worthwhile to find out, and see if she needs treatment/medication.i know it can be difficult to get someone to a doc if they are resistant. when my mom started having symptoms, she flatly refused to see a doc. after many discussions, she finally said she didn't want to go because ""i don't want to have brain surgery."" i assured her that surgery is not necessary for memory loss. (we always referred to it as memory loss, not alzheimer's.)many months later, she called and told me she had seen a neurologist (!!!). i asked her what he said. she told me the neuro said it was dementia. she was very matter-of-fact about it, but she was probably just covering up her real feelings.so at least we finally knew what we were dealing with, so we could start doing research and making plans.and no, it's not fair. the best you can do is try to get her diagnosed so she can be treated. and keep her safe.",https://www.reddit.com/r/dementia/comments/s4ldm7/my_mom_is_only_56_and_has_dementia/,My mom is only 56 and has dementia
"this is a first for me because my grandmother, a woman who up until this year was so sharp and quick witted, is finally showing signs of....something. i highly suspect dementia. she's 82, will be 83 this year. it started last year a few months after my grandfather passed. my grandmother began seeing people in her house. she called my mother to tell her that there had been a family living in her house for 2 days before she finally pitched a fit and told them to leave. it was determined that she had a horrible, horrible uti/bladder infection that the doctor said could cause delusions and hallucinations in elderly patients if left untreated for so long. well, just a few nights ago she called 911 to report a break in. she said she saw 5 children in her house, all dressed in black, crouching with their faces to the wall as if to hide from her. as creepy as it is to me, she said she didn't feel afraid or like they were trying to harm her. just more annoyed that one of these children sat in her flower pot.she's had a hard time remembering current things and events, but can prattle off a memory from 50 years ago. this is all so new to me. i think my mother is in denial or is just having a hard time accepting what's coming. i just needed to get this off my chest. i guess i'm hoping for some advice or encouragement or insight. how do we approach these types of hallucinations? how do we preserve what could be the last few years of her life?"," i highly recommend reading as many of the books referenced on this site as you can.  i dealt with my father for 10 years with what i now know was lewy body and a mother-in-law with alzheimers for a few years before she was moved to a nursing home.then, 3 years ago, i saw signs of my wife beginning alzheimers.   i was devastated but decided to really study these dementia diseases.   it has helped both my wife and my me to have a much happier time than my earlier experiences.   i feel guilty that i could have done much better with my father and mother-in-law if i had read the books before caring for them.",https://www.reddit.com/r/dementia/comments/s4bn59/i_think_its_finally_happening_to_my_grandmother/,I think it's finally happening to my grandmother.
