submission,comment,url,title
"we are a team of students working on a project to improve the medication devices used to help mild to moderate stage dementia patients remember to take right medication on time. we would really appreciate your feedback on these questions:&amp;#x200b;1) what device did you use? did you like it? any improvements to the device you would like?2) what problems do you or your patient faces with current device used for storing and reminding your medication?3) is there any problem with the design of the device? what changes would you like it to have?4) is the device doing its job? if not, please try to explain why if you can.&amp;#x200b;note: please do not share any personal information. this post is to understand in general the failures of current medical devices for further improvement."," we never got there as far as tech goes, so our method was using me to deliver his meds on time. drawbacks were keeping him on a schedule when he never slept or was awake on a consistent schedule. we ended up rearranging some meds so nothing was twice a day to avoid some worry about the timing. secondarily, when he was his most ornery it was difficult to motivate myself to go in there, even though of course i did. we also kept controlled substances in a lockbox - both to protect him but also i sleepwalk so the risk of taking something was increased.",https://www.reddit.com/r/dementia/comments/qcqxse/what_medication_and_storage_related_problems_do/,What medication and storage related problems do dementia patients and caregivers face?
"so this is the first night that i have looked into this sub-reddit, because my mother has mild to moderate dementia, and i am moving in with her because after my vacation (heh) it was obvious that i needed wider help what had happened to my mom. my vacation was productive?, but incredibly difficult. i won't go into details, but there were mis-steps and high moments. the most important thing that i came away was that i needed to communicate with her in a fashion that was radically different way that will work for both of us. coming to this sub-reddit, i saw i was not alone, but how much horror and pain there was here, even from posts today. she is still there, but now i need to reach out for her, rather than when she reached out for me when i was a child.  i've found a couple of online resources,  which led me to this book.the book is, as is said in the title, ""**six steps for managing alzheimer's disease and dementia: a guide for families**."". i haven't read all of it, i'm reading it as fast as my heart allows. it is still incredible, and written by a pair of doctors specialized on the memory and the psychology with elderly people and published by the reputable oxford press, which as published scientific and medical books for over 200 years.the book talks about the different types of dementia, how different types of dementia start and progress, but most importantly, how to handle, plan for the worse, and take care of yourself while taking care of your loved ones. from what i have read, it completely tracks. more than anything else, the stories that are woven throughout the book move me to tears; because they are so much my life now and forever until my mother passes.if you are new and  lost, please look into this book, it has many answers you are seeking for."," check out teepa snow, she has tons of videos on you tube explaining how to communicate with someone with dementia.  will open your eyes and improve understanding.",https://www.reddit.com/r/dementia/comments/qclu0s/a_critical_resource_for_a_loved_one_with_dementia/,A Critical resource for a loved one with dementia: Six steps for managing Alzheimer's disease and dementia: A guide for families.
," stage 6, you are going into moderately to severe dementia which means they may forget who you are, need more and more help with adl's, may be incontinent.  you don't say what your role is in the care taking of this person. i would assume you are in some sort of supported role, assume this person is being cared for in the home? provide a few more details please.",https://www.reddit.com/r/dementia/comments/qckq5f/stage_6_diagnosis_any_insights_tips_suggestions/,"Stage 6 diagnosis. Any insights, tips, suggestions?"
"yesterday mister demento was so mad at the caregiver and how terrible she is (6 hours a week, ruining his life cooking for him, dontcha know) that today he asked if he could get out of the situation with her by moving to a care home. lol. yeah dude, that's what we're planning, but if you want to go sooner, i think we can manage it. 🙄"," if that was your future plan, do it and do it asap.  he will change his tune fast and nothing better than being able to remind them that it was their idea and you didn’t have to make them go. they can’t (but sometimes will anyway) hold it against you. my dad refused to return to psychiatric doctor because the doctor agreed with me about no driving. dad said he would have to go to a different doctor (i had three letters from different doctors stating he couldn’t live in his own and needed help). my dad willingly walked into the ‘new doctors’ office and they kept him for ‘observation’ and for therapy. dad was confused and angry, but at them and not me.  dad is now safe and knows he is there until mom improves (she was in different nursing home and knows she is staying there ).   honestly, it’s been a terribly emotional rollercoaster but they are safe while i work fulltime and continue to drive back and forth seeing them several times a week.  the only good thing was i did t have to force him off farm so he has no negitive feelings towards me (most the time). we just say the doctor said he couldn’t leave yet and it wasn’t safe.  there is a no win situation when a loved one has dementia but just knowing they have help available 24/7 and can’t wonder off or climb on a stupid tractor is worth it’s weight in gold.  the stress doesn’t go away when they are in home but i can lay my head down at night and know someone else is at least taking over for that time.",https://www.reddit.com/r/dementia/comments/qck3vj/trade/,Trade?
"how do my family and i (27f) survive taking care of my grandpa who has vascular dementia? we had no idea he would be an absolute nightmare when he gets in a bad mood ! when he gets mad or feisty he treats mom horribly and acts like a 2 year old! tonight we were on our way home and he tried to grab moms pop and she tried to grab it back which caused the car to swerve slightly . we are fine but my question is , is there something we can do about how mean he’s being ?", dementia careblazers channel on youtube has helpful advice and tips. it’s a great resource! (helps keep my sanity),https://www.reddit.com/r/dementia/comments/qcggxs/rant/,Rant
"today was the first time since february my grandma left my granddad alone so she could spend time with her sisters. all day my granddad didn’t answer his phone, and his tracker (itraq) says he was running all around the county. finally get ahold of him, and he says he was home all day mowing grass. dealing with dementia is absolutely rough, but i don’t think people understand how much more difficult it is handling my granddad when we live on a farm, and the technologies don’t work because of lack of broadband/ cell service. scared to tell my grandma we thought we “lost” my granddad on her first time out, because she absolutely needs to care for herself. but still…"," what do you mean ""running all around the county""?  it sounds like family needs to start thinking of plans for supervision when he's gone. it's only going to get worse. it's terrific you were able to get your grandma to go out and have her own time.",https://www.reddit.com/r/dementia/comments/qcetsn/it_was_a_day/,[deleted by user]
my mother was recently prescribed memantine to slow down her memory loss. is it better administered night or day. we were administrating at night. however the nurses in respite care administrated during afternoon. which is better?i am also wondering about the benefits of complan for helping her to sleep?, therapeutic dose is 10 mg twice a day.  typically in the morning and then at night.,https://www.reddit.com/r/dementia/comments/qccocq/memantine/,Memantine
"hello. my wife, who has frontotemporal dementia, entered residential care about a month ago. i had been her caregiver for the past few years when she started declining rapidly. the move to the care home was very traumatic for me and somewhat for her. (since she has no short term memory, who knows what's going on inside her mind?)i've posted here about the tremendous guilt i've felt and the responses were great but... i still feel a tremendous sadness that i suspect i'll be living with for the rest of my life.my question today is for those who have placed a spouse in a care facility. how often do you visit? on one hand, i wonder if it makes any difference how often i visit. on the other, is visiting just a way to assuage my residual guilt since she doesn't remember if i've been there or not?thank you for any thoughts you may have."," my sympathies. visiting is hard. my dad gets upset by visits more often than not, or just doesn't seem to know we're there, so i question how much good it really does for him to see us. plus it's just hard to see them like this. tbh, i only visited once: my mom visits regularly, but i haven't been able to bring myself to go. he's so far gone that i don't recognize him as my dad anymore - he got violent, something snapped in my brain one of the times he attacked me, and from that point on, for me, he just stopped being my dad and was just a crazy stranger wearing my dad's skin - and he doesn't even seem to recognize me, so what's the point?since you are a spouse and primary caregiver, though, i'd gently encourage you to visit at least once a week - not to see her, necessarily, but to make sure you know what's happening with her care, and to make it clear that your wife has an engaged and concerned caregiver. one of the unfortunate realities of even the best facilities is that they'll naturally pay less attention to residents whose families aren't there as much.",https://www.reddit.com/r/dementia/comments/qccef8/how_often_should_i_visit/,How Often Should I Visit?
"hello,so my grandma is 83 - 4'11 and like 80lbs. a very mighty woman, extremely active.in the past few years her memory is slipping more and more. covid made it worse and i think part of it is she is lonely since her husband died 10 years ago and all her friends are dying. the entire family has jobs - we're all hard workers so we can't talk much.she is calling us non-stop about ""hey do you know if it's going to rain today?"" ""just wanted to let you know i'm going to go cook some food"" ""where is whole foods again? (even though she goes there everyweek)"" or just calls to chat about random stuff.so it's partly she's asking something and partly that she's bored i guess.the worst is if she calls my mom and my mom doesn't answer, she automatically thinks my mom is dead and calls all of us crying and flipping out.what do we do? she swears she'll never go into an assisted living place and my mom ""just can't do that to her"" so i really don't know what to do"," try getting her a care worker/companion.  also check with senior centers, many have adult ""day care"" or other activities she could do.  she probably doesn't know she is calling so frequently, getting her involved would likely help.",https://www.reddit.com/r/dementia/comments/qca4rx/my_grandma_calls_me_50_times_a_day_and_i_just/,My Grandma calls me 50+ times a day and I just can't do it anymore. What do I do?
[removed],,https://www.reddit.com/r/dementia/comments/qc8fuj/dementia/,Dementia
[removed],,https://www.reddit.com/r/dementia/comments/qc6ihr/recruitment_for_the_ucsd_caregiver_study/,Recruitment for the UCSD Caregiver Study
"my grandfather passed away before my mom could participate in this program, but it sounded interesting and might help someone else. it is all online and they provide a tablet. alzheimer’s sucks the energy out of caregivers and families, so hugs to all the families dealing with it!"," note: this is for alzheimer's diagnosis, not just any dementia. i'm kind of disappointed, but i hope others make good use of it.",https://www.reddit.com/r/dementia/comments/qc2mow/caregiver_program/,Caregiver program
i don’t but do want to understand how perception of texture changes with dementia. i mean i’ve seen her literally eat something akin to slop., my mother used to love melted ice cream spooned into her mouth. then she became reluctant to swallow. be glad she is eating. the life road is very bumpy towards the end.,https://www.reddit.com/r/dementia/comments/qc1j0t/im_watching_my_grandma_wait_until_her_cereal/,I’m watching my grandma wait until her cereal becomes unbearably soggy 🤢🤮🤮🤮🤮…I’ve gotten to the point I put less then a teaspoon of milk in her bowl.
what are your thoughts about this?," people naysaying gene therapy are really off mark. the sad part is for the people with a clear gene causing alz , no one is pursuing gene therapy as the market for a disease modifying drug is so much greater. but even for all alzheimer’s types once the process that leads to dementia is uncovered , you can figure out which genes contribute to that process , and then regulate them. so it’s a definite possibility in a longer term.",https://www.reddit.com/r/dementia/comments/qbwmgy/gene_therapy_have_you_heard_about_this_to_treat/,Gene therapy - have you heard about this to treat Alzheimer's?
what are your thoughts about this?,,https://www.reddit.com/r/dementia/comments/qbwlyy/gene_therapy_have_you_heard_about_this_to_treat/,Gene therapy - have you heard about this to treat Alzheimer's?
"any activity ideas/resources for late stage dementia? has to be seated, one-on-one activities. my family member doesn’t like doing “childish” activities, so i’ve been asking them to do things to help me (i.e., having them pour ingredients into the mixing bowl and mixing when making recipes). i plan to get brightly colored artificial sweetener packets and tell them that i need help organizing them to put in the pantry. they struggle with communicating at this point, so even reminiscing is difficult. they can understand basic instructions for short periods of time, so typically quick activities are best like up to 20 mins.sometimes old movies/music work, and other times they don’t. it just depends on how severe symptoms are that day.thank you!"," we bought packs of cloth napkins and washcloths in lots of colors to fold and stack. we also did cd organizing, putting them into the sleeves of a binder meant to store them, and then taking them out of the binders to put into the cases, then back again.  sorting socks. fokdong baby onesies and stacking them, dressing dolls for my students or foster xhikdren, yours could be to help a preschool teacher you know or something-- anything that helps your loved on feel useful. brushing very long-haired furry stuffed animals to tidy them up, stamping inkpad-stamps onto cards and putting them in envelopes to give my students,  into envelopes, putting diapers into a diaper stacker, matching lids to tupperware, putting crayons and markers into their boxes (i am a teacher. i would just dump dump back into a plastic shoebox to sort again later), rolling cloth napkins and putting napkins rings on them, peeling the labels off old crayons so i could melt the into crayons cubes for students, sorting coins so we could roll them (actually we just dumped the same ones back into the plastic box to do again), putting  clothespins around the top edge of a plastic shoebox to make them easier to grab while hanging laundry (i never hang laundry that way, but it is a great job and you can just put them all back into the bin for the next time), putting our foster daughter's hair bows onto a long ribbon to hang in the closet, decorating blank note cards with stamps. we used a bookcase for work boxes of tasks. this worked very very well for us. we could easily reset the task and always had ""jobs"" we ""needed help with.""",https://www.reddit.com/r/dementia/comments/qbr39s/activities_for_late_stage_dementia/,Activities for late stage dementia?
"if all goes well, my alzheimer's mother will go into assisted living tomorrow. she's been in the hospital for a fall, and i've arranged medical transport for her from the hospital to the facility. the doctor has asked me to be there for when he breaks the news to her. but, my mother is incredibly angry and vindictive (she was before dementia, and even more so now). should i be there to try to comfort her? (and possibly/probably endure her wrath?) or should i just meet her at the assisted living facility, and put the blame on the doctor?"," protect yourself, stay away from the doctor's appointment so when you see her at the facility you can blame him.  only way to go, fib a little, tell her doctor told you to meet her at the new facility then go on and on about how nice it is, bring some things from her home and just try and ignore any upset she may have.  good luck.",https://www.reddit.com/r/dementia/comments/qbpz72/mother_going_into_assisted_living_should_i_tell/,"Mother going into Assisted Living, should I tell her or let the doctor tell her?"
"my elder can't speak easily anymore and combination of aphids and cognition. i over the years i have seen them tell the doctor the wrong hip hurt ( i had no way to know) after a fracture. have a terribly infected bug bite after the doctor has left the exam room. i finally caught on and would try to prep him prior to appointments. but now that we are.mostly home bound and i am the sole caregiver he can hardly talk, it's a nightmares to figure out if something is off. or why something is off. how do you all cope with guessing is something is wrong."," someone with aphasia can still understand what is happening and so needs you to be able to communicate clearly what you need from them.  sit close, touch them, speak slow with short sentences, be direct in your questions or statements, give them time to speak, use pictures or drawings to help get the info you seek, as much as possible ask yes and no questions, have the area quiet and distraction free. be really focused on them and allow them the time they need to communicate with you.  you should keep notes on what you notice going on with him at home, any indications of pain or discomfort, then you can speak up during a doctor's visit. you are his advocate so have to step in for him.  during doctor's visit for my husband i speak more than he does and he doesn't have aphasia, with his sort term memory loss he can't tell them what is happening with him.  i keep a binder with notes so we don't miss anything that the doc needs to know.  good luck, keep up the good work of caring for your loved one.",https://www.reddit.com/r/dementia/comments/qbpbh2/what_is_wrong/,What is wrong?
"my dad was diagnosed with dementia after he had a stroke.he is slow after his stroke but there is nothing wrong with his mind.he is on a handful of medication to help keep blood thin, help him sleep, help his cholesterol and for some reason parkinsons medication because the doctor says it will give him more energy. it is hard to except that my dad has dementia but what puts the cherry on the cake is he has cataracts and cannot see very well. because of his eyes he is depressed and seems to have given up on life. he even talked about blowing his brains out because of it.he was on anti-depressants but it just made him sick so we took him off. my mom who is his carer is also very depressed and talks about wanting to die and that seeing my dad as he is, is killing her slowly but surely.i do not know how to handle things anymore. it hurts to see my dad in his state...it hurts even more that he won't even try doing better. he can do exercise and move around and do things but he refuses to. i don't understand people have been in comas and have woken up and put effort into getting better, people have gone blind and learned to adapt and figure out how to do things. but he just does nothing. it makes me feel so angry..i still carry lots of hate over things my dad did and said when i was younger...many things he said shaped how i turned out as a person. the worst is when he would get full on violent and angry when i was on my cellphone a lot. that was his peeve and he beat me with a book over my head with book because of it. he has hit me a few times over it as well and i was not a stupid kid when it happend i was 21 or 23. ( i am now 28). my mom says i must talk out my problems with my dad but what's the point."," why can’t your dad have cataract surgery? my husband just had it, he has lewy body dementia. they used only numbing drops in his eye and he did fine. i refused to let him have any sedation.",https://www.reddit.com/r/dementia/comments/qblkij/i_dont_know_how_to_handle_things_anymore/,I dont know how to handle things anymore
"i'm not sure if anyone is wanting an update, but i think writing one might help me...?so, i went and picked holly up (the dog) last friday after work. papa had given consent to give her to me ""for the weekend"" while they moved the big pieces of furniture and such into the new place. additionally, i had been under the impression that a vet checkup was necessary in order for holly to move in and that hadn't been scheduled yet.well, papa never forgot that i had holly. he kept calling my mom and asking about holly. my mom kept telling him i had her and that he'd get her back on sunday night. i started recognizing that this whole situation was stressing papa out more than anything and kind of accepted that a permanent acquisition of the dog likely wasn't in the cards. there are a lot of things that i would have done differently had i been more involved in the planning process of this whole thing. i don't like how my mother handled it. but in any case, papa was supposed to come with my mom on sunday evening to pick holly up. but instead, he drove himself to my house by some miracle to get her sunday morning. alone. yes, he's still driving which is another thing that needs addressing but my mom isn't listening to me on that front either. so, i guess the bottom line is...we tried to take the dog and this attempt failed.", you can disconnect the battery. or substitute a key that doesn't work. everybody acts perplexed including the mechanic (who you've clued in).,https://www.reddit.com/r/dementia/comments/qbkbym/update_dog_papa/,Update: Dog & Papa
