submission,comment,url,title
"i have had two parents with dementia of two different types. my father died of complications of dementia last month and my mother is in the final stages.both had normal mris to the end, both were highly educated and very successful people. one early (60) onset &amp; one late onset.i am curious if in y'all experience how often this might occur. thanks for the resourse."," mris do not necessarily show up abnormalitirs in the brain.  my 71 year old wife underwent 2 nuclear medicine tests, spect and pet as well. both measure brain activity. one measures the brain's consumption of glucose which shows which parts of the brain are not functioning as normal.the wife's alzheimer's is not too bad, forgetful but functioning. taking aricept now. she is also taking shark cartiledge, which contains chondroitin 6, which according to an oxford univeristy study improves neural plasticity. we are also taking gingko biloba which improves blood flow.we will try anything that helps.",https://www.reddit.com/r/dementia/comments/qg6p0h/mri_dementia/,MRI & Dementia
"my mother has dementia she was diagnosed about 5 years ago, showed symptoms for the last 10 maybe. i have 2 sisters, one lives near by, one far away and a brother. we are all in our 40s -50s. she is currently under care at home with my stepfather and hospice. he has full poa and is her medical proxy. she is stage six and has other debilitating conditions which makes her pretty much unable to do anything by herself.very long story short, my stepfather is extremely verbally abusive. he fights with her constantly about things that happened earlier in the day and she doesn't remember and he just badgers her about it on and on and on calls her a f****** b****, tells her he hates her, says she's ruining his life.anytime we try to confront him he just blocks us from everything. she cannot dial a phone, she also can't answer a phone. he is my only lifeline to her.we had a bit of a disagreement earlier today and he has blocked me again, tonight she fell and his on her way to the hospital. i asked him to unblock me, he said call the hospital and get updates and hung up on me. he is power of attorney and medical practice so they won't tell me anything. this has been an ongoing issue. hospice is slowly recognizing that there might be an issue. biggest issue of all is that if he decides that he no longer wants  hospice to speak to my sister and i, they have to oblige and  then we will not know anything. i called adult protective services a few months back and they cleared him and said that he was taking care of her needs.i need help. what do i do?","  if he puts on a show for protective services you will need proof of what he is doing.  is there anyway to get a recording device in the house?  seems like that is the only way to get proof of what he is doing. your only recourse is adult protect  services and somehow they need to be convinced of what he is doing. i would keep calling them.  is there anyway he would agree to you taking over her care?i am so sorry for your mom, what torture to be trapped in the world of dementia and then be tortured daily by the man who should be protecting you.",https://www.reddit.com/r/dementia/comments/qfxvi2/i_need_advice_and_help_for_my_mom/,I need advice and help for my mom
"to try to condense this probably 5 year long story as much as possible.. i’m currently 22 years old and my mom is only 56. i would say about 4-5 years ago i noticed a change in my mom. over the years it got progressively worse and i begged my parents to go to the doctor to get her checked out because something wasn’t right. they never went. about a month ago my mom started having hallucinations all aimed at me, and all very negative. it got to the point where she was constantly confronting me about things i wasn’t doing, and it seemed like she truly started to hate me. still the doctors visits were postponed. finally they got so bad to the point that she got physically aggressive and was taken to the hospital. she ended up getting diagnosed with lewy body dementia. i can’t help but feel frustrated with the fact that no one listened to me all these years and instead of being proactive about the disease when it wasn’t as bad we’ve come to this point. she has a really difficult time communicating and all of her hallucinations seem to be about really bad things. i honestly don’t know what i’m looking to get from this post, but i feel really alone. i never would have expected any of this to happen, and i’m sure no one does. i don’t know what to do and i don’t know how to help and i don’t know how to get through this in a healthy way. please just any advice or support you could give would be greatly appreciated. thank you all in advance.", this is my lunatic alcoholic gold digging step mom. my dad has had dementia for about 5 years. she has stopped bringing him to the dr. she lets him drink all day   she has made herself the sole beneficiary of all my dad assets. she has taken us off the will. she won’t let anyone in his family see him. my uncle and i would like to know what needs to be done to get her gone. and make one of us power of attorney. we have a ridiculous amount of evidence against her. we’re worried if we take legal action. she will go nuts blow even more money that should be going to his care. also worried it will get dragged out so long we won’t be able to see him until it’s to late,https://www.reddit.com/r/dementia/comments/qfxbhy/looking_for_advice_and_support_hoping_this_is_the/,"Looking for advice and support, hoping this is the right place"
, this slums score is in the impaired range and indicates a possible dementia process but isn't a diagnostic really.  normal scores are around 26 to 30 for reference.  things like low education level and poor effort can lower the score artificially but not usually this much.,https://www.reddit.com/r/dementia/comments/qfxa5v/slums_score_1330_any_insights/,SLUMS score 13/30. Any insights?
"my father and i were struggling to get my mom (72, ftd) to shower regularly. i tried just about everything, even purchasing nice shower gels to get her excited about bathing again. she'd get angry and insist she already showered, then say we're hurting her feelings.one night during my recent visit, i decided to try something different.  my mom was very confused that day but in a good mood.  i pulled out her pjs and clean underwear then announced i would run a shower for her so she could relax at the end of the day.  she obliged.  the next night, i did it again and it worked.  if my mom sees the act of gently laying out her nightclothes as a loving gesture by my father and me, she complies.  new shower gels, reasoning, or outright begging don't seem to cut it.  i'm actually stunned this simple approach works after all the techniques we've tried in the past."," i’m so glad you and your dad found something that works for all of you. good for you for trying something new; it’s often hard to get past feeling frustrated because a parent isn’t doing something that would be good for them. i like reading about successes experienced by others when dealing with a loved who has dementia. sometimes the successes are small, but it’s still satisfying. i’ll pass your idea along to my friend, who is facing a similar struggle with her mom.",https://www.reddit.com/r/dementia/comments/qfrvh1/finally_got_mom_to_shower_regularly_heres_how/,Finally got mom to shower regularly! Here's how.
"hi i'm relatively new at caring for a dementia patient. i had a question is it ok to lie sometimes? i feel weird about it because i'm an honest person but like sometimes in the afternoon she gets agitated and wants me to leave because she ""doesn't need me"" it's usually before she wants to go take a nap in the afternoon which she always does. but she doesn't like leaving me alone so she won't go up till i leave the house so what i've been doing is pretending to leave waiting outside a few mins and then i go back in after she's gone up. i go back in and do any chores that need done and go get her when it's time for dinner and reintroduce myself. anyway my question is, is it ok to lie? i always answer her questions and am as honest and patient as i can be. i just dk if it's proper to lie when it makes things easier"," i lie to my mil w/ severe lbd every time i see her. because she's in the terminal agitation phase and i always say stuff like ""we're going to take care of that later.""i guess it's not a lie. we will take care of it later. probably long after she's passed.",https://www.reddit.com/r/dementia/comments/qfpo6g/is_lying_ok/,Is Lying ok?
"i've been taking care of my mother with diagnosed dementia for a handful of years now and it's become too much for me. she needs more care than i can give. and i want my life back, i want to go back to school and start my life together with my fiancée. i want to live my life for me for once, i want to sleep through the night without having to get up and talk down someone's delusions. i'm sick of having my life dictated by this illness, i'm sick of never having any time at all to myself ever. my mental health is complete garbage and i'm having difficulty taking care of myself. i'm exhausted.both of her poa's have been activated, were working with the adrc to get long term care set up. we're almost at the finish line with the applications filled out and we're just waiting now.in the meantime it's been discussed with my mother that i'll be moving out at some point and we need to find a good place for her to live. we all know memory care is going to be the best option but of course mom thinks she's ""just forgetful"". she has become super fixated on this idea of moving in with someone and being their caretaker. she's freaking out about moving somewhere where most of her money will go to her care (she doesn't think she needs any extra care) and she won't be able to bring some old furniture. not that she's able to keep track of any of her finances anyway or has any idea whatsoever how much money she takes in or what she has to pay.any advice or shared experiences on placing a loved one in care when they don't understand the level of care they need?",,https://www.reddit.com/r/dementia/comments/qfnsbd/how_to_navigate_placement_in_memory_care/,[deleted by user]
"somehow i've convinced myself that the experimental ""new"" drugs that were prescribed to my mom in the early 70's for her ocd have triggered her dementia all this time later. maybe i'm the crazy one? does anyone else's person they care for have ocd or something similar? i just need to find something to make me understand why my 70yo mother is so young and so sick.", may i ask what drug has she been taking?  did she only take them in the 70s or has it been continuous?,https://www.reddit.com/r/dementia/comments/qfjnzn/my_mom_was_diagnosed_with_ocd_in_the_70s_could/,My Mom Was Diagnosed With OCD in the 70's. Could the Dementia Be Related?
"my mom is currently suffering from dementia.  apart from all the stress of caring for her, i sometimes worry about myself forgetting things and wondering if i am going to follow the same path.  it is not serious, but i have considered going to the doctor about this, but i don't think i am ready for a bad diagnosis.  and will there be any advantage to get a very early diagnosis as there is not really something to stop it?"," first, it can take a long time to get a definitive diagnosis, and sometimes only at autopsy. you may know it's dementia, but which type? alzheimers? vascular? ftd? lbd?but it also never hurts to get help earlier rather than later, especially as there are newer treatments coming out all the time. my own father was dragging his feet about getting a dx because it scared him. but once he did, they put him on aricept and it did help. i believe it helped slow the progression somewhat. also know that getting old does make us somewhat forgetful, and that's not dementia, it's just getting old. stress doesn't help. and i can tell you that whenever i spent a lot of time with my father and mil, i'd walk away feeling maybe i too had dementia. but that would pass--- it's just normal i think to start questioning your own mental faculties.",https://www.reddit.com/r/dementia/comments/qfd12j/is_early_diagnosis_important/,Is early diagnosis important
"for those that can't help themselves that cant do what came so natural before the afterthoughts of day to day routine that becomes mountains that used to be walks in the park. my mother was diagnosed with cjd 3 months ago, what we though was dementia, shows the same signs but much more rapidly. she passed this friday, at home surrounded by loved ones. almost a blessing for it all to happen so fast, instead of the years long of battles of loss of control. what you do all of you, the time from your life you give for those that have run out of it is s blessing and just wanted to say it will never go unappreciated by those around you, in this group and those you take care of. please don't forget to take care of yourself💚", i’m so sorry about your mother's death. i hope the good memories you have of her will comfort you in the days ahead.  thank you for the kind words for those of us still caring for our loved ones.  not an easy road to travel.,https://www.reddit.com/r/dementia/comments/qfbp2l/all_of_you_are_guardian_angles/,All of you are guardian angles
"i'm a caregiver to an elderly gentleman, in his own home, overnights. he gets up quite frequently to use the restroom throughout the night.sometimes when he wakes up, he sees children standing in the doorway to his bedroom. i've came to realize, after some research, that it's not ok to just tell him they are not there, and that he's seeing things. and the problem is, being the middle of the night, there is no good way to redirect him.i've thought about just going along with it, and ""shooing"" the children out of the room. but i'm just not sure that's the correct way to address the situation. does anyone have any advise on how to deal with middle of the night hallucinations?thanks in advance!", are they bothersome? turning the light on may make them disappear.  if you walk through them it may make them disappear as well.,https://www.reddit.com/r/dementia/comments/qfb1g0/hallucinations/,Hallucinations
"he thinks he’s in france (which is where he used to live). he keeps asking to go home and he doesn’t recognize me, my siblings or my cousins anymore. he recognizes my mom and her sisters but can’t remember their names. he is constantly confused about time and space and says incoherent things. just a year ago he could still hold a coherent conversation in the two languages he knows. it’s advancing too fast and we’re not ready to lose him."," ohhh, that’s so rough. i’m sorry. try to get in as much love as you can. doesn’t matter if he doesn’t remember names or you guys. you know him so just love him.",https://www.reddit.com/r/dementia/comments/qf7zzf/my_grandfather_doesnt_recognize_me_and_my/,My grandfather doesn’t recognize me and my siblings anymore
[removed],,https://www.reddit.com/r/dementia/comments/qf65br/can_dementia_make_someone_a_sexual_predator/,Can dementia make someone a sexual predator?
," it can be a sign but at the same time, even healthy older brains forget a few things. when it gets to the point you're hearing the same question multiple times in an hour, it's a warning sign. my mom, for example, in a little over an hour asked me over a dozen times if we needed to get my car home so my husband could go to work. i answered the exact same way, that he worked nights, each time. conversation lulled, the question came up again.",https://www.reddit.com/r/dementia/comments/qf4z6c/is_repeating_oneself_more_with_age_normal_to_an/,Is repeating oneself more with age normal to an extent or is it always a bad sign?
"i get heartbroken when visiting my father who has early onset vascular dementia (he is 65 only, diagnosed 3 years ago).you know, i understand i won't have my parents for all my life - the cycle of life. it is what it is. death is always around us and soon or later, bam.but the hardest thing to deal with is seing his suffering and wondering. i can imagine how horrible must be not being able to recognize your own house and, spouse and sons. the anxiety kicking in for not knowing what to do, what is happening, what happened. lost somewhere in the past: ""i don't have any money, how do i will work tomorrow?""i have engaged in more conversations with my father, which is something i should have done more in the past (i will regret for this mildly relationship we had that lacked more deepness). and i get emotional afterwards because i can feel his dispair. he knows he is sick of the head. i feel so much for him . there is no cure. his future as grandfather is cancelled he won't get the chance ever.he isn't the same man he was, for sure. but his soul is still there, wandering inside a void that will only get worse. he doesn't recognize me  immediately but treats me with the same kindness he always did..."," my dad is also 65 and has early onset alzheimer’s. it’s definitely been the hardest thing in my life. i hate to see him suffer like this but we are sending him to a long term care home in about a month. it breaks my heart just thinking about it. i miss my dad everyday; i miss our happy family everyday. it’s something no one else understands and it’s so hard. the disease is just so cruel. but remember you’re not alone, so many people are going through what you are going through. you’ll be okay and you’ll come out of it stronger.",https://www.reddit.com/r/dementia/comments/qf2iq5/their_suffering_is_the_hardest_to_deal_with/,Their suffering is the hardest to deal with
"hi. i am a 29 year old female helping take care of my grandpa. he has been getting more and more aggressive (by yelling at us). for stupid things. i made him an bologna sandwich and he always wants two slices of bologna. i gave it to him and he started being rude, because he thought i gave him only one slice. it’s not like him. is this an early symptom or is it further down the line symptom?"," you might want to check for a uti. it causes psychosis in folks with dementia. happened to my father, and he was different within a couple of months.",https://www.reddit.com/r/dementia/comments/qf27rz/increasingly_getting_more_angry/,Increasingly getting more angry?
"my grandmother is not the person i grew up with. she is cruel, vengeful and quite content to destroy all relationships with everyone she loves.today alone; she laughed in the face of my grandfather as he cried, threatened to disown my mother and told my uncle she “didn’t care” that i left her house in tears after seeing her behaviour.i never knew dementia could be like this. i was so ready for the memory loss and deteriorating cognition but how can i deal with a woman who once considered her family her whole reason for living now happy to hurt every one of them.my mum is at breaking point. she said some awful things today to my grandma in an argument and i’m lying awake terrified that something will happen and they’ll never get a chance to make up.how do you deal with this? how can my mother deal with this? i’m so worried about her i think this will ruin her mental health.i try and remind myself it’s not her it’s the disease but it’s getting so hard. any advice for how to deal with this particular aspect of this horrible disease would be appreciated :("," ours was not this intense, but gradual over 3 years. i'm not sure how many times my grandma threatened to kick me out. at first i was crushed. here was the woman who had been such a huge part of my life just telling me she hated me and i didn't deserve to live there. after time and time of her saying this, i just new it would pass. she would forget after a few hours and we would be okay. but of course i didn't forget the yelling. i would take a few hours and avoid her as much as possible. to let myself process my emotions. my mom (her daughter) and i talked about it. her sentiment was ""i'm sorry we didn't get the sweet old lady. we ended up with the b*tch."" and over those 3 years we mourned the loss of her. now we care for her still. but she's dropped further off and is no longer as angry. if putting her in a care facility is not an option at this time, possibly see if an in home option may help. having someone not from the family may be better. sometimes a stranger can get better behavior from our loved ones. finding a local support group could be helpful too. especially for your grandad.",https://www.reddit.com/r/dementia/comments/qf26em/how_do_you_deal_with_the_personality_change/,How do you deal with the personality change?
