submission,comment,url,title
"my husband, who i suspect may be in early stages of dementia, has started this hard chomping while chewing. he’s never done it before. he’s always been something of a lip smacker (already hard for me), which is either getting worse or my patience is just getting thinner, but now he’s starting chewing hard (that’s the only way i can explain it) and i can hear his teeth chomp and clack together when he’s chewing. he doesn’t grind his teeth or do it unless he’s eating but it’s new and i wondered if anyone else’s loved one did that early on."," yes, my dad does it. it drives me nuts. sometimes he's eating something completely soft, like yogurt, and i hear a bunch of crunching.  i think i noticed it in moderate stage but i wasn't monitoring him before then so it could have started earlier.",https://www.reddit.com/r/dementia/comments/qdxcwx/hard_chewingchomping/,Hard chewing/chomping
"hi! my grandma is 93 almost 94 (!!!) and currently in a nursing home with dementia. apparently, she talks a lot about babies, how shes pregnant, she's concerned about taking care of the babies, etc. (she had 6 kids so makes sense this would be on her mind.) i think she'd really benefit from doll therapy. does anyone have a good suggestion for a baby doll for dementia patients? based on what i've read it seems like the more realistic the better, soft-bodied is good."," i once bought one of joymor's lifelike newborn baby dolls for my grandmother, and she was so happy that she thought it was a real baby.she goes to sleep with this doll every night.",https://www.reddit.com/r/dementia/comments/qdtc7o/best_baby_dolls_for_dementia_patients/,Best baby dolls for dementia patients?
we keep calling him but he keeps forgetting. he feels so alone. is there anything we can do to remind him that we love him and to remind him of our visits?, i knew a family who created a collage on the wall of photos of family members and what time they would call. you can also write where they live. the people i knew used an entire wall it was fun.,https://www.reddit.com/r/dementia/comments/qdtb2z/how_can_we_keep_our_grandfather_from_feeling_like/,How can we keep our grandfather from feeling like we're forgetting him?
"hello! im a 25 year old female, and my father (60) was finally diagnosed with ftd after years of symptoms. i am noticing certain symptoms within myself that i fear mimic my fathers demise with dementia. for example, im often unable to find the right words, and i have a very difficult time writing and doing certain intellectual tasks which involve the frontal lobe (this is making uni very hard).    im wondering if this is just due to anxiety from having witnessed my father slowly loose his cognitive abilities over the past few years (and/or anxiety from it being an early on-set, possibly genetic type of dementia) or if it is an *actual* cause for concern. i also have a history of depression, and i'm thinking it could be a psychosomatic response ?   i'm just reaching out to see if anyone has felt a similar way, or experienced something similar. i apologize if this is a stupid post or i sound like a hypochondriac, it's just really effecting me and my caretaking abilities for my father at the moment.  any help is greatly appreciated, thank you!"," hi, i know this is an old post. i just sympathize and empathize with what you said. i noticed a decline in my mental abilities in college, and i’m 30 now. i had finally gotten to a place where i felt comfortable with it and attributed it to stress and mental health issues. i felt comforted by how many of my peers experience brain fog, and talked about it openly. then my dad got diagnosed with ftd. i felt selfish that one of my first thoughts was - oh god do i have this/will i get this? i don’t have anything helpful to add because i just found out a few weeks ago. but i am in therapy and planning on talking to my primary care doctor about options for testing for myself. i really do feel comforted that so many people i know in their 20s/30s feel the same way as we do, they just don’t have that added stress of wondering if it’s dementia. the anxiety about having a loved one with this disease can make every slip up so much more noticeable. i just wanted to drop in and thank you for your post- the post and comments have helped me feel better today. i hope you are doing well.",https://www.reddit.com/r/dementia/comments/qdr5ea/frontotemporal_dementia_ftd_and_me_help/,Frontotemporal dementia (FTD) .....and me? help
"i've been involved in my grandparents care and health for several years now.  my grandmother started showing initial signs of impairment around five years ago this december.  i'd say she's in late early stage or early mid stage at this point (if that's the issue).  i personally don't like their pcp.  i think he ignores way too many issues.  he's a 70 year old internist, personally i think he should be retired and not giving medical advice to 89 year olds.  i could give you 20 reason why i dislike him, but the main ones are how dismissive he has been to two serious issues with my grandparents.  two years ago my grandfather was hospitalized after feeling very ill and with chest pains.  he ended up having a pulmonary embolism at 87 years old, due to deep vein thrombosis, which caused acute heart failure.  he spent three weeks in the hospital.  come to find out, his pcp knew about his extremely swollen legs and never did anything about it and brushed my grandfather off.   my grandfather did eventually recover, but only to an extent.  he's healthy for an 89 year old, but that event dropped was a huge hit and caused a noticeable and sudden decline in him.  the hospital referred him to a cardiac specialist after his release, and he was pissed as hell that my grandfather's leg issues were never taken seriously by his pcp.  for my grandmother, as i said initially, these symptoms started about five years go and have progressed since.  their pcp never sent her to a neurologist, she's on several medications with side effects being memory impairment but he never looked into it, and even today, five years later, i just took a look at her medical chart and it only lists ""minor memory impairment"", despite things getting much worse.  at her age, and with her issues, shouldn't she have been sent to a specialist?  shouldn't her medications have been looked into?  shouldn't more tests have been run?  i'm trying to explain to my grandfather that with them both being nearly 90, they need to drop their current pcp.  they shouldn't be seeing a 70 year old internist.  they should have a pcp who is at least below retirement age and has a focus in geriatrics.  i just want to know if i'm wrong or right here, because at this point i think i need to take over fully and legally in regard to my grandparents medical decisions.  i don't want to, because i do think my grandfather is still competent in his daily life, but he's not comprehending or understanding the medical issues appropriately in my opinion.",,https://www.reddit.com/r/dementia/comments/qdqz0v/shouldnt_a_pcp_give_a_referral_to_a_specialist_if/,[deleted by user]
hi i’m a 26 year old female. my brother is 24 and my sister is 19. my mom is 54. my dad (64) has alzheimer’s disease diagnosed 3 years ago. my mom has been his primary caregiver for the past 3 years. he has declined quite rapidly in the past few months and we are considering long term care. my mom is so tired and depressed and i feel that his illness has changed the family. we were so happy once and now so depressed. i hate it. i don’t know what to do. i want to help everyone but i am so depressed myself. i have a job and am in grad school and it’s so hard navigating everything. it also breaks my heart that we have to send my dad away. i am married and can’t imagine how hard this must be for my mom but she’s trying to be strong for us all. i’m just so sad and this is so hard. why is life so unfair and cruel.," if he does end up in care just make sure people visit multiple times per week. his mental status will change but its hard to know if it will be worse or better.  someone will always be there to help but it is hard to wakeup and not know where you are s over and over.  hang lots of pictures and signs so he knows that is where he is supposed to be and that people know that he is there.   visit a lot and don't feel bad you needed help. the only other way is to change everyone's lives to fully support him.  no one wants to be a burden, but no one wants to be forgotten either.  so the best way is to act like it is normal and that their opinion still matters.  despite the severity of the disease they still know what's going on sometimes to most of the time and that is the hardest part.  just treat him like a human that matters always. that is the most important part.",https://www.reddit.com/r/dementia/comments/qdhe7z/i_dont_know_what_to_do/,I don’t know what to do
"long post, tldr at the end. i didn't know my grandpa growing up. he was estranged from the family for decades. by coincidence, i moved to a town close to him a few years ago, and decided i would try and strike up a relationship with him. as it turned out, he is a kind, quiet soul. i knew he had mild dementia when i looked him up, but he knew who i was, and we bonded really quickly. now, looking back, i realize how lucky i am that i got to form a relationship with him before his dementia got really bad. i feel like i got in there just in time, he has already forgotten who by brother, and his other grandchildren are.the last year was the hardest, he lost the ability to keep track of time. he'd go to bed at weird hours, and wake up just thinking it was morning all the time. i would pop by for a visit at 8pm, and here's grandpa at his kitchen table, having a cuppa coffee, saying ""what brings you here so early?"". he would go for short walks at all hours of the night, which was very worrisome, as he lives in kind of a crummy area. i became that one person he could trust if he needed help. since he never knew what time it was, he would make phone calls at all hours to ask about groceries, mail, and other little things. eventually, i had to take his phone book away because people were getting mad at him about the 3am calls (including one of his ex wives - i always joked that maybe i would just leave her number there!). i left my number by the phone, and said ""you can call me any time, and i will never be angry."" true to my word, whenever he called at weird hours, i was as nice as pie and patient. it was usually a short, 2 min conversation, just to reassure him that things are taken care of and he doesn't have to worry. recently, someone started to target him for money, ""some babe"", he called her. she would come to him and say she's taking him out for a drive, then get him to pay for a bunch of stuff at walmart. she sent her kids to his house to beg for money. he'd call me after to tell me ""i've done something i shouldn't have"". by the time i got talking to him the memories of it would fade. we never got a proper description, or figured out who was targeting him. not that the targeting was a good thing, but it was the catalyst that got him into long term care finally. my family has been begging the local health authority to approve his long term care application, because he got way past the point where he could manage on his own, or with my help. we had people coming in to help 4 times a day, but it wasn't enough. we sent the health authority an email with the subject line ""instances of elder abuse"", and bam, three days later he had a placement! his ltc facility is about an hour's drive from me, i wish it was closer, but i'm glad he got into it. it's one of the nicer places around here. he has his own room, and the facility and staff seem amazing. i was so worried about his confusion, because he did not want to go into care. but when he arrived, and saw all his stuff set up in his new room, he said ""all this is for me? what did i do to deserve this? this is great!"" phew! he's doing great, and i'm finally sleeping through the night without the phone calls. i miss him, even though it's only been a few days. i'm going to give it a couple weeks before i visit, because i really want him to get into the routine there. sorry for the long post, just new to reddit and this community, and so happy i've found a place where i can talk about it anonymously with people who are going through something similar. tl;dr - newly formed relationship with my estranged grandpa with dementia turns heartwarming, then difficult. after being essentially robbed by someone, gets long term care placement. couldn't be happier, except if he was a bit closer."," this warms my heart. i see someone posted the same thing, but i don’t care to be original. heart warming indeed.",https://www.reddit.com/r/dementia/comments/qdd6n9/my_grandpas_story_from_estrangement_to_best/,"My Grandpa's story - From Estrangement, to best friends, to long term care."
"my mom has a noncancerous tumor in her frontal lobe and has had many seizures as a result. they've removed it and it's coming back, so it is creating ongoing symptoms similar to dementia. i'm hoping even though she hasn't had a dementia diagnoses that maybe you all can give me some advice with dealing with the very similar symptoms.how do you go about encouraging someone to take care of themselves (go to the doctor instead of waiting til they are completely crippled by body pain), or to not lie about things by pretending they understand?my main issue is i cannot tell if she can't comprehend logic or if she is really that stubborn? she's crippled by embarrassment and would rather stumble and fall than use a wheelchair, would rather have accidents then wear depends because ""old messed up people wear depends""...i don't know how to deal and have no support to help me."," i am experiencing similar declines and frustrations with my dear mom.  ='(   i hope in sharing my experience and insights, it may be of help to you.  i went through a period where i thought my mom was being extremely stubborn, unreasonable, and refuses to cooperate.... which made our lives harder, and made me more frustrated with her.  but as her condition got worse, looking back, i now realized that dementia has a f\*ed up way of robbing your loved one's brain of normal functioning.  it is hard to explain or comprehend.  my mom refuses self-care.  she can still do some things... but she just doesn't do it.  i've asked her why and she cannot explain.  it's the disease.  :(you have to learn to change your expectations.  i've started changing my expectations of her... i keep reminding myself that she is unable/incapable of doing things anymore.  because the ""normal"" healthy her would not be this way.  in doing so, i felt less frustrated by her inactions.  but my dad is still in denial or refuses to believe that my mom is no longer able, so he gets angry and frustrated, which doesn't help anyone at all.  he thinks she's stubborn, just unwilling.whether or not your mom comprehends or is being stubborn, you just have to think of other ways to try to help her.  her executive functioning is definitely affected, or impaired.  be more loving towards her... that might have a positive impact on her compliance.  maybe purchase absorbent underwear or thin pantyliner depends for her.  schedule her appointments and take her to them.  bottom line, there is no turning back the clock.  don't waste time arguing and getting frustrated and get no results.  try different options.  but she will need extra help because she can no longer help herself.  patience is huge!",https://www.reddit.com/r/dementia/comments/qd6w8c/need_advice_please/,Need advice please
"sorry if this is not the right place to ask this question. looking for advice on how to get a screening and diagnosis for my dad.my father (late 70s) had an ""episode"" last year. he was dazed, disoriented, confused, forgetful. he said he was hearing voices. he had no history of hallucinations or delusions before. finally he was barely responsive to my mother asking him questions or trying to talk to him. she took him to the emergency room and they sectioned him. it was terrible. the place they sent him, i don't understand how anybody could get better in a place like that. there were people screaming at all hours having severe mental health issues in the halls. they kept him strapped to a chair! he doesn't use a walker or anything, he does not need a wheelchair. he couldn't have his ipod. because of covid my mother, his wife of 30 years, could not even visit him. he had limited access to a phone to talk to me or my mother. no one would consider his age to be a factor, it was treated like a mental health crisis. they said it was depression. he had been prescribed ambien so that was also blamed. he was finally released but he has never been the same.he forgets things all the time- i don't remember how to use the washing machine (he's done hundreds of laundry on this machine), i don't know how to answer my phone (it's a flip phone), how do i get to turner classics (it's the same channel number it's been for 15+ years), how long should i cook this steak for (he's been grilling t-bones for 50 years), etc. wakes up at 1:00 or 2:00 a.m. thinking he has to get to a doctor appointment. doesn't read anymore, doesn't talk to friends, doesn't listen to music. my father has over 1600 albums on vinyl. i have no idea how many cds and classette tapes. this man isn't listening to music anymore?! can't decide what to order for dinner for like, 30 minutes. burger or salad? burger or salad?his pcp *will not* screen him for dementia or alzheimer's. will not refer to a specialist. he says it's not worth it because my dad is depressed so the screening won't be accurate anyways. how do you have a man in his late 70s with these symptoms and not even look into it? he won't test for vitamin deficiency or anything. blames everything on depression and says the severe episode last year was because of the ambian.well now my dad is having another episode. he won't talk. i got him to say hello to me over the phone but he couldn't answer when i asked how he was feeling or what's going on with him. asked him if he knew where he was and he didn't answer. asked him if he remembered he and mom are supposed to come visit me soon and he was quiet for a long time and then said yeah. ask them if he still wanted to come visit me and he didn't answer.he's terrified to go to the er because he thinks they'll section him again. i need his shitty doctor to take this seriously or get him in asap with a doctor who will. how do i force this terrible medical system to screen and diagnose my father so we can know whatever is going on with him and start looking into treatments?? how can i stop them from putting him in a horrible place like they did before?"," i don't know what you mean by ""they sectioned him"". you need a specialist managing his symptoms, not a pcp, whether dementia is involved or not. are your parents open to seeing a geriatric psychiatrist? a geriatric psychiatrist will be specialized in dementia which is very different than regular psychiatry. same goes for psychiatric hospitals - if someone is suffering from psychosis or a mental illness and they also have dementia, they really need a geriatric psych ward and not a regular psych ward.  if you can schedule an appointment with one, do it even if there's a long wait time.  have you looked at his medical records?  they usually do a full panel of bloodwork and other tests during diagnostics at a hospital. this may contain some of the answers you are looking for. he should bring all the records from the er and the psych hospital with him to the geriatric psychiatrist.   i would also look up if there is a geriatric psych ward in your area. if he needs to go to an er again before getting to a new doctor, request he be brought there. i assume they changed his medications while in the psych hospital?  does your mom insure he takes the meds as directed each day?  this doesn't sound like obvious dementia to me. these symptoms are definitely consistent with bad reactions to medication, such as ambien, and mental illness. however, these things can co-occur with dementia so you need a specialist to cover all the bases.  treatment and management of mental illness is different when dementia is involved.  does your dad have a history of mental illness, depression, alcoholism, strokes, head injury? my dad's regular pcp would not consider dementia either and it caused a big delay in diagnosis and other problems.  a geriatric psychiatrist and a geriatric nurse practitioner for regular health issues ended up being the perfect combination for him.  (they worked together.) good luck!",https://www.reddit.com/r/dementia/comments/qd5x65/pcp_wont_screen_for_dementia/,PCP won't screen for dementia?
"my name is yoshikage kira. i’m 33 years old. my house is in the northeast section of morioh, where all the villas are, and i am not married. i work as an employee for the kame yu department stores, and i get home every day by 8 pm at the latest. i don’t smoke, but i occasionally drink. i’m in bed by 11 pm, and make sure i get eight hours of sleep, no matter what. after having a glass of warm milk and doing about twenty minutes of stretches before going to bed, i usually have no problems sleeping until morning. just like a baby, i wake up without any fatigue or stress in the morning. i was told there were no issues at my last check-up. i’m trying to explain that i’m a person who wishes to live a very quiet life. i take care not to trouble myself with any enemies, like winning and losing, that would cause me to lose sleep at night. that is how i deal with society, and i know that is what brings me happiness. although, if i were to fight i wouldn’t lose to anyone."," there have been so many troll posts lately. i don't understand how people think, ""yeah, let's pick on people dealing with a horrible, irreversible disease. sounds harmless."" like...it's just a another annoyance, and a small one in the grand scheme, but i'm running out of faith in humanity.",https://www.reddit.com/r/dementia/comments/qczher/i_am_very_sorry/,I am very sorry.
"i’m 30 and unemployed. 90% of people have lost respect of me since i’ve been unemployed this last few years and it kills me as i used to be doing so well in life.and i just feel pathetic. my dad was great and did what he could help me out when i was younger and people hated me for it. now i’m 30 and only just had his diagnosis this year. but nobody saw  the arguments we were having before hand etc etc and that my life really wasn’t as easy as it seemed. but i feel so fucking useless. my dad worked hard all his life etc etc and brought me up to be the same yet i can’t seem to win at anything. after applying for well over 2-300 jobs a few years back (after being sick of doing delivery work for local takeaways) i thought i would find something better but never did. and i really don’t know what to do about it. i feel like i’ve mentally fallen apart as a man. had to sit back and lose my social life, my goals and dreams and my identity. and i can’t blame it all on my dads dementia but it definitely added to it. i used to have so many opportunities. and options with life. i didn’t take things up because i wanted to make the most of having him around. now i don’t have any. i feel like i missed the boat with everything and i’m a complete shell of who i used to be. then i beat myself up about feeling like i can’t seem to get on in the world and figure shit out and make money. i spend half the day in bed depressed.has anyone else had a parent with this and it fuck them up just as much?i feel stuck between a wise old man and an overgrown kid. like i missed a chunk of my life somewhere along the way. then i think if i had the opportunity to really change things around would i want to?i know i’m blessed to still live at home and have him here. im so mentally conflicted with everything and don’t know what to do about it. i guess i just feel like my life shouldn’t have gone this way? i had such a great start and potential and it’s like i just can’t figure myself out. my dad says the opposite he thinks i’m doing ok. i say to him nobody respects me anymore etc and he says they will. but will they? really?  i just feel like i’m going to be getting walked all over the rest of my life. and even if i don’t i beat myself up about the way so much of my life has gone"," my gosh, you're only thirty. seriously. you're still sooooo young. you have sooo much time to figure it all out. consider a career coach or additional training after you get treated for depression.",https://www.reddit.com/r/dementia/comments/qcwdco/i_feel_like_a_fuckup_of_a_son/,[deleted by user]
"my alzheimer's mother is now in assisted living. it was a long and stressful week with her in the hospital. working with the doctors, nurses and caseworker was tough. but in the end, the system worked and she got transported to the assisted living facility. i broke the news to her and that went surprisingly smoothly, as i focused the conversation on how if she wants to leave the hospital that she hates, she needs to go to the assisted living facility (i called them senior apartments) temporarily. you all know, it's not temporary, and i feel terrible for lying to her. but someone here said something that resonated with me: you're lying to the disease. not the person you knew. those words are what helped me do and get through all of this.", it’s not wrong to lie to them. it’s for their safety.,https://www.reddit.com/r/dementia/comments/qcsvfc/i_finally_got_her_into_assisted_living/,I finally got her into assisted living
