submission,comment,url,title
"grandmother is slowly slipping into-- possibly dementia? she still knows who everyone is, even if she does have to list off 3 people before she gets there, and she's not ""gone"" by any means-- but almost every day she reports people messing with her outside her house at night. my mother is practically her caretaker at this point, and it's exhausting her physically and mentally trying to sort this one out, so i'm posting for advice.details:   \- these things occur only at night  \- she isn't afraid, more annoyedoccurrences include:  \- somebody parking in her driveway and shining a light inside her house  \- a man walking with boots stomping up and down her gravel driveway  \- a man breaking into and living in her (locked with a chain) shed  \- making bird call noises outside her window  \- just various other similar things  \* they are never in the housewe believe this to be some sort of night-based delusions, because a lot of these can be explained by moonlight, frogs, birds, and so on. it does keep her up, it does frustrate her (she's reported yelling out the window for them to go away), and it frustrates her when she tries to tell my mother about it.we have:  \- set up cameras that catch nothing (but she believes they ""hide"" from the cameras)  \- tried modifying living space to change the triggers (lights / sounds) but she won't have any of it  \- stayed up all night and watched to see if anyone or anything shows up  \- various other things to ""prove"" nothing is there, but obviously as she believes it's happening there's no convincing her.so what's advice here? normally dementia advice is ""let them live in their fantasy world"" where their family is still alive or something, but here reaffirming ""yes there are men messing with you outside at night"" is not helpful. proving they're not there hasn't been helpful. trying to remove (what we believe to be) triggers either doesn't work or isn't physically possible. we attempted adjusting her medications, but it did not improve this particular issue and made the things she is taking medication for worse.we just want her to feel safe and my mom to have peace of mind. any help is appreciated! &lt;3 &lt;3 &lt;3"," same happened to my grandma in the early phases when she was living alone. she had recurring utis that greatly exacerbated her hallucinations and false perceptions. if y’all can get her in for a checkup in that regard, that would be my first piece of advice. eventually these episodes were constant, but when things came to a head in those early phases, 99% of the time she had a uti and getting treatment stopped the delusions (for a while). another thing that may be going on is sundowning. i was told that can be caused by low stimulation during the day that had the brain overreacting to shadows, sounds, etc.  filling up the day with engaging activities my help her sleep at night. in my grandma’s case, i ended up opting for memory care because she could be herself there. she was also closely monitored and checked for infection when she exhibited a rapid change in behavior. they also had tons of activity, and even if she didn’t participate, i believe it was good for her to have a lot of activity around her. and if she ended up pacing the floors with anxiety all night, she was in a safe place to do it. sorry you are dealing with this. it is so scary. :(",https://www.reddit.com/r/dementia/comments/qbfbl5/grandmother_thinks_people_are_messing_with_her/,Grandmother thinks people are messing with her outside at night - what do?
"she is still quite early stage in the illness so she still uses the landline and she has an emergency fall system which is linked to the phone.she gets fake calls from all areas, bank, insurance, roof repairs etc and it's causing her enormous upset.does anyone have any experience or suggestions how to help with this?", u/dink-dang-do needs to be booted and is abuse coward.hey mods get off your asses and boot this guy from all of reddit. wtf he just spent the last hour verbally assaulting everyone. you guys really gotta get your stuff together.,https://www.reddit.com/r/dementia/comments/qbbipp/help_please_my_friends_mother_is_getting_plagued/,[deleted by user]
"mom 83 vd with lbd, dad 86/veteran. i am the daughter who lives next door. her other son and daughter (anti vax) live 3 houses and 1 mile away respectively.pre vaccinations they entered daily without masks. as of now 5 of 8 have been positive. i got my parents in week 2 rollout and myself at week 3. boosters last month.i have been dads only assistance. in addition, he cooks for moms sister daily and takes it to her. she has a do nothing daughter. i drive my mom (alone ) to her neuro 2 hrs away each way because we live rural. neuro is fantastic. dad chose not to follow his advice she possibly had a uti and one more later we are  8 hours er with uti+kidney and impacted colon to rectum.if i take a day off she doesn’t eat or drink until i arrive at night. dad is unable to deal. he hides in his room playing solitaire. diagnosed 3/2020, i have pressed him to get help. he says they are fine and he and i can do it. i am stress level 100… and they are financially very well off.this past friday i was to arrive at 230pm. upon arrival dad says give mom a boost hydrate ( not eaten or water all am) if you can then tells me she is sitting in the sun(87 degrees, no ice nor water and no idea how long. says he’s going to take a nap.i go to check on mom and skin on fire, low bp, non responsive, blue lips. i can tell she is going to have a seizure(her 3rd ever) so i drag her inside , ice her down with packs of frozen foods and keep her semi  conscious i undress her body covered in sweat and urine, and during this for the 2nd time dad mentions the food will go bad (!!) fries and hotdogs. then he says he has to run errands and leaves the house. a relief for me, as a prior rn , he is in my way.i have contacted her pcp of 30 years who advised me to remove blockage myself. zero help. begged vamy “do nothing  brother” is poa.my parents bought all 3 of us homes. we are all adopted.i had a home inspection done and dad followed no advice. az of nc gave us 2 caregiver respite packages to helpwith his yard. i buy finger food and baby snacks on a red tray. he makes elaborate meals she won’t eat. he also cooks dinner for her bedridden sisters and takes to their homes. both also wealthy.now on monday he is driving one sister to moms far away neuro for an appointment i will stay with mom 6am until 5pm.i cannot do anything without poa.patriarchal family.i shake all the time. i left this area  at 17 for nyu then 18 years abroad. came home for covid to a house i usually rent. then mom diagnosed do i have any options? thank you."," yep, call adult protective services to do a well check.",https://www.reddit.com/r/dementia/comments/qb4tym/i_feel_my_mom_is_in_danger/,[deleted by user]
"sorry if this post seems frantic, i just want to make sure i do this the right way. her husband (my grandpa) died 14 years ago. last week she woke up not knowing where he was, and every day she has been grieving his death as if it just happened and nobody told her he was sick.how do i approach this for the sake of her health? do i keep telling her it was 14 years ago? do i let her grieve? any advice would be helpful."," i've done both with my mom, spitting. kinda like humphrey suggested - if it seemed like she needed to grieve then i would say ""yeah, dad died, mom. he didn't want too - the cancer tore through him. but now he's watching over us and waiting for 'ya when you're ready to roll on."" sometimes she was relieved with the explanation, like she thought he just left her, finding otu he died was actually better than abandonment. sometimes it made her cry for awhile, but she was an adult and i figured i could suck it up so she could feel something. other times it wasn't clear if her questions about my dad were actually *about my dad*. i don't know if you've gotten to that phase yet, but it became unclear who mom would be talking about and what exactly she was asking so then i'd just tell her ""he's waiting for you! when you're ready to see him, he'll be ready to hug you big time!"" my mom became non-verbal pretty early on so i didn't get a lot of argument like ""let's go now!"" from her, just acceptance. the biggest eye-opener in my dementia family career was finding out that forums are awesome and other caregivers have such great advice, but in the end i knew my dementia mom better than anyone, not every fantastic tip or trick worked for her as they did other's. get info from other's experience then trust your judgement. believe me, we're never gonna be right all the time - it's dementia - it's designed to make us all wrong alot!",https://www.reddit.com/r/dementia/comments/qaycmd/my_grandmother_has_slowly_been_losing_her_memory/,My grandmother has slowly been losing her memory over the years. Last week she forgot her husband died.
"our aging parents fill a very special place in our hearts. they raised us and cared for us unselfishly. so that’s why it’s only natural that we’d like to return the love they’ve given us.#### however, life happens.many of us settle down, raise a family and have busy careers. as such, we are active in every aspect of our spouse’s and children’s lives—school activities, errands, chores. life! another part of our day that grows is our work, and as we move up the success ladder, we have more responsibilities and bigger demands.time then becomes more scarce for us. yet, you still want to show that you care for your parents.  maybe you can’t come and visit as often as you’d want to.impossibly tight schedules? you can’t just let go of things at work for now? you moved and settled farther away?it’s understandable. you cannot take on everything.but, how do you show you care for them?your loved ones are like everybody else.they also plan and desire to fill their days with activities they enjoy.however, given their age and current health status, they may not be as mobile and strong anymore.#### caring in different ways.you may not be able to do it personally, but sending your care or love through a companion is invaluable and would be appreciated.you can send a selected webookcare companion to check on your loved one if:&amp;#x200b;* they’re keeping ok and have high morale.* they can take care of themselves or if they’d need assistance with certain things.* they’re eating right and healthily.* they’re able to take their medication at the right time, at the right dosage.* they need a companion and someone to just chat with during the daythe schedule and duties don't have to be fixed like you'd get with traditional home care agencies or like how nursing homes do everything for the elderly.you can plan and suit the type of care you’d give based on what you think your senior family member needs the most help with. you control the home care services you avail of, the cost and when you need help. you also need not worry about your parents' loss of independence and being uprooted from home. while you avail of home care services for specific areas in their lives, they will still enjoy the lower cost and independence in other areas. #### comprehensive yet flexible care for seniors.there are various reasons a family would consider or decide to get home care for their senior family member. for example, they may need help with personal care, dressing and grooming, housekeeping, meal preparation and eating, pet care, transportation services, around-the-clock monitoring, companionship, shopping and errands, and more.as seniors and their needs are unique, we at webookcare made sure that home care services are as comprehensive as possible, and much more importantly, customisable for every senior’s needs. your senior loved one might just need help with one or a combination of home care services any time of the day.the bottom line is, we’ll be ready with the desired home care services. all you have to do is download  [webookcare on the app store]( or [webookcare on google play]( fill out your profile and select a compassionate caregiver. then, you will only pay for the home care services chosen—no minimum hours, no fixed schedules, no fixed care plans, and no subscription/membership fees required.#### safe and secure.once you’ve downloaded the app and completed your profile you'll be able to view the profiles of webookcare caregivers plus testimonials from other care seekers. because of that, you choose who you think will be a suitable match with your senior loved one. then you also could book a meet-and-greet session with the caregiver before any actual home care service gets underway, for you to be doubly sure of your caregiver selection.moreover, you’ll be able to pay for the home care services through our trusted payment platform, stripe.#### empowerment.download the [webookcare on the app store]( or [webookcare on google play]( now and feel empowered right away. through the app, you now have the power to assure your senior loved ones of the help they need in their lives without taking their independence away. you also get to conveniently choose the caregiver who you think will suit your loved ones’ needs most. lastly, you will be able to give yourself the peace of mind you’ve been hoping for, knowing that with webookcare, you’re putting the care of your senior loved ones in capable and compassionate hands.  #### let’s work together.through our mission to revolutionize the home care landscape with technology that empowers those giving and receiving care to choose how they want to live their lives, let’s work together to ensure that our loved ones stay at home for as long as possible!download the [webookcare on the app store]( or [webookcare on google play]( and let’s better home care for seniors and caregivers!",,https://www.reddit.com/r/dementia/comments/qawa2r/what_is_comprehensive_home_care/,What is Comprehensive Home Care?
[removed],,https://www.reddit.com/r/dementia/comments/qavsbu/93_yo_grandmother_with_ftd/,[deleted by user]
"my grandfather (94) is in the mid-term stages of dimentia, however he responds well to medication. still, this does not make things easy on my grandmother (89). as a family, we have spent a lot of time supporting my grandfather and feel like my grandmother has been somewhat forgotten in the sense that she is also suffering as a result of my grandfather's illness. her 90th birthday is next month and i wanted to get her something special. not only because it's her 90th but also something to perhaps help remind her she isn't alone and she is doing a tremendous job at supporting and caring for my grandfather.the easy option is to buy an engraved glass or some nice ornament but that is less practical and just something more to add to their collection of things to dust. any ideas are welcome, not necessarily practical but not a bad thing if it is. or maybe something to help with supporting my grandfather. could seem like a gift for him but something to help her by proxy if that makes sense. thanks all."," i would give her an experience.i took my mom to japan for a week for her 70'th birthday. she has wanted to go her entire life. i didn't really have the money, but i realized that soon we won't be able to do this. she has some chronic illnesses and her mobility is getting worse.  i think that was one of the most amazing weeks of her life! so worth it!not saying you do this with a 90 year old, obviously. but to take her somewhere - out for dinner perhaps? - and spending time with her celebrating her would be worth a lot more than some trinket gathering dust in a corner. :)",https://www.reddit.com/r/dementia/comments/qatx3y/birthday_gift_for_my_grandmothers_90th/,[deleted by user]
[removed],,https://www.reddit.com/r/dementia/comments/qasavg/father_with_possible_dementia/,Father with possible Dementia
the results are revealed here:[, very exciting! gives hope to millions of people who suffer from this disease. i have been following the company for years. it is the only actionable company in the space. the team is credible and the science is vetted. those; who oppose bioviva are against health itself.,https://www.reddit.com/r/dementia/comments/qaqy7o/human_dementia_study_results_bioviva/,Human Dementia Study Results - BioViva
[removed],,https://www.reddit.com/r/dementia/comments/qaqy01/recruitment_for_alzheimers_disease_caregiver_study/,Recruitment for Alzheimer’s Disease Caregiver Study
they are drops developed to help combat dehydration in dementia.  do you think they could be useful?," i've heard about them and wished i could get them for my dad, but i'm in the us. it's a fight to keep him hydrated, since he doesn't remember to drink, understand the need to drink, realize he's thirsty, and/or want to drink. he looooooves candy, though, so i feel like these would be great for him. a shame they haven't made it over yet.",https://www.reddit.com/r/dementia/comments/qanwkw/have_you_heard_about_jelly_drops/,Have you heard about Jelly Drops?
"friday 10/15 was a happy and bittersweet day for me. happy because we made our 50th anniversary, bittersweet because my wife with alzheimers could not realize it. i woke her with a big hug and said “ today we’ve been married 50 years, happy annversary!”, and she looked at me and said “is that right? ok”.  it started 10/15/1971 in dallas tx when we were both 20, and has withstood the test of time.  many good memories, some occasional bad ones. it is painful to watch her confusion and apprehension grow through the last 5 years…she has loved me unconditionally for over 50 years. our love has grown since our wedding day, but her mind can no longer relay that to her heart.  i pray for peace and comfort for her, and all those afflicted and affected by this dreaded disease."," peace and love and sincerest congratulations on your anniversary. deep down, her heart knows. she’s a lucky women to have you!!",https://www.reddit.com/r/dementia/comments/qae9g7/50th_wedding_anniversary/,50th wedding anniversary
"my stepfather had a bad episode involving feces and severe disorientation. he was in the hospital for a week where he got much better. (i think he hadn't been taking his meds/drinking enough water.)he has since been moved to a nursing home where he is on a memory care floor. things i'm not happy about that they say are this way because he's in memory care:-he can't go down to the dining room and therefore can't participate in most of the home's activities-little or no choice what food he gets-surrounded by people who are in worse shape than him (further along in their diagnosis)he stumbles over his words and forgets things mid sentence but can still talk about shakespeare. but it seems like all the homes with actual intellectual activities and nice libraries cost 15-20k a month. so what i'm wondering is, is what i describe above normal for a home with memory care? i'm tempted to move him somewhere else but maybe i just have the wrong idea of what memory care is like."," sounds more like skilled nursing with a memory care hall/wing. i looked at one for my grandma that was similar to what you describe   they wouldn’t let my grandma past an imaginary line, and i was like heck no, that’s not going to work with my grandma. she is very fit, physically. and can become vicious if she can’t do what she wants. i kept her in memory care for as long as possible, but yeah, that was $5k-$10k per month.  it was absolutely the best place for her during the earlier phases. she is now in skilled nursing, but i made a point to find one that allowed her to wander. she rarely makes it to the dining room, but when she wants to she can.",https://www.reddit.com/r/dementia/comments/qabjm5/is_all_memory_care_like_this/,Is all memory care like this?
"my alzheimer mother fell on thursday and has been in the hospital since -- she didn't even have a bruise. but, with any luck, she'll be in assisted living by tuesday. she needs it and it's the safest place for her.even knowing this, i'm wracked with guilt and i know this will infuriate and devastate her. i'm sure that eventually she'll forget. but until that happens i'll be dead to her."," i am new to this community and really appreciate hearing others experiences because this is so so hard! my father is in hospital after a fall, very impaired mobility,  and 6ft 3 in height. he also has to have palliative radiotherapy in a few weeks and i don't want him to go home to my mum and admittedly fantastic carers. he is giving everyone grief about going home, but the hospital think it's time to invoke epoa which puts me in charge of his care. my biggest problem is that his signs of dementia are mostly an unrealistic idea of his capabilities,  and angry and aggressive behavior.  his memory for the most part is not that bad. i very much feel between a rock and a hard place.  he's a danger to himself and my mum, but if the specialist comes down on the side of him being able to still make his own decisions what on earth do i do?",https://www.reddit.com/r/dementia/comments/qa9wcp/i_know_many_of_you_have_had_to_do_this_its/,I know many of you have had to do this. It's absolutely brutal.
"hello. my grandmother has dementia, i recently found out. although i kind of knew that she was showing symptoms of it, now i realize how bad it actually is. my mother doesn't really have a strong relationship with my grandmother, they normally see each other once or maybe twice a year, they also live pretty far away from one another. i think when we visited my grandmother in 2018, she was already being a bit forgetful: occasionally repeating words and phrases in sentences. in 2019/begin 2020 we visited her again, she did not seem to recognize me at first when she opened the door. she went upstairs, and showed us cabinets and wardrobes full off unnecessary stuff, which she compulsively bought. rows and rows of the same cleaning product, toilet paper, et cetera. i don't think that we really visited her after that. (until recently)just a few weeks ago, my grandmother (she is usually very cold and blunt) called my mother in a deeply emotional state, begging her to come by once. my mother asked if it was okay to see her that same day, which my grandmother initially accepted.however, just 30 minutes or so before the appointment she said she wasn't 'feeling well' so my mother shouldn't come. she didn't, but a couple of days later she did. when my mother arrived, she found her own mother lost in dementia. my grandmother has formed this narrative which she says every single time when she's talking to someone: ""oh, did you know i got fired from my job? the business closed down."" this was 15 years ago.""hey, i renovated my kitchen."" 10 years ago. yesterday, i went with my mother to see my grandmother. she did not recognize both of us. we brought some food, because she is terribly skinny and keeps forgetting to eat. my mother had to explain that she was her daughter, i think she understood that. she kept asking for my age, and awkwardly asked me what my name was, and where we lived. care: she can not live by herself without help anymore. we can't go there every day to take care of her, but, there is a friendly neighbour at the other end of the street who helps her and chats with her occassionally. he is truly a kind man, but it is also very strenuous for him. he is getting literal physical pain because of the intensity of taking care of my grandmother, poor soul. we have contacted my grandmother's doctor (she has not been officially diagnosed yet) who is very, lazy i would call it. he refused to get help for my grandmother and was overall just lacking. after some pushing, we have managed to get a caretaker to take care of my grandmother, but onfortunately, it starts in januari! my grandmother still has a driving license and is still driving, which should be taken from her. i don't know what stage she is in, however, i would guess stage 5 of alzheimer's. damn, i just realized how much i wrote. if anyone actually read all of that: thank you. i don't know what we can do at this point.", [deleted],https://www.reddit.com/r/dementia/comments/qa9jux/i_dont_know_what_to_do/,I don't know what to do.
we finally moved my fil into memory care. the past few months were marked with steep decline in his ability to care for himself and incontinence. the decision was made easier by a breast cancer diagnosis for me. i have a good prognosis but still have chemo and surgery to deal with. he's angry and feeling abandoned. he doesn't understand that he's hard to care for. he doesn't understand his own deficits. my sil is taking it hardest because he knows how to push her buttons. he had his phone at the beginning and called her to try and get her to pick him up. that left her feeling really guilty. we'll get through this tough part and things will get better. much love to those struggling with this awful disease.," sending love and positive thoughts your way, too.  you've got your health to take care of and you did the right thing.  it's so tough moving family members into memory care, though.  i moved my mom in march and her anger, my guilt- it takes a toll on everyone.best wishes for a full recovery for you!",https://www.reddit.com/r/dementia/comments/qa6wr3/moved_into_memory_care/,Moved into memory care
