submission,comment,url,title
"my father and i can't come to an agreement on what to do with my mother.i love my mom very much, but her dementia has progressed, making her extremely difficult to deal with.  lately if you suggest anything at all, she wants to pack up everything and move in with her last surviving sibling who lives 3000 miles away.my father frequently texts and asks me to call my mom to try to calm her down.  it doesn't work.  all she does is end up screaming at me, telling me to shut up, that i'm a horrible daughter, etc. i know this is the disease talking, but it's getting increasingly difficult to deal with, especially in the middle of my workday.  she now refuses to shower and threatens to leave almost daily.  she's actually left a few times and walked over 2 miles.   i think memory care is best, but my dad wants to keep her home.  i see where he's coming from, but we're all losing our minds in the process. how do you remain respectful to your parents as an adult child and stay supportive while keeping your sanity?  i'm exhausted and this has impacted my quality of life in multiple areas."," a lot of places have great day programs that could help.if they qualify financially, some states have a program called pace that takes them 8-4 and in addition to great programs has all of their doctors there as well.",https://www.reddit.com/r/dementia/comments/odorsi/call_your_mom_shes_having_a_meltdown/,"""Call your mom. She's having a meltdown."""
"my dad (diagnosed 2 years ago with the behavioral variant of ftd) is now starting to show language loss. today while on the phone with him he couldn’t come up with the world for “sister”. he’s greek and has lived in the us for 40 years, but grew up in greece and lived there until 30. i guess i’m asking for other people’s experiences with language loss in bilingual people- how long did it take the second language to go, how long did it take the native language to go. the cruel thing is that i never learned greek, so i’m losing my ability to communicate with him."," was he diagnoised with ppa- primary progressive apashia?  i am age 58 and struggling with word finding and forgetting how to spell, writing one word when i was thinking a different one and short term memory loss. my neurlolgist thinks i may have early ppa and referred me to a specialist in behaviorial neurology for a potential diagnosis.  any additional background you can provide is appreciated.",https://www.reddit.com/r/dementia/comments/od8o85/ftd_and_language_loss_when_bilingual/,FTD and language loss when bilingual
how was it communicated to them? do they remember it? do they fully understand it?," my mom knows. she still has moments usually in the morning where she is quite lucid. she knows why she takes the tests to see her score and compare it to last time, if i remind her what her last score was. it was 20, by the way. she knows she's on some ""memory drugs"". she does not, however, think she needs the medacube med dispenser... until i remind her that she's on memory drugs... then we laugh about it.  my mom is still a very very nice person, always has been.",https://www.reddit.com/r/dementia/comments/od3hdi/to_those_caring_for_someone_with_dementia_is_that/,To those caring for someone with dementia.... Is that person aware of the diagnosis?
how was it communicated to them?do they remember it? do they understand it?,,https://www.reddit.com/r/dementia/comments/od3gr2/if_you_care_for_someone_with_dementia_is_that/,If you care for someone with dementia - is that person aware of their diagnosis?
"my mother was fine.  getting older still taking care of herself on a daily basis.  she showers walks around the house makes her own food.   tuesday she was not talking normal.  couldn’t get words out that you could see she knew.  her left side face was dropping.  basic stroke symptoms. went to the er.  she spent a week in the hospital.  during her stay they can multiple mri’s multi ct of her head chest and heart and neck,  they couldn’t find anything.   she currently can hardly get words together.  can’t get out of bed and needed a lift to get in a chair.  in three days.  the neurologist said it’s dementia.can dementia manifest itself that quickly?  i think the neurologist is a nut job but they can’t find anything else wrong.  any ideas people of reddit?thanks.", bells palsy can cause these symptoms as well.,https://www.reddit.com/r/dementia/comments/od23u0/could_dementia_manifest_this_way/,Could dementia manifest this way?
"hello,my stepfather's dementia is progressing steadily. presently he is still able to function: he can cook, do simple tasks, and hold a reasonable conversation so long as it doesn't require too many information streams. anything that remembers creating new memories, exercising judgement, or forming a plan are non-starters.my mother, never a patient woman, is at her wits end trying to support him. all the children live a minimum of the 75 minutes away, and all of us have commitments that make being with her/helping her more difficult.she primarily needs babysitting help, but also help around the house helping with the things she wants/needs done.  everything from cleaning the basement to fixing a broken toilet etc.", she should check senior centers in the area for respite programs.    her local chapter of [alzheimer's association]( will be a good source of the resources available to her even if her husband isn't diagnosed with alzheimer's disease.,https://www.reddit.com/r/dementia/comments/od1v63/support_for_my_mother_a_reluctant_caregiver/,"Support for My Mother, a Reluctant Caregiver"
"here's an 85 year old woman, and she stares. no verbal response   or a very slow one.i want to yell at her to go sleep....or at the least to stop looking at me  omfg when will i die? when will she?"," i'm sorry. the lack of sleep is the worst. my grandma is 86 and she just stayed up for almost 40 hours and finally crashed last night. i don't know how to fix the refusal to sleep, but for for staring have you tried a sleep mask or putting a blanket over your forehead and covering your eyes while you sleep? we had to install curtains in some areas so she doesn't see us walk by and such. kinda like blinders on a horse. stay strong :(",https://www.reddit.com/r/dementia/comments/ocycvs/my_mom_stares_and_i_hate_it/,My mom stares and I hate it
"hi everyone, i'll try to make this as brief as i can, and apologies if the problems stated here don't exactly have to do with dementia alone; but as many of you probably can relate to, his relationship with us (me and my sister) is complicated and it's hard to trace the threads.i am 37, my dad is 64 (65 in october). when he was 18, he adolescently tried to race a train and lost, resulting in a tbi that is now manifesting as early-onset dementia. this was only recently diagnosed, though, and all my life he was a slow thinker, borderline illiterate, not ""stupid"" (he could design, build, and fix things brilliantly but his mom had taken him out of school at 16 to work and i think that seriously set him back), but shy, maybe anxious, and a man of few words. and, importantly, largely absent in our upbringing.both my mom and he are alcoholics, which is another topic for another sub, but importantly my dad was largely just not around when i was growing up, even though my parents didn't divorce until i was in my 20s. he worked a lot i think (various kinds of construction but mainly putting in pools), but he was also out in the garage drinking with his buddies, out fishing, or god knows where else. starting in my early adolescence, furthermore, he basically moved into the basement (the stated reason was that the waterbed he shared with my mom upstairs was bad for his back and she refused to get rid of it, though i was never quite convinced by this) and from then on he was barely more than a housemate, or some distant uncle who'd weaseled his way into a basement apartment.so we grew up being used to not having him around, not expecting communication or support from him, and basically operating as a one-parent family. now, he seems to have clued in belatedly to some of this, and seems to want to ask me if/why my sister hates him. i don't think she does, and nor do i, but we definitely don't have much affection for him; my primary emotion about him is pity. and, i know that if he wants to know how she feels he should just ask her instead of me (though he is right in saying that she and i are close enough for me to basically know her pov).he went to a 3-month in-patient rehab two years ago after some kind of alcoholic episode (his dementia diagnosis must have been around this time too), and since then i think he might be realizing that it's likely to be all downhill from here. my perspective, and my sister's, is that we basically don't want any more than the bare minimum to do with him. we don't want to see him dead or in the streets; but taking over his finances, making decisions for him is not something i want to do, or my sister. i feel like we're going to end up doing it anyway because we're good, compassionate people. but i don't think it's going to remedy our negative feelings toward him. so what am i asking here... solidarity, i guess? advice, maybe, but if you're going to tell me ""swallow your pride and bury the hatchet before he can't any more"" i don't think that's going to work for me. i'm the furthest thing possible from a proponent of 12-step, but until he makes an effort to make amends with us regarding the effect his alcoholism had on us, my wall isn't coming down. any similar experiences? similar choices, regrets, validations? i expect that there will be less and less cohesiveness and stability in his discourse with time, and since phone calls with him are already torturously anxiety-inducing for both him and me, i don't expect to want to increase communication with him. we don't understand each other, we don't communicate on the same level, i doubt he has the emotional intelligence to really name his emotions (something i had to learn as an adult because we were so goddamn repressed at home), let alone express them.is it possible to have an ""arm's-length"" relationship with an absentee parent declining into dementia? or am i fooling myself into thinking there's anything but all-or-nothing, that i either just cut him out or dive into power of attorney?thank you for reading, again sorry if not enough of this is directly to do with dementia but i hope there are others who can identify with my experience."," my dad wasn’t absent growing up, but to make a very long story short… he battled alcoholism and it won and eventually ended up in nursing home. he did some really terrible things to us - not like sexual abuse terrible but he was just a terrible parent as a teen and in out early 20’s any way….what i’m getting at is he has spent the last 20 year in nursing 5 different nursing homes and the first 4 years i didn’t visit him. neither did any of his 8 kids. but at some point you realize (especially for me - when you become a parent) all the sacrifices he had made for me in my childhood, that he was a good man a one point and still is but booze got the best of him. so i guess my point is, at some point you will realize you might want to “bury the hatchet” because he’s your dad… but i base that off of my dad who sucked terribly but i still love him when i get to the bottom of all of the bullshit. good luck",https://www.reddit.com/r/dementia/comments/ocwv4d/dad_was_absent_most_of_my_upbringing_now_dementia/,Dad was absent most of my upbringing; now dementia is starting
"hi,&amp;#x200b;i'm a senior ai student and i'm looking to create an app that is simple to use for people with dementia to help them in their daily lives. it will be heavily focused on speech recognition to make it as simple as possible. the functionalities i have are&amp;#x200b;* for people with dementia (voice commands):   * good morning: gives them an overview of their schedule for that day   * call x: will call someone   * how do i do x: will give instructions on how to do x   * what's my schedule?: pretty much the same as ""good morning""* for their caretakers (no voice commands)   * a dashboard like webapp where they can:      * schedule things &amp;#x200b;i'm open for any ideas that can come in handy. thanks for reading!"," my grandad is incapable of making incoherent sentences, but if he is agitated i can guess if he needs the bathroom, reassurance, water or something, so maybe making suggestions could be useful when there is no specific input",https://www.reddit.com/r/dementia/comments/ocw5q2/ideas_to_implement_into_my_app_to_help_people/,Ideas to implement into my app to help people with dementia
since majority of people suffering from dementia are alzheimer's patients as well i am reaching out to all those who know about alzheimer's  if you are or were a caregiver of an alzheimer's patient answer this survey on google forms pleaseeeeit will help me so much thank you[p.s mods please dont remove this post and help me out thank you!,,https://www.reddit.com/r/dementia/comments/ocvl2c/i_am_conducting_a_research_on_alzheimers/,i am conducting a research on Alzheimer's caregivers!!
"hospice started doing weekly check-ins with my gran this past week. afterwards she was furious. she told my aunt that we (the family) must stop thinking she is dying; she is still cleaning her house, and cooking every night. (she does not. someone comes in twice weekly to clean her house, and her boyfriend cooks for them.)in a way this is more a philosophical issue… my grandmother is (was?) a very intelligent woman who thought deeply about life and death. she also had major depression in her earlier years (she is still on an antidepressant). these days she barely believes in death. perhaps that is self-protective? she clearly doesn’t want to know that she is dying (she recovered from cancer twice), so perhaps it is best for her to continue being happy and believing that she is capable and strong?"," if she is taken care of i don't see what the problem is. you might want to continue the check-ins but ask that the people pretend to be from another type of agency like senior services or a church if that would make her feel better. if the boyfriend is the main cartaker, talk with him and see what support he needs.",https://www.reddit.com/r/dementia/comments/ocv7lm/my_grandma_believes_she_is_okay/,My grandma believes she is okay
"mum finally got the office dementia diagnosis but now she’s in a constant state of aggression and it’s breaking my heart because i found myself getting very angry recently.  now i feel like an absolute sack of shit i’ve been dealing with her suicidal ideations for 33 years off and on the last 3 it’s been constant. i started to get angry because she’d just mope in bed all day and not do anything, not even get up to watch a 30 minute short film.  then she went into a fit and i admittedly yelled because she refused to go to the placement appointment that i’ve worked tirelessly for the last three years and finally secured it. the good news is she’s not coming home and will be places in a locked down facility where she needs to be. my only fear is she’s stuck like this. maybe it’s time to go to a support group."," time to take care of yourself. a support group would be a good idea. but do all the things you have put off. relax, eat some great food, be with friends. you deserve it.",https://www.reddit.com/r/dementia/comments/ocr4cb/finally_a_break_but_now_i_have_to_work_on_healing/,"Finally a break, but now I have to work on healing."
"dementia has been a special interest of mine for a long time, it’s always something that’s fascinated me. however, it’s a lot scarier when it’s in your life and happening. when speaking with my grandfather for the first time in months, i noticed he kept repeating the same question or statement about four or five minutes apart. the first few times i thought it was intentional; a callback, or something (he is an eccentric person already and speaks in sort of strange ways). but i asked my father and found out he’s been having memory issues and he’s getting tested because of his sudden trashed instant recall skills. it’s not official yet that it is dementia, but the thought that one day he may or recognize me is very sad. he also seemed pretty down; he is someone of many hobbies and i can’t imagine watching him slowly forget or not be able to do what he loves. this is just a venting post, feeling down.", try not to think too much about the future ‘what if’s’ and just meet him where he is now. other things than dementia can cause forgetfulness so it may also not be dementia. i hope your grandfather can get the medical checks he needs to find out what is wrong.,https://www.reddit.com/r/dementia/comments/ocqc93/its_starting/,It’s starting
i don’t even know what to say. i have no words. this is really happening. i feel sick.,,https://www.reddit.com/r/dementia/comments/ocp3kl/my_neighbors_are_setting_off_4th_of_july/,"My neighbors are setting off 4th of July fireworks while my grandfather, a WWII veteran, lay dying in his bed."
"my mil was diagnosed as having what they believe is a mild cognitive impairment / early dementia. she scored a 20/30 on the moca. however, last year her symptoms were out of control. personality changes, suicidal ideations, lying, wandering, and what we thought were psychiatric symptoms since she is 60 years old. her father did have alzheimer’s. regardless her symptoms were so out of control we (her kids/spouses) admitted her to the hospital and after being there for 2 weeks, they found infarcts (mini strokes) on her mri as well as more dementia like behavior that was creating such behavioral concerns. since then, she is on an abilify (anti-psychotic) and an antidepressant and definitely is better although not nearly her old self. seems to cognitively went downhill since her memory isn’t great now and has this urge always to move and cannot sit still which is probably from the meds. she is definitely a lot calmer though and seems a little more lucid.anyway my dilemma: my husband and i are having a baby. she keeps saying she wants to babysit and does babysit my nephew (his parents however live in the same building as her) and he is 5 years old. i don’t know if someone with a mci is supposed to really watch a baby on their own or if i’m comfortable with it. i will probably ask her doctor but i was curious how people dealt with this or if they had any experience with this. i feel sad because i know she’ll never really know my children the way she would have and my husband is really upset about what has happened. it’s also to me at least not clear exactly what this is. it’s not full on dementia but something hasn’t been right for years and it doesn’t seem purely psychological but they haven’t given her drugs for the impairment."," unfortunately not. it is not safe for a patient with dementia to be left alone, and leaving her alone with the baby would be setting her up for failure. i would only allow supervised visits for both herself and your children's safety. that be like leaving a toddler alone with a baby. my grandma will switch from sweet and loving to hitting and screaming faster than i can dodge, you just never know when their personality will switch and it's not fair to subject a growing mind to that stress. i'm glad you asked this question, it's totally normal to be worried, or even feel like you're causing your mil to miss out. just know you aren't the reason, she isn't the reason, it's the illness. dementia is a terminal illness, remember she is extremely sick and just can't handle the responsibility of children. sit next to her on the couch with your baby, see if she wants to hold them, maybe put on a movie you've already seen and supervise until she gets distracted/bored and you can safely take baby back. just be extra careful she can't wander into babies room at night. my grandma does the wildest shit at night so we started locking her in her bedroom while she sleeps (her adult daughter sleeps in the same room so it's safe and legal for us to do so). good luck. :)",https://www.reddit.com/r/dementia/comments/ocokox/mother_in_law_babysitting/,Mother in Law babysitting…
"i got to see my grandparents for the first time in more than a year recently. while we were having dinner, my nana and i were talking about my biological father and his side of the family. papa said “wait a minute, i thought i was your dad?” i explained to him that he’s my granddad and he started crying because he doesn’t want to forget his family. it was jarring. i’ve never seen him cry in my life. he’s always been the strongest person that i know. i told him that it’s an easy mistake to make because 1) my mom was 19 when she had me so i’m a lot older than the rest of his grandkids and 2) i look almost like my mom’s twin. then i told him that the most important part is that he knows that i’m somebody that he loves and that he knows that i love him. but inside i’m fucking destroyed."," i’m really sorry that you and your papa are going through this.  i work with older folks who have dementia. (i’m not a doctor or a social worker, but i do have experience with non-clinical work)here’s one way you can deal with something like this:1-lie. i know. it stinks. but “therapeutic lying” allows you to skim over the things that will make your papa sad and get back to what makes him (and you) happy:  he loves you so much!  you love him so much!   to use your post as an example...papa: huh?  i thought i was your father, not your grandfather!you: oops. my mistake! you’re right!(now quickly divert his attention to something that will make him feel loved!you: that’s a nice class ring you’re wearing. what subject would you enjoy teaching to kids if you were a teacher? 2-cut out details, because details can make people with dementia feel overwhelmed. 3-direct the conversation around his feelings.  why? because they don’t involve him trying to remember something. they also allow you both to have an enjoyable, meaningful conversation. (see above?  you asked him what he would enjoy teaching. this doesn’t require him to remember anything. this meets him exactly where he is. maybe he plays the piano, and he’ll tell you he’d enjoy teaching music. now you can smile, give him a hug, and tell him how much you love his music.)4-if you’re out, away from home, ask him his opinions. “papa, which car do you think is a better car—that one there, or the one next to it?”  in a museum?  “do you think you’d be good at painting, papa?”  at a restaurant? “wow, she’s got an octopus tattoo. what’s your opinion on tattoos, papa?”i know how scary and sad this can be, and i’m sorry this is happening.  i do think you can continue to have a meaningful and loving relationship with your papa if you can learn some of these tricks. you may even get to know him better!   my grandparents are deceased, and i have no idea what either of them thinks about tattoos!   maybe you could write down a bunch of things you dont know about your papa and start weaving those questions into your conversations. one more suggestion: find some good (free) online classes to help you navigate this. caringkind has some great ones. feel free to dm me or reply on here with any more thoughts or questions. sending you a hug!",https://www.reddit.com/r/dementia/comments/ocmk59/my_papa_is_starting_to_forget_us/,My Papa is starting to forget us.
"ca, usa so i am current taking care of my mom, and i am working on a dpoa as our original lawyer screwed it up somehow but i do have her will and trust. i don't really want to do anything on her behalf until we have that taken care of.she owes back taxes, credit card debt and is in collections, and a meriwest personal loan. payment plans were set up, but she called the bank thinking they were fraud and haven't been deducted for the past 6mo.i am speaking with a new lawyer but this process seems a little extensive and he didn't go into too much detail, i'm assuming until the poa docs are signed. basically said i need to file her 2019 and 2020 tax returns and get the transcripts, contact all the agencies that she has debt with and see the total she owes. i just wanted to pick some brains as i am waiting on the poa and see if there are any suggestions on what to do. i'm thinking bk but then her credit will be ruined (i think?) and some assisted living homes will check her credit score apparently. i'm guessing i can declare cnc on the taxes, but i am thinking they are over 10yrs old because they haven't been garnishing her ss or pension. no idea. maybe its because she hasnt filed 2019 or 2020?i know the taxes are critical to take care of but debt collectors can't really do much (i think?). the irs did put a levy on a checking account that i was unaware that had both of our names on it, i have since closed out the account and opened a new checking without her name.pretty lost here and trying to take care of this before/while i find an assisted living home for her. any suggestions? thank you"," you might get better input in a tax sub (i only think this because my sister is a cpa, i work in memory care, and 100% my sister would be able to answer these kinds of questions)",https://www.reddit.com/r/dementia/comments/oci5jk/mom_with_dementia_and_debt/,Mom with Dementia and debt
