submission,comment,url,title
"hello everyone!i work for the university of plymouth and we are using a series of tests to learn what skills and processes are important to search and navigate the world around us!! we hope that our findings will inform practices that are designed to assist those who find it difficult move and interact with the environment around them (e.g. hydrocephalus, dementia and autism). come and help us support those less capable and get paid for it!!!!we are looking for participants for a \*paid\* study, but as we are coming to the end of our data collection, we are looking for specific samples. we offer a relaxed and inclusive environment and you will have to right to withdraw at any point should you not feel comfortable. we are recruiting participants within the following age groups and unfortunately, we are only looking for uk based participants: 28-30female, 33-35female, 38female&amp;male, 44female, 56female, 59-60female, 45-47male, 49-51male (±2 yrs).  please email tara.zaksaite@plymouth.ac.uk for a 30-min pre-screen (£5 amazon voucher). full study is 4hrs &amp; £40. please click here if you would like to see more: [ note that you also must: \- have access to a computer or a laptop with a microphone and a video camera \- have access to an android or apple smartphone or tablet (microsoft phones/tablets are not compatible) \- have native-level english \- have normal or corrected-to-normal vision (normal with glasses or contact lenses) \- not have a psychiatric diagnosis, history of head injury or neurological conditions \- not be dependent on alcohol or drugs", try r/samplesize if you haven't already,https://www.reddit.com/r/dementia/comments/ogvvz9/improving_the_navigational_abilities_of_those/,Improving the navigational abilities of those with dimentia
"i'm thinking my mom is getting up during the night now partly because she is hot and wants water. she complains about her throat at night. so i'm putting lemon juice and honey in a small purified water bottle and giving it to her. she drinks it, i fan her for like and hour and she is relaxed enough to sleep.dementia sucks."," she might have post nasal drip. a mucinex tablet before bed helps me. doesn't interfere with other meds, that i know of.",https://www.reddit.com/r/dementia/comments/ogor1p/these_last_couple_night/,These last couple night...
"i'm thinking my mom is getting up during the night now partly because she is hot and wants water. she complains about her throat at night. so i'm putting lemon juice and honey in a small purified water bottle and giving it to her. she drinks it, i fan her for like and hour and she is relaxed enough to sleep.dementia sucks.",,https://www.reddit.com/r/dementia/comments/ogor1n/these_last_couple_night/,These last couple night...
"my mom is in her early fifties. i don't know too much family history, but my mother's mother had a series of strokes over my entire childhood leading her to be progressively disabled. i lived in the same home with her for some years, during which time my grandfather was still working and so me and my siblings were her prime caregivers during the day at the young ages of 5-10. it was a nightmarish experience and she was verbally and physically abusive despite being extremely obese, nearly 500 pounds at the time of her death. it was definitely not the little media trope of forgetful sad little grandma. she was angry, paranoid, short-tempered, and absolutely unwilling to try to do anything for herself. i was the youngest sibling but only by two years. she knew my siblings got older, but she never seemed to ever recognize, on a very literal level, that i was older than 6 or so, so she would angrily yell at me for doing things like turning on a microwave or tell me i was incapable of dusting the tops of doors because i was too short, even when i was the tallest. we had to clean her and feed her and cloth her and she fought us. she was mostly incontinent and for some reason, probably because i was the youngest and didn't fight back, this was always my job to clean up. my family always brushed it off because ""what can we do?"" and since her death, she is never mentioned. when i came home the day she had died, the first thing i was told was, ""it's okay if you're happy she's dead."" and i was, because i never loved her, and she was such a burden on my grandfather. since her death he has begun traveling the world and is very happy. it is a little sad because apparently she was a different person before her strokes and subsequent dementia, but i never knew her like that. she just spent 12 years dying slowly, painfully, and meanly. for many years this has been a sort of underlying issue or scar, in regards to my mom. she doesn't take good care of herself and never has. she's significantly obese and has had a lifelong depression, and neither of these things she has ever made successful efforts toward improving. she has told me things like, ""i'm going to die fat"" and ""when i'm in a wheelchair, please take me outside sometimes"" and always, always tells me that she's going to have dementia someday, and that **i'm** going to take care of her. the only thought in my head is nope, no, never. i will never pin myself down to be abused like my grandfather was, like i was as a child, ever again. in the past couple of years, my mom has started to show a lot of signs of mental decline, and it makes me very angry. i'm living with her as it's the summer and it seems like every summer she's worse. she's just more short-tempered and easily confused. she does this, throw-up-my-hands and repeatedly say, ""i don't know! i just don't know!"" thing that my grandmother always did. a lot of times if i have something in my hands for whatever reason, she thinks it's something else. sjust today i asked if i could have a ball of bright yellow yarn that's been on her dresser in plain view for months, and she looked at me in confusion and asked, ""do you have a wound?"" i said, what are you talking about? she said, ""what do you want that for?"" i said, for my weaving. she said, ""oh! i thought that was a roll of bandages. where did you get it from?""i told her i got it off her dresser, and she told me absolutely not, she had never seen it before. **i just walked away at that point, which she huffed at because she always thinks it's rude. it's way less rude than the things i would say if i didn't just walk away.** stuff like that happens *multiple times a day*. she gets very agitated thinking that i haven't eaten all day and comes and tells me i make her feel like a bad person for not cooking for me. if you haven't gotten the idea, i'm a very independent person and haven't relied on her to cook for me since i was in elementary school. what happens, i'm pretty sure, is that she doesn't remember or doesn't realize ever seeing me in the kitchen. but she comes and guilt-trips me and says, ""*you're* making me feel like a bad mother!"" it happens pretty much every day. she's a very bad driver, sometimes driving past her own workplace and, if she's in a new place, she'll get hopelessly turned around even if the destination is in plain view. she forgets to brush her hair often and sometimes forgets to feed the pets. i mostly take care of them now, but i feel bad for when i go back to college.she won't go to the doctor for anything because ""they'll just say i'm fat and unhealthy, and i won't listen to them anyways."" this is true. this is the hard to understand part:**my mom is working on her doctorate and is doing very well in her classes.** she writes 20 page papers and does massive studies and is working on her dissertation, which is on a very cerebral topic that i don't even understand. i don't think any of her coworkers see any/many of these behaviors, although she rarely interacts with them outside of work. they know little things like, ""oh, she has such a bad sense of direction!"" but i feel like i'm going insane a little, or that people would think i'm insane to say it looks like my mom is having the start of a cognitive decline. i just don't think that ""normal old people aging"" is staring at a ball of yellow yarn two feet away for 15+ seconds and thinking it's bandages. my 80 year old grandfather is much more mentally fit than my 50some year old mother. it's not right, and i don't like it, and i don't feel like anyone would believe me. that's why i came here. i just wanted to talk about it all. i find myself having a lot of fantasies for her to suddenly die in her sleep, just because it seems so terrifying, the path she's going down. for her and for me and for everyone else. and then it makes me very sad, that i wish my mom to die.", bredesen protocol,https://www.reddit.com/r/dementia/comments/ognj0h/mom_is_very_highfunctioning_but_also_not_my_story/,"Mom is very high-functioning, but also not? My story. Sort of dark but... what isn't, here?"
"my father has been showing signs of dementia/alzheimer’s/lewy body and my mother is bearing the brunt of his care and supervision. she reached out to me asking for help, but i thought i would ask here to see if anyone has already tackled this. my dad was always very good with technology, he was instrumental in the early days of fiber optics and telecommunication, but those skills seem to be going the fastest. my mom is frustrated because she is not able to get in touch with him if she has to leave the house. when the phone rings he will try to answer the tv remote. this ends up with mom not talking to dad, and the tv being inputs being changed to the point he can’t figure out how to get back to his shows. mom is looking for some kind of solution that 1) he does not have to keep up with or remember where he set it down, 2) requires minimal steps/button presses to access. my first two thoughts were either a smart watch that receives calls, or something like an alexa or google assistant. do any of you have any experience that may help?  any preferences or suggestions based on the options above?  thanks for your time.", is he ok using the phone when he finds it? we had to try a few handsets but eventually found the doro 1360 worked well for him.if he manages to get out of hospital and use it again i’m consideringgetting a lanyard so that the phone is always around his neck.i found that recently even the most blatantly obvious signage like “tv” or “phone” would often be missed…interested in hearing any tips you have if you make progress.,https://www.reddit.com/r/dementia/comments/ogm59c/help_needed_reaching_dad/,Help needed reaching dad.
"hi everyone. first of all, sorry my english is not perfect. my dad is having a hard time communicating. he kept saying he can’t find, can’t find, can’t find. eventually the caretaker know he meant he can’t find the words of the topic he wanted to talk about.i was thinking maybe giving him like a… book of pictures, if that makes sense? like the ones for kids or babies. so that he can point to the things he wants to talk about. do you think it will help? any advice is appreciated. thank you."," yes, that's a great idea. by the way, the term is called aphasia. knowing that makes it easier to google techniques, products, and ideas. one idea is you can print out an emotions wheel, one for children with big images that he can point to when he is frustrated and trying to describe some emotion.for example i saw on the iphone shortcuts program, there is one called ""what do i need?"" with a big green hand (and you can make it a huge widget) and it has options like ""i'm too hot, too cold, hungry, need the bathroom..."" etc.",https://www.reddit.com/r/dementia/comments/ogliob/any_advice_to_help_communication/,Any advice to help communication?
"my mother had a recent test score of 20 (up from 17 a few months prior but it was late afternoon when she took the first assessment) she's in a retirement facility and still living independent, although we got her a medacube for meds disbursement and there's a daily wellness check-in and one good meal in her plan (right now).  on the testing scale, she is at moderate cognitive impairment.  she has a neurologist.  he has her on donepezil and just started her on a tiny dose of prozac.  i can see that she is slowly losing ground with her memory loss, but has not had any changes in personality besides the normal confusion of not remembering any new information.  her mri shows the typical narrowing of the ""memory centers"" in her brain.  at what point do we get some type of official diagnosis beyond moderate cognitive impairment?  she can ""age in place"" and we can bump up her level of care as she needs it.  but how do we know when she needs it?  she's almost to the point where she can't remember when she's having problems...i don't want to wait until something hurtful happens to her, and i thought having a diagnosis might help us decide on when she needs more help.  another reason we need a diagnosis is that she has a really decent long term care insurance plan that will pay quite a bit of her housing and care once she has some sort of official diagnosis.  i don't know how they find out what is causing the dementia and memory loss and what is causing it?"," do you have medical power of attorney? can you contact the neurologist and tell them about the issue with needing a solid diagnosis for care financing?as far as when to escalate her care, i would guess that if her facility can accommodate her, maybe they can assess her too?",https://www.reddit.com/r/dementia/comments/ogk3xq/moca_test_score_of_20/,MoCA test score of 20
"my mom and dad live on their own in a rural area. i am unable to visit/help as much as my dad seems to expect me to, and he will not accept other forms of assistance in caring for and supervising my mom. as you can imagine, shenanigans are frequent and patience is thinning.my mom has, for the last year or so, been secretly cutting up things at their home. most notably, her targets are clothing and shoes. my dad says he will find them in the trash, in the yard, stuffed in nooks and crannies around the house. he always calls me when something has been hidden/destroyed and asks me to replace whatever it is. he keeps pushing me to take her shopping, but that is not a realistic expectation. she won’t even try on anything at home. i can’t handle her temper in a store by myself. that said… it’s frustrating to go through the process of scouring the internet for something that fits and is easy to maneuver, then have to do it all over again a month or two later. this is not sustainable.i don’t know if this is me searching for suggestions or if i’m just whining… any input?side note: i know the scissors are a safety issue. i have no idea where she keeps them, since i don’t live there. my dad can’t keep track of her all the time, and she’s pretty sneaky. i’m making it a mission to go on the hunt at my next visit."," before my mom was moved to memory care, she liked to cut bills and tax information up, thinking it needed be the right size, for what?  we weren't sure but it created a lot of headaches while i tried to round up what was left of documents.cutting up clothing is worse, because of the expense and the hassle.   at this point i would strongly suggest that box or trunk with a lock be purchased to hold several changes of clothing, shoes and also the scissors.  have a second lockable trunk for dirty clothes so they can be safely held until it's time to wash them.i agree with the others here- children's scissors are fine but i also just remembered- my mother had a go at her hair, too.   just hacked off chunks so perhaps if you could find children's scissors that barely cut paper.   is there an activity that your mom could be redirected to?  using children's scissors can she clip coupons?   one friend asked us all for old calendars- her mother had dementia but needed to ""work"" and she would write all over piles of last year's calendars and if she didn't have that activity, she'd mess with the real appointment sheets and checkbook of my friend if she could find them.",https://www.reddit.com/r/dementia/comments/ogjkfv/mom_hiding_scissors_cutting_clothing/,"Mom Hiding Scissors, Cutting Clothing"
dad just barely survived his aspiration pneumonia after two weeks on antibiotics. but they say it will surely happen again no matter how careful they are as the dementia is progressive and starts to impact autonomic systems like the swallow reflex. so the doctors recommend he go into hospice altho he looks back to his pre-pneumonia self - dementia not withstanding. his advanced directive is no artificial mechanisms. so now we're left with the dilemma as to how much to treat him to his favorite foods and how much to preserve every last minute of life. what i understand is even people on feeding tubes often succumb to more aspiration pneumonia by just swallowing saliva down the trachea. has anyone come to this fork in the road? it's so hard because even before dementia he didn't even want old folks home food (which is actually quite good) let along hand fed mush. yet on the other hand i don't want to accidentally bump him off with a big juicy steak.," my mom is in ynt same state as we speak.  she's on hospice the last 2 weeks.  i believe she had aspirated again but we're basically waiting to see if she gets pneumonia again.  it's hard and heartbreaking.  she's only 65 but has had it rough and didn't take very good care of herself.  thinking of you and yours.  just so you know... we're giving my mom nearly anything she wants to eat.  you can aspirate from water,  saliva,  anything.  so why not let them go having eaten thier favorite things? 💛🦋🙏🏽 strange but that's how i see it.",https://www.reddit.com/r/dementia/comments/ogitu2/aspiration_pneumonia_survivor_age_late_80s/,Aspiration Pneumonia Survivor Age - late 80s
"yesterday he didn’t know what sweet corn is, formerly a summer favorite his whole life. he also didn’t recognize old friends, didn’t know important people in his life. starting to not know me. it’s all fading fast. i’m scared and alone. if you would, please show me your lovely animals. ❤️❤️❤️thank you!", i wish that i knew how to post images in replies!im sorry....have this though 🧡,https://www.reddit.com/r/dementia/comments/ogg1m6/worst_week_so_far_got_doggy_or_kitty_or_wildlife/,Worst week so far. Got doggy or kitty or wildlife pics or kind words to cheer me up?
"our dad was 70, he had ftd for the past 4 years. we always struggled to accomodate his changed behavior. the sleepless nights, the agitation and unrest. in the past months things seemed to be a bit better on this side. he looked more relaxed, this now makes us be even more angry for how things ended up. at the end of may he went for a day hospital surgery, an inguinal hernia. it went ok, but since then he had started breathing exclusively through the mouth. 3 days later he gets the second dose of pfizer covid vaccine. one week later gp thinks he had bronchitis and started a cycle of antibiotics. 4 days of antibiotics the gp says his lungs sound clean. it was a saturday. we felt happy.on tuesday, the gp comes to see him again, she suggests an x-ray cause “there’s something in his lungs”. meanwhile he had started i.v. antibiotics. i suspect something is wrong with his throat. i go buy thickener powder for him to drink gelatinous water. on thursday i bring him to a pneumologist. the specialist doesn’t think there’s anything particularly bad with his lungs. he said father might have aspiration pneumonia, cause of swallowing issues. father was followed by neurologists and geriatricians. but no one had ever mentioned that aspiration pneumonia is a major cause of concern for people diagnosed with dementia. according to the lung specialist, on a later stage he might had needed a feeding tube. nonetheless for now it was more or less ok. for the second time in 2 weeks, we felt relieved. two days later, saturday. father is having hard issue breathing. he can’t eat or swallow. we bring him to the er. after a ct scan, the doctor tells us he has a serious pneumonia, with “very evil bacteria, hard to destroy”. they send him to another hospital to get admitted to a ward. there are no beds, he spends the night in the er. i had asked them to be with him, they agreed and i watch him all night long. he has oxygen, and his breathing is at times difficult but he’s awake. in the morning they tell me there will be no available beds for a couple of day. i decide to drive him to the capital city, 2hours drive. we’re in italy and covid-19 measures lowered the number of available beds for non-covid patients. in the metropolitan hospital they admit him to the er again. here, they don’t allow anyone to be next to him. he stays here 3 days alone, waiting to get admitted to a ward. as many people with dementia, he is hard to control. that’s why they wrap his hands and tie his arms to the bed. the hospital is full, i pressure the doctors to admit him to a department so i could stay with him. covid-19 rules make impossible for care givers to stay within the er spaces. on the 4th day at the er, they call us. father situation is critical. they say his kidneys collapsed. he might die any moment. me and my brother rush to the hospital, the doctor says there are no beds and he is in a very critical situation. if he was her father, she would bring him home. that’s what she tells us. the time of a sentence, and the all world collapses over us. we call an ambulance to drive him home. he breaths with great difficulty. i untie his arms and can feel the tension of 3 full days of fight against the constriction they put him in. his muscles vibrates. he’s shaking his forearms. when home, in his bed, for two nights he resists. i pressure the gp to give him water. i call the pneumologist to come see him. they come. but they’ve given up on him. he’s in a pre-coma state. we sleep next to him for two nights. until on the morning of the third day his breath slows down. until he stops moving and closes his eyes. all happened so fast and in a rush. we have so many questions and very few answers."," my dad recently died too, and he went probably 2-3 weeks after getting his second pfizer vaccineit started innocuously enough with hiccups that wouldn't go away...over the days it became difficulty swallowing, loss of appetite, sleeplessness, restlessness, loss of the ability to speak...then one day suddenly he has a fit/seizure where his body went rigid, and shook violently...after they took him to the hospital they found that his body was having a severe auto-immune (attacking itself) response to something...they tried figuring out what, but his condition worsened and in a couple days he was gonei'm sorry to say this, but yours is just one of a number of reports i've heard of an old person suffering some strange symptoms/injury/death in the weeks following their second injection...**ask the people around you in your life to tell you their experiences**...from what *i* have heard from *my* people, i do not trust these fucking vaccines",https://www.reddit.com/r/dementia/comments/ogcuy1/in_a_rush_father_died_ftd/,In a rush father died - ftd
hello all! mother in law officially lives with us. we are in process of finding out the details of her condition and what resources etc. can someone recommend any reading material for me to understand the subject better please and thank you. also is there such a thing as a good environment for them? tía, what type of dementia has she been diagnosed with?,https://www.reddit.com/r/dementia/comments/ogbwgo/reading_material/,Reading material
"i (26 f) am the full time live in caretaker for my grandma in law (90f) and recently she’s taken a sharp turn for the worse- but comparatively to some she’s been doing quite well. she’s recently gotten significantly more confused and asks a new set of questions every few minutes and i don’t know what’s the best way to answer them. so far i’ve been honest but i’m wondering if there’s a better way for her to not feel so concerned. the questions she often asks are-where am i?what city is this?how long have i lived here?who of my siblings are still alive?where is my daughter? (who lives in town)do i live here alone?did i get here last night?who brought me here?obviously this is not a comprehensive list of all questions she asks, but it’s some of the more common new questions. these are mostly factual questions, so i just keep answering with facts? or is there a kinder better way to answer her concerns?"," could be sundown syndrome, my mom has the same problem, starts around 4pm, asks tons of questions and gets agitated.",https://www.reddit.com/r/dementia/comments/og9q4m/best_way_to_answer_questions/,Best way to answer questions?
