submission,comment,url,title
"**tl;dr:  75 year old parent with short term memory loss is constantly wearing our patience thin and causing us to lose sleep and a bit of our own sanity.  need advice for next steps.**for the last decade we have shared our home with my 75 year old mother in law. she is blind in one eye (glaucoma i think) and takes prescription eyedrops.   she also takes cholesterol and blood pressure medicine.    she is also diabetic.unsurprisingly, she has been increasingly forgetful over recent years.   often bringing up the same gossipy topics at dinner time that we often don’t care to hear again -- not even the first time.  her vision required a family member to take her wherever.   but around the house she had been relatively independent.    cooked her own meals, sometimes for us as well.   generally ate what we ate as long as it wasn’t too spicy or salty or whatever.when she feels a headache, she instinctually self-checks her bp (digital tabletop omron) so a few weeks ago she caught a 200-over-something reading and she was taken to the er.   there they found her sodium levels were very low.  so she spent a week in the hospital.  and the whole time she was calling my wife’s home literally every hour.  “they haven’t fed me.”  (yes they did.)   “what pills do i take?” (the hospital is giving them to you.)  they had to put a “safety nurse” in her room to keep her from getting out of bed unnecessarily and escorting her to the bathroom.  after sodium iv’s and pills, eventually her sodium got back to normal and a week later she was discharged but transferred to a physical therapy place to work on her walk -- which over the years has been more of a shuffle, i assume due to her decreasing eye sight.  but not even 2 days into what was going to be a multi-week stay at the facility, she was frustrated at not being fed (she was) and not getting her medicines (she was).    she exercised her “patient’s rights” and basically checked herself out.  my wife picked up her up the next day. it’s been a living hell at home ever since.every morning we now give some of her pills and eye drops because we don’t want her to self-administer multiple times due to her memory.   then we give her the others in the evening.   and throughout the day she will call (her room is on the other end of the home -- by design)  or she’ll come upstairs (to our bedroom/home office) and ask “where are my pills?”  “we gave them to you this morning” “are you sure? because i feel like i haven’t taken them.  why don’t you say while i’m taking them ‘mom, here is this pill, that pill, etc’”     “that’s exactly what we do.”  sometimes it ends there.  other times it ramps up:   “well i don’t think you are giving them to me…why are you holding my medicine? i don’t want a stroke.  i don’t want to go blind.  give them to me.  you’re killing me.  don’t make me call the police.  you can’t do this to me...”   last week she went to her pcp for a post-hospital follow-up and they did a basic memory test.  something to the effect of “can you recall the three words you were asked to  remember earlier?” to which she then asked my wife who took her to the appointment, “what words? was i supposed to remember?”   so the pcp prescribed donepezil and vitamin e pills, and we are praying they actually do something.  though from what i’ve read, even if it does, it doesn’t help much after a year or two.  and everyone’s experience here seems to vary wildly.on reading this to myself, i admit it comes off like we are simply tired of bearing her burdens and are horrible children/in-laws.   we do our best to put ourselves in her shoes -- being a generation older, once in charge of our lives, then suddenly told that our perception of the truth (i.e. not being given medicine) is wrong.  but being berated exacts a toll on us as well.  even just having to repeat for literally the 50th time in a day that “yes, you took your pills and eyedrops, yes we know you don’t remember this is why you write it down.  what paper?  the paper by the whiteboard where we list all your medicines.  no you cannot keep your pill bottles. because you can’t remember anything and you might keep taking them.”  my wife recently had a baby which was already a strain.  ironically having the in-law live with us was a boon at first, but now she is basically one more child to contend with, and frankly more difficult than any of the real children we have.  my own grandmother developed alzheimers late in her life, and i saw the toll it had on her, my mother, and her siblings and their families.   so as much i feel a prisoner in the present, i dread the future of escorting her to her bathroom, keeping her from eating napkins at the dinner table, and having to (re) child-proof all the entryways into the home.  we were looking forward to welcoming a new pet (or even another child) to the family at some point, but that feels like a distant dream now with our plate of responsibility.financially, the in-law has retirement savings, my late father in-law’s pension, and presumably a very good health insurance plan.  my wife and i know very little of the other programs (medicaid? medicare? social security?) to understand how that would help with future care.i desperately want a return to sanity -- for all of us.  i want to work at home without getting “triggered” when i hear the in-law dialing the cordless phone because 99 times out of 100 she’s going to call us to ask about her medicine.     i want to relax at night and not be triggered by the lights in the hallway coming on because i know she’s going to beg for her pills that she doesn’t remember we gave her hours ago and threaten to call the police if we don’t hand the pill bottle over. for the first time since covid started, i actually want to leave my house to work in a cube and bear all the annoyances of office life instead of working from the comfort of my home -- just to not hear this broken record chipping away at my own sanity.   but that’s not fair to my wife who will now have two babies to tend to.i recognize this is my wife’s mother we’re talking about.  and my wife deserves a lot of credit for putting up with the bulk of the in-law’s repeated questions, criticisms, and lapses.   but she will go back to her own work and career soon once maternity is over.  and while she’s also work-from-home due to covid, it’s bound to revert to the old fashioned office sooner or later, and then who will care for her mother and listen to her fret every 15 minutes over pills she doesn’t remember already taking.police threats aside, this past winter  she almost blew up our house (with my pregnant wife inside) by not closing one of the gas stove top  burners completely.   thank goodness for that rotten egg smell they put in it and that i came home in time to catch it.  my wife didn’t even smell it upstairs.    we’ve since installed a natural gas leak detector.  and then there are the recurring issues.  misplacing her eye glasses, her egg timer, her necklace (why did it move from her jewelry box in the first place? she rarely goes anywhere since covid.  we would find pools of water inside pots and pans in the cupboard that we know she “washed.”like all in-laws she also has a penchant for telling us how to parent and being horribly out of date with all the latest best-practices (on her back, not her belly.   no water, only milk/formula).  and while she’s stubborn about that, her new “mindset” if you will is the last straw, even if it’s not her fault.  many of her other faults i chalk up to just being a product of a different time.  but under it all was/is this thoughtful, kind, generous woman.  and while she’s in arguably an early phase (she has not seen a specialist to get an official diagnosis) my wife and i and other family agree that a memory care facility seems to be a logical next step.my wife has had the “nursing home” talk with her, and she of course is hesitant.  after all, during the day when she’s not pestering us about things she forgot 5 minutes ago, she can still talk on the phone with her few friends/family, operate her tv, etc.  she will proudly pass our pop quiz about who she talked to 5 minutes ago, but not remember what medicines she takes and when.    instead the in-law insists on bringing someone in to help in the house.  but that seems pointless and besides the point.  it will be a replay of the hospital/therapy situation where she thinks this person is withholding her food or medicine, and she’ll just blow up our cell phones anyway.  especially if that person comes in, does their thing, then leaves to care for the next client.  and it won’t do anything for her nighttime trips upstairs, begging for medicine, threats to call the police, etc.i’m reaching out to this community for suggestions, resources, next steps.   she goes back for a follow-up with the pcp to see if those memory pills helped.  but that’s a long 4 weeks from now.  we are trying to get a visit w/ a neurologist sooner than that.   my in-law’s sister’s family (in another state) has offered to have her stay for a couple weeks, but even that is a long two weeks away and is just a temporary reprieve.  i don’t know what else to do. i wish we could take the in-law to the hospital and say this time don’t send her home til her mind is whole again, but we can’t.   or take the in-law to a nursing home against her wishes, but we can’t.  we’re trapped in this living hell.i hope this was readable.   honestly, i feel like we all need help now, and at least i get to vent to an audience that can perhaps relate.   i guess we’re specifically interested in how to cope with this, who else to talk to, how to pay for memory care (if that’s the right place for her to be), etc.thanks for reading and thanks in advance for your help.", [deleted],https://www.reddit.com/r/dementia/comments/ofoz10/vent_75_year_old_livein_motherinlaw_has_lost_her/,"[VENT] 75 year old live-in mother-in-law has lost her short term memory and it is destroying my home, work, and family life. What can we do?"
"whenever i describe my situation to someone, being that my partner and i live in a one bedroom apartment and have given my dementia suffering mother-in-law the only bedroom, everyone always responds with oh that must be so hard. they always tell me taking care of someone with dementia must be so hard that’s got to be so awful. and then they tell me stories about people who’ve had it so hard and had it so awful taken care of people with dementia. i would really like to hear a story where someone talks about how wonderful and fulfilling and good it was for them. it’s getting bleak only hearing how difficult this always is for everybody. we are currently looking for a two bedroom apartment with two bathrooms, my mother-in-law hearing somebody go into the only bathroom triggers her having to go to the bathroom so every single day she interrupts me using the restroom in the morning. and i keep trying to tell myself that it’s not that big of a deal for someone else to have to go pee when there’s only one bathroom, but it gets really old one every day you have your morning poop interrupted. i’ve been really clear with my partner that i’m hitting the end of my emotional rope in this one bedroom apartment. it’s just so hard to rent right now with the market the way it is because of covid. so many landlords are just choosing not to rent to people so that they don’t have to deal with the moratorium. and landlords can’t get people who aren’t paying rent out of places to make rentals available to people who would pay the rent there like me. i feel like i’ve gotten a little bit off track here. but like i said this is a rant and i am heading and emotional wall. i’ve also done this entire thing talk to text so i really hope y’all are able to suss out what i’ve been trying to say.so can anyone tell me any story about how caretaking has been good for filling for them in anyway?"," here’s my story.my great-grandmother with dementia came to live with us for a few weeks or months in the fall when it was clear she couldn’t live on her own anymore before moving in with other family and then into a nursing home. were there hard times? absolutely. forgetting names, getting lost, hallucinations, delusions, being unable to go many places, laughing through the pain. but that’s just life, love, and family. i wouldn’t trade that time for anything. it’s the most i’ve seen her in my life, and we made plenty of memories together. we did puzzles together (which she enjoyed more than nearly anything else, despite her own epic puzzle fails), went on walks with her wheelchair, and cooked thanksgiving dinner together (she can still cook pretty well). she absolutely loved it when i played piano, even though she really couldn’t tell the difference between drills, good music, and pieces i played for the first time. she enjoyed our cooking, our support, and overall loved living here. she even was standing much straighter and walking much better than when she arrived and lost a large amount of excess weight with improved diet (not just cookies and ice cream all day). i only hope your experience will be better than mine and offer sympathy if it won’t. this whole group is here for you when times get tough.",https://www.reddit.com/r/dementia/comments/ofmq5h/little_rant/,Little rant.
"hello all, i’m new here and this is my first post so excuse me if i break any rules unintentionally. i am writing because i need both to vent and some advice/support. my adoptive mother is now 91 and has been declining since 2018. i am only in my 30s so this prolonged mourning process has been somewhat difficult on me to say the least. at any rate, my mother’s cognitive impairment/dementia is very difficult at times. she is staying with me right now because my sister (in her 70s) was going out of town with her family for the holiday and desperately needed a break. i really don’t mind my mom because a lot of her behaviors are amplified versions of who she has always been. she has always kind of been selfish, paranoid, and somewhat cruel in her language to some extent. she does have her positive traits as well, but it’s something that you learn as an adult to either accept of the person or not and love them despite their negative traits. i’ve finally learned to cope with not taking her vitriol to heart, but last night, she said some mildly homophobic things to my partner and i. (we’re queer.) we are also getting married in august and after last night my partner doesn’t want my mom at the wedding. i also don’t truly want her at the wedding either but for different reasons: she has never expressed excitement or joy at the fact that we’re getting married, she reacted when i first came out to her 15 years ago, she’s always been against “gay marriage”, and lastly and selfishly, i don’t want her to come for the wedding because i don’t want to have to take care of her or stress over her on my wedding weekend. my partner was extremely hurt by her last night because she doesn’t have the same love/empathy/patience i have for my mother—which i do understand why. my mother has hit her before and has done some terrible things to us as a result of her illness. as i write this, i realize that it sounds like i’ve made my decision about her being at the wedding and i felt like i have, but there is a lingering fear/sadness/guilt inside me that i will irreparably harm our relationship if she’s not at the wedding. and that i will regret her not being there after she’s passed. i also don’t want to feel the shame from my family who is coming to my wedding about not having her there. what can i do to explain to everyone involved my reasoning? how can i explain to my partner that it’s not worth confronting my mother over the things she said?", i would think that a wedding may be a confusing event for someone with dementia. confusing events would likely bring out the worst in her and make for a very unpleasant time for her and everyone around her. congratulations on your upcoming marriage!,https://www.reddit.com/r/dementia/comments/ofl4cb/i_dont_know_what_to_do/,I don’t know what to do
"hi, i m a 21 female and i’m new to all of this. my grandma has dementia  and had 3 strokes.. she s 90 now but she still eats, remember things, she makes jokes, she remembers us, i mean.. it’s not that bad. my mother had a mri ( she s 55) and it turned she has some sort of cerebral atrophy( i ll try to translate: it says diffuse cortical atrophy which is more observable frontally).. she was an accountant all of her life( she still is and works a lot) and doesn’t show any sign of cognitive decline. she has a very very good memory and no other symptoms.. but the thing is my grandmother had the same thing when she had a mri at 83 and for me it seems like it’s hereditary it doesn’t help that my grandma from my dad side had alzheimer at 50ish and died from other issues ( idk much my dad never talks about it)i feel pretty f****d honestly.. it feels like it’s impossible for me not to have one of this in my life and i’m scared it will happen young.what do you think about my situation? is it hereditary? how do i stop the progress or even stop it if i’m at risk? also.. is it possible to have this atrophy but in fact to never show cognitive decline and other clinical symptoms? my doctors said to my mom that as long as she never let’s her brain go lazy she doesn’t have to worry, they said it’s good for her to continue her accountant carrier and work her brain all the time to prevent the dementia to actually “ form” idk how to put itpls help"," please look into mindfulness and self compassion.  they have been super helpful to me as i navigate dementia with my mother.  mindfulness guides you to live in the moment, for that is the only moment that is real--right now.  the past isn't real, just remembered.  the future isn't real, just a projection of your thoughts and fears and worries.  only now is real, live now, every now to its fullest.  self compassion says this is hard time.  this is a moment (many moments) of suffering.  you are not alone, everyone suffers.  stop and see the moment as it is, accept your feelings, they are okay.  give them room to just be.  give yourself compassion (as you would give a close friend) in this moment of pain.",https://www.reddit.com/r/dementia/comments/ofl2ti/hereditary_what_do_you_think_of_my_story/,Hereditary ? What do you think of my story?
"my mother was formally diagnosed with dementia caused by alzheimer's about a month ago, she scored 21/30 on the mme. she clearly needs 24/7 care, but she refuses to even discuss visiting an assisted living facility, with an anger and energy that i didn't know she had. her anosognosia is strong, and is completely unaware she has dementia; according to her ""those doctors are wrong.""so, from your experience, how much longer do i have for her to calm down so i can get her into assisted living? i don't think they'll take someone who is -- literally -- kicking and screaming."," can you have her doctor prescribe seroquel? it is a medicine that helps alzheimer's patients calm down a lot so there is less kicking and screaming. also, is this level of anger and violence a really sudden change? i would get her tested for a uti.my grandmother also doesn't believe there's any problem with her memory at all. she takes the pills because she had frequent utis earlier and was prescribed antibiotics, and she accepted that she needs such pills to prevent those and so she takes the meds.",https://www.reddit.com/r/dementia/comments/ofi3w7/when_do_dementia_alzheimers_patients_calm_down/,When do Dementia /Alzheimer's patients calm down?
"first i want to thank literally everyone in this subreddit. whether you were the mod that suspended me that one time (i deserved it), the folks that gave me advice/support, or just someone that put up with my posts: thank you. y’all got me through the last 5 years. i don’t really feel like mourning, honestly. the man was 96, lived his best life, and now he’s with his wife and friends. my grandfather was a damn good man and i’m so grateful i don’t have to see him suffer anymore. now comes the process of putting my life back together in a way that serves me, not my family. that might be the hard part, but that’s a journey for another subreddit. i truly wish you all the best. thank you again.", your gramps will rest in peace and you live in peace.be blessed and enjoy life.,https://www.reddit.com/r/dementia/comments/ofhrod/he_passed_on_now_we_can_move_on/,"He passed on, now we can move on. 💜"
"a certain everyone here has or will experience a level of abuse from their dementia love one or patient. my grandmother recently got in the habit of choking me out while i clean her during bathroom trips. i could handle punches since i got some muscle on me, but it's out of line to get choked out. i ended up buying restraint mitts that i can put on her before the bathroom trips to prevent her from grabbing/scratching me. it's pillowed on the palm so when she hits me it's nothing more then a pillow fight and less likely that she will get hurt swinging at me. the only unfortunate part is that she stays mad at me for using the mitts for a couple of hours, but it's better then getting strangled.", i’m so sorry you are going through this.,https://www.reddit.com/r/dementia/comments/ofgup6/today_i_finally_made_the_decision_to_take_the/,"Today, i finally made the decision to take the first step to protect myself from harm."
"my mum is 75 with some alzheimers and dementia.  i'm her only son and only family for miles so i'm her support. i am trying to bring my own family up and work full time.  most of time she is ok, but she has her moments.  this morning she rings after 9 am when i'm working to say someone stole her milk and she is mad, she shouts at me and there's nothing i can do, i csnt drop all to go get her milk.  then her carer calls to get her tablets and rings me saying mum is distressed.  again,  i can't leave work. mum goes to a day centre today so she will get fed and she says she feels safe there. this resonated with me as she feels people are tsking her pictured of walls and stealing her food.  i've spoken to social services who assessed her.  a 5 min assessment in her home where she said she was ok and didn't need help meant she was ok.  so i'm left dealing with all this and i don't know what to do .  i've applied for extra benefit ( in uk ) so can get her a carer.  but her calls to me and all her shouting are making me feel helpless to help.  i'll be in bad form all day now and find it hard to concentrate on work.  i just want her to be ok."," venting is good, and we all need to do it sometimes (i did it a short while ago). i'm in a similar situation in the us. i have a 75 yr old mom, with dementia/alzheimer's, who can briefly pull it together when meeting with doctors/care givers. but when i'm around, i get the full crazy/anger treatment.hang in there. everybody in this sub knows what you're going through.",https://www.reddit.com/r/dementia/comments/off2uw/hi_guys_i_just_need_to_vent/,Hi guys I just need to vent.
"i live with a family member with dementia. she's gotten lost before wandering outside the house to a neighbor's while dragging the dog with her on a leash. as a result, we have to lock the doors and don't give her a key so she won't get herself in danger, and she gets very frustrated and upset we won't let her go wherever she wants. she gets quite frustrated and will often tug on the doorknob and bang on the window by the door to get out. i don't really know what i'm supposed to say to her about why we won't let her have the key. i emphasize with her feeling trapped and wanting freedom of movement, but it's not safe for her and she'll often either want to go outside because of something she's hallucinating or won't be able to explain what she needs. occasionally i'll (very slowly) walk the dog with her by my side, and we have a caretaker who takes her out to do things like go to a restaurant or out shopping, but she'll still want to get out of the house and it's annoying having to play babysitter for my grandmother when i'm trying to be more independent and find work. we will be moving her into a care facility but the process is taking a while.",,https://www.reddit.com/r/dementia/comments/ofc4p7/angry_we_wont_let_her_wander_and_escape_the_house/,Angry we won't let her wander and escape the house
