submission,comment,url,title
"it's done. it's finally done. after nearly 4 years of caregiving for my grandma, she has finally moved into assisted living.i'm so relieved. she is safe. she will be well taken care of. i believe she will thrive there. my 4 year old son, husband, daughter due in november, and i can go on to live our lives without having to tiptoe around grandma.i'm so surprised on how well today went. we ordered a uhaul and hired some moving helpers for 11:30am. my dad picked up grandma at 11:00am for an ""appointment"" to get the results of some ""medical tests"". but the ""appointment"" got delayed so my dad took her out for a verrrryyyy long lunch, then a verrrryyy long drive until she seemed tired. then he drove her to the assisted living community for her ""appointment"" and by the time they brought her up to her new apartment, all her furniture was moved and in place.we chatted on her sofa for a while. she didn't even realize it was hers. finally she said she was tired and said she was ready to go home. my dad told her she was home. she finally took a closer look at all the furniture and noticed it all looked familiar. she said she was not happy.i took her hands and told her we loved her very much and would not do this unless we thought it was the right thing for her. i could see the acceptance but sadness in her eyes. it broke my heart.we spent the rest of the time making her feel comfortable in her new home and stayed until she fell asleep for the night.she's safe. her medications are back on track. her diet will improve. she'll get the physical therapy she desperately needs. i'm so thankful and relieved."," sending love to you all! this isn’t a easy transition, and you did the best thing for her and the rest of your family. amazing that this went so well, it isn’t always the case as you know.",https://www.reddit.com/r/dementia/comments/oenkr5/update_2_moving_grandma_into_assisted_living/,Update #2: Moving Grandma Into Assisted Living
hello! recently my grandpa moved in with us on hospice. he has other health issues but his alzheimer’s is really really bad. this is the third day and each day has gotten worse. i am 21 and in school and i have to him help a lot. tonight he told me if he dies it’s my fault. i’ve been reading much of the sub and wanted advice. what do i do with him when he’s super confused? he needs help doing things i can’t leave him alone but he’s a real s.o.b sometimes. thank you," as much as you can, try to let it slide off you like water off a duck's back. i know it's easier said than done, because their behavior is incredibly crazy and frustrating, but you can't argue with them (they're in their own reality and you can't make them join yours no matter how hard you try) or reason with them (their brains are too damaged to string two coherent thoughts together) so all you can do is distract, redirect, and kind of go with the flow. i swear, a lot of dealing with dementia is like doing improv - they say something nuts and you have to figure out how to roll with it. if he asks where someone is who's been dead for 20 years, for example, don't tell him they died, just tell him they stepped out. (keep your therapeutic lies vague and simple, though. anything complicated just confuses them more.)  do you have other family there to help out? i really hope so. if you're not his primary caregiver and just need to watch him to give the other caregivers a break, just try to be there with him, roll with the crazy, and then when you're done you can go outside and scream at the sky for a while. you could also ask the hospice staff for advice, or watch how they handle him and try to imitate it.",https://www.reddit.com/r/dementia/comments/oeljx6/grandpa_moved_in_with_us_on_hospice/,Grandpa moved in with us on hospice
," my only suggestion to you is to do your homework in a great deal of depth on those sites and blogs already out there to learn about gaps etc.  often i am overwhelmed with information offered and support across so many different sources.  i believe some kind soul started a resource page on this sub that we can add to together and this alone has been incredibly helpful to me.  hope i am remembering correctly!  may have been on the dementia sub.frankly, linking other caregivers to each other and unique caregiving opportunities (e.g., in exchange for a place to love) would be request.  however that may be a niche so hope others respond to you!",https://www.reddit.com/r/Alzheimers/comments/oejqyc/potential_blogyoutube_ideas/?utm_medium=android_app&amp;utm_source=share,[deleted by user]
"my mil was diagnosed in january with mild dementia. 20/30 on moca but had major behavioral symptoms that lead the family to hospitalize her. since then, she has been on abilify (an antipsychotic) and seems to really have gone done cognitively. does anyone have any experiences with antipsychotics and long term effects? unfortunately this is the best she’s been and the doctors want to keep her on this.", my thoughts are with you💐,https://www.reddit.com/r/dementia/comments/oedqjf/progressing_quickly/,Progressing Quickly
"today we had another milestone. my father was diagnosed with dementia almost 10 years ago and we have been on a slow journey that seems to be speeding up. at first it was barely noticeable. forgetting the name of someone he hadn’t seen in years or a long past memory. then it was he couldn’t continue to do his job anymore and had to go on long term disability. for a while after that he seemed to even out and was fine for a while. then he couldn’t drive anymore and we had to sell his car. then he couldn’t go on walks alone as he would get lost in his own neighborhood. then he didn’t recognize my brothers anymore since they looked like men instead of the boys he is looking for. then he forgets the way to the bathroom or kitchen in the house he has lived in for 30 years. today my mom (main caregiver) had to make another milestone decision. he had been spending one day a week with family friends of ours so my mom could continue working. they love having my dad and dote on him the whole time he is there, but health wise it isn’t safe for him to be there anymore. he is now a fall risk and there is no one in the house who would be able to help him if he fell. it was a hard decision for her to make. my dad used to spend three days a week with them and now that period is over. another milestone down and they seem to be getting harder to pass by.", oh do i know and you captured this all so well.  each over-the-cliff moment and many more you took care not to report.  hang in there!  you and your mom can get through this.  sometimes placing those we love with dementia in care is the hardest decision but the right one.  it often takes a team approach to provide care at this point and also avoid cutting short your own lives (many die before the one they care for).  he never would have wanted that for you and your mom.my heart breaks for you as well as us all.,https://www.reddit.com/r/dementia/comments/oedjae/milestones_are_hard/,Milestones are hard
"hi all,my dad has little ability to regulate his emotions or keep himself occupied anymore. he relies on my full attention to keep him busy and this is really draining for me. though he often talks about wanting to go back to work, he needs step-by-step instructions &amp; supervision to do daily tasks at home and just loses it when attention isnt on him.he moved into an apartment with my partner and me about 3 months ago. sharing a small living space has been triggering for him. when he's in our house in a room by himself, he will start to talk negatively to himself until he is yelling and cursing, crying, or throwing a physical tantrum. he has his own room but being told to hang out in another space is triggering for him. regardless of whether i tell him what i need to do, if he can't shadow me or track me with his eyes, he just loses it and throws a tantrum. even if i am in the same room studying on the computer, i feel like he gets angry that my attention isnt on him. he starts to yell and curse to get my attention.i had to take a leave of absence from school to take over his care. my family is expecting me to be a full-time caregiver and full-time student while they are also aware of my dad's behavior. there's no way i'll be able to attend 3 hour lectures, study, and complete long projects and care for dad. i feel the expectations are not realistic and i've told my partner this a few times. i feel trapped.i just started applying for disability, home care, social security for dad so it will be a long time before i get help. is there a way i can work on getting dad to be ok alone?"," my dad passed away from dementia 6 hrs ago, and i'm heartbroken. i will never see him again, smell or touch him, he is not in a better place, his place was with me. i love you georgie.",https://www.reddit.com/r/dementia/comments/oeasrk/getting_dad_to_selfregulate_be_ok_alone/,Getting Dad to self-regulate & be ok alone
"so, nobody in my family has ever had dementia, alzheimers or anything like that. however, it may be important to note that my grandfather has had parkinson’s for about 10 years and has been declining fast recently. he’s 88 years old. i don’t know if this is normal aging or a form of dementia maybe caused by parkinson’s.concerning things that happened somewhat recently…- he broke a chair himself, unsure how. but today he accused my dad of being the one who broke the chair. he wasn’t even there at their house the day it happened.- he was scheduled to get a minor surgery, but cancelled it twice because he was convinced the doctors were planning to kill him. he has other bizarre suspicions of people like this as well, like believing people are stealing from him. now the doctors wont do the surgery since he cancelled twice. - he forgot how to use netflix which he used a lot. he just one day no longer remembered how to use it and was unable to be taught because he didn’t understand.- he forgets to hang up the phone. this is a recent thing but he does this pretty much any time he uses a phone now. we think he forgot that you must hang it up.-he has to use diapers as he has frequently had accidents, even in public (i was unfortunately there one day when this happened)- he was telling an extremely bizarre untrue story about how somebody he knew would cut off people’s arms and legs. we think maybe it was something he saw on tv or dreamed about. he told this story as if it was real since he completely believed it was true when it wasn’t.- making extremely inappropriate comments. his filter does not exist. he insulted our waiter’s appearance to his face while i was at a restaurant with him. he also calls people fat to their faces and tells them they look deformed.does this sound like dementia? he is very, very old, but this does not seem like normal aging and it seems like something much more concerning.", [deleted],https://www.reddit.com/r/dementia/comments/odxv3b/we_are_convinced_my_grandfather_has_dementia_but/,We are convinced my grandfather has dementia but no doctor has said it. I have no control over him seeing a doctor to get tested. Does this sound like dementia? Not seeking a diagnosis.
"hey all, my dad has been showing signs of dementia for the past year. &amp; as his son, i suspected he had dementia. but it wasn't until recently that he **really** showed signs.it's gotten to a point where we can't ignore it any longer. &amp; i feel like its time to get help. but just not sure where to start? background: * signs of dementia: the tv talks to him, he called 911 believing ppl were out to kill him, etc. * dad:    * late 60s, lives by himself. separated from my mom.    * financially, he only has the small house he lives in. doesn't work, on medicaid.* potential caregivers.   * eldest brother (in state) lives in the same city. not too organized, but means well &amp; would like to help.   * me (lives out of state, more than 8hrs away) &amp;#x200b;questions:* what are next steps to determining/evaluating dementia? do i just find him a primary doc &amp; go from there? * in regards to health coverage, my dad has medicaid. does medicaid cover dementia-related treatment, etc? (neuro-related stuff?)* what can i expect long term? (financially) what are things i should maybe start accounting for? my dad doesn't have any assets &amp; so i am his entire 'retirement plan' essentially. &amp;#x200b;between my brother that lives in state (in the same city as my dad) &amp; me out of state. what next steps should we be taking?&amp;#x200b;any feedback, help, suggestions are so very much appreciated. reddit has been our life saver with other unforeseen family events. &amp; i've been very grateful for this community", get a power of attorney drafted by a lawyer. probably easiest for your brother to be poa if he's in the same state. this makes a world of difference when your dad is no longer able to take care of his finances or make decisions.,https://www.reddit.com/r/dementia/comments/odw3m1/dad_has_signs_of_dementia_next_steps_medicaid_of/,Dad has Signs of Dementia - Next steps? (Medicaid of any help?)
"31-year old here. i live with my dad and help him care for my grandfather/his father with dementia. i’ve been here 5 years and now grandfather is bed-bound. i’m emotionally exhausted and there’s no end in sight. i want to escape a narcissistic family member who doesn’t live in town but is involved with my grandfather’s care. i’m checked out after last night and i don’t think i can continue to do this. the issue is, my father is 70 years old caring for his father alone if i move out. i can still help if i live 10 minutes away, but i feel guilty for even thinking of leaving him here alone with him so much. is moving out the right thing to do or should i wait for my grandfather to pass away? it’s likely only going to be months (at most), but i think it’s a matter of weeks or days. i’m just so overwhelmed right now. i need a break.and before anyone says vacation… i don’t… know where i’d go or what i’d do. nothing sparks joy the same way as thinking about moving out does. i’m not making any rash decisions, though. just sitting on it and thinking about things. that’s why i’ve made this post. anyway… just. let me know what you think as strangers."," don’t worry that nothing sparks right now, you’ve been through a lot. trust that the joy will return. you do need to take time away for yourself, so start with a vacation, so you don’t have feel like you’re abandoning your dad. as for where and what to do. if it were me i’d pick a state park (nearby if money is an issue) and spend some time hiking or biking, and seeing nature, and recharge",https://www.reddit.com/r/dementia/comments/odrqs0/i_think_im_ready_to_call_it_quits_but_is_it_right/,"I think I’m ready to call it quits, but is it right?"
it wasn’t the dementia that caused his death it was covid . in the past few years i learnt a lot about dementia because of my grandfather. i tried a lot to make his life comfortable. i’m going to miss him so much ., rip,https://www.reddit.com/r/dementia/comments/odrjge/he_passed_away/,He passed away .
"i'm posting this 10% to vent, 90% for advice.  and i have a habit of analyzing things from a cool, calculating perspective......but don't let that make you think i don't love my father.  i think in this calculating way to keep myself from breaking down and crying.i feel like my father is --this-- close to being shipped off to a nursing home.  on the one hand, i feel that it will be necessary, but on the other hand, it seems like such a waste, since he is still able to enjoy many parts of his life.  maybe there's some better way.a little background:  dad and i are basically best friends.  we've always spent multiple days per week together (even while living an hour's drive apart), and we've always had similar interests and wanted to do the same things together.he is 81, has some physical health issues but they seem to all be under control.  i know these things are hard to predict, but i expect his brain to (further) fail before his body does.  and.......i hate to hear myself say this......i think it would be for the best if somehow his body could fail before his mind fully tortures him.in my non-professional opinion, his dementia is at state 6.  he knows who his family members are, most of the time.....except when it's night.  he can bathe, dress, and eat, with careful supervision.  he cannot cook, clean, or manage his finances in any way.he has a long-term live-in girlfriend who has now become his primary caretaker by default.  she is cold and unkind, and is never willing to have a discussion about her way of doing things......but on the other hand, her way is the right way about 90% of the time, which is pretty good.  she takes him to all of his doctor's appointments, follows (most of) the doctors' recommendations, and takes care of both his house (cleaning, gardening, light maintenance) as well as all of his basic needs (food, bathing, laundry).  she manages his money and keeps the bills paid and the house stocked with groceries.  by day, dad and i can get in the car and go for long rides, and while we don't do all the things we used to do (he gets bad anxiety in large retail environments, always feels cold outside even if it's slightly chilly), we're still able to do quite a lot-----we spend a lot of time driving around in the car, he can handle small, simple, quiet restaurants, he can handle a quick trip to a convenience store if i need to buy a thing or two.  he can carry on a simple, pleasant conversation with waitstaff and gas station clerks (most of the time).by night, he's someone else.  he gets out of bed to urinate every ten minutes non-stop for several hours, often getting confused in the bathroom and needing help.  then he sleeps for a couple of hours or so.  then he gets up and wanders around the house, slamming doors and yelling, says the most cruel, irrational and nasty things you can imagine (his great vocabulary and wit have stayed with him, for better or worse), and makes threats.  at night, he suddenly refers to his girlfriend as ""the staff"" and thinks she's there to work for him in some way.he hasn't quite fully attacked his girlfriend yet, but it's gotten pretty close.  he's threatened to kill her.  he's shoved and bruised her.  she's terrified of him at night.  since he only sleeps for a couple of hours per night, that's all the sleep she's been getting as well.  this is obviously an unsustainable situation that needs to stop before it gets worse.i just spent one with with him, day and night, and can confirm that everything the girlfriend says is true.the girlfriend said that it's probably time for me to find a home for him, and sadly, i agree.by day, he doesn't remember any of the things at night.  when he's told what he did, he feels terrible about it, and says ""what the hell is happening to me? i must be losing my mind"" and makes it very clear that he doesn't want to hurt anyone, and is terrified at the possibility of hurting and/or losing his girlfriend.  he's too wealthy to get medicaid, but very likely too poor to afford in-home care for very long.  he has a little money in the bank (somewhere in the tens of thousands), but long ago put his girlfriend's name on his bank account.  (which means she has the full legal right to drain the account for herself if she wants.)   his main asset is his paid-for house.  i suppose it's likely the house will have to be sold off to pay for his care.i feel i will have to go to the courts to get control of my father and his affairs. his girlfriend will certainly feel insulted and offended, and there's a good chance that will drive her away entirely. while that will be her choice and not mine, i'll feel bad if my father loses her.  tldr version:  \--dad is a mostly functional human being by day  \--dad is so dysfunctional at night that he's a danger to himself and others, especially his smaller-than-him, also-old girlfriend. and he doesn't sleep at night so she can't sleep either\--while i'm no doctor, i believe the medical options to get him to sleep at night have already been exhausted\--i don't think he can afford an all-night caregiver at home, at least not for long, and even if he can, his girlfriend will find something not to like and will cause problems\--it seems like such a cruel thing to take a man who's fairly manageable for 2/3 of the day, and toss him in the nursing home because he's a monster for 1/3 of the day\--while i have a flexible schedule, i'm only able to spend about 10-15 hours per week with him, maybe even double that but not much more\--i wonder if there's some kind ""adult night care"" place instead of adult day care. i've looked at adult day care and he can probably afford it, but all that would do is give his girlfriend a break to nap and clean up the house. he'd still be a threat at night"," i realize you don't have a lot of control over the medical decisions here, but this sounds like some combination of sundowning, bladder issues, and maybe him having difficulty distinguishing between dreams and reality.meds: melatonin is a great start. thc-free cbd may also help keep him calm. i've seen and heard of good results with atypical antipsychotics like seroquel and clozapine. but see if you can persuade his gf to try the ""small guns"" approach of giving him melatonin and/or cbd. they tend to be well tolerated with minimal side effects, and both i (with my dad) and other folks in my support groups have improved the night time restlessness with those.other: has he been to a urologist or even his gp to make sure he's emptying his bladder completely when he urinates? urinary retention isn't uncommon in these situations and can lead to lots of waking up at night.",https://www.reddit.com/r/dementia/comments/odr8hn/father_is_mostly_ok_by_day_but_an_aggressive/,"Father is mostly OK by day, but an aggressive terror at night"
"all stories welcome my dads stil somewhat ""there"" at 66 but requires assistance with basically everything get lost in our house can't find a place to sit without lots of directions any feedback is nice just feel like chatting"," you're not alone, its a big decision we were recently forced to take. :( my grandmother's sundowning has officially reached the point where she risks killing or severely injuring herself each night. just 2 months ago, she nearly pulled down a glass shower enclosure onto herself at 3 am, when she got confused and couldn't figure out how to get inside.  we then decided to lock the door to her ensuite at night, and restricted her to the bedside commode only. a few weeks later, she got out of bed to rummage in her drawers as is customary. the next morning her entire forehead was black and blue. after reviewing footage from her bedroom camera, we saw she'd repeatedly smashed her face into her nightside table while reaching for items in a lower drawer... then a few nights ago at 3 am, she tried to rip the commode out of the floor (anchored for her safety). we heard a loud crash and ran to her room only to find her on her back. again, upon reviewing footage we saw that she'd braced against her walker while pulling on the commode..she and the walker went flying across the room when the brake mechanism failed, and the back of her head bounced twice on the floor as she landed... currently we're monitoring her for a subdural hematoma as we work to get her placed in ltc.on all 3 recent occasions my mom had fallen asleep, and therefore didn't hear anything until it was too late. she's having an extremely hard time processing this, but i reminded her only a machine is capable of working fulltime and staying awake 12 hours per night to ensure grandma doesn't somehow kill herself. to expect that of herself is madness. can't think of any way to keep her safe, short of tying her to the bed at night, which is both cruel and illegal. we honestly tried for as long as we could, including ramping up our home to the max. we added gates by the staircase, which progressed to locking her bedroom at night bc she'd try to access the stair lift and fall.. we installed locks at the top of every exterior door because she constantly attempts to wander outside during the day. we closed off kitchen access with a wall + door because she dropped and managed to embed a knife into her foot last year (also b/c the psw who bathes her every morning constantly found knives/other sharp implements she would hide in her room to cut fabric and saw at wires/plugs). during the day she's relatively sweet and manageable, and since i've been doing online courses for the past year, i typically spend 9-5 taking care/interacting with her, then study after dinner until bedtime. the problem is that we just can't find a way to keep her safe at night, as her behaviour gets progressively more and more outlandish. she only sleeps from 9pm-1 am on average, then she will rummage and attempts to wander the house until 6 am. currently our 3 bedrooms upstairs are vacant as at least 1-2 times a week, she'll rant/scream all night (mom can't get her to stop). my dad, sister and i all sleep in the basement bedrooms so we can study/go to work. my mom probably hasn't slept a night through for the past 2 years and it shows, she has so many white hairs now that she didn't before. we really tried, but it just doesn't make any sense for us or any of our extended family to take care of her anymore. prior to this she was staying with my uncle, who similarly threw in the towel after 3 years.",https://www.reddit.com/r/dementia/comments/odpoxh/when_is_it_time_to_send_your_parent_to_a_home/,When is it time to send your parent to a home?
