submission,comment,url,Title,title
"my grandma passed away at 90 from dementia in march. we did home hospice and it was utterly exhausting. i've been out of work for 2 years caregiving, i have to return to my life as a 26-year-old.for decades, grandma was the primary caregiver of her son who survived a tbi and stroke in his 20s. she was instrumental in his recovery. they lived together since the 1980s. he has aphasia and like a dozen other medical conditions, and she prided herself on being the only person in the world who could understand his special language (*you can see where this is going*). when she was dying, he was angry that we were not putting her on a ventilator and feeding tubes. felt like she was declining because of us, not in spite of us (me, my mom/his sister, my brother)we moved him to an apartment across the hall from grandma's. started to create distinct spaces for his furniture and various things. untangled their expenses from each other's finances. started building a routine, social life, and activities for him, where she was one part of his day but not his entire day. made enough space to safely walk around the rooms. we even got him onto the medicaid waiver with a home care aide. tried to avoid a double trauma rocking his world. but of course, it takes a lot of energy and the more we try to clean up messes and try to prevent foreseeable disasters, the more he manufactures drama, injures himself, and creates new problems.we have to empty out her condo. she was sentimental and frugal (in theory), the disabled son tends to actually hoard. some mix of sentimentality, frugality, optimism (barely started projects), admitted his ""pre-accident self"" abilities won't ever return to 100, and likely the fear that getting rid of the items means the memory is gone. he has never wanted to get rid of anything even items that were broken beyond repair. we had to get rid of a lot of broken items directly from the basement behind his back because he would try to stop us. now the condo has to become actually empty. any thoughts??? advice???", have him select a dozen things that are most meaningful to him.  get a friend or family member to take him out shopping and for lunch while you have a hauler pull everything out and take it to the donation center or the dump.,https://www.reddit.com/r/CaregiverSupport/comments/ty4ae3/cleaning_out_deceased_grandmas_home_her/,,Cleaning out deceased grandma's home. Her codependent disabled son is a hoarder. Advice???
"i don't know what to think. i am a caretaker for both my grandparents but most of my focus has been on my grandmother and her dementia. this just hurts way worse for some reason. i almost miss the days when her aggression was my worst problem. it was sad enough to see my grandfather become affected by that. now this. for context, he had been in the hospital over the weekend with extremely low blood sugar, the hospital decided to take him off some stuff and cut some of his meds in half. so today we were going through all his meds and and a nurse came by and we all sorted out what was actually needed and what wasn't and that is how i found out the truth. i feel so bad for not knowing all this about him. he is overweight, though recently he lost 15lbs just from not eating as much anymore. i hate bothering him about how he eats too, as that has been going on for years and i feel like he is tired of it. i feel bad reminding him of it. i don't know if it's too late anyways. also he will be having a physical therapist coming 3 times a week now so i hope that will also help with movement and maybe exercise. he has so many problems, diabetes, lymphedema, high blood pressure etc. he is 82 and knowing everything he has its amazing he is still here. i'm sure he's not feeling too good about all this either. i really have no words for how devastated i am. i'm not ready to let him go. i feel so bad for him, i just want him to be happy and have an easy life. the cardiologist appointment isn't soon but i needed to tell someone because i know i will be dysfunctional and spiraling until then. does anyone have any experience with this? i know i should be telling all this to a doctor but i am desperate to help him and i need help to calm myself down. maybe some words of advice? i don't know anything about life with heart failure besides what i just read on google. thanks anyways if you read this.", i have congestive heart failure since one and a half years now. i control it with medication.  i al's eat a healthy diet. i lost 20 pounds. i am able to live a full life and enjoy time with my grandchildren,https://www.reddit.com/r/CaregiverSupport/comments/txzwc5/just_found_out_my_grandfather_has_heart_failure/,,Just found out my grandfather has heart failure
"looking for advice and support. i come from a large family, 7 siblings. parent, grace 80f, has developed dementia and has been the primary caregiver for physically disabled daughter for 50 years. daughter, carrie, is on longterm care assistance from the state. she talks but cannot care for herself in any way. grace does everything for her and it’s starting to impact her own health heavily. now that grace is older i started going over everyday to help cook and clean. i have my own family at home but grace and carrie were not doing ok on their own. missing meals, wearing dirty tattered clothes, the house was filthy. some of my siblings have gone over periodically but have prioritized they’re own lives, no judgements from me but there’s a lot of us and some help would be nice. the biggest issue im having now is the rest of the family want to keep them together and i think they should separate. carrie needs full time care beyond what any one of us can give her. feeding, changing, incontinence, and doesn’t sleep through the night. she cannot move on her own from the neck down and is about 130lbs. i feel that leaving them together forces mom to keep caring for carrie. i think it’s making her decline more rapidly and she just cannot do it anymore. im afraid an accident or emergency will happen one of these days and one of them will die because they are alone. my siblings think they can find a live in caregiver for both for about 5k a month. the assistance carrie receives will not cover it. full time caregivers are already sometimes unreliable at home and hard to find. realistically i don’t see this happening. it’s caused a lot of ugly arguments. the family is split. i can’t continue taking care of them everyday. im burnt out and its taking a toll. ive been outcast by my siblings who want them to stay together. they even accused me of benefiting from the situation because i take my kids over and we often eat dinner (that i make) at moms. i take them to grocery shop, medical appointments, i cook and clean and help feed, wash and change my sister carrie. i don’t know what to do anymore except step down and wait for the inevitable. i question myself everyday wondering if im wrong for thinking carrie needs to be in a care facility yesterday. everyone that doesn’t help seems to be yelling the loudest about keeping them together. any advice or support helps.",,https://www.reddit.com/r/CaregiverSupport/comments/txw9mq/family_battle/,,Family battle
"i am a care giver.. or so i thought. my grand dad started going down hill about a year ago, we had hired one person previously to take care of him but he would complain constantly about her actions. which thinking back were what you would expect of a care giver. fast forward 3 months and i have begun to take care of him instead, what i thought would be a good opportunity to become closer with my grandad in his final months has become more damaging than i could have ever predicted. i am a care giver, i scrub the sinks with a toothbrush, i dust and polish every piece of wood furniture once a week, i sweep mop vacuum and carpet clean once a week. i tend to the garden, i mow and weedeat his 4 acre land, i clean the toilets 3 times a week, i clean the windows once a week, i clean the mirrors once a week, i make breakfast, lunch and dinner, do the laundry every 3 days, drive him wherever he needs to go, clean all kitchen appliances once a week, clean the front and back porch as needed, rake leaves as needed, do all of the grocery shopping.i work on any of 7 antique cars whenever asked, im on the roof cleaning gutters and replacing shingles whenever needed, maintaining yard tools such as weedeaters and mowers, paint the walls whenever desired.long story short if there's any sort of job to be done, i'm doing it. whether it be maintenance, cleaning, or actually taking care of my grand dad. all things said and done i'm able to complete the tasks with ease, the issue comes from where even with the tasks i do, i receive $300 a week, i have my own family and home and i declined a job offer for nearly $20 an hour so i could make sure he was properly taken care of. i don't get any holidays off, i don't get any breaks, i don't get any time off. i cannot rest after a hard job such as weedeating his creek (approx 2 hours of work) or i'll get a comment such as ""i don't pay you to sit, get to work"" and constantly belittled infront of his hospice nurse and social worker because i ""don't do any work"" my goal in the post is to understand is my power of a care giver being taken advantage of? should our family hire an actual care giver instead of me? my grand dad used to hire cleaners and contractors to take care of his home, now it's solely my responsibility to take care of every aspect inside this roof, one of the biggest issues i have is being cursed at or to about the work that needs to be done. i'll do the work, but i don't appreciate being cursed for the sake of it. he is a vietnam veteran with lung cancer, dementia, copd, enlarged heart and 100% blocked inner carotid artery."," since money doesn’t seem much of an issue for him, it is really hard to understand why he doesn’t hire people to do all the maintenance like he used to. the simple answer seems to be - he is taking advantage of you. and while there are certain difficult situations where there is no other solution, this is not it. you should see yourself not as a servant, but as his house manager. if he says - repair this or that, you are responsible for hiring someone to do that, not to do it yourself. it seems that could apply to most tasks.and please, negotiate a decent wage, there is no reason to hold your grandad as more important than your family. in the long run, it can very badly backfire on your relationship with your own family. you are already burnt out, and that will soon spread to your partner.",https://www.reddit.com/r/CaregiverSupport/comments/txqii1/am_i_a_caregiver_or_a_maid/,,"am I a caregiver, or a maid?"
"**before reading**: this will be a long and detailed story. i had to share this with someone and share our story. i ask for any advice and help from anyone because i don’t know what to do to help get us out of this situation. my family is everything to me and i refuse to let our lives be ruined once again. i’d like to first give some background about my family. there are four of us kids, ranging from 17-20. two boys, c and e, and two girls, m and p (me,18), and our single mother, d. we live in ohio. we are all white for clarity. we have been below the poverty line our whole lives, have been homeless before, gone through recovery, and all of us have severe mental illnesses and some physical problems. d has incredibly debilitating asthma, to the point she cannot function at all. i’d like to say that even though we’ve been through tough shit before, we’ve learned to handle it pretty well and stick together no matter what. we bought a house for the first time in 2019 with the help of our grandmother. at the time, d had a full time job and a full time gig as a babysitter for our family friends. for once we felt secure and steady. however, the family ended up firing d as their babysitter, after 4 years of raising their daughter in 2020. due to covid, d also lost her full time job. everything started going downhill after that. my mother decided to get back into caregiving for elderly and disabled people. this was really hard for her considering that she has intense ptsd. she was responsible for taking care of her very sick father for her entire childhood and throughout adulthood until he died in 2013. d also went to nursing school and worked as an emt for a couple years until she had to drop out. so she absolutely is qualified and knows what she's doing.  while working gig to gig throughout the first part of 2021, in august, d found a listing for what she thought was a younger man who was taken care of for the most part by his parents. the listing was $10/hour, three days a week, and evening/nights. combined with other gigs, this was good enough. when she was later interviewed, she found out that the man (h) was in his 60’s and supposedly taken care of by his sister (j), and two other caregivers, one of which was more need-be. seems normal enough, so she ended up taking the position. up until october, everything was totally fine and matched with what she signed up for. during october, s, the other caregiver gets fired for using while working. our family is very understanding of that type of situation, so no judgment. the need-be caregiver kind of just slowly stopped coming as well. j is also nowhere in the picture and my mother wasn’t even given contact information for her. h’s parents also don't really touch base. us kids realize that mom is not coming home. from october to december, d was left to take care of h, who needs 24/7 care. obviously my mother knows what is happening, yet because of her ptsd with this kind of stuff, she is literally unable to differentiate reality and the past. she is constantly arguing and begging with h that she needs help. he ceases to ask his family to help, hire another caregiver, or do anything. she was still able to function when she had to, but she was slowly dying and no one cared except for my siblings and i. my sister and i would come over multiple times a week to help her with h. at this point, my mother is unwillingly stuck taking care of h 24/7 with no way out. since we were never expecting this to happen or wanted it to, my mom is sleeping on a couch every night, doesn’t have access to her daily meds, has a weeks worth of clothing, paying out of her pockets for h’s medical supplies, paying for two houses worth of food, alone (for the most part), and losing her fucking mind. where it gets even better is that since october, h is either flat out not paying my mother, or is paying her an average of $3 an hour. we were already poor and now we are quite literally broke. not only that, h went to the hospital at least once a month because of how sick he was. because of his special ventilator and the lack of knowledge from the medical professional on how to operate it, d was required to take the ambulance to the hospital with him every time. for the first couple of visits, she would stay there the entire time. mostly because she was worried that the hospital wouldn’t take adequate care of him, which they didn’t. if she wanted to leave, to visit her kids for example, she would have to uber to and back, which was deducted from her pay. and at that point, she was so broke that she had to use h’s card. she also didn’t have access to the account info, nor was she told how much was spendable or not. so any accidental overdraws she made would also be deducted from her already non existent pay. because of how much h manipulated her, she believed that she needed to be there for him every time.around december, d was so desperate for help and company from another person, h finally agreed to have my sister move in, after weeks of begging from my mom. m at the time was working at petsmart and living with her boyfriend. agreeing, m quit her job and broke up with her boyfriend (which was coming regardless) and moved on in. h guaranteed that he was done with his bullshit and would be paying both m and d fairly. surprise, surprise, and shame on us, because of course that didn’t happen and continues to not happen. around january (2022), even though i knew what i was getting into, i decided to also move in. i wanted to be with my mom and make sure she knew we loved her and would always help her. once that happened, mom was finally able to have the time and ability to work on getting this shit fixed. she was able to reach out to h’s parents and sister to explain what was really happening and what h was doing to us. did they care? no. not only did they continue to let it happen, but they had the audacity to judge d for not doing well (physically and mentally), not believe anything she was telling them, turning a blind eye to the lack of pay, and blame d for what was happening to us. they also started to show up to h’s house without any notice or warning to just bash my mother for *her* wrong doings. during this, our car was repossessed making it even harder to be able to pack and leave, we don't have the money to even be able to pay one months worth of mortgage, lost our food stamps, and have been going through incredibly hard mental health. our plan as of now, which isn’t even solid because there is no stability whatsoever, is to get our house repaired and sold before it gets foreclosed on at the end of april, find whatever car we can, and move to texas where our grandmother is. if we can’t manage to sell our house in time, my grandmother will have to file bankruptcy for the 2nd time and will absolutely disown us, which will most likely leave us homeless and financially ruined.we now know that h is not mentally stable enough to be making these types of decisions, and most likely has some form of dementia. which may excuse his actions in my mothers eyes, but not mine. about a week or two ago, j decided to come back into the picture to take care of her brother. based on her decisions and actions, she doesn’t listen to my mothers medical opinion on h’s condition and health, nor the doctors’ recommendations. she quite literally is not qualified for any of this. and of course, my mother has communicated with j as much as possible. however, she continues to not communicate with d about anything. this past week, j has been offering other caregivers hours and out of pocket cash pay at the end of each shift, which is 12 hours max, including sleep. has she offered or mentioned these shifts to my mom, sister, or i who are very much still living here and taking care of h when j or the original need-be caregiver from the beginning is here? no. this is where we stand as of now and all we can do is see what happens next. although there has been more bad than good during this situation, i want to mention the silver-linings that we have been lucky to receive. when our car was initially repossessed, h’s parents let us borrow a car for a couple days so that mom, c, and e could work on our house. our friends have kindly given us rides when they can. m has a part time job that is making us more of a stable income. i have given my small savings to my mom to help. our tax returns came quick and contained about 2/3 of our budget for a car. j has apologized for her actions and will hopefully treat us kindly now. i’ve learned much needed medical experience/knowledge. i have learned to read lips better (due to a trach tube, h goes between mouthing words to talking).i am so beyond disgusted by this whole thing and it has changed my entire view on life. it has shown me that a lot of people are awful and selfish, that i need to always stand up for myself, and how important family is to me and how many sacrifices they are worth. thank you for listening."," you sound like someone who has been able to hold yourself together and assess this rapidly deteriorating situation. that's a good thing and it will carry you far.h needs a very big team, capable of making decisions rather than maintaining the status quo even as the ship is sinking. his sister, not your mother, needs to understand this, and needs to coordinate with social workers, doctors and whomever else she can get.your mother has done her part and it's time for her to leave.your mother is stuck in a dangerous cycle of ptsd. she can't extricate herself because of her mindset, so you. have to do it for her. get her home, call h's parents and say one thing: ""she's not coming back."" then make a second call to social services elder care unit and lay out the situation. you do not have to identify yourselves to them. just make the call.  it's time for them to step in.best luck with your move to tx.  you're making good choices surrounding the house. you all need to go where you have more support, and while h's family has been nice in loaning you the car, again, you are reliant upon a family that has a very bad track record of making decisions. texas will be better, though make sure you all are getting the medical and mental healthcare you need, and that each of you chooses a career path. vocational or professional, these are incredibly important years for you, and you should be looking to gain skills that will be applicable in a growing industry in a few years time. don't be afraid to shoot for the moon. you sound smart, capable, and resourceful. just remember that teamwork, networking, resource gathering, as well as knowing when to change course (which includes an exit plan) will be the way to continue in the future.",https://www.reddit.com/r/CaregiverSupport/comments/tvp7oq/my_family_and_i_are_stuck_and_we_need_help/,,My family and I are stuck and we need help
"this is my first night where i really had to step away - i've got an alzheimers father who just pissed himself and is just walking around cursing, and i've spent the last 24 hours awake taking care of a 77yo mother with food poisioning who is not able to get to the toilet fast enough so i've been cleaning up vomit and diarrhea all today.  i'm 49 single unemployed childless and don't have any real friends or support, and neither do they. sorry to vent but i also need some kind of help- i've never had to deal with any of this before because they both tried to be self reliant and kept saying i didn't need to worry about their problems.... but it turned out neither of them bothered to do anything besides get kaiser and medicare and then just wait for someone to tell them what to do. like a fool i let them get away with that and its become too much.  now i'm expected to step in and deal with one with dementia and one who is too sick to plan or decide or even know if she can go to the bathroom.  i think i need some kind of in-home care help, but will they come for emergencies like this when i need them or am i expected to juggle this myself?  will they deal with my parents filthy hoarder house or do i need to fight my mother to get that cleared up beforehand? what should i ask for? i had an assessment meeting with a geriatrics nurse from kaiser and nothing got done- it was like we werent asking the right questions.i'll get through tonight and learn how to deal with faeces everywhere like a new parent,  but what should my first step be as soon as the crisis is over? where do i start?"," ask to be paid to help. the going rate is $30/hour, but even getting minimum wage will help you. we were using a service called paychex. they do all the withholding and taxes and reports. if you do this, try and set it up in both their names or as an either/or so if one dies you don’t have to close the account and open a new one. or do it in the name of the parent you think will survive the longest.once you’re getting paid and have some down time, start de-cluttering. ask them if you can sell their stuff if you’re so inclined to earn a little extra money selling their stuff online. it will be win win win: they get a cleaner house, people online get stuff they need and you get some money. oh- it also probably will help clear out trip hazards, too. i know how much this sucks. i’ve been taking care of my two elderly parents alone since my mom was hit by a car in january 2020. dad passed away in february. it sucks, even though i love them. getting paid helps it suck less.",https://www.reddit.com/r/CaregiverSupport/comments/tqq0he/how_do_i_start_getting_help_taking_care_of_2/,,How do I start getting help taking care of 2 elderly loner parents who have plenty of money but didn't set anything up to take care of themselves besides relying on me.
"i previously posted that my mom’s going into a nursing home.problem is: she keeps asking how long she’s going to be there, and when she will come back to the house she shared with my dad (before he passed).how do i tell her she can’t come back?  she has cognitive issues (either a stroke or dementia), so trying to reason with her is extremely difficult.thanks"," delay the question. for example if they are undergoing pt due to an injury, “when you get stronger”",https://www.reddit.com/r/CaregiverSupport/comments/tpdqy2/how_do_you_tell_your_loved_one_that_they_cant/,,How do you tell your loved one that they can’t “come back home?”
