submission,comment,url,Title,title
"i care for my mom (70s, parkinson’s and advancing dementia) i have a spouse, kid, fulltime job. i try so hard to take good care of my mom, drive her to three different workout classes a week and coordinate with a neighbor to take her to two more (yoga) manage the 6 different meds she takes a total of 10 times a day. make sure she eats enough and at the right times with her meds. take her to so many dr appointments and ask all the important questions. help her with her tv and phone many many times a day. she’s always been an emotionally needy person, and having lived with her the past 7 yrs, i now understand why she is three times divorced :( i’m starting to hate her for her constant need for attention and hate myself for feeling that way. no matter how much i do for her, she always wants more. my spouse helps but he gets frustrated too. we’ve considered assisted living facilitates for her, but she doesn’t have much $ and applying/qualifying for medicaid seems daunting. plus i worry about the quality of care she will receive and covid. she would need fulltime memory care for sure. i’m slowly mentally and emotionally collapsing. it crushes my soul that no matter how good a caregiver i am, she keeps declining. i know in my head it’s not my fault but my heart hurts. i feel like a failure as her daughter and also to my husband and kid. my job too. just struggling with everything, all at once. i probably need a therapist but who has the time to even find one plus my insurance sucks. and to know it’s only going to get worse and in the end she will die and i will have no mom…like there is no light at the end of the tunnel only more sadness and pain.i have a brother and her sister (my aunt) that will help some but i have to be very specific with my requests to both of them and manage/follow up to the point that it’s not helpful, just another chore to manage. plus they are both super flakey, they will commit to do x then something else will come along and i’m left scrambling. sucks.not sure what i am asking, i guess i’m just venting. thanks for reading."," im sorry you're going through this! theres only so much you can do, you have to take care of yourself. i would look into other types of care available to her.",https://www.reddit.com/r/CaregiverSupport/comments/u7c7ww/struggling/,,Struggling
"i am 35 now with a parent with alzheimers. i grew up caring for other family adults with mental illness, on top of that my family has a history of domestic violence experienced from my father. me and my older sister have put our lives on hold to survive our past to then care for family members on my mother side including my mother now who has alzheimers. at this point i can't help but wishing sometimes that god can just take her peacefully in her sleep.we live in nyc and the health care services for alzheimers patients are limited and underdeveloped for caregivers to use (aides are not properly trained and memory loss facilities are another form of neglect) for so long i've had to leave jobs and couldn't move else where because of all the responsibilities of caregiving. my love life is short lived with many partners getting the drained version of me (sometimes having to leave my dates since due to constant calls from the aides not being able to handle my mom or my sister needing my help) unfortunately putting her in a home would kill her faster. she asked us to promise her to never put her in a home and she was a great single mother to us even after surviving a gunshot wound from my abusive father. this woman deserves the world but she also had us take care of other family members which created a caregiver trauma cycle for me and my sister. i am even scared to have kids because i don't want to take care of no one else i'm tired of being a caregiver and i want out but i don't see any way out other than to place her in a home which we know will kill her faster or a natural death. i'm exhausted. i love her but i can't help to feel resentful for trying to survive and not being able to live the life that i wish to have. does anyone feel the same about wishing their person died of a natura cause so they can free themselves of the responsibility? i feel guilty for this but then i honestly wouldn't mind.", [deleted],https://www.reddit.com/r/CaregiverSupport/comments/u5wzbm/i_am_a_caregiver_and_daughter_of_an_alzheimers/,,I am a caregiver and daughter of an alzheimers parent and I feel guilty for...
"in january of this year my uncle passed away and within days of his passing her daughter, my cousin, showed up at her house and bullied and threatened her into signing a poa that gave her everything. she's also printed out a last will and testament and told my aunt that it was a living will. the daughter had major recipient that will which as you know you cannot do when you are power of attorney for someone. you can in no way in which your self. i drove down from north florida to south florida and picked up my aunt to bring her home with me to keep her safe. this was with her full consent. i had not seen her since the beginning of the to baker act her so that she could get evaluated and treat it. they refused telling me i just needed to get along along with her and while i had realized everyday on the phone talking to her that they were serious memory issues going on i did not realize that there was such a depth of dementia. during the pandemic she had experienced a prolapsed bladder, within weeks of coming to my house she had a full-blown uti which causes people with dementia to have horrible behaviors and hallucination. she woke up one morning coming after me aggressively and within a few hours locked me out of the house when i tried to walk away from her to get some peace. i knew something was seriously wrong and knew that it wasn't safe to get in the car with her so i called the police here in jacksonville florida to baker act her so that she could get evaluated and treated. they refused telling me i just needed to get try to get along with her and then she had nothing wrong with her. my aunt can act normal when she chooses to because their dementia is very early and while this is unusual it does happen. it took me 6 hours and another visit by the police to convince them that she had to go to the hospital and that i was not safe. memorial hospital evaluated her and held her for 3 days and did brain scans and diagnosed her with dementia with behaviors. i already had her in a doctor's practice here in jacksonville and we had all agreed that we needed to do neurological testing and nail down what type of dementia it was and how to go forward.the hospital recommended assisted living until she could get the surgery and we made arrangements for all of that to happen this week. however there were serious problems in the assisted living facility and i brought her home with me as we were only a few weeks away from getting the surgery. within a week she had another uti and this time it was absolutely unbelievable. the police would not baker act her again, they claim they knew she didn't have dementia which is ridiculous. i was on the phone with the doctors and social workers locked in my bedroom while watching my aunt on camera to make sure she was safe. she eventually ran out the door screaming that she was going to call anybody she could find with a phone the tell the police that i had kidnapped her and was hurting her. i need the police came and took her to the hospital. unfortunately she went to baptist hospital where they decided, with no brain scans are testing that she did not have dementia because she did not present symptoms when she was there. the next thing i knew the police were called on me and d c f was investigating me for kidnapping, mental anguish, and abuse. i presented my p o a, all of the brain scan information and diagnosis for memorial hospital and yet the police still maintained the she didn't have dementia. there was only one doctor memorial it was saying this and yet the police ran with it. meanwhile i'm still caring for her, arranging for another assisted living facility and paying the bills behind the scenes. the day she was supposed to be transferred to assisted living my aunt reached out to her daughter, the one who had abused her and that dcf had found the complaints for valid and the daughter came and picked her up. baptist was willing to release her to her. at this point the police called me and told me they were charging me with stealing her car even though my address is listed as hers because she was living with me. my aunt and her daughter came to pick up the car with four police officers and i would not answer the door because i was not going to go through it. i had left the keys for them to take the car. according to the police i'm still under investigation for all this and they refuse to believe that she has dementia in spite of memorial hospitals in her primary doctors diagnosis. i have reached out to an attorney. i'm still terrified and i guess no good deed goes unpunished. jacksonville police are freaking flueless and please do not take your elderly relative with dementia to baptist hospital!!"," well, that was quite an account.  i hope things go okay with these legal charges you are possibly facing.  please have nothing further to do with your aunt and cousin - this is a situation you cannot possibly win.  you just need to take care of yourself right now.",https://www.reddit.com/r/CaregiverSupport/comments/u5qdic/ive_been_a_caregiver_for_my_elderly_aunt_in_the/,,I've been a caregiver for my elderly aunt in the police are threatening to arrest me.
"hello, i’m trying to get some guidance on how to go about getting mom into either assisted living or paying for a full time caregiver (right now someone comes during the day). us…. on medicare/disability. it’s been a long road. what’s the approval process like to help get it somewhat paid for? and how do you have that conversation that it’s time for that? she’s adamantly opposed, partially due to a lot of dementia-like symptoms she’s having with her illnesses and issues. any help would be amazing."," try to keep her at home as long as possible and see about having someone come to her home. she would be in her comfortable, familiar surroundings. she will be more relaxed.",https://www.reddit.com/r/CaregiverSupport/comments/u5jgum/assisted_livingfull_time_caregiver/,,Assisted living/full time caregiver
"this is my first post here, and it probably won’t be my last. i’m leaving a lot out and choosing to focus on *one* situation, so i may mention a few things that i don’t really clarify or add on to. i’m not great at getting straight to the point, and this is a bit of a ramble because i’ve had nowhere else to talk about it.i started ‘sitting’ with an elderly lady (i’ll just call her miss c) last week. this is what the time i’ve spent with her has looked like so far:- thursday (9am-12pm)- saturday (8am-8pm)- friday (3pm-11pm)- today (9am-12am)and i’m going to be honest, i’m already feeling burnt out. all the other jobs i have had have always been childcare, and i wasn’t feeling nearly as burnt out as a nanny as i am right now. i’m dealing with my own health issues and long-term effects from having covid twice this year, including a migraine that i’ve had every day for nearly a month now. i have chronic illnesses and for many of them, fatigue is my worst symptom. i’m so tired. i feel horrible. i don’t have to **do** much of anything. grab her something to eat when she’s ready, hand her meds when it’s time, occasionally help her adjust how she’s sitting, grab her a blanket, fix her socks, and help her if she needs help pulling her ‘underwear’ up because she’s very unbalanced and struggles at moments. i literally just sit here because she watches the news and naps. i don’t care for the news for multiple reasons and it’s very repetitive when it’s on all day, so my brain is just overwhelmed and overstimulated each day that i’ve been here. her daughter is so nice, and i fully understand that she needs a break at times. she stays with miss c overnight and most of the time when her worker isn’t here. i’m currently taking over for the regular caregiver who would be here these times i have been, but miss c’s daughter is under the assumption that this lady will request less hours if she knows i can be here. so far, i have a pretty full evening and weekend schedule through the end of the month though. i’m also mentally exhausted. someone i’m close with is her regular worker (tues &amp; thurs), and i brought up some pretty big similarities between my grandma and miss c. my grandma was diagnosed with alzheimer’s last year and for the last couple years, i’ve been regularly caring for her when i can. so i was around to note certain things and to also learn how to handle some of it. miss c sees things and hears things that aren’t there. she often thinks the news people are looking at her or saying her name as well as other behaviors. i’ve been trying to handle it how i do with my grandma — not shutting her down or telling her she told/asked me something already. basically just letting her talk and making appropriate sounds or saying something when it seems needed. because i don’t want to make her feel crazy or have her get upset with me. i’m not a doctor, and i’m not trying to diagnose her. but her regular worker says the reason she doesn’t receive more care through the senior center or even hospice is because her daughter doesn’t want to admit to the fact that there may be something else going on. i’m hoping that except for maybe an occasional evening or saturday that after this month, this isn’t a regular thing. i get $10/hr which is more regular than my last nannying job, but this isn’t worth it to me mentally and physically right now. i got home at 11pm last night and didn’t sleep well, so i was up at 6am and here at 8:50am. i’m ready to go home and want to cry when i realize i still have 12-13 hours to go. i love miss c and she’s so sweet, but i am so drained. how do you deal with this type of burnout? if feels ridiculous even calling it burnout when this is only my 4th day, but that’s what it feels like. it doesn’t seem right considering i don’t even do much of anything while i’m here."," if you’re burnt out on day 4, i would look for a different job. being a caregiver is not easy money, it’s difficult to care for another human being. there’s nothing more you can do if you’re already not happy, it doesn’t get easier.",https://www.reddit.com/r/CaregiverSupport/comments/u4zvza/bunt_out_on_day_4/,,Bunt Out on Day 4
"i don’t know if this is the best place to post this, but i’m currently in the hospital with my mother (58f) who has osteomyelitis in her back after (what the doctor’s believe) having a herniated disc surgery back in july 2021. she’s experiencing mental confusion and seems agitated and has even raised her voice at me, which is not her normal behavior at all. im absolutely terrified, i can’t stop crying. my mom’s still aware of her surroundings, who she is, who i am. she can answer all her own medical questions. she acts completely normal, but then she’ll start saying that my sister or some random extended family members are outside in the hallway, laughing and crying. they’re not, i’m the only one here to visit her.im not allowed to stay over night due to the hospitals policy (i’m guessing covid related?) but last night my mom called me every hour, telling me my uncle was in the hospital and she could hear him screaming. my uncle just so happen to be sleeping over at our home and i was able to pass the phone to him after her 4th phone call to prove to her that he was in fact ok. i barely slept. as i’m also my sister’s caregiver (she has cp) i had to wake up early to get her ready so i could go and spend the day with my mom. the doctors aren’t too concerned about it because she acts completely normal, but then there’s moments where she changes. she’s desperate to go home and part of me feels the hospital is aggravating the mental confusion, but i’m afraid of her getting agitated at home and it’s just me there, or the worst for me would be that she gets stuck in this cognitive state. her mother had dementia/alzheimer’s and my mom and i cared for her 3 years before she passed away. i know dementia is hereditary and i’m afraid she’s developed it or something. i guess i’m wondering if this is something she can come back from, heal from or is this just the beginning of the end? sorry this is long, i don’t have anyone to talk to about this."," thank you to everyone who replied, i’ve had my hands full with mom, so i haven’t been able to reply but i feel so heard and understood, thank you all ♥️mom gave us a scare this morning, she was sweating profusely and he blood pressure was super high. they checked her heart and lungs and she was fine. they gave her loads of medicine to lower the bp and it worked. while she had hbp she barely spoke. now she’s back to speaking, delirious but at least she’s speaking and responding compared to earlier. i’ve taken some of the advice given to me. i went home last night, turned off my phone and slept. i plan on doing the same tonight now that’s she’s stable. the doctors believe she might be delirious because of the infection in her back or the antibiotics. so they’re planning on switching up the type of antibiotics to see if there’s a difference. they also moved her to a room with lots of windows. im feeling calm and hopeful that everything is going to be alright.",https://www.reddit.com/r/CaregiverSupport/comments/u4ibls/mom_suffering_from_mental_confusion_due_to_an/,,Mom suffering from mental confusion due to an infection
"i'm in a bit of an interesting situation but i've already tried a million other subreddits and have had no luck ... i'm hoping i have finally found a place to put this post. i was recently hired as a teacher at a senior citizens center (it is not a personal care center or an assisted living facility but rather a place where seniors go during the day for activities) and i've been running into a lot of challenges. i'm a university instructor and normally teach undergrads - i knew going in that it wouldn't be the same and i've already done many things to accommodate, which i have absolutely no problem with and i'm happy to do. i was extremely excited to start this job and now, i'm afraid of going in. one of the people i teach (let's call them student ""a"") has been a particular challenge and class is like an emotional roller coaster, constantly shifting from one extreme to the other. ""a"" gets huffy and angry at me, things get better momentarily, the mood lightens up and then things get bad again. over and over. it makes me extremely unsettled and it's impossible to stay on task and keep the class organized. i have no idea how to handle this. ""a"" gets extremely impatient with me as i'm teaching. this is just an example, but i give very easy to follow step-by-step handouts to the students and i go over the concepts that we're talking about directly following the handout (usually numbered or organized in boxes) ... i'll start from the top, going down in a stepwise fashion and as i'm on number 1 or 2, ""a"" starts interrupting me with questions about number 8 or 9 on the handout, i'll say ""we'll get to that in a minute - i'll be happy to answer it in a second,"" and they just keep derailing the whole thing .... and then proceed to get upset at me because they're then lost and have no idea where they are. this next part i feel really bad about: ""a"" becomes extremely frustrated with themselves out loud during the class, going on and on about how 'stupid' they think they are and comparing themselves to others. i keep reassuring them over and over but it gets to the point where it's disruptive for the whole class and holds the class up. we haven't been able to finish one full lesson because of this and i've had to plan lessons around it. they had 4 outbursts like this in the last class and each class is only one hour. i absolutely don't want them to feel that way. also, i may be completely misinterpreting and i'm trying to be as differentiated as possible, but sometimes it seems like it is being said passive-aggressively in order to get me to do something differently instead of saying what the actual thing is.i've been getting a lot of odd criticism and i know that it's from ""a."" instead of filling out the feedback forms i've given the students in class (these aren't required by the way, i make them for myself to make sure i'm accommodating everyone) or emailing me directly as i've also suggested, ""a"" goes and reports me to the director of the center and when i come in to teach, they always say ""the director wants to speak with you before class starts."" last week, the complaint was that ""a"" was offended that i'm ""not looking them in the eye"" enough when i'm talking and that they weren't being ""entertained enough"" by the class. no matter how crazy some of these complaints are, the director always seems to side with ""a."" i desperately need the income from this job and every time i walk in, i feel like i'll be losing the job on the way out. multiple people have suggested that this person may have early stage or undiagnosed dementia based on the mood swings in class and other behavior and i'm trying to be extremely empathetic but it's starting to wear me out. i have absolutely no training of this nature and i give all the credit in the world to the people who do. i feel like an awful person for not being able to help feeling frustration about this - i feel like i'm getting barked at, like there's a lot of undue hostility and it's dragging me down. does anyone have any suggestions on what i can do to gently put this person in their place when they're rude to me or being extremely disruptive? or how i can manage my emotions surrounding this? it's really my first time working at a job like this."," while i don’t have any direct experience with dementia, it does sound like “ a “ has some behaviors that fall in line with that condition. check out “dementia careblazers” on youtube or instagram- she gives good, clear information on redirection, validation and deescalation. i also agree with sophess’ suggestions for managing the situation - without knowing exactly what the root of the issue is, it seems that accentuating the positive in each situation might be the best way to get by. something like “ great eye “a!” i’m making my way to number 4 and i appreciate you pointing that out!” and then making a positive reference to “a” again later when you address it : “ as (favourable adjective ) “a” pointed out ….” sometimes people in care facilities just want attention and after being lonely for so long, they no longer care if it is good or bad. you’re here posting about to handle it, so you obviously care- and i’m sure it will work out. just stick with it , you’ll win “a” over. 💕",https://www.reddit.com/r/CaregiverSupport/comments/u1o44o/having_difficulties_teaching_at_a_seniors_center/,,Having difficulties teaching at a Senior's Center ... any suggestions?
"i, 19f, didn't have a normal childhood because my grandma had dementia for 7 years before it eventually killed her. my whole childhood i spent very little time outside doing whatever it is that kids do because my mum, along with my aunt was busy taking care of her and my disabled cousin (the five of us in one house). by the age of 9 or sth like that i didn't have any responsibilities, but i can assure you i knew all too well what no sleeping bc my grandma was screaming the house down was like.now i'm 19 and i'm not a girl cool enough to be invited to parties, i'm shy and only have a few close friends. my aunt, the primary caregiver for my cousin, had hip surgery and now i have to step in along with my mum. i know my stress isn't near what my mum's is rn, but i do know my life right now isn't ""normal"". i want to hang out with people and kiss people and do whatever it is that other 19 yos are doing. i love my cousin but i don't want to stay in this situation, changing diapers and feeding people. i feel like i'm missing out on so much and the fact that i already have a lot of unresolved trauma surrounding caregiving isn't helping. sorry for ranting, guess i'm just looking for people to relate to."," this is what is known (by me, anyway) as sacrificing one child to care for another.  you may have heard of parents who have an additional baby so they can get a kidney match for the sick older child.  you're 19, an adult.  pack a bag and leave.  find a job, any job, and rent a cheap room, probably in a shared house or somebody with a spare bedroom to rent.  you can stay in phone contact with these relatives only to the extent that you aren't getting guilt-tripped.  if that happens, block them.dysfunctional families employ a lot of denial.  your mother and aunt may be totally oblivious to how damaging this circumstance has been to you.  therefore, it won't be surprising if they see you as selfish - because in their world view,  you are.  well, think for yourself and refuse to buy into that.best of luck.  you have a life ahead of you - live it!",https://www.reddit.com/r/CaregiverSupport/comments/u09xya/i_dont_know_what_to_call_this_other_than_ranting/,,i don't know what to call this other than ranting
