submission,comment,url,Title,title
"hi, i was wondering if anyone here could offer me some ideas or advice on what to do about my grandma. i am her caretaker (my job). she is in the stage of dementia where she has episodes of being very hostile and aggressive with brief moments of clarity sprinkled in. it has not been diagnosed because she believes the family doctor is a nazi so we gave up on trying to get some medication for that. she is usually nice, just confused often and asking many questions (where is the bathroom? where does that door go?). but when she becomes hostile she yells at my grandfather that he is a fascist, kills jews, all this crazy stuff and she hits him, throws things at him, and pushes his walker repeatedly into him. he is not in the best health with very bad legs (lymphedema) and has trouble moving around and i am afraid she will seriously hurt him. she also runs into the hallway of their apartment building (senior community) and screams what a bad person he is. we are worried someone will make a complaint and she will have to leave. my grandpa is very adamant about letting her go somewhere and says he will endure the abuse as long as possible. i can see it is really affecting him and see an otherwise very optimistic old man has now become very depressed on a regular basis. it hurts me so much to imagine how much it hurts him to see his partner acting this way and there is nothing to make it better. i cannot live with this and feel like i have to do something but i really don't know what. i am looking to find a new job immediately and find someone who is more skilled to take my place as i am soon to be 25 and think i should move on now. when she is acting aggressive she suddenly is able to move around more quickly and without a walker, knows where the door is to the hallway, how to work a lock and such things she can't do normally.  i can't figure out how to create some barrier for her to at least be unable to go into the hallway. if anyone has any ideas or advice it would be greatly appreciated. i am at my wits end. sorry for the really long post. thank you."," at my work if someone is acting aggressively we try to figure out the why e.g toileting, in pain ect. but sometimes people get aggressive because they've gone in their pad and their too abusive to change it. as horrible as it is sometimes you just need to leave and try again later because the aggression will only escalate if you stay there. is there any way that you and your grandad can leave the room whilst she is acting that way? both of your safety is important and i've seen people with training for this struggle too.",https://www.reddit.com/r/CaregiverSupport/comments/t0190h/advice_for_dealing_with_an_aggressive_person_with/,,Advice for dealing with an aggressive person with dementia
"i posted about this recently, but not sure how to handle at this stage and want to get different points of view. my father was diagnosed with terminal cancer. his kidneys are also failing so he will be undergoing a clinical trial with bad side effects in lieu of chemo. he grows weaker everyday. he has been my mothers caregiver for years. she had a bad stroke that has left her paralyzed, reliant on a feeding tube and dementia. i’m an only child with a family and a career and do not have the ability to care for everyone. i have been trying to convince my father to provide me with the information for his estate planner or to meet up with a family law lawyer to review medical poa options and also ways to qualify for medi-cal (medicaid) in order to provide them both with quality care. right now, my father hires a lady to help him part time, but she not a healthcare worker and isn’t there 24/7. there has already been an incident that required a hospital trip because care isn’t sufficient. anyway, as of now he’s refusing to cooperate with me. he wants me to work with his caregiver and he says he’s going to continue caring for my mom himself. he can’t. this treatment will leave him hospitalized soon.  do i just wait until he can’t make his own decisions? i think he’s partly afraid that i’ll put my mom in hospice which he considers a “killing machine.” i was really hoping to put together a plan that would work for him. 😟"," as a fellow only child caring for both parents i feel ya. fortunately mine have been ok with the poa and letting me hire home health but i don't know if they will fight me when/if it becomes necessary to go to long term care. do you have hospice involved for your dad? from what i know it's mostly covered in full by medicare/insurance and i've heard nothing but great things about it. i would also talk to a lawyer about filing for a guardianship and talk to adult protective services and see what they recommend. wishing you the best, this is a hard time.",https://www.reddit.com/r/CaregiverSupport/comments/szwqev/father_refusing_help/,,Father refusing help
my partners 87 year old father was just diagnosed with early dementia and while we were gone his doctor said he shouldn’t be living alone. we were just on vacation and his daughter was over at his house and he suggested having sex with her. she has said it’s never happened before and blames the dementia. he just doesn’t seem like he’s that out of it and i think it’s strange he did it while we were gone. my partner (his son)  is the one who goes over every day to check on him but the other 2 kids go over about once a week. has this happened to anyone else? is it normal in early dementia?," it has happened to my dad, he finally got his vascular dementia diagnosis 5 years after his stroke. we excused the all day porn consumption as stroke-area-related things but then it launched into no filter conversations, an emotional affair, and accusatory assumptions of mom's pre-marital life. medication helps a bit with these issues, but so does closing the door and pretending we don't see it.the neuropsych guesstimated he's at the moderate level, since he's also struggling to eat enough to maintain weight, and has more measurable cognitive issues than 5 years ago when he had similar neuropsych testing.no one really knows there's anything ""wrong"" with dad because he covers his decline well - he's crafty and smart. his memory is fully intact, too. it almost can seem manipulative, until you look at it as more of a brain short circuiting randomly instead of just switching off, behavior-wise.you know if he were back to his old self, he wouldn't act like this. i feel for y'all, it's the secret no one really talks about and are rarely prepared for.",https://www.reddit.com/r/CaregiverSupport/comments/sz8jfb/early_dementia_sexual_advance/,,Early dementia sexual advance
hello i'm gonna get right to it i've been a live in caregiver for my grandmother with dementia for 6 years i had poa when i moved in and my aunt demanded she have it because i was too young (i am 27 now) so she took over but my aunt and grandmother would get into arguments and kick my aunt out so i would be stuck doing the bills until they made up. my grandmothers condition has worsened to the point where my aunt wanted to get hospice involved (she wishes to die at home) but a couple days after we talked about it my aunt had 2 mini strokes and 2 massive ones and has now passed away. my grandmother has pretty much disowned everyone in the family except me. my question is should i pursue trying to get poa again or is it possible with her condition? or should i try to take guardianship of her and her estate? or should i just leave it all alone and ride it out?, poa asap!,https://www.reddit.com/r/CaregiverSupport/comments/sx8iyn/poa_or_guardianship/,,[deleted by user]
my grandmother has dementia and recently she’s been declining more. today she has a spell where she didn’t remember me. it’s the first time and honestly made me really sad. she helped raise me and to see the confusion on her face when she has a forgetful spell really hurts. i’m the only grandchild that helps take care of her and it just .. really tore me up. anyone else dealt with similar emotions? this is all still relatively new to me.," get a doctor who specializes in geriactrics,....and i would bet she is low in vitamin d also magnesium...most n.americans have crappy diets+winter means less vitamin d,both vital to proper brain function,nevertheless it obviously make her 20 years younger,we do what we can do.",https://www.reddit.com/r/CaregiverSupport/comments/swt8gn/bummed_about_change/,,Bummed about change.
"its been about 4 years now since we really started noticing symptoms and her minor stroke.  we had noticed some symptoms prior but really didn't pay too much attention to them.i've been living with her for about 1 1/2 years and there are days where my heart weeps and misses the strong, intelligent and witty woman she was.  i miss being able to talk to her about when we were kids, older relatives, what we did last week or even earlier in the day, having a two way conversation where she drives it.... dementia is so cruel.  all of you caregivers, sending a big ole hug and love your way. my heart hurts today more than most, i feel she's starting to slip even more and there's nothing i can do to help or prevent it.  i'm tired... my soul hurts.. i want my old mom back..  :( but.... go on we must.. be strong all of you, i love you all", same here. and my 60 year old stepmomis passing this week from cancer. i’m her hospice nurse. i am….there are no words.,https://www.reddit.com/r/CaregiverSupport/comments/swem57/reflecting_i_miss_my_mom_before_dementia/,,Reflecting: i miss my mom before dementia...
"1. stay with my 3 elderly family members with alzheimer’s etc. who refuse to wash hands with soap after touching dirty things, which results with me falling sick perpetually  2. rent a place near them so i can keep an eye on them but don’t need to live in the same house. crazy high rental in that area means i will have zero/negative savings. my dependents don’t want to move to a cheaper area. they also don’t want a nurse or paid caregiver and chase them away if we hire them. 3. buy a place in a cheaper area and commute extremely far to them whenever they need my help. as i have a full time job this means i’d probably only get to visit them once in a while. note: i can’t buy a place in the same area as them as there is a property law which impacts my partner and he can’t take a loan which means i’d need to finance the home loan all on my own and housing prices are sky high in the city we stay in"," it depends on how far away option 3 is. if it’s only an hour or two, it’s do-able. i lived 500 miles from my elderly parents and did the long-distance caregiving thing up until my mom was hit by a car and i moved into their house. it was exhausting doing the ten hour drive and then i would end up staying with them for weeks at a time. so don’t go too far away or the commute will suck your life away. sorry you’re in such a high cost of living area.",https://www.reddit.com/r/CaregiverSupport/comments/sv8872/which_housing_option_should_i_choose/,,Which housing option should I choose?
"my mother has been getting gradually more confused. she struggles to follow simple directions. later day activities and sleep are challenges. in the past few weeks, she is becoming really distressed after 5. i don't think she realizes what's happening. i hope not. don't misunderstand. during the day she is still fairly independent. she reads and watches way, way too much cnn. so she's at the beginning of the journey (or so i'm telling myself). two questions:1) i'd prefer if she doesn't know what's going on. i don't see an upside to her knowing she is fading away. ethically/morally can i leave it as ""tonight's a little scary "" instead of ""you have dementia""? i think the immediate is a lot less scary than the knowing the longer arc of eventual debilitation. my plan is to involve her in her management of the symptoms ex. decide to take a xanax or melatonin ""tonight"". i can manage the overall structure and include her daily. i think she feels some sense of control and less overwhelmed. maybe i'm just fooling myself.2) suggestions, tips and resources to handle the symptoms? i don't think i can sleep in her room every night, much less constantly hold her hand. the only way i can get her settled is with xanax or benadryl or being physically present the entire time. we rent. she begged me to go ""home"", so i found a house we lived in when i was in high school and we are moving in in march. i'm going to do my best to re-create how it looked then. i'm hoping for familiar. i plan to incorporate light therapy and a much less fluid schedule. she loves to read and lurk online. so maybe a big desk and lots of books??thanks."," please discontinue benadryl.  antihistamines are supposed to be very bad for people with dementia.  it sounds like you are taking excellent care of her, with a lot of compassion.  good for you!",https://www.reddit.com/r/CaregiverSupport/comments/su5uq8/when_the_sun_goes_down/,,When the sun goes down
"hi everyone! i hope you’re all doing well. we’re a group of phd and master's students from melbourne and we’re conducting research on people living with dementia and their caregivers to develop valuable resources and tools.specifically, if there are any early caregivers whose loved one has received a diagnosis in the last 1-2 years, we think our personalised action plan may help you navigate the journey.the action plan is free (and will remain so), thus we are not looking to sell it. our priority is getting feedback from caregivers to improve the action plan and make it as useful as possible for as many caregivers as possible, and we hope that your valuable feedback can help us.if you’re interested, please visit [ all you have to do is fill out our 2-min questionnaire and the action plan will be emailed to you.or, if you’re willing to give some of your time, we would love to talk with you, just comment below.thank you for your time!  \[admin, please feel free to take this post down\]", please post this in the research requests thread stickied at the top of the sub. this has been removed.,https://www.reddit.com/r/CaregiverSupport/comments/st013g/dementia_caregivers_guide/,,Dementia Caregivers Guide
"hi i’m an engineering student from australia. a few friends and i are hoping to work on a side project to assist people living with dementia and their caregivers through a technological solution. right now we’re hoping to understand more about the experiences of caregivers, and would appreciate if you could fill in this short 3-5 minute survey to help our understanding.  thank you so much in advance. if you have any other feedback re the survey, please let me know in the comments.[", please copy/paste this into the research requests thread stickied at the top of the sub. this has been removed.,https://www.reddit.com/r/CaregiverSupport/comments/sstxka/questions_for_dementia_caregivers/,,Questions for dementia caregivers
for context my grandmother is 79 with vascular dementia which has resulted in several seizures over the last 2 years. she is mostly immobile unable to go out on her own stays mostly to her bed cannot cook for herself. i have largely taken over the caretaker for role because even before the dementia she was not the easiest or the nicest person. for context the home we live in is my childhood home i was born here grew up here and for my entire life and as of now it’s been in my fathers name. this is a very selective thing for my gm she decides some days it’s his and some days it’s hers. she generally finds issue with everything whether the house is clean enough wanting things placed in a specific way etc. recently the new argument is over fridge space. we have one single door refrigerator she refuses to let me use the top she because she can’t see or bend so that leaves me with 2 smaller shelves to put food. this has created the issue of my and my husband needing to cook almost every day because we simply don’t have space to meal prep or even leftover. my solution was to simply buy another fridge. she however refuses and tells me to get my own house to put the fridge and can’t give me a single reason why she doesn’t want it except she doesn’t. it may seem silly but it’s the fridge today and as soon as i get over it it’s gonna be something else. this is really a thankless job because she refuses a nurses no one else wants the job of putting up with her but yet every day she tells me get out of a house that isn’t even hers.," i have experienced some of that and it took me a very long time to decide to take action. one funny example was they wanted a particular sunday newspaper that they enjoyed reading with their breakfast and lunch and even into dinner. they really liked reading it. but they opposed the company that put out the paper and did not want to be a supporter. so i had to zip out every sunday and get the paper and in the summer it sometimes took a few visit to area stores to finally get a copy. it was so annoying so i finally subscribed and they paid me back. but it is the step or reversing the chil/elder roles, which is hard.also, i lived with a family member who had to have everything done just so and i learned that once they stopped caring  and correcting me on details it was a bad sign and the the start of a true decline.",https://www.reddit.com/r/CaregiverSupport/comments/ssshp2/this_truly_is_a_thankless_job_and_im_about_ready/,,[deleted by user]
"can anyone please recommend a bed rail? i’m caring for my elderly parents 84 and 90. dad’s in the hospital right now but if he comes home will need this too. i need a bed rail that goes across the whole side of their bed and prevents them from getting out unattended. my mom is pretty compliant with staying in bed, and prefers it, but will rarely try it if she urgently has to go to the bathroom and i didn’t take her in time. she has balance problems, weakness, dementia and frail bones where she can fracture if she falls- a bad combination.any ideas? i ordered a bed alarm mat and will place motion sensor cameras, but if i don’t get there in time she could fall and fracture her bones. thanks!!", just be careful. the last time my mom was in rehab a woman in the room across the hall slid into the rail and slowly suffocated.,https://www.reddit.com/r/CaregiverSupport/comments/ss0gh1/recommendations_for_bed_rail_to_prevent_escape/,,Recommendations for bed rail to prevent escape?
"tell me if this sounds familiar.elderly family member asked me to make them a sandwich, no problem.i asked when they want their sandwich, they said after their nap.i asked what time will they wake up from their nap? and they *screamed* at me that they don’t know.if there was a dementia diagnosis or something it would be different, but they’re just an ass who has never had any problem abusing others either to get their way or for no reason at all. this is, sadly, pretty normal around here.i thought throwing a mug of hot coffee at me last year when i moved their stereo was the last straw for me, but i managed to let that go. i don’t know why, but this seems somehow worse. like… they asked me to do them a favor… and before i could even ascertain when to do it, they started screaming at me?so when they screamed at me in a fit of rage that i should go live somewhere else, neglecting the fact that the only reason i live here is to help care for this person who refuses to believe anything is wrong with their behavior, and now that their adult children have passed there’s literally nobody else who is prepared to do what i do, it’s tempting to start packing my bag.that feels like the wrong thing to do, but the right thing for me. i feel trapped between bad and worse. so what do y’all think? how much abuse can a person take before walking out the door and saying good luck?"," hi, there. new member here. f/29 and full time caretaker of my dad who is 70, bedridden with a myriad of health issues. yes, i can relate to this. he has no mental illness history or dementia but in the last year, his mood swings are completely off the charts and i am positive he is undiagnosed bipolar.  everything has to be done when he says so and he is manipulative and twists the truth to his gain. he repeats things nearly verbatim daily and if you mention that he already said something, he gets extremely pissy.  he says that he ""isn't in a hurry"" and will tell you ""to take your time"" but then will ask for five things back to back and expect them to be done.  if you answer his questions with a little stress in his voice, he retorts that \*\*you\*\* need to be more patient.  he will purposely move slower completing simple tasks to test your patience and if you fall for that trap, then he yells at you.   his mouth never stops moving - constantly asking questions and complaining.  he is incredibly sarcastic and passive aggressive and belittles. he doesn't communicate well and if you say something opposite of him then he thinks you're trying to control him. ah, yea. such a joyful person to be around. :(",https://www.reddit.com/r/CaregiverSupport/comments/srzikk/how_much_abuse_can_you_take/,,How much abuse can you take?
"i’m caring for my two elderly (84 and 90) parents. mom was hit by a car a couple years ago after having walked to the store every day and now stays in bed most of the time. she has dementia but is super easy to care for because she stays in bed until i come and help her to the toilet to poop. i change her disposable underwear a few times a day. she has pretty fragile bones and has a history of falling and fracturing her bones although when she was hit by the car, the car impact broke her hip and when she fell she miraculously didn’t break anything else, which i’m attributing to her being on boniva.dad on the other hand is more challenging. he has a pretty aggressive prostate cancer which hasn’t been staged yet because he hasn’t had the pet scan yet. he suffers from lewy body dementia, which comes with parkinsonism. up until a few days ago was able to get out of bed, dress himself, toilet himself, use the computer, and feed himself. three nights ago he fell next to the toilet. since then, he needs assistance to try and use the walker although it is safer if he stays in bed. dad is a bit of a daredevil and tries to get out of bed by himself. he either won’t listen (long history of him doing exactly opposite of anything you ask just to spite you), or doesn’t understand that he needs to wait for me to come help now or he will fall.i have a call button system but they don’t really use it to call me. instead i check on the several times an hour but then can’t check when i’m asleep.i have already had to pick my dad up and get him into bed twice today after he tried to get out alone. this is getting scary.i have some blink security cameras i could place to alert me when he tries to get out of bed, but don’t know what else to do?can anyone suggest a good bed alarm and/or some tips please? i have pretty severe fatigue and should be on bed rest myself. this would be so much easier if my dad could wait for me to assist him. i’ve started changing his disposable underwear as well but wouldn’t mind walking him to the toilet or commode. after he had fallen a few days ago i ran out and bought a bedside commode but he hasn’t used it yet and still tries to walk to the toilet. he would need help with the commode as well. i just need him to stay in bed until i’m able to help him.thanks!", you put a pillow under his legs like where his knees are. then tuck him in well and that usually does the trick,https://www.reddit.com/r/CaregiverSupport/comments/spefhm/how_to_keep_my_elderly_father_from_getting_out_of/,,How to keep my elderly father from getting out of bed alone?
"taking full time care of my dad with stage 5 kidney failure, high tolerance to antibiotics because of mrsa a decade ago, so catches one uti bacterial infection after another, takes a long time to knock each one out, always turns into having sepsis which causes intermittent dementia and delirium, then a hospital stay with intravenous antibiotics to get him fixed and clear headed again, only to last a number of weeks before we start over again. during the times of dementia and delirium, he can be very mean, demanding, manipulative and abusive (emotionally and mentally). but when he bounces back he’s sweet as pie, and claims not to remember the bad times. how do you deal with a swinging personality like that, and when things are temporarily back to normal act like nothing happened and everything is great? i was able to shake it off over the first year, pretend it never happened, but it’s now getting to a point where i’m harboring a lot of animosity and it’s affecting my attitude and how much i care. i tried talking to him about it, but when his answer is “sorry i don’t remember that” and he brushes it off, it just makes me more angry."," oh my gosh i am not sure how you are coping with that. one experience with that, where they were just so out of it, not even mean, it traumatized me. i feel for you to deal with that over and over again.",https://www.reddit.com/r/CaregiverSupport/comments/sowbuq/finding_forgiveness/,,Finding Forgiveness….
