submission,comment,url,Title,title
"i'd let my parents know back in september that i'd be returning to work in november - nothing intensive, but just something to put some hours on my resume and contribute to my dwindling bank account. mom could reasonably handle dad's day-to-day as long as he remained independent with walking with his quad cane. as i have for the last 5 years, i left her a list of agencies and numbers to call if something suddenly changed. they remain adamant that they will age in place and be as independent as possible, so i left this in her hands as she could handle it.  pride, however, wouldn't let her go through with it. i found a schedule which would still enable us to plan appointments on my days off and going into it, i knew there'd be a brief busy season between nov-dec and made them aware of it. i had some 60 hour weeks and i was offered a permanent position (better pay, benefits like eldercare /insurance/retirement) and i felt really good about just having ""normal"" building-a-life experience again with the flexibility of always being able to fill in the gaps with caregiving at home since i still live there.  dad had a fall last week, 7 weeks into the job. mom knew i would be home in 30 minutes so she didn't call anyone to get him up. when i came in, i lifted him (he's about 135 now due to the vascular dementia progression) and i started doing our pt work on my 3 days off. he hasn't regained the full ability to walk independent yet so i had to resign from my job. mom just assumed things were going so smoothly (they weren't) that she didn't need the numbers i left for her. and if i was going to be home in 30 minutes, why call anyone?  a very real problem. i can't go into a 40 or 50 hour workweek without the knowledge that whomever is at home will do the right thing in a crisis. whatever support network they need,, i will have to set into motion for them because mom will not do the right thing when needed. i've drawn up a small contract as this is going on my 18th or so year caregiving for free for my family - i will be getting a small monthly stipend and it will be short term help until we know where dad is at mobility-wise and starting next week, we're arranging to sit down with various aging-centric groups to get mom the help she needs but refuses. unfortunately, i'm not just taking care of my dad as mom has expectations of me that are ""just part of living here, we don't charge rent"" that bleed into me doing everything while she falls asleep due to her health issues. even when i was working a 60 hour week, my days off were for her, not me. so, ,yay."," if you’re in usa, please look into what would be necessary to arrange their finances to get into a care facility. if they have few assets beside [the house]( then it should be within reach. at least see if you could get paid by the state for the work you’re doing anyway ",https://www.reddit.com/r/CaregiverSupport/comments/rub2zb/constantly_revising_our_backup_plan/,,Constantly revising our backup plan.
"happy 2022 everyone. if you are like me, the new year just sort of slid in while i was otherwise engaged. i care for my 98 (99 this week) bedridden, dementia ridden mother. i'm in her home everyday from 8-6. no days off the last two years. my brother takes over in the evenings, but lately caregiver fatigue has set in and more often than not he's content to have me back (i live a mile away) to clean up a messy poop. he says she no longer lets him do it. she weighs 180 pounds and changing her isn't easy. i'm 69 years old. my friends are retired and mostly kicking back and enjoying their freedom from work. i see facebook posts from friends enjoying walks on the beach and feel intense pangs of jealousy. some are dealing with their own health issues, however. being a senior citizen is challenging. i, on the other hand, can't afford to get sick, and if i do, oh well. i soldier on.my husband is completely unsupportive. he does his own thing. goes on outings without me. we now officially live separate lives. my daughter thinks i'm crazy. when i'm elderly and in poor health, there will be no help there. my mom's doctor told me to put her on hospice care, which i've done. he said it would make a big difference. well, it doesn't. a nurse breezes in and out a couple of times a week to take her vitals and a woman shows up twice a week to clean her up. that's it. little difference from when she was on routine medicare home care. i can' t afford caregivers and mom has just enough money in the bank that she doesn't qualify for any paid help. believe me i've looked into it. it sucks. so, what's the point of this post? to simply take a moment to share my story but more importantly to salute you all for your selflessness and hard work that too often goes unrecognized and unappreciated. i acknowledge each and every one of you who posts here. you wouldn't be here if you didn't need a kind word, some support, a place to vent about the frustrations of caregiving. those of us who do it didn't ask to be put in this position. we do it out of love and a sense of duty. so, again, happy new year to all. i pray that each of you find the strength to keep going no matter how difficult the circumstance and that you take comfort in knowing you're not alone because you aren't.", thank you so much for this post. as i lay here in bed crying it feels good to know i’m not alone.,https://www.reddit.com/r/CaregiverSupport/comments/rtmsjt/all_hail_the_caregivers/,,All Hail the Caregivers
"i have had 3 ladies helping me take care of my mom, who has dementia but not late stage yet. we have spent most of her ira account paying them, and her bank account is getting lower. she gets social security and a payment from her retirement account.i’ve talked with a couple of financial consultants about her getting in-home sitters through medicare when the time comes, but they’ve basically told me we’re screwed until she has practically nothing.  i’d like to keep her in her home as long as i can. she has a little dog that is her world, and her dog is just as attached to her.do any of you have any advice for me? i can’t get any concrete advice from anyone, and i need to know what to do. not having a plan scares me."," not sure what state you live in, but here in california we have ‘in-home supportive services (ihss) program provides in-home assistance to eligible aged, blind and disabled individuals as an alternative to out-of-home care and enables recipients to remain safely in their own homes. ‘i’m able to care for my nephew and get paid for it he requires 24/7 care. however, your mom could choose a caregiver and gave multiple ones.",https://www.reddit.com/r/CaregiverSupport/comments/rql9wz/confused_and_depressed_over_finances_and/,,Confused and depressed over finances and continued care
"spouse has been in the hospital since christmas eve morning. the fever and infection seem gone, but the hallucinations, confusion, and various stroke-like symptoms persist. more tests tomorrow. last stroke was two months ago. i'm not sure how i'm going to care for them at home, being basically in dementia, bedridden, incontinent (both), with only 30 hours a week from the va caregiver. it's been over 60 days since i've had a night's sleep that didn't include 3-6 wakeup calls.i wonder if it's time for hospice. on the palliative performance scale they score 30%.two weeks ago i lost a family member that was very dear to me. my tears were abruptly stopped for good, when i was accused of being selfish, because others' grief was more important than mine.now i can't cry, even for myself, or for my spouse, or for our situation. there is a wall there.it's like i can't grieve what i've lost. when i look in my spouse's eyes, they aren't there anymore, only some gleeful imp who delights in causing upsets. i've lost my best friend of 30 years, and they don't even know it."," yes, look into hospice or a nursing home now. i was at my wit's end when i hadn't slept a full night in two months and was doing all the caregiving both day and night. your quality of life and quality time will improve, because you won't be exhausted all the time. you will have more energy to spend time together because you won't be exhausted. you will get time to grieve. it is a very very good idea, and there is not a single downside to looking into hospice before the day you are so run down that everything breaks down. because then when the breakdown day arrives (and it will soon, by your description), the wheels will already be in motion.",https://www.reddit.com/r/CaregiverSupport/comments/rq713c/christmas_in_hospital_and_more_strokes/,,Christmas in hospital and more strokes
"her medical issues are beginning to snowball, it is beyond too much to be handled by family at home. she suffers in a facility (discharged from rehab after hip replacement, because she did not participate in pt), due to confusion from probable alzheimer’s. she now cannot stand up alone, she got her first bedsores, must be lifted to the toilet, she got a kidney infection despite prophylactics for utis, a yeast infection, fungal infection on her skin. (probably not helped by inability to wash her hand, due to bandage from the escalator incident). she attempted to stand up by herself, and fell down on multiple instances while in rehab. she needs care not just during business hours, but all waking hours. and, she doesn’t even sleep soundly through the night anymore. she yells for help some 5 times a night.we are now at the point of deciding whether to go all-in on the legal/financial paperwork necessary to qualify her for medicaid, or if we should focus on comfort care. she broken down sobbing about how her body is a mess, her old age wasn’t support to be like this, she frequently can’t remember where she is, her kids names (also doesn’t connect her memory of her babies and her grown children as the same person), or who she is. the first time l heard her be self-aware of the situation. and she’s right, it sounds terrifying and miserable. how many hours of aide care does hospice give the patient? can there someone on shifts daily? or is it just one person every few days to give a bath?she needs to be lifted up from/onto any bed or chair or walker, onto the toilet, her clothes and soaked diapers changed, i assume now she must be rotated to prevent bedsores. my mother cannot lift her due to her back surgery. her gp said she is open to hospice and will submit a referral for consult. she agrees forcing her to tough it until the bitter end is tortured for all involved. does hospice provide long shifts of in-home care? or will we have to pursue the medicaid waiver to get that many hours, and keep treating her utis and making her do pt?? (fyi, she legally lives alone in a 1 br condo although we are nearby)"," sadly neither will provide in-home attendant care.  the only thing that provides the level of care that you are seeking is a long term care insurance policy.  every state is different in the level of care and services that can be provided.  an adult day care center can provide supervision and care during the day but getting her up, dressed and delivered to a day care may be unmanageable.  hospice is excellent for managing pain and allowing a natural death but the home health aide services typically provide bathing a few times a week.  there is nothing that prevents medicaid managed care services in concert with hospice but they won't duplicate services.  if you can afford it look into private duty care.",https://www.reddit.com/r/CaregiverSupport/comments/rnul1y/how_many_hours_of_support_do_you_get_via_medicare/,,how many hours of support do you get via Medicare hospice? how does it compare to Medicaid home care waiver?
"my mom has dementia and i care for her in her home. she likes to help with the dishes, but she doesn’t remember where she keeps anything and finds different places all the time. i used to get frustrated when cooking because i couldn’t find anything, but now i look to it as a cognitive game for myself. i note where she put a utensil, bowl, etc. and instead of moving it, i try to remember where i saw it. if nothing else, i’m more mindful and observant, which helps me to not get as sad as i watch her struggle. i don’t want her to ever feel like she’s a burden or see me upset, it’s unsettling for her. what helps you with your loved ones with dementia? she’s refusing labels, too proud for them and she says her dementia is her secret, so i keep it. i don’t think i’m breaking it here because i feel somewhat anonymous."," give her tasks that are really hard to do “wrong”. like folding a pile of clean towels or underwear. or, picking up clean items from the dishwasher, then towel dry them, and handing them to you, which you put away in the cupboard. you can also give her a page of promotions from the newspaper and ask her to clip coupons. if she does it all wrong no harm no foul.",https://www.reddit.com/r/CaregiverSupport/comments/rkpkwf/way_to_keep_my_sanity/,,Way to keep my sanity
"the title is pretty much the post; my fil is an incredibly misogynistic and inappropriate man. he does not suffer from dementia (yet); he's just old and sees nothing wrong with his suggestive and demeaning comments to and about women. it's time to hire some household help for him. hiring a cleaner and someone to help with bathing and medication is where we'd like to start. when this was brought up today his response was simply, ""as long as she's good looking"" followed by stupidly righteous laughter. i wanted to scream. my husband tried to shut him down but this man just gives zero f\*cks about other people or simple respect. we live in a fairly rural community and staffing shortages are real but would i be completely wrong to ask for a male caregiver? or even attempt to insist on it? i just do not want any woman to have to put up with his garbage attitude and possible sexual advances. i understand that most caregivers have dealt with this before but i don't believe they should have to. it's already a difficult job and i'd prefer not to make it harder. any tips? anecdotes? funny jokes? it's been a day."," his attitudes might make some men uncomfortable as well.honestly, i wouldn't hire anyone. no one. i'd let him fester and rot.",https://www.reddit.com/r/CaregiverSupport/comments/rkayl4/how_to_choose_a_caregiver_for_a_dirty_old_man/,,How to Choose a Caregiver for a Dirty Old Man?
"i’ve been a caregiver before but never for the elderly. i have been hired to spend three hours a day (six total for her with another caregiver) with an elderly woman who is believed to be dying by her family who hired my company for unskilled companion care. the thing is, the client is completely lucid, albeit over 100 and hard of hearing. she doesn’t need assistance with anything, except which is provided by hospice. she is still walking, toileting, taking her meds, and communicating clearly. there’s some dementia. she was sleeping a lot and eating very little while the family was here which prompted the caregiver support since they feared she would pass soon. tonight however the client did not want me in her apartment. she wanted to go to bed and she wanted me to leave before she even left the room. i did all i could to convince her but she was visibility uncomfortable with my presence even though we chatted amiably for about an hour. she asked me clearly to leave several times. i didn’t want to force my presence on her any more than necessary. that doesn’t seem to be what the family wanted either. it’s too late to communicate with the family but i plan to tomorrow since i will be seeing her in the evening again. does anyone have any tips for a situation like this? she does not have any designations that require line-of-sight caregiving so i feel the best thing i can do for her is respect her wishes as long as they don’t endanger her. of course it’s up to the family or the company. what would those in this community do? thanks for reading."," maybe you can bring dessert and tea, a nightcap, a game she likes and just make it a social call and fun. ask her if she would like that and it would satisfy her family and provide her with something she’s been missing or something new to try.",https://www.reddit.com/r/CaregiverSupport/comments/rjm1e9/how_can_i_be_a_good_companion_caregiver_for/,,How can I be a good companion caregiver for someone who doesn’t want it?
"my husband, age 80, has been steadily losing weight without trying to.  this is apparently an effect of alzheimer's.  i admit to putting on weight, i call it my ""pandemic pounds.""  now we have a conflict regarding this.  i'm a person who does best when there are not a lot of temptation foods lying around.  if we buy cookies, i will eat 2/3 of them.  husband loves having cookies around, and really i should be giving them to him to counteract the dementia weight loss.how am i supposed to deal with this?  he says he'll keep them locked up, but he would never be able to manage the complexity of a lockbox or locked cabinet.  he loses everything, can't remember pin numbers, how would he do that?if anyone has a suggestion about these conflicting goals, i'd be interested in hearing it.  thanks.", are there calorie rich snacks he likes that you don't? keep some of those at home! :)also have him drink an ensure at lunch daily to help keep him getting nutrients and calories.,https://www.reddit.com/r/CaregiverSupport/comments/rj6bt4/weight_change_his_and_mine/,,"Weight change, his and mine"
hello i don't really know where else to ask about this. but i am a caregiver for both of my elder grandparents one who has stage 6 dementia the other has pulmonary fibrosis. the situation is rough and it takes a lot of my time and money. i was wondering if there's any sort of financial assistance someone can point me in the direction of that would be available to me as a caregiver. i'm also an appointed guardian. thank you and feel free to send me a dm or just comment here.," income and assets refers to those of your elderly grandparents, not yourself as the adult caregiver. ",https://www.reddit.com/r/CaregiverSupport/comments/ri30kb/questions_about_financial_support_for_caregiving/,,Questions about financial support for caregiving for loved ones in Michigan.
"it has been so nice having a break from the daily in-and-out, getting yelled at all the time. she has dementia and hates her family members actually doing the work. i’ve been able to just snowplow through paperwork, errands, home repairs, etc. and i’m really sad it’s going to be over. i’m not here because i particularly love my grandma. but i love my mother… the eldest daughter who would try hard to handle everything single-handedly… and allow her own bones to get ground to dust in the process. but it’s now been two years, i have no career, no boyfriend (he left me because he’s getting a phd school and my home was less a place of rest, but of constant chaos), no graduate degree, no inheritance from grandma. she doesn’t qualify for medicaid-paid long term care yet because she’s still got money she intended for her disabled son. who i am also taking care of full time. that money which will be split up among the other siblings including one useless uncle after the son’s death. and i just feel really sad. i am so tired of hearing from everyone i’m “so amazing, a saint, we really appreciate you, what a great skill, i could never do that, blah blah” i hear it from family and from prospective employers during interviews, but no one wants to put their money where their mouth is.", can you get occupational therapy/physical therapy home visits?  it made all the difference when my mom had to transition from independent living to living with me and being dependent on a walker/wheel chair (for a little while).  great people who helped her accept her limitations and still keep some independence.  the best part is they said it was good for her to fold and put away her own laundry (a task that i sometimes don't even do for myself - just scramble thru the baskets).  i also made sure that we had a little lesson in recovering from a fall - steps to get back up/sitting.,https://www.reddit.com/r/CaregiverSupport/comments/rhce5o/she_is_coming_home_from_rehab_not_bc_she_can/,,"She is coming home from rehab. not bc she can actually walk again, but bc she stopped trying in PT so medicare won’t continue"
"my mom finally left, i've been taking care of her for 10 yrs. plus my hubby has dementia too, so still taking care of him. now that she's gone i feel a little free but i'm tired. how long does it take to feel normal other than a caregiver? is it normal to feel so tired and drained?i have no idea who i am besides a caregiver."," i'm back, antibiotics in tow. first off, i am so sorry you're going through this. it is so very surreal. tired and drained are so unfairly normal words for us. sucks. the world goes on, and here we are, basically dying a slow death. i've cared for my mother (87) for over 10 years. i am 47, and i fight to not lose hope in any ""future"". i have no friends at this point, and the reality of that is mind numbing. being a caregiver is all i know in my waking life. i occasionally get to live out my own life in dreams. my cats give me purpose beyond caring for mother. i am so full of life, yet living the life of a dead soul. i encourage you to do little things that free you from the everyday repetitiveness. read. try and fit in a new hobby. we really are in a position of fighting to hang on.",https://www.reddit.com/r/CaregiverSupport/comments/rftqj1/caregiver_10_yrs/,,Caregiver 10 yrs
"so as caregiver to my father, it certainly has been a roller coaster year of infection after infection. he goes in the hospital once it gets really bad (unusual dementia,  nausea, won’t eat or take his meds, totally bedridden etc), comes home and is good for a few weeks, and then we start the slide back downhill again. here we are again, and i thought the doctor would hospitalize him again, but this time they’re having me treat him at home with a gram-negative infection. i’m trying to find what precautions i need to take to protect myself and my spouse, but very little info online about protecting a caregiver. how bad is this infection? how do i protect us?"," infectious disease doctors are a good idea. i don’t know why the hospital didn’t refer you to one. i’m no novice to battling infections with my father. he’s hospitalized right now because of several ailments but primarily the infection caused them all. infections are no joke, they can definitely go down hill fast. -hugs- having a sanitization team come in is a good idea too.",https://www.reddit.com/r/CaregiverSupport/comments/rdjvj0/help_i_need_advice_on_gramnegative_infection/,,Help! I need advice on Gram-negative infection….
