submission,comment,url,title
"hello everyone! &amp;#x200b;i am a masters student studying user experience at goldsmiths, university of london. i am reaching out to ask about a research for an assistive technology prototype that we are developing for a group project. it is based on a system where an amazon alexa style device is used in conjunction with qr codes and camera recognition software to read out instructions for individuals who have learning disabilities. &amp;#x200b;my current objective is to collect feedback from the carers of individuals who have cognitive issues such as alzheimer’s disease or dementia in order to evaluate if this is a useful product for them and if it would help them with their care practice.&amp;#x200b;i would really appreciate your assistance with this work and am asking if you know specific groups of carers or individuals who would be willing to fill in a feedback form about this project. please let me know if you can help with this, or if you can direct me to specific people or communities who might be able to advance this goal. &amp;#x200b;i will also include the feedback form that we are planning on sending out below.&amp;#x200b;&amp;#x200b;[",,https://www.reddit.com/r/dementia/comments/k22xlt/looking_for_feedback_on_a_user_experience_project/,Looking for feedback on a User Experience project from carers of individuals with learning disabilities.
"i work as a carer and sometimes i have to shower dementia patients. these patients are all very friendly and non aggressive, but other than asking how did they sleep or telling them about the weather i'm out of ideas. sometimes they look at me and smile. i do the same while saying nothing. i don't know if this is useful.there is a vascular dementia case. i feel he is insecure and i don't believe he remembers me from the previous day, but i don't want to denigrate him repeating the same questions and information every.single.day.we have a south american with us and she is very candid with them, but she treats them like children, modulating the voice like mothers talk to children. this i find ridiculous, but given that dementia patients regress to being children, might be the right approach.your experiences and thoughts please."," i had one who forgot what her own clothes looked like, so i’d get her pajamas every night and make her think i bought her a gift. i’d tell her i was anxious to see if it fit. when helping her “change” i’d mention she spilled something on her shirt or that her clothes were dirty (even if they weren’t) and tell her some of it got on her. then she could be convinced to take a shower.the act of convincing will sometimes take more time than the shower. you really gotta get into their head and make that something they want to do.",https://www.reddit.com/r/dementia/comments/k22h8i/teach_me_your_tricks_to_make_a_dementia_patient/,teach me your tricks to make a dementia patient enjoy a shower
"my father in law has been odd for a few months now to the point where we’d discussed the possibility of a stroke. dementia never once entered into our thoughts because he’s only 65. a couple of weeks ago we were forced to call the police after a family discussion about the need to see a doctor and soon. he became violent and honestly, i think he was hallucinating a bit. the cops took him to a mental health facility for evaluation. we’ve got answers now which is a good thing but no one was prepared to be told that he’s got dementia and is no longer able to make his own decisions regarding health care. the doctor brought up the possibility of him being in a facility for the remainder of his life and at the time my father in law was having a good day. that night though he went violent again in the facility and since then he’s been agitated. i don’t know where we’re supposed to go from here. he doesn’t have moments of lucidity anymore and we’re not sure if we’re should file for a conservatorship in the event that he does come home. i’m just at a loss because i’ve seen dementia before in my grandmother and a lot of what he does and says reminds me of her. it especially reminds me of her after her dementia had progressed to a point where we were discussing memory care for her.  anyone have any advice for us? thoughts on what we should be doing?"," i'm sorry you are going through this, and i'm sorry your fil has declined so rapidly. does anyone have a durable power of attorney or medical power of attorney? if not, then you're likely looking at conservatorship.first thing i would do is consult with an elder care attorney so you can get a handle on the financial situation and the legal aspects of placement. the sooner you can get him placed into a facility, the better. please do not make the mistake of thinking you can care for a dementia patient in a private home. he will need 24/7 care and that takes an entire staff. where is he now, is he still in the hospital?",https://www.reddit.com/r/dementia/comments/k1unv7/where_do_we_go_from_here/,Where do we go from here?
what kinds of things do you check to make sure your parent isn’t missing something he/she needs to do?  is there someone we can consult with to ensure we are doing all the checks we need to?like i got a smart toothbrush to make sure he’s brushing his teeth.  someone watches to make sure he eats his meals.  he’s a guy and we are women so we don’t want to watch him shower and don’t want to hire someone to do so as we don’t know if he’s even to the point he needs someone and well covid.," i will add - peeing, pooping and eating are big deals.  utis can cause delirium, it can really mess with a senior’s cognition. which may or may not go back to baseline even after treatment. another reason prompt treatment is needed is because otherwise it can go to the kidneys, it can be fatal. sometimes there aren’t symptoms, or they don’t complain and the only sign is that they’re peeing frequently. hard poops can lead to fecal impaction which can perforate their bowels. so ask if he’s  constipated or when he last had a bowel movement. try to get fibre into his diet. skin sores (from dry skin) can lead to cellulitis. check his skin regularly. file his nails down in case he scratches.",https://www.reddit.com/r/dementia/comments/k1u1g0/how_do_you_make_sure_youre_checking_everything/,How do you make sure you’re checking everything that needs to be checked?
hello. i didn’t really know where to ask this or if it’s appropriate to ask but i really need an answer. my mother has been obsessing over worms. she seriously talks about them almost every time i have a conversation with her. she said they’re crawling out of her skin. she says they’re all over the house. she told me to drink alcohol to kill any worms in my stomach. she’ll find anything on the ground and she’ll say “look there’s a worm!/egg!.” earlier i was talking to her and she showed me a white thing on her hand and was like “that’s an egg about to hatch” and just flicked it off. i looked and it was a popcorn crumb... me nor my father have actually seen any worms. are there worms that crawl out of your skin??? and infest your house?? or is this a sign of something wrong with her. she is getting older (mid 50s). i’m really worried. if anyone could let me know if these “worms” she’s talking about exist or not it would really help me get some piece of mind... thank you.," if it's a sudden onset, please get her checked for a uti. they can realllllly mess up your mental state and especially as you get older. best of luck to you!",https://www.reddit.com/r/dementia/comments/k1qxtp/is_this_an_early_sign_of_dementia/,Is this an early sign of dementia?
"i want to start with expressing how helpfull this forum has been for me. hearing your personal struggles and triumphs has helped me better understand this disease and what it is to be a care taker. for the past year and half i (30) have been trying to get my partner (32) to atleast look at a memory care unit for her 91 year old grandmother. she has been really the sole care taker and ward for her since i have known her but as we all know this disease progresses. i used to be a 1on1 and work with troubled teens and children with special needs as a teenager/early collage. i have noticed her demeanor, actions and progression of her grabdmothers dementia and its becoming troubling and frankly a huge strain on our relationship.  the problem is i am too close to her to really listen to me. before covid i didn't mind working an extra shift or side job so she could take an extra day to take care of her gram. it was implied that when "" it got bad"" she would put her in a home. leading into covid her grams mental capacity has greatly diminished to the point where she had to be there almost everyday. now during covid she can't not go a day or the day is spent yelling into one of many cameras scattered throughout the house to keep her inside, remind her to eat, tell her not to eat etc.i'm stuck. right now i am the sole provider for the household really ( she gets paid through an outside agency. it doesn't really cover much besides her car note and gas) and have a child from a past relationship i also support. i feel to close and frankly out of line to really press the issue. her family ( except her one out of state sister) are non existent and the amount of care her gram needs is taking a noticeable toll on her and i fear far outside what she can handle. last time i brought up putting her in a care unit i was told "" she would kill herself"" and "" its too expensive "". it is noted that my partner was a lna for 3 years and seems to have a unfavorable view on alot of homes in the area. her gram living here is not an option as she is allergic to my partners cat and i can't afford a larger place. i guess i would like to hear what made people actually pursue a memory care unit? i've had her speak to people i know who recently put their loved ones in one. selfishly i personally can't do this anymore. i just can't keep my life and financial future on hold indefinitely.i can't spend every moment at home watching her gram on a cam, listening to her complain all day and increasingly become the care taker i know she would detest. if anything i want hope that atleast for her sake something will happen so she can live her life."," i'm sorry for what you are going through. memory disorders like dementia/alzheimer's really dampens everything, such as being unable to make decisions or do things that might put one's life in danger. my grandfather suffers from vascular dementia and within the last 5 to 10 years, he's declined to the point where he makes terrible decisions or puts himself at risk of getting hurt or worse. we've tried to persuade him and grandma to move into an assisted living, where both of them will be safe and his mental health could be monitored by professionals. the first time it was brought up, grandpa was dead against it, but then he was taken advantage of by scammers and he lost a bit of money. i think we've tried to persuade him a few times before the start of the pandemic and at one point, he did agree, but then changed his mind. there was talk of bringing in a caretaker who could monitor his health, but he didn't want a total stranger in his house. he doesn't want to lose whatever independence he has left, although i think he will lose it altogether some day. i honestly hope he passes peacefully while he sleeps, instead of suffering for many more years. it is very stressful when you care for someone with this condition, but hopefully all of us, including you will get through this.",https://www.reddit.com/r/dementia/comments/k1mkp5/what_prompted_you_to_put_your_loved_one_into/,What prompted you to put your loved one into memory care or something similar
"i’m on the drive back home from the nursing home with my mother after visiting my grandfather, who has dementia. i can’t describe the interactions between them with any word other than painful. one of the nurses had us call her phone so we could speak to him through one of the windows. it was hard to keep his attention, my mom frantically knocking on the window and saying his name over and over when his attention drifted. next was him completely forgetting where he was. he tried drinking the phone. all my mother could ask was how his drink was. horrible, he said. the beer here was disgusting, he ranted. he forgot who my mother, his daughter was. it was just hard to watch, him just drifting away from the conversation every five seconds. he would come back and ask her if she was an anthropologist, a cop, a teacher, (none of which she was, however my aunt used to be a cop.)it’s impossible to imagine any other memories now. the crafty troublemaker with an unbreakable will i once knew... stripped away."," this disorder is so hard to withstand at times, it's just heartbreaking to see your loved ones act so different from what they once were. my dad has dementia he's with us in our house and each day that goes by is hard to see him this way. big virtual hug",https://www.reddit.com/r/dementia/comments/k1gyjn/i_never_realized_how_painful_this_disease_is/,I never realized how painful this disease is.
"i’m sorry if this has already been asked a bunch but i couldn’t find anything helpful. my grandmother now has severe dementia and often wanders off on her own to buy groceries and then gets lost. i need some way of tracking her so if she does i can find her, for example a device that i can put in her purse or something. do you guys have any advice? i live in ontario, canada if that helps at all."," trackers like tile, chipolo, cube, trackr, etc, work while connected to a mobile phone or tablet. i can track my mom’s car keys, but only if her phone is charged and bluetooth connected. a person with dementia will eventually lose the ability to keep a charged phone with them. then you’ll need a gps locator, which requires a monthly/yearly subscription. they can track continuously (typically more expensive) or set intervals every so many minutes. you’re still depending on the person with dementia to wear or carry it with them. even if the tracker is  in a purse, you’re counting on them to always remember their purse.",https://www.reddit.com/r/dementia/comments/k13ecv/tracking_device_canada/,Tracking device Canada
"hi there folks,my dad keeps locking himself out of anything with a password or pin. atm, garage, accounts, that sort of thing. i was wondering if there’s a secure site you can store your passwords, account numbers, info, anything...that doesn’t have a traditional password. ideally something you can set your own question password for. example: “what kind of pet do you have?” “what is your wife’s name?” “what city did you grow up in?” - things he still remembers. not a password app that auto fills passwords.he’s likely to lock himself out of his phone next, so it would be nice if it was something he could access from his phone or a computer. i wish i had the know how to build this."," if you can’t turn the password feature to the phone (i did this on mymom’s computer for the same reasons), i’d suggest using something stupid simple like the month/day or f his birthday. or go with facial recognition. otherwise, i use lastpass, an app/website which stores everything and has facial recognition if used on a phone. if you have the master password you can log into it too, and it has family sharing.",https://www.reddit.com/r/dementia/comments/k0zjfx/dad_keeps_locking_himself_out_of_pins_site_he_can/,Dad keeps locking himself out of PIN#s. Site he can store sensitive info on?
"i just found out my favorite professor and mentor in college has alzheimer's. we were very close in college- she was the dept chair of my major and got me a work study job helping her in her office. she really changed my life. we kept in touch after college, and she even came to my wedding. after i had my first son 6 years ago we kind of lost contact. i had been trying to get in touch and it was always hard. i messaged her daughter recently who told me she has been dealing with alzheimer's for the past 2 years. i honestly had dreams that she had it. i think because the last time we got together she was repeating herself a lot i had noticed. her daughter told me probably not to call her because she would be confused. she is still living at home with her husband, and that i could write her a note or card. i did send her a card about a month ago and plan to send another soon for the holidays. is this it? should i just not call her or try? i am so sad that i never knew that would have been the last time i talk to her :-("," could you call and speak to her husband? explain how much you’d love to see her or call her and see what he says since he would know her intimately from day to day. maybe by calling and checking in via her husband you could get her on a good day. i don’t know why i sense not to go on what her daughter says. i mean alzheimer’s does progress slowly in most, and if sending her a card is ok but not a call or visit - how is that any different? with a card all she has is writing and a name. in person she has so much more to go on for memory recall.i wouldn’t give up trying to contact her, make absolutely sure she truly can’t do any other type of contact apart from a card in the mail. i’m sure her husband would also love to hear from a former student it would be lovely for him to hear",https://www.reddit.com/r/dementia/comments/k0xm0k/my_fav_college_professor_has_alzheimers_and_i_may/,my fav. college professor has Alzheimer's and I may not get to talk to her again?
, ,https://www.reddit.com/r/dementia/comments/k0wl0v/what_are_some_signs_of_dementia/,What are some signs of dementia?
"i want to get my dad some headphones for christmas so he can listen to music more. here are the requirements i’ve been thinking about:1. he gets easily frustrated, so they need to be easy to use. he lives with my family so they can help, but i think autonomy is important2. i think wireless makes the most sense so he can walk around without getting tangled in the cord3. over ear not earbuds, and comfortable for a larger head4. he can no longer readanyone have a good setup? what else should i consider?", i don't have an exact brand but bluetooth gamer headphones would be a good place to start. they would be the most comfortable since they are designed to be worn for semi-long periods of time.,https://www.reddit.com/r/dementia/comments/k0uywz/headphones_recs_for_dementia_or_tips_for_playing/,Headphones recs for dementia? Or tips for playing music?
"she is super late stage now. she has been nonverbal for over a year and had two seizures in february which she never really came back from. she just sits in her wheelchair with her tongue out sometimes looking around. she has had early onset dementia for majority of my life and being there for her has always been important to me. it's going to be so hard not being able to go see her and hug her on thanksgiving. it doesn't help that i don't have any other family around. my brother is halfway across the country and we can't talk about our mom because i usually end up getting mad that he doesn't care and has never done a single thing for her leaving me to do it all myself. anyway, yeah. it sucks and i'm sorry to everyone else here that won't be able to see their loved ones either.", understood and i'm sorry. i lived 6 hours from my folks and was always working holidays. i made it home maybe once every five years. i was divorced and had no family in town so spent holidays by myself. i used those days to reflect and be at peace. i don't have any easy answers. but i would fix this for you if i could. do the best you can. accept what you cannot change. hang in there my friend.,https://www.reddit.com/r/dementia/comments/k0u6r6/this_will_be_the_first_thanksgiving_where_i_dont/,"this will be the first Thanksgiving where I don't get to see my mom. well, I can through a window but you know"
"in ontario, canada. i (42f) have worked in healthcare for 20+ years (not an md), my brother (47) is a scientist, sister (45) is an engineer. we’ve all read up on dementia and believe this is what mum has.she’s 68, lives alone, doesn’t like drs, believes “prayer” is the answer to sickness/illness.so how do we get her diagnosed??"," my mom - who doesn't have dementia - is 79 and is a 'thoughts and prayers' kinda lady too, so i get that frustration.(i'm in canada, btw, though not ontario)you may have to take her to a doctor - as a family - and have her assessed. if she's found to be without mental capacity to handle her affairs, the doctor can sign off with a second doctor to have her legal ability taken away. you might need a lawyer for that part - not sure for ontario.that being said - you'd best be damned sure she has dementia. just 'reading up on it' isn't good enough, as dementia is mimicked by quite a few other issues, and i highly recommend you take your suspicions - make a list - to a doctor without her first.if you just do it without that first and you're proven wrong, your mother will likely never trust you again, will think you're demon possessed, throw you on every prayer chain in the church and a slew of other things.so tread carefully here. it's not easy to watch someone fade in front of you, but acting too fast can be even worse.good luck.",https://www.reddit.com/r/dementia/comments/k0roqt/having_someone_diagnosed_whos_in_denial/,Having someone diagnosed who’s in denial
"hello, i need your advice. i have a 92yr old granny. but she is getting forgetful. i only came home now during pandemic. i setup my phone so she can watch tv shows and have some entertainment. but i will be leaving soon and permanently, may i ask what i can buy for her as entertainment? thinking of tv with digital box, can this be automated to be turnedon? 2 of our other family members do not care about my granny and it's sad.", thank you all. i already bought a tablet. setting it up for some remote control and automation. hope it will work good. thank you all.,https://www.reddit.com/r/dementia/comments/k0n571/tv_for_granny/,[deleted by user]
"as a caregiver for someone with dementia, my relationship with my partner is so much more difficult! we have great communication, but now someone is constantly listening and will confuse and twist our words. we have great dates, but now someone is waiting for us, sometimes calling us wondering where we are. we have great routines, but now someone is critical of when things are done and wants life on their schedule (she would like us all to wake up at 4 or 5am and go to bed at 6pm or 7pm).the things were not great at, like eating healthy or keeping a good sleep schedule or *not over feeding the fat cat* have gone totally sideways. we’re eating fast food several times a week. i am constantly bothered and haven’t had uninterrupted sleep since september. my cat, who i have worked so hard to slim down, is tiring back into a butterball who can’t clean her own butt. i feel like all this stuff would be so much easier to handle if this person living in my home could be reasoned with rationally. thank you for listening to my rant."," my partner and i are having similar experiences. although my dad’s dementia doesn’t seem to have progressed as far, he constantly will flip back and forth between which one of us he will be more civil to. the physical and emotional demands of caretaking are definitely putting strain on our relationship. he never signed up for this and we’re basically stuck in this situation since i’m the only family he has, and with him is the only stable place we can reliably afford to live 🙃",https://www.reddit.com/r/dementia/comments/k0n113/everything_that_was_kinda_not_great_is_super_worse/,Everything that was kinda not great is SUPER WORSE
"i'm not sure ""happy"" is the right adjective for ""thanksgiving"" this year...[thankful?]("," that's very cool of you to let me know, whoops. writing down my experiences has become crucial to keeping myself afloat, knowing that the posts ease some of your journey makes sharing even more important to me. so i have been a little more up since i wrote this. mostly because for the first time ever the boyfriend in the basement and i spatchcocked a turkey last night, and i can't stop giggling at the phrase. especially when i say it like this...spatchcock!!!i know, i'm weird. ;)i hope you have a thankful thanksgiving, and if you're getting overwhelmed yell out spatchcock!!! knowing that i'm doing the same thing on my end.",https://www.reddit.com/r/dementia/comments/k0kh33/thankful/,Thankful?
i’m curious if anyone has any experience with a long term (40+years) daily marijuana user entering dementia?   we don’t have an official medical diagnosis yet but i suspect my husband has early stage alzheimer’s.  about a month ago he had a psychotic episode and since then he hasn’t really smoked pot. prior to this he smoked maybe 20 times a day every day. it almost feels like he’s forgotten about smoking weed. anyone with a similar experience?, he should detox before you try to diagnose him with something. marijuana use that heavy will have months of affects even after he stops. obviously he will be experiencing short term memory loss smoking that much. i'd just encourage him to be sober and go to na meetings if he needs. seems like he's an addict possibly going into recovery.,https://www.reddit.com/r/dementia/comments/k0k2zl/forgetting_to_smoke_pot/,Forgetting to smoke pot?
