submission,comment,url,title
"i've been a doomster of late, tossing a lot of dementia gut-wrench into the ether. i'm shaking that off (for now) to congratulate all of us on the myriad of ways we are making this swinging dementia lifestyle work![caregiver mad skills]( - kids, it is high time we acknowledge our superpowers.[superbad]( \- caregivers be banging!", really enjoying your website!  you're a breath of fresh air.,https://www.reddit.com/r/dementia/comments/k6xzs0/superbad_superpowers/,Superbad & Superpowers
"hello, new to this sub and this issue. my husband was just diagnosed with mild dementia a few days ago. on the tests with the neurologist, he struggled with remembering the five words, and repeating back sentences. the doctor told him he could drive, but not to do so alone, and prescribed some medication to help with his cognition. the advice that confused me was that he needs to socialize more. my husband has never been very social. he had a few friends at work, but retired last may and none of them have tried to keep up with contact with him. my daughter and son in law live with us, along with their five year old son, and my husband has regular contact with my daughter's in-laws. the doctor said that was not enough, he has to talk to others outside the family. while that would be great (though hard with covid), why doesn't conversation and contact with family count?"," yes, it's true that socialisation outside of the home is important otherwise lack of stimulation does lead to worsening of condition.  during the time my partner lived with me, there were times when i had to leave him at home by himself for short periods and i found he got worse.  can your husband go for a walk at all?  even walking outside will help and you can talk about what's going on around you or talk to people in the street.  go to the local park.  visit your neighbours. it doesn't have to be too challenging.good luck!",https://www.reddit.com/r/dementia/comments/k6mn9f/why_doesnt_family_contacts_count_as_socialzation/,Why doesn't family contacts count as socialzation?
"hello,first time posting here.  my dad is 81 and has light/moderate dementia.  he is okay as far as long term memories, and still knows me, my brother and my mom, who all live with him.  he can take care of himself with most things and is fairly independent as far as showering, using the restroom, etc. though he doesn't cook for himself, drive, etc.we live in safe neighborhood with minimal traffic and our street goes in a loop.  my dad often gets bored and goes on walks.  our house has 6 sliding doors and a front door so he will leave without us noticing or sometimes he will be in the backyard and then he will decide to go on a walk. we aren't necessarily worried about him getting lost as of now, however, **the issue is he never lets us know that he is going for a walk.** we know as his condition worsens, this will be more of an issue.  locking all the doors or constant monitoring will likely be what we need to do down the line.. but for now, we just want a way to be notified when he leaves the house so we can know when he left and stop him if needed, accompany him, etc.  he has a verizon care smart watch[but it really doesn't do a good job of sending notices. more over, even though verizon is by far the best cellular network for where we live, on a device this small the signal is very weak and drops out often.  anyone have any suggestions or thoughts on these products?[[one more note: i realize there a some tracking devices that are not watches but still wearable.  unfortunately, anything that isn't wristband or watch is unlikely to stay on him.  especially if he wakes up early, dresses himself and leaves the house. thank you"," sorry friend you need a locksmith. my grandma walked out the door, dragged her feet until bloody through rocks, then across the road and hugged a frightened neighbor. we all had to quarantine because of it. if he can't remember to tell you he's leaving, can he remember to socially distance and mask up when walking past a pedestrian? not a risk i'm willing to take. i had to get every door and window locked. now she threatens to smash the windows but hasn't gotten that far.",https://www.reddit.com/r/dementia/comments/k6hqbi/dad_with_moderate_dementia_perimeter_system_gps/,"Dad with moderate dementia - perimeter system, GPS Tracker or Alarm System?"
"i cried so hard until i almost threw up.  i feel like i can't do this.  i just finished helping my husband take care of his mother who passed away from dementia on sept 12.  i haven't even gotten over her death yet and now i'm being punched in the gut with my own father's diagnosis.  i feel like i just cant do this.  he isn't even that bad yet and i'm trying to come to terms with this.   counselling is not going to help me.  all it will do is make me talk about things with other people going through the same thing.   but i will still feel alone regardless.   even though my husband went through this i will still feel alone regardless.  yet i am expected to ""come to terms with this and accept it"" practically yesterday.   i'm trying.  i really am.", my mom has it and it’s been so hard because she is in a nursing home and i can only zoom calls her it’s very depressed seeing her like this. i definitely feel your pain and understand it.  realizing that you’re not alone and if you can spend more time with your dad that will benefit the both of you. i pray that you will find the strength to get through this and able to be there for him while keeping strong through this 🙏🏾,https://www.reddit.com/r/dementia/comments/k60chs/i_cried_hard_today_first_real_cry_since_my_dads/,I cried HARD today. First real cry since my Dad's diagnosis.
"my company [big motive]( are working with a new company who is hoping to improve the experience of searching for a carer.  if you have recently searched for a carer to support yourself or a loved one, we would love to speak to you (england only). we’re offering a £30 amazon voucher for 30mins zoom call on friday 11th or monday 14th december to give us feedback on a new website to find, match and hirer carers.  if you’d like to take part in the user testing please email carol at cm@bigmotive.com to arrange a suitable time.", [deleted],https://www.reddit.com/r/dementia/comments/k5xfvu/we_are_looking_to_speak_to_people_that_need_to/,We are looking to speak to people that need to hire a carer
"hello all,  i am 36 and am the sole care taker for my grandmother (80).  i was raised by her since i was 3 months old and have always called her mom.  she has 10 children that can not be bothered to help with her care.  i feel like i owe it to her to take care of her and try and keep her in her home.  this is getting to be progressively more difficult.  i have tried to talk to some of my family members but we are not close and they have resentment because i was spoiled growing up having much older parents supporting me.  i have been taking care of both of my parents (grandparents) since i was 13.  i only left home as an adult to get an education and returned after 1 year of college because it was to much on my mom as dad had passed.  i got a job and worked full time and went back to school at night while still being here to take care of her.  now that we are getting into the later years of her life she is saying such hurtful things and has outbursts over things i have no control over.  she keeps trying to have a realation ship with her children which is fine.  the problem is no mater what she does, sends gifts, gives money, ect… they treat her terribly and always talk down to her.  this drives me insane because everything they do or have done in the past umpteen years i'm the one that catches the brunt of it.  she directs her frustration at me.  i'm finally to the point that i just don't have the patience to digest it any more.  since i have stated that i can't handle hearing about these things now she accuses me of being jealous of her kids. i'm the only one that has stayed with her and tried to work my life around her care.  i built my home close to hers so i would only be a phone call away and can help out with her needs and property.  she recently had a pacemaker put in and went to a care facility for 1 week.  that was the hardest thing i've ever done not being able to see her and know that she was taken care of for that amount of time.  now that she's been home for a few months i'm wondering if i made the right decision to have her at home.  she's still with it mostly as i have cameras to watch her and see what she does through out the day since i have to work during the day.  it's the sundowners that i notice that makes this much more difficult at night.  she orders things through her phone and if it doesn't show up the next day then she's furious that the company is scamming her and when i try to help and explain she just says the most hurtful things.  i'm very sorry for the long rant but i had to get my thoughts out as they are wearing on my  sole.  i guess now that you know my life story i should get to the real questions...1. what can i do with the phone situation.  i have call blocker and the likes but she's crafty and will order things from the tv or her fliers in the mail.  this always turns into an argument.  also the spam calls set her off because she thinks her ss has been breached and that she has a problem with her bank account.2. how do you emotionally cope with her saying hurtful things and now show shock and that your upset?  i know it's not her but the stress she's dealing with knowing that she's slipping.3. how would you handle the family situation.  there are 2 family members that live close but both are in the medical field.  i don't feel comfortable with them being around with covid.  do i just say oh well we will take our chances or do i just keep plowing ahead? 4. i started to read the 36 hour day and it helped but i'm a busy person with not much personal time.  i have a hard time sitting down and getting to read more than 30 minutes a week.  any ideas on that?thanks for any response and your time for those that read this far into my book..."," she's paranoid and sundowning.  these never get better, only worse.  she needs meds.  contact her doctor to start down the road finding the right meds to counter her aggressive/suspicious/paranoid behaviours.  and if you're amenable, let the doc know that you're looking into cbd, to see if there's any meds she's currently on that would have bad interactions.  cbd can help calm her down at night, just one drop of the remedy really helps with my elder.  i wrote a post about it if you want to read more.",https://www.reddit.com/r/dementia/comments/k5vtvs/thankful_i_found_this_and_im_not_alone_need_some/,"Thankful I found this and I'm not alone. Need some advice,"
"tl:dr grandma with dementia is coming to live with me for a few months. i have no caregiving experience. any suggestions for resources? she's also very physically active and i'd love any any tips on keeping her occupied. hi all! so, my grandma is a 78 y/o, fairly active lady. she's been showing evidence of cognitive decline for the past few years, but things progressed very, very quickly with the combination of lack of stimulation from covid isolation and my grandfather passing away a few months ago. for the past 30 or she years she's gone to the bahamas to escape the winters. but, obviously, with the combination of the pandemic and her dementia getting worse (she's often confused, mixes up night and day, asks the same questions over and over again, etc) it's not a good idea for her to travel abroad alone. unfortunately, she's extremely stubborn, and the only way we got her to agree to stay in the us, is if she could stay with me instead (she lives in new england, and i live in a very warm part of the west coast). i don't mind hosting her for a few months, especially because my family back home are obviously experiencing caregiver burnout. but, apart from multiple sclerosis and tourettes, i have no experience caring for someone with a neurological disorder. could anyone recommend any resources for me to read? any websites or books? she's also still very physically able. and she tends to get bored staying at the house all day. she loves volunteering, going to casinos, eating out, and knitting. i know with the pandemic going on it will be tougher to keep her occupied, but any ideas of what might be good?thanks everyone!",,https://www.reddit.com/r/dementia/comments/k5rffz/grandma_coming_to_live_with_me_resources_advice/,[deleted by user]
"she was coughing so i gave her water. but she was in the middle of sundowning hours so she wouldn't drink but neither would she let it go so i could put it on the side table for whenever she *would* want it. even with saying ""okay, let it go"", ""i'm putting it here for later"" about 150 times, i still had to pry her death grip off the handle. later i brought her dinner. i tasted it myself and ruled it was warm-but-not-too-cool. ofc when i give her a spoonful she cries out like i cooked it in boiling lava. i waited about 10 minutes and asked if she wanted to try it now that it should be cooled off, but now she's too wary and says no to everything. she needs to take her evening meds, and i'm not just going to let her starve. but even if she forgets the reason, she still has the angry emotions associated with me.", i hate that feeling of helplessness when you're just trying to help and the confusion they feel distorts every bit of care you give them...,https://www.reddit.com/r/dementia/comments/k5psgc/pissed_her_off_now_she_wont_take_foodmeds/,Pissed her off now she won't take food/meds
"my father is 86 and has had dementia for 2 years now. today he was saying something very peculiar. he said that he's been dreaming that he's died and met his loved ones who have also died.upon hearing this, it's made me very very sad. he could be going very soon. i know this may not necessarily be the came because he's always talking gibberish, but is this something to be worried about? is it normal?"," my father just had a dream about a family friend who died years ago, but he wouldn't talk about it because he didn't remember who. later that day he said he wrote her name on his hand, but he had actually scratched it into his chest. it wasn't a bad dream, but his behavior unsettled me and i've been in a bit of limbo since i heard about it.",https://www.reddit.com/r/dementia/comments/k5dqac/my_father_is_having_dreams_of_death_and_seeing/,My father is having dreams of death and seeing people who have died
"i tried antidepressants, nothing worked. now i find myself using alcohol to cope, to at least lessen my own anxiety. it’s hell! i’m so terrified of the future. my mom is mid-stage now. i hate this disease more than anything in this world 😓"," must admit i'm also relying on alcohol which is a tad worrying.  i used to exercise a lot, running and cycling, both of which were good for depression, but i just can't go out for a 3 hour ride nowadays, i can't even do an hour ride on a static bike in the shed without mum going walkabout.  commenting in the hope of useful answers and a reminder that other people know exactly what you're going through",https://www.reddit.com/r/dementia/comments/k5dni8/how_do_you_cope_with_the_depression_from_having_a/,How do you cope with the depression from having a parent with dementia?
[removed],,https://www.reddit.com/r/dementia/comments/k5asem/medanonymous_resource_for_support/,MedAnonymous Resource for Support
[removed],,https://www.reddit.com/r/dementia/comments/k5aa3y/medanonymous/,MedAnonymous
"i have been having depression episodes for 3 months, and it possibly gave me pseudodementia.i don't really know when it happened, or why it happened, but one day, after calming down, and  forgetting about my symptoms almost entirely, i forget one of my teachers, i am in her class too still. i saw my teacher, and wondered who she is, with only a vague sense of recollection, even though i saw her face, and heard her name just a few seconds before. it took me at least 2 days to remember some of the details, such as what class she is in, but by then, i don't really know if what teacher i was trying to remember was the teacher i was trying to remember.is it normal for pseudodementia to get worse like that?",,https://www.reddit.com/r/dementia/comments/k58yt6/can_pseudodementia_get_worse/,Can pseudodementia get worse?
"i first want to know if it's okay to post anything about pseudodementia. i want to explain why i think i have it, the symptoms i have been having. and the effects from it.i am going to the doctors again in a week to talk about it(i never got to tell him my other symptoms, as i was having difficulty explaining my symptoms, and i didn't have much time to talk to him), but i want to give a clearer explanation of my experiences/opinions to you, but without talking about actual dementia.i don't know why it took me so long for me to realize i don't have dementia, why i kept posting here about my symptoms, and why i couldn't see the much more obvious cause(pseudodementia), and instead chose the worst cause for my symptoms. i'm sorry to everyone i have annoyed and/or offended(especially you bonnie).",,https://www.reddit.com/r/dementia/comments/k57z4h/would_it_be_okay_to_post_anything_about/,Would it be okay to post anything about pseudodementia here?
"so, my father is about 56 maybe 55 if i remember correctly, my mom just turned 50 this past november 29thso, my dad jokingly mentioned that he is starting to feel like he's experiencing dimentia, we regularly talk about old age and how i'll carry on the blood line im ""(fathers name), the second"" and im supposed to have the third. um, so he mentioned he has a hard time remembering where he put stuff and falling asleep while doing work.. and so while i have depression, called ""suicidal depression"" as my girlfriend called it, um i've been having a hard time accepting the idea of my father passing; i've listened to stuff like the caretaker albums and read a bit about dimentia and alzheimers, and my dad often talks about how did dad, my grandfather was a really picky eater (this was like when hitting women was socially ok, and he seemed a  it abusive toward my father and their family) and when he got dimentia, he just mixed all his food together and ate it, and my dad talked some about how he'd rather kill himself then sit there and barely be able to eat, or like live an enjoyable life. so normally i wouldn't say this but im a bit younger, a teenager... its been really hard during quarantine think about losing my father and mother to their own minds, it makes me really upset and honestly i've cried over it a few times, it really hurts me to think about not having someone as sweet and amazing as my dad in my life, and due to quarentine and how bad things have been.. its been really rough on my mind to try and not think about losing my father while pretending everything is ok during zoom meets and around my family and my girlfriend, she has depression too and bringing this up might upset her, she recently lost her grandpa which she was really close to.. and i can't really just talk to my parents about this because i dont wanna talk about how i wanna end my life (i never will.. it would hurt my mom and my girlfriend so much..) i've tried being quiet because i dont wanna upset anyone, and i dont exactly have friends that i can talk about this to, i've made lots of mistakes and never exactly made any friends...i just desperately want advice on how to stop worrying about my dad without making everyone worried about me..my dad and my mom mean the world to me and i don't wanna lose them..."," is it possible your dad has a sleep disorder such as sleep apnea? since you mentioned he falls asleep while working, that jumped out at me. urge him to get a sleep study. all of this could be from lack of sleep and short periods of less than optimal oxygen levels. tell your dad how worrying about him is affecting you and how getting this checked out could help you mentally.",https://www.reddit.com/r/dementia/comments/k54bct/i_need_advice_for_dealing_with_the_eventual_loss/,I need advice for dealing with the eventual loss of my father
"hello all. i am conducting a study for my master's course and need adult (18+) participants who have been diagnosed with a mental or physical health condition (such as dementia) by a health practitioner.we would like to know about:* the diagnostic consultation - including your experience and opinions* how you responded to the diagnosis* your wellbeingthe findings of this study aim to improve the diagnostic process for patients. participation will take approximately 15-20 minutes and is online, voluntary and anonymous.participants must be fluent in english.if you would like to participate, please click on this link: [thank you :) feel free to share with anyone who you think may be eligible :)",,https://www.reddit.com/r/dementia/comments/k52bdu/how_were_you_told_about_your_health_condition/,How were you told about your health condition?
i yelled at her. she’s with me 24/7 now and i’m so tired and so tired of the accusations that i moved things or ghosts moved things and i yelled. i feel so bad. is it even possible to have 24/7 patience with someone with dementia? so many things.," they say the most ruthless shit. the most targeted, personal attacks i've ever dealt with. they become bully comedians and their own audiences, when my grandma laughs it actually scares me now.",https://www.reddit.com/r/dementia/comments/k510xe/_/,😭
my dad was diagnosed with dementia about 9 months ago but hasn’t grasped what that means. for him he believes he’s still in the beginning and pretty much fine. my mom and i have known something was wrong for about 5 years. he started with aphasia and forgetting a few words. now he can barely get 2-3 words out in a sentence. he still believes he is mentally competent and can drive and everything. my mom and i know better. he is becoming a danger to himself and i don’t know how to convince him he’s no ok. he turns every calm discussion into a fight. he can no longer make rational decisions or remember many of the things he had done. my biggest fear is that carpentry was a hobby of is and now he has been trying to use power tools again. he used to lecture me on safety constantly and now i see him use tools without any regard for safety. i’m honestly just at my wits end. any help would be appreciated.," same with my father.  we moved him in 3 weeks ago due to his declining situation with dementia.  his license was suspended a year ago and thank god for the wuhan virus, because it has been a good excuse for him not to take the test (would fail on first question).  he still thinks he can drive and doesn't have any issues.  my wife took him to his doctors appointment yesterday and now he has afib.  the bad news just keeps coming.  we try to keep him busy with tinkering around our house and in the garage.  no access to power tools and he likes to organize little stuff.  just today, he wanted to go in our backyard and pull some weeds - now we have a landscaper!  try to keep calm and faith.  we removed the deadbolt latch on our front door as a precaution.  this is such a devastating disease!",https://www.reddit.com/r/dementia/comments/k4w424/helping_my_dad_realize_hes_mentally_impaired/,Helping my Dad realize he’s mentally impaired.
"hi all,thank you for having me in your community. i'm a freelance reporter/producer working on a story about caregiving for a new u.s. -based media company called [ipondr]( which launches in january. the story will be told in a first-person style, meaning from the perspective of a caregiver, and it will be recorded and published online in an audio format.i'm looking for someone who:\-is currently a caregiver for a family member or has been a caregiver for a family member in the past, and has been in that position for about 6 months or more. you don't have to be caregiving full time, but you have made personal sacrifices.\-lives in the united states\-speaks fluent english\-has access to a computer with an internet connection\-ideally, has a compelling story to tellthe interview will be conducted remotely, in the next two weeks.warmly,andrea"," i'm also willing to share if you haven't chosen yet. i'm the caretaker for my 82 year old mom & the only child. i moved her in with me after my dad died. she hasn't had a formal diagnosis, but i can tell she has dementia because of her behavior.  i'm a grateful recovering alcoholic & got sober right after she moved in with me, over 3 years ago. please message me if you'd like to hear more.thanks,",https://www.reddit.com/r/dementia/comments/k4unji/looking_for_a_caregiver_with_a_story_to_tell_for/,Looking for a caregiver with a story to tell - for a new national news outlet
"my mom started forgetting lately, and have been buying too much of a single item the past few years, a symptom we saw in her dad at his onset of dementia. today she was officially diagnosed with pseudodementia. apparently stress is a major factor in causing it.however she is very young, 54. my question is how to we deal with it? is it reversible if diagnosed early? i have no idea how to deal with this and am hoping for some guidance and what to tell her. she is extremely saddened and worried about this news. how can i ease her burden?"," sometimes medications or combination of multiple meds can create cognitive problems, too. statins, in some people, pain meds, or sleeping meds, for example. consider making a list of all her meds and ask her doctor about it, if you can.",https://www.reddit.com/r/dementia/comments/k4lxtj/mom_got_diagnosed_with_pseudodementia_anyone_here/,[deleted by user]
