submission,comment,url,title
"3 months ago, i suddenly had a decline with memory, typing, and knowing the date and time. the cause was from an untreated iron deficiency(only now getting treated). i'm not sure how much of an effect it had on me.it progressed to problems with sleep, depression, difficulty with certain directions, compulsion, forgetting people, and apathy. most of these symptoms for the past week, are hard to notice as well, but i think still affect me, but today was the day i got actual treatment.", [deleted],https://www.reddit.com/r/dementia/comments/k30s4s/i_think_i_have_delirium_that_was_progressing_to/,"I think I have delirium that was progressing to dementia. Is this form of delirium getting better, or is it progressing to a form of dementia?"
"my dad's brain scan finally came back and the specialist has diagnosed him with ""mixed dementia"".  whats the first thing my dad asks when he was told this?""ok so when am i going to get my license back?""doctor: "" i'm sorry, but you're never getting it back"".this has angered my dad.  that's all he cares about.  i get that this was something that gave him independence, and that's how been stripped from him, but he's taking it out on us, and even yelled at the doctor demanding that the doctor gives it back!  it's so heartbreaking but so difficult to navigate through his frustration.  i feel like i'm in denial.  my mom is a wreck.  heck, so am i.  i just finished watching my mother in law die from dementia after suffering for 6 years and then i get this crushing blow? my own father?i just don't know what lies ahead, and i'm terrified."," i am so sorry about your dad's diagnosis and it is so hard on the patient and their family.the anger is common.   i had to take over the checkbook from my mom and i texted my sister ""who knew finances were a contact sport?""  my mother was furious and cruel and aggressive and then she dissolved into tears but i have to take over the bill paying.   that loss of control, the key activities that define us as independent adults- driving, taking care of our bills, making choices about what to do today- those things are stripped away.  to add chronic pain to all that- it must be so hard for your father right now.i try and distract and deflect the anger- i know you must be trying that too.   i've made a boogeyman out of the doctor and out of my sister, who works in finance  and lives halfway across the country.  ""your daughter said it was important that i take your checkbook home to work on it,"" i said.   my sister said,  it's easier for me to take shouting over the phone than for you to handle it in person.i am finding myself bribing my mother with treats- too many and she gets overwhelmed- but sweets and small toys and activity books are things i bring over when i have to do something unpleasant, like take her blood pressure or handle a bill.  are there treats that your father likes?i always try and agree with my mother when she's angry as well.  ""it does suck to get old!"" i say to her.  ""it's a rotten business and i'm sorry things have gotten this way for you."" i try to then redirect to something fun or ""i found this beanie baby when i was clearing out a drawer and i was thinking of donating it.""  i keep it low key and let her have control over how interesting the item should be.  usually it's nabbed immediately and her anger ebbs for awhile.",https://www.reddit.com/r/dementia/comments/k2y9w7/my_75_year_old_dad_has_been_diagnosed_with_mixed/,"My 75 year old Dad has been diagnosed with ""mixed dementia"" after brain scan came back with deterioration. He is not taking it well, and is very angry at all of us, including the doctor who diagnosed him."
"so as the title already states. it's quite late and i'm feeling a little down. i miss my dad, it's been 2.5 months and i was listening to a new band and just instantly knew that my father would have loved them as well. anyhow whenever i get sad i write and i wanted to share it with you guys. it kind of works therapeutic. i did wrote it in dutch though so i hope the translation makes sense.here it is:hey dad :)i miss you and i was thinkinghow i just wish to be 8 years old againhow i want to see you fishing and that i want to collect rocks with you like those good old daysi wish to be 15 years old againi want you to come up to my roomand ask about the vague band i'm blasting from my stereoi want to enjoy eachothers companyin silence, while we bond over a melodyand talk about how life has been latelyi want to find your eyes in the publicwhile i'm on stage doing a showi want to find your eyes and see them twinkle once morei wish to be your 'little girl' againa father - daughter dynamici want to hold your hand and look in your warm, brown eyesand tell you how proud i amhow brave you've beenand how much i love youand i want you to tell me all those things as wellinstead i'm 24, sitting in my bed and crying over your losshaving imaginary conversations in the open letters i still write to you.even though i'm lucky to have so many warm memories to fill my heart. in times like these its simply not enough. i'm too cold and there aren't enough blankets."," i feel your pain.  when my dad passed in 2013, the first few months were so hard; relieved that he was not in pain anymore, but so very sad that he was gone. some times, i would think i was okay but then i hear a song or see something that reminds me of him and start tearing up uncontrollably.for a while, had dreams about him a few times a month. my mom and i visited his grave 2-3 times a week for over two years. i will say that with time, things to get easier; you never forget, but the pain you feel will grow less and less intense as the years pass by. stay strong.",https://www.reddit.com/r/dementia/comments/k2wlvs/some_late_night_writing_because_its_been_25/,Some late night writing because it's been 2.5 months and I miss you
do any of your loved ones take this? has it helped? my grandmother has been on it since about march i believe. recently she told the doctor it’s making her sleep too much and they halved her dose. she still sleeps a lot i don’t think it’s the med. her mood seems changed now with the half a pill as well., my grandmother has been taking olanzapine in the evenings for quite some time. it has helped calm her down. she used to be extremely paranoia and verbally abusive when she’s upset. she’s also taking escitalopram in the mornings to help with her anxiety. what stage is your grandmother’s dementia at ? mine is 93 and is currently in the middle stage.,https://www.reddit.com/r/dementia/comments/k2v21p/olanzapinezyprexa/,Olanzapine/Zyprexa?
my dad (79) has in the last 12 months very rapidly developed strong symptoms of dementia. he for example only remember the past and cannot form new memories. he really believes he is doing everything he usually does but it is in fact his family and friends that make sure there is food in the fridge and his bills are paid. he just doesn’t know this since he can’t remember more than 10-20mins in the past. he also doesn’t like showering or doing anything practical.increasingly he only wants to sleep. he is not unhappy and usually in a good mood when i visit. he tells me just wants to sleep. he likes it. since winter came this year i feel he is in total hibernation. sleep 23 hours a day. he is impossible to reach via phone since he is sleeping and doesn’t hear it. and when i visit he doesn’t want me staying long as he wants to go back to sleep.i am unsure how to react. he is not unhappy and is free do as he please. i am just worried about what this can do to his health and also feel a bit rejected as sleep seems more important than his family.any thoughts or similar experiences? i am unsure how to react. we don’t want him in a home if not absolutely necessary.," apathy is quite a typical symptom of dementia. it’s helpful to ensure good social opportunities and meaningful activities to counteract that. that’s become difficult with the pandemic and more so not winter is drawing in. aside, from that it would be a good idea to get bloods done to check for any issues like low b1 or iron. some medications can cause sedation also - what’s he on?",https://www.reddit.com/r/dementia/comments/k2uxj9/my_dad_only_wants_to_sleep_how_should_i_react/,My dad only wants to sleep. How should I react?
"my grandma (only 62) was diagnosed with dementia about three years ago. it's been a pretty rapid decline since then.she's at the point where we are no longer able to take care of her and keep her healthy. she refuses showers and changing. she doesn't use the bathroom anymore, she just goes where she's at. and still won't clean up. she barely eats or drinks. her hallucinations have gotten bad. i feel like we've hit rock bottom here.my family has tried to take care of her as much and as long as possible, but we can't do it anymore. she's not healthy.on monday, we are finally moving her into a care home. because of covid restrictions, no visitors are allowed. it's hard enough already that she won't be at home anymore, but now? as bad as she is, and as bad as the shut downs have been... i'm honestly worried that i'll never see her again.i didn't know who to tell, but i needed to put it out there. thanks for reading.", it's okay hold on. dementia is tough. it challenges the mental and physical willpower of the family members. you just gotta keep holding on. that's all that we can do,https://www.reddit.com/r/dementia/comments/k2u7oo/i_just_wanted_to_tell_someone/,I just wanted to tell someone
"orientation boards are used in patient rooms in hospitals and nursing homes. they provide information to the patient as well as the staff.get yourself a whiteboard of manageable dimensions (mine is 18”x24”) and put it in a place where your loved one can see it during the course of the day. every morning, write the following on it:the day and date.the appointments or events that day.the upcoming appointments or events the rest of the week.my mom has recently been diagnosed with dementia (alzheimer’s or lewy body), and she’s experienced a lot of anxiety and short term memory problems, so she was constantly asking me “when do we go to physical therapy?”, and “what time is the doctor’s appointment?”. once i put the board up on the mantle, she was able to relax, because it was right there in front of her. i was able to relax, because she wasn’t bugging me every five minutes.you can also put other information like the weather, the season, people’s names, or what’s for dinner. whatever matters to your person and helps them feel grounded and calm. the one i got my mom is posted in the family room. i’m going to get a second one for her bedroom, since the first is working so well. i’m also looking at putting up a lot more pictures of family and friends, since she absolutely hates that she can’t remember people’s names and who they are.next purchase: a label maker"," my mom was recently discharged from a hospital to a skilled nursing facility. i asked the nurses to write notes on the wall to let her know where she was, why she was there, how to make a phone call (her phone is different than the one she had at home) and what my phone number was. she still can't remember (or understand) how to answer the phone when i call, but having those visual reminders helped a lot. when they moved her to a new unit last week, they didn't bring the reminders. it made her move a lot worse. i did ask them to put them up again, but since i can't go in to see her i can't verify that it's happened. i really hope that they put them up.",https://www.reddit.com/r/dementia/comments/k2s7b8/start_an_orientation_board_for_your_loved_one/,Start an orientation board for your loved one
if you are a caregiver of a person with dementia (parents/grandparents) and are worried if one day you will lose cognitive ability as well. how would you like your future caregiver to care for you? what would your like future caregiver to know about you so that they can care for you better?, i would like to be moved to a state where euthanasia is allowed. i absolutely could not fathom living in such a way nor being such a weight around someone’s neck.,https://www.reddit.com/r/dementia/comments/k2lmd9/how_would_you_like_to_be_cared_for/,How would you like to be cared for?
"i don't know if this is just me overthinking things or if my fears are grounded. over the summer, my grandmother had a ministroke of sorts (not sure if there's a specific term for it, but that's how she worded it). this, coupled with her poor drinking habits, has made me a bit worried. reading through this sub has helped in at least assuaging some of my concerns since she isn't displaying the early warning signs such as repeating questions and the like, but i also haven't seen her often enough to really be able to tell definitively (thanks covid). this sub has also taught me that a lot of early warning signs often go unnoticed because they often get brushed off as just getting old so i'm second guessing if maybe we missed something. i seriously have no idea if this is all just me overthinking or if my concerns are valid, especially with the recent ministroke.","  late 50s is unusually early for even early-onset.  everyone is overly concerned about early detection and diagnosis.  this isn't cancer, you can't cure it.  just love your grandmother, encourage her to be as healthy as possible, and live her life to the fullest.",https://www.reddit.com/r/dementia/comments/k2jyrd/are_my_concerns_about_my_grandmother_late_50s/,Are my concerns about my grandmother (late 50s) valid or am I just overthinking?
"in two weeks, i'm seeing the doctor again, and i'm gonna give him the sage test, meanwhile i want to know if this is common with dementia, especially in the early stages.after the accident 3 months ago, i had (apparently) activated my iron deficiency or something, because all of my symptoms happened quickly, but some more symptoms occurred later on.the first noticeable thing to go is recent memories. i have gaps in recent memories that destroys my ability to remember anything. when i get sad, i'll know that in the next day, i'll mostly forget why i was sad.then my typing skills got impaired. it's hard to tell if it's improved, but google and grammarly autocorrect are my friend s right now.i became constantly confused about some things like my symptoms and time and date.i think at this point, i started having depression episodes. these episodes happen when the slightest something goes wrong. then i started experiencing issues sleeping. at first it was a few blips of insomnia, then it became frequent, and now it's everyday, and it causes me to sleep in the day, and have no or broken sleep in the night.then i became more compulsive and started having mood swings. i also became more apathetic, and i don't know if my mood swings has gone away, but my relationship with my family is continually being damaged.i then started to have harder times listening to directions. i didn't lose attention, but the direction s should be easy to understand. it only happened 5 or more times. it causes me a lot of stress.i then started to become to mistrust everyone. if they do anything wrong, i can quickly stop trusting them.so are these common symptoms in dementia/delirium? are these common symptoms with iron deficiency and fatigue? also what are some early signs of dementia?",,https://www.reddit.com/r/dementia/comments/k2jjp3/fast_decline_very_confused_about_if_iron/,"Fast decline, very confused about if iron deficiency and fatigue can cause these dementia like symptoms."
"i'm really fucked up rn and trying to educate myself on dementia and since it's a disease that is caused by damaged brain cells could doing whippets possibly lead to dementia? ya know, since whippets damage your brain cells or something like that"," whippets can cause brain cell death by starving the cells in your brain of oxygen, if you take a look at steve-o, i’d say he’s inhaled more no2 than just about anyone, and looking at him now, i’d say that he is perfectly capable of remembering things despite his overuse of the substance, so i would say that you should probably stop using whippets and you’ll be just fine.i’m not a medical professional, but i have used a lot of drugs including whippets, and i was just giving my two-cents.",https://www.reddit.com/r/dementia/comments/k2g5pi/whippets_and_dementia/,whippets and dementia
" so, basically my grandma is forgetting little things, like one time she made a louse noise at the cat and i asked why, and she said she just wanted to see what would happen, another time she was laughing at an ad she always laughs at and i said ""you always laugh at that ad"" and she said ""thats the first time i've seen that ad"", is this just old person forgetfullness or...? reason i dont want to convince her to go to the doctor is she is really stubborn so i don't want to go through that for nothing, also i'm really stressed out, can someone please tell me..."," from what you describe it could be, but it could also just be a uti (urinary tract infection) which causes people to show similar symptoms to dementia. best thing to do would be to rule that out first, if you or a relative can call her doctor and express your concerns and also have a chat with your grandma maybe you can get her to go and get checked out so if it is a uti she can get treated. it took a long time to get my grandma to see a doctor too so i know how frustrating that can be. she’s also very stubborn so it took us several months of missed until we finally got her to go. the road to diagnosis isn’t always a quick one and doctors may not be able to get her tested for dementia right away (due to covid it may be too risky) so the best thing you can do in the meantime is take notes on her behaviour, write down anything that is out of character and when you can get her to the doctor make sure they see it. fingers crossed it is just a uti, but if not this subreddit is a very kind and supportive place and it’s helped me a lot especially when i was my grandmas carer :) hang in there and i wish you and your grandma all the best!",https://www.reddit.com/r/dementia/comments/k2ft9g/i_think_my_grandma_has_alzheimersdimensia/,i think my grandma has alzheimers/dimensia
"hi all,i thought maybe we could brainstorm some ideas for holiday gifts? my mum lives in a care home and they aren't allowing food... i'm a bit stumped about what to tell my mum's family to send. comfy clothes? what are your thoughts?thanks!"," depending what stage she is at, simple jigsaw puzzles or word find books, colorful coffee table books about favorite subjects. my mom also likes light scented bath soaps.no food at all? or will they allow packaged snacks? my mom loves salty/sweet soft granola bars, oreo cookies and m&m’s!",https://www.reddit.com/r/dementia/comments/k2anai/gift_ideas/,Gift Ideas
"over the last couple weeks, i've noticed that my grandma (88) isn't eating as much.  maybe only half of what she had in the past (prior month).  mainly i've noticed she's been boxing up a lot of food after meals, which i prepare usually.  today i made up normal proportions of leftover thanksgiving dinner.  i wasn't there during the meal yesterday, which she got delivered, but i wonder if she doesn't eat much when i'm not there.  anyways, she finishes up here meal and had only taking like 1-2 bites of everything, and more than half is left.  i ask her about if she's feeling okay and mentioned she seemed to be eating less.  she says  she felt full, but didn't seem to think she had any stomach pain or other reasons like that to not eat.  but i could tell her question made her agitated, and she tried to prove to me that she was eating enough and not having an issue.  i'm not worried about one particular meal, but just seeing a pattern.  but she wanted to show me her plate and asking if i could tell she ate more, when she clearly did, because she needed to prove it to me i guess.  she does this sometime, like when i said it was slick outside so she shouldn't go out, she told me the 2.5 feet by the door wasn't and went out to stand on it, and then let me know.  or last night i tried to fib about recycling being put out by neighbors when she was on the way to bed, so i could go do it when she left, but she had to walk out all the way just to see if her neighbors had not put out stuff like i had fibbed about.   i have changed my behavior last two weeks for covid precaution, i eat in the living room instead of at the table, but within sight, in one room.  usually i finish before her by 10-20 minutes and she stays and finishes all the food while i clean up the kitchen (also open view).  i think i'll go back to eating at the table to see if that helps.  i'm not sure what it is, whether she is full and maybe is having a problem being full easier, or it is her dementia hurting her motivation to keep eating.  she seemed to eat a lot when i accidentally goaded her on, so i am more inclined to believe she is just not having motivation to continue her meals, possibly from me eating further away, but also just because.  i notice when i'm gone she doesn't eat much of food i prepare for her.", my mother is 84 and for the past 2 months her eating has declined.  i try to offer her different food items.  my sister told me their taste buds change as they get older.  make sure she drinks plenty of water and much love to you.,https://www.reddit.com/r/dementia/comments/k28kov/dementiarelated_eating_changes/,Dementia-related eating changes
"my 86 year old dad fell and broke his hip at the end of august. his “friend” found him the next morning on the floor of his bedroom, and called the ambulance. dad had surgery on a tuesday and my sister and boyfriend (dads so called friend) didn’t tell me until friday. dad and i had always been close but had an argument in may (he accused me of stealing money that he told me to use for dental work) and didn’t speak all summer. as soon as i found out that he was in the hospital i went to him right away. he was so happy to see me we both cried. i spent the day with him, calming him down and reassuring him that his dog and business were being looked after by his friend. thanks to covid he was only allowed 1 visitor a day so my sister saw him the next day because she had to fly back home. the next day he was moved to a rehab facility. once there he was only allowed one outside socially distanced bust per week. my dads friend, my husband and i shared the first visit. then i had to return home. i talked with dad every day twice a day because i wanted to be sure he was ok and i was concerned about his mental capacity. sometimes he was lucid other times he was delusional. a week later i get a call from the head of pt calling to let me know that after my dad and his friend visited dad wanted to talk to his attorney about revoking the poa he had give me 15 years prior. the next day i hear from the facilities dr. the same thing and she told me dad had dementia and couldn’t make those kinds of decisions and she recommended i get an attorney. dads friend and my sister began working on getting him to move out of state to be close to them. dad stopped talking to me, and insisted i relinquish the poa because he made a mistake. he became such a jerk to me that i let him go live with my sister and boyfriend who has dad believing he is his son (my brother passed away 4 years ago after a lengthy illness, and dad was his caretaker) and his kid is my dads grandson. has anyone else lost their loved one to people telling them lies? is it normal for him to believe the lies they are telling him?"," update. dad passed in february from covid brought to him by my sisters “boyfriend”. unfortunately i was right. the boyfriend/handyman exploited him horribly to the tune of $75,000. my sister broke up with him a couple of days after dad passed. now this handyman is wanted by the us marshals. i was never “stonewalling”. i just knew what was going on but nobody would believe me. now my heart is broken.",https://www.reddit.com/r/dementia/comments/k28gt7/undo_influence/,Undo influence
"hello, i work as are caretaker with dementia patients with behavioural problems/aggression/obsessional behaviour. i have this one patient who is very hyperactive/manic and obsessed with drinking. she asks for something to drink repeatedly, all day long. when i give her something to drink, she finishes it in one go and asks for more. does anyone have an idea on how to help her and her caretakers get some peace?i was thinking about giving here some sort of bottle which releases water very slowly, so it lasts for a while. does something like this exists? or does anybody have a different idea?"," fyi - mania = bipolar, not dementia",https://www.reddit.com/r/dementia/comments/k26peq/need_help_or_ideas_for_this_specific_patients/,Need help or ideas for this specific patients obsession
"when my mother who has...maybe stage 4 dementia (fear and paranoid and psychosis is worse than memory) asks me questions and i answer honestly, she says i’m wrong and gets mad at me. how do i keep her happy? lie? agree? say “yeah, aliens and ghosts are totally trying to get you. that’s terrifying. you should be scared”. help."," i always tell my residents something like „i haven‘t seen a ghost but i believe you. this was scary, right? but it’s just us now.“ (might be a poor translation but you get the meaning). make sure she feels that you understand her. show support (i know it‘s hard) but don’t confirm her in something she’s affraid of. don’t start a discussion. just short sentences. if it gets too worse...you should talk to the doctor about her behaviour, too.",https://www.reddit.com/r/dementia/comments/k25irk/do_i_lie/,Do I lie?
