submission,comment,url,title
"hello, im a new member whose grandmother has been recently showing signs of mci which seems to have been progressing rapidly in the last few weeks. we suspect she is either in the early stages of ad or will eventually develop it. she was recently prescribed medicine from a neurologist to help with her cognition.  my grandmother is very kind hearted but also quite proud. not that she is boastful or pompous (in fact she is very humble) but she does not like depending on others or having people worry about her. she is very reluctant to rely on people even as her health is beginning to go very quickly. she suffered a severe stroke 25-30 years ago and has had mild hemiparesis since. so my whole life i've known her as a physically fragile person but never to the point where i worried about her going about her daily life.but these days she can hardly walk without clinging to someone nearby. she slipped on a step outside her door earlier this week and almost fell but luckily my uncle was there to catch her. she forgets things minutes after she's said them and my grandfather gets frustrated when she begins to get upset at him because she insists that he did not say something he's said many times before. she is luckily very early in her stages, she is still able to cook (albeit slowly), hold simple conversations, and use the toilet alone. however given the rapidity of her recent cognitive decline i want to start preparing to become a caretaker for her when the time comes.just a little background, i'm her daughter's daughter, my mother works long hours and doesn't have time to see her mother. i'm about to graduate college this semester and will be staying home for a gap year or two saving up for grad school applications, so i'll have time to visit my grandmother often. i was hoping i could gather some advice on how to go about being an effective caretaker. what kind of attitude/disposition should i show her so that she won't feel too reluctant about receiving help from her granddaughter? what are effective ways i can help her walk and increase muscle strength in her legs? what kinds of things should i talk to her about that will help keep her mind active? sorry for rambling! any tips would be so very appreciated. thank you."," she sounds very much like my mother. i assume she has been under her doctors and neurologists care. my experience is from helping my dad 94yo. as we age we become less mobile and physical. our bodies weaken etc and its easier to just do less. what we do tho should be safe. if you can get her on a workout regimen that will help some. there are some good exercises for seniors on youtube and/or her neurologist can provide that info. several things...and i dont know if she will want to change her behaviour. no sharp movements like sudden turns or spinning around. everything should be deliberate and a bit slower. when sitting up or/and standing count to 30 until stepping. there's a sensor in the brain and compensates for blood draining down from the brain when we stand. this can cause dizziness and feinting and falls. counting to 30 lets it catch up. keep an eye on her doing her tasks during the day and watch for things she may have trouble with. as in taking her meds. is it organised and separated from everything else. does she have a day to day organiser. my dad at times will try and take his hearing aids. does she have hearing aids and are they working properly, clean, and plenty of batteries. check the house for trip and fall hazards. not only what may cause it but what she may fall on. make the house safe. look at where she may go, like the front steps. are there broken steps or bricks. is the patio in good shape, can she reasonable go out back. sometimes the little thing taken for granted or not seen make a big difference. my dad's shower has a lip of several inches and then a stepdown. this is very dangerous and keeps him from using the shower. is the shower and bathtub safe. if she needs it you can get handles installed in the bathroom and shower and a showerseat. you can also look to see if you can organize the house in a way that makes it easier for her to use the things she uses alot. like, i hang my dad's clothes in the closet so what he wears daily is at the front. things may go unnoticed even though they are right there. just because they see it doesnt mean they recognise it. i can write my dad a big note and tape it to his bathroom mirror and he won't see it. mentally. hopefully she doesn't just veg in front of tv. find out what hobbies etc she likes and do it with her. keep her engaged and lead her mind to think and reason. there are books of mind puzzles on amazon. i've read that videgames are good also if she may like that. gardening is good if she can get up and down. if not then maybe a table to do the work and some tiers for potted plants or planting boxes. one thing with the mind is puzzles and touch and sound and working thru 3d and extended puzzles. we tend to do the same things the same way as we age. our brains wire it in and it gets old and musty. doing new things in new ways and the more senses used the better. so if she's solving puzzles or games that involve color and space etc it will prompt her brain. working and solving in new ways is very good. the goal in it all is not the end result, the win...but the effort. the struggle, the reasoning is what helps the brain.music. music is the second best thing that reaches my dad. music enlivens brain and emotions and is somewhat magical. for fun find her favorite band or singer and get her a tshirt. stories. if you are so inclined. sit down with her and record her talking about her life and the family history. you could take these stories along with some old pics if she has them and make a short story album. she won't think anyone will care to hear it but tell her you do. and the family does. and the family to come will treasure it. sorry for the long dishevelled post, trying to run fix dinner. bless you for the love and attention you're giving her. i wish you the best of luck in your grad school and career. take good care of yourself and give grandma a hug for me.",https://www.reddit.com/r/dementia/comments/k3tzu6/caretaking_tips/,caretaking tips?
as the title asks  - how often do you see your lo laugh at something (so there’s a reason) or make a joke? any moments of so much laughter that they start crying?," my mothers's dementia has been rather interesting, as she does have some very cogent thoughts and acts.but a few months ago, i was visiting my parents at a mcdonald's. they've become some of the regular ""seniors group"" that will eat there and linger for hours, so they've made several friends, many of whom i've seen more than once.on the most recent, a woman who had previously met me asked, ""what's new?"" i gave a standard ""dad joke"" response by saying, ""everything that isn't old.""my own mother started laughing uncontrollably. dad (no mental issues) had stepped away and missed that.i was happy yet somewhat sad at the same time. happy because regardless of how my mother was processing this exchange internally (which we'll never truly know), she was smiling. this was for her an outright ""belly laugh,"" and i've known that an ability to laugh would help someone's mind, attitude, the whole bit. but it was sad in the sense that it ""only"" took a ""dad joke"" which normally would elicit a moan or groan response.i made a point to focus on the former. seeing my mother laughing made me feel quite well for her.",https://www.reddit.com/r/dementia/comments/k3tdji/humour_does_anyone_experience_their_loved_one/,HUMOUR - Does anyone experience their loved one laugh hysterically til they cry over a joke? Or make the occasional joke?
"hey guys! :)my boyfriend's grandmother has dementia. she and her husband mostly let the days go by, their son visits when possible &amp; when doing errands but they are still alone most of the time.last year we gifted them a digital photo frame. apparently she was into sewing &amp; sudokus but sadly doesn't do that anymore. and i honestly don't know her that much &amp; i'm also fairly knew when it comes to dealing with dementia. so what would be suitable gifts for someone with dementia? i noticed she seems to be fuzzy with her hands, always picking at something - so maybe something to activate her sense of touch?i'm glad about every suggestion ❤️stay safe in those times, feel yourself hugged!"," fidget toys. calm strips.  a fuzzy and soft stuffed animal.we are doing some new shirts, undershirts, and chocolates for my dad.",https://www.reddit.com/r/dementia/comments/k3nj10/gifts_for_someone_with_dementia/,[deleted by user]
"eight months ago i was desperate and in total despair. i had been diagnosed with mci and additionally was in physical agony. my short-term memory was toast, and i was only 49! i was terrified i had early-onset dementia and reached out here for help and people were so kind and i wanted to update in case it might help anyone else worried about dementia, specifically early-onset dementia (maybe this is long shot but you never know).long, long, long story short - a very eagle-eyed pa saw that my calcium was high, lots of testing and imaging later and i was diagnosed with something i'd never even heard of: **hyperparathyroidism.** *every single symptom i was suffering from lined up and dovetailed with this diagnosis.* this summer i had a parathyroidectomy, a very easy, simple procedure...and the physical agony was gone immediately. my energy returned rapidly. and miraculously (to me), my memory issues started improving rapidly and as of today, a few months later, i no longer suffer from any short-term memory loss, and i am no longer considered cognitively impaired! if anyone here is concerned about early-onset dementia, or heck, any kind of dementia - for yourself or a loved one, please have your/their calcium levels checked and a parathyroid hormone (pth) test. hyperparathyroidism and/or hypercalcemia should be included in the differential and ruled out in all cases and concerns of possible dementia, in my humble opinion. if this helps even *one* person, i'll consider this update a success...**links with more information:**[**[**warmest of wishes and happy holidays to all of you, thank you so much for being there for me."," will you please tell me your symptoms, specifically? i’m terribly worried about my husband. i’m looking for answers, hoping he doesn’t have dementia. he’s only 58.",https://www.reddit.com/r/dementia/comments/k3ilxo/update_early_onset_dementia_worries_found_a/,UPDATE: Early Onset Dementia worries - found a reversible medical cause in my case
"i‘m working as a specialized nurse for gerontopsych. with dementia patients since 7 years now. (not sure if i can translate my job title exactly in an english version.) i love my work. i work in a nursing home with 32 residents. i see them mostly happy everyday. some of them can‘t talk, but communicate nonverbal. we laugh, we sing, we celebrate, we have daily activities together...what i‘m trying to say is: dementia is not the end of the world. you can live a very happy life with dementia. the personality definitely changes and this is hard to see for the family. but: when you are in good (medical) care and are loved and accepted...why do you think this is the worst that can happen?i don‘t want to offend somebody...it just makes me sad to see so many family members suffer with the diagnosis. i just wanted to take you this bad feeling. (before you judge me for „knowing nothing“: i saw my step-grandfather getting ftd.)"," with all due respect, this is a pretty insensitive comment. the diseases that cause dementia are devastating for millions.",https://www.reddit.com/r/dementia/comments/k3hn28/please_dont_think_that_dementia_is_the_end_of_the/,[deleted by user]
"my father has been going downhill for a while now. my partner and i mentioned dementia for the first time about a year and a half ago. we lived in a different country for a while, so i didn’t really have an influence on seeking help back then. we moved back here in february and i’ve been trying to work towards a diagnosis since then. tomorrow it’s finally happening. i don’t know how to feel."," my father was just diagnosed with mixed dementia 2 weeks ago.  i won't lie, it turned my world inside out and upside down.  i felt like my life became unhinged.    i didn't cry so much at first because of the shock of it all.  but i started crying at random times and all i could think about is what the future held.   not how he was now, but how he would be when he was in the final stages.  i have spent the last 6 years helping my husband take care of his mother who passed away from dementia on sept 12.   maybe i became numb or more or less conditioned as to what to expect.  but dementia is different for everyone who suffers.  when you get the diagnosis and it's dementia, ensure that you've taken all the tests that will make this diagnosis conclusive.   my dad scored 15/30 on his cognitive and his brain scan showed several kinds of deterioration in different areas.    this confirmed dementia once and for all. it felt like someone punched me in the stomach.   it was real this time.  no other test could tell me different and no 2nd diagnosis would produce a different result. it was dementia and i had to work on accepting it sooner than later because if i prolonged the denial stage, i would be doing my dad a huge disservice by prolonging treatment.  so i decided i was going to take the stance of *living in the moment for now*.  just *for now*.   enjoying my  father while he still has most of his faculties,  and not consuming myself with what the future holds.   how do i do this you ask?  easier than you think.   i engaged in a little gentle self talk with myself on my own time.   i promised myself that would enjoy him at his best right now because if i consume myself with doom and gloom i will have become too preoccupied with what lies ahead and will have missed out on who *he still is right now*.   if you can keep that as your personal mantra, and remind yourself of that every day, i hope that helps you cope.   you will have time to worry about the future when your dad reaches the stage where you know it's progressing to a point where those discussions need to be had.   i wish you love and light.  hearing a diagnosis like this almost seems worse than a cancer diagnosis in my opinion, and i don't mean any disrespect to anyone who has lost someone to cancer.   losing your mind feels worse.",https://www.reddit.com/r/dementia/comments/k3f67v/tomorrow_my_father_gets_a_diagnosis/,Tomorrow my father gets a diagnosis
"so my grandma is having memory issues ( under the care of memory specialists). i have been a nursing assistant in nursing homes before. i have seen dementia patients in all state of the disease. i feel bad, but i would rather her get sick and die now while she is herself sort of than watching the decline that is coming with memory issues."," you are not horrible, not at all. if anything, it is a compassionate pov. i feel the same way about my mom, watching her rapid decline is horrific. my siblings are in other cities so it's all on me and i am suffering right along with her.",https://www.reddit.com/r/dementia/comments/k3bgjh/i_feel_like_a_horrible_granddaughter/,[deleted by user]
"father, 81, is in early stages of cognitive decline. he keeps a routine centred around meal times, walking and taking the dog out. anything outside of those he spends secluded in his room reading or just looking out the window. i am struggling to connect with my father. he is not able to converse outside of asking about meals or the weather. he is often argumentative or negative. he is not physical. mother, 69, is reluctantly moving into accepting her new role as a caretaker. she is struggling and has many sleepless nights or days of wanting to run away from this. how do i, their 36 year old daughter, help my parents?  what realities do i need to prepare for? what conversations should i be having now? i should mention i’ve moved home during the pandemic so they are not isolated with all the restrictions.  i feel like the next six months are my opportunity to make any impact."," feelings of anger, impatience and denial are normal for family caretakers in the early stages of this disease. just give him lots of hugs and love and show him lots of affection. as the disease gets worse and he becomes more childlike, it's also normal for caretakers to look back in regret at not having more compassion. have compassion for yourself.also, see if you can include music in his routine. amazon alexa is pretty inexpensive and you can schedule playlists throughout the day.make sure he goes for walks every day regardless of if he wants to or not. that might keep him from losing the ability to walk.was he religious? religious rituals like prayer should be maintained as long as possible.lots of trial and error will help him find other activities to brighten his day. perhaps he would like to color (perhaps not) won't know until you try. also, every day is different. he might not like coloring today but that can change tomorrow... eventually sensory toys like fidget spinner or sensory balls might keep him busy..",https://www.reddit.com/r/dementia/comments/k3a0h5/new_to_this/,New to this
"hi. a family member of mine has early dementia and has a lot of trouble keeping track of the day. he’s still able to work and function but something that hinders this is he has trouble keeping track of the day. every day we call him to make sure he knows to go to work and we have short arguments about the day. a calendar is too confusing to him. even checking off the boxes is too big of a task. i’m thinking of developing an led calendar that shows today’s date and doesn’t have any room for interpretation. he needs very simple instructions like:“today’s date is sunday november 29th. you work at 11 amit is currently 9 am”he should be able to press a button to see tomorrow as well, so he knows what time he has to wake up if he has to work. thoughts? this may need to have two versions. one audible and one text. he has trouble reading sometimes."," smart devices like amazon echo (alexa), google home, etc, can be set with reminders like “time to leave for work.” an internet or amazon search of “dementia clock” gives variations of a picture frame clock that sits on a table or hangs on a wall, with a large display my mom with dementia can read (for now): monday  aftermoon  3:35 pm  november 30, 2020.",https://www.reddit.com/r/dementia/comments/k39tzl/keeping_track_of_the_day/,Keeping track of the day
has anyone else been diagnosed in their 30's? i feel the symptoms started in my teens and have gradually progressed and became more problematic as i got older. it's almost felt and progressed in the same fashion as i'd expect an auto immune disorder such as ms would.just wondering if anyone else has discovered similar and after a bit of reassurance really. i don't really have anybody to talk about it with anymore and i don't want to upset my partner and worry her.thanks for reading,,https://www.reddit.com/r/dementia/comments/k39mnf/frontal_lobe_dementia_in_your_30s/,Frontal lobe dementia in your 30's
"i drove 13 hours to get here to care for mom while dad is out of town. i got mom fed, bathed, and in bed. i fell asleep. an hour later, i was startled awake by the door being flung open and lights turned on. mom wanted to know who was in the room and where dad was. 2 hours later, she's back asleep. i'm exhausted. is there a reliable way of helping mom sleep through the night from now on?"," that's frustrating, especially after a marathon drive, very tiring!   i don't have any solutions for helping yr mom sleep, but i do leave notes on the kitchen island-counter for my mum when there's something out of the usual happening.   half or full a4 size paper, msg printed clearly  eg   ""mum, (brother) is visiting for 3 days, he's sleeping in the spare room.""  or   ""i'm visiting friend for a few hours, i'll be home late afternoon.""    you likely will be asked a zillion times where your dad is, might be best put out a note for her - it's probably quite upsetting for her, not having any memory nor idea what happened where is he.    good luck!",https://www.reddit.com/r/dementia/comments/k37p1q/up_at_2_am/,Up at 2 AM
"she (90f w/ vascular dementia) has spent the entire day today in a state of heightened alertness that i haven’t seen since pre-diagnosis 7 years ago. she’s recalling events and details from the past several days clearly. shes singing entire songs ive never heard her sing. shes been so clear minded that she’s used the toilet and not had any accidents. very unusual. she’s been much more demanding of attention today as well. i walk out of the room to do chores and she immediately has some frivolous need i have to attend. right away. all day and night long. pull the curtain, bring a drink after she’s just finished one. her sock is crooked. etc. she’s also been very talkative and expressive. saying thoughtful things that she typically doesn’t display the acuity for any longer. she refused meals (highly unusual) and instead wanted to snack all day. hot food was totally off the menu. flat out refusal. everything had to be cold. now at 1am, after having meds and being in bed for 2 hours she insisted i bring her something to eat. shes eaten so much today i don’t know how she’s not in pain. and shes never asked for food after bedtime. i asked what was going on. she got a little snappy and said i should just bring her food because she eats in bed all the time. no, she does not. all of this is fine. i’m not complaining. but it’s such a strange deviation from her normal that i feel a little concerned. i’ve yet to experience an episode like this with her. is this just “one of those things” or does it sound like a precursor to some other change? it was suggested to me that this means her dementia may be preparing to progress? i can’t see how that would work, but i’ve never witnessed the advanced stages progress so i’m hoping someone here will have some idea as to what i’m seeing.", wish i could see this :/,https://www.reddit.com/r/dementia/comments/k34b51/unusual_alertness_today/,Unusual alertness today.
"i wanna forget my life.my life was almost perfect before i was 13. i was ignorant, and ignorance gives me bliss, and i miss being blissful.all i have now is empty memories and nostalgia, constant confusion, mistrust, stress from lack of answers, paranoia, depression, fatigue, apathy, anger, anxiety, etc. i am not ignorant anymore, and i'm too aware of everything.i want to be ignorant again, i want to forget the awful things that happened to me, and be in bliss again."," i've seen a *lot* of people with dementia.  not one of them was blissful.  they were confused, disoriented, frustrated, mistrustful, and sad.  every one of them.  you have a basic misunderstanding of what dementia is.  what you want is to be a houseplant.  totally different thing.  it sounds as if you need to treat your depression and gain control of your life path.",https://www.reddit.com/r/dementia/comments/k342gs/i_wish_i_had_dementia/,I wish I had dementia
"it's frustrating nobody wants to answer me because i'm only a child.""dementia is a serous loss of cognitive ability, affecting daily life""couldn't kids lose cognitive ability, affecting life, and if so why is it not a form of dementia."," children actually can get dementia. it's very rare and usually, patients pass by their early teens. often it is given the blanket term batten's disease. however, usually more broad symptoms are seen like seizures. there is genetic counseling to check for those genes. however, genetic counseling services are not always covered by insurance.if you are experiencing a loss of cognitive ability (often due to depression and anxiety) are on meds, changing meds, or missing doses: that's probably what's going on. call your doctor and let them know what's going on. the worst thing you can do is say nothing and suffer in silence without the help you need.",https://www.reddit.com/r/dementia/comments/k33snb/why_dont_kids_get_dementia/,Why don't kids get dementia?
"hi!i’m building a telehealth product enables the chronic illness patient’s journey to get the right medical help they need sooner. the vision of this startup idea is to make healthcare accessible and affordable to people with chronic conditions in a timely manner, particularly improving earlier diagnosis and effective ongoing care management through matching them with the right medical specialists and solutions.""**90% of** the nation’s **3.5 trillion** in annual healthcare expenditure are for people with chronic or mental conditions."" - *centers for disease control and prevention,* [*national center for chronic disease prevention and health promotion (nccdphp)*](i'm currently at the stage of feasibility testing to understand your most urgent problems, and would appreciate it if you can answer a quick survey (3 minute) regarding your current healthcare experience.please find the survey here: [",,https://www.reddit.com/r/dementia/comments/k32yj1/telehealth_product_concept_virtual_matching_with/,Telehealth Product Concept - Virtual Matching with Doctors and Specialists
